id,question,choices,answerKey
NYSEDREGENTS_2010_4_24,"What is the definition of animal migration, including the factors that typically trigger this behavior?","{'text': ['Animal migration is the seasonal movement of animals from one region to another, typically triggered by changes in food availability and breeding conditions.', 'Animal migration is the random movement of animals across different habitats, mainly influenced by predator presence and random environmental changes.', 'Animal migration is the daily movement of animals within a habitat, primarily caused by temperature fluctuations and immediate threats.', ""Animal migration is the movement of animals following the magnetic poles, driven by the Earth's magnetic field and gravitational forces.""], 'label': ['A', 'B', 'C', 'D']}",A
Mercury_SC_409673,"What is the full biochemical process called where plants convert light energy into chemical energy, and what are the main stages involved?","{'text': ['Photosynthesis, which involves the stages of photolysis and carbon fixation.', 'Respiration, which involves glycolysis and the Krebs cycle.', 'Fermentation, which involves the stages of alcoholic and lactic acid fermentation.', 'Chemosynthesis, which involves the oxidation of inorganic molecules.'], 'label': ['A', 'B', 'C', 'D']}",A
Mercury_SC_400374,What is the primary ecological role of periodic flooding in maintaining the health of riverine ecosystems?,"{'text': ['Periodic flooding reduces biodiversity by washing away all organisms in the floodplain.', 'Periodic flooding supplies essential nutrients to floodplain soils, promoting plant growth and supporting diverse wildlife habitats.', 'Periodic flooding introduces pollutants and toxins into the ecosystem, degrading water quality.', ""Periodic flooding creates barriers to fish migration, disrupting aquatic species' life cycles.""], 'label': ['A', 'B', 'C', 'D']}",B
CSZ_2009_8_CSZ20740,What is the precise formula for calculating the time taken by an object to travel a certain distance at a constant speed?,"{'text': ['Time = Speed × Distance', 'Time = Distance ÷ Speed', 'Time = Speed ÷ Distance', 'Time = Distance + Speed'], 'label': ['A', 'B', 'C', 'D']}",B
Mercury_SC_406482,What is the precise definition of a scientific control and its purpose in an experiment?,"{'text': ['A scientific control is a variable that is intentionally changed to observe its effect on the experiment, ensuring variability.', 'A scientific control is a sample that is treated in the same way as all other samples but is not exposed to the experimental treatment, serving as a baseline for comparison.', 'A scientific control is an experiment that is repeated by different researchers to verify results, ensuring reliability.', 'A scientific control is an alteration of the independent variable to test its effect on the dependent variable, ensuring accuracy.'], 'label': ['A', 'B', 'C', 'D']}",B
OHAT_2007_8_24,What is the primary process through which igneous rocks are formed during volcanic activity?,"{'text': ['Sedimentation of volcanic ash', 'Metamorphism of existing rocks', 'Solidification and crystallization of magma', 'Erosion of volcanic material'], 'label': ['A', 'B', 'C', 'D']}",C
Mercury_188335,What is the formal definition of a main-sequence star in terms of its core hydrogen fusion process?,"{'text': ['A main-sequence star is a star that has exhausted its hydrogen fuel and is in the process of fusing helium in its core.', 'A main-sequence star is a star that is in the stage of stellar evolution characterized by the fusion of hydrogen into helium in its core.', 'A main-sequence star is any star that has a mass greater than twice the mass of the Sun and is fusing elements heavier than hydrogen.', 'A main-sequence star is any star that is undergoing the process of nuclear fusion but not specifically hydrogen fusion.'], 'label': ['A', 'B', 'C', 'D']}",B
Mercury_7128555,"What is the biological term for the mutual interaction between two species where one species facilitates the reproduction of the other, specifically seen in the interaction between plants and their pollinators?","{'text': ['Symbiosis', 'Mutualism', 'Parasitism', 'Commensalism'], 'label': ['A', 'B', 'C', 'D']}",B
Mercury_407517,What are the defining characteristics of the element that has an atomic number of 20 in the periodic table?,"{'text': ['It is a non-metal, has 20 protons, and is known for its gaseous state.', 'It is an alkaline earth metal, has 20 protons, and is known for its reactivity with water.', 'It is a transition metal, has 21 protons, and is known for its high melting point.', 'It is a noble gas, has 20 electrons, and is known for its complete electron shell.'], 'label': ['A', 'B', 'C', 'D']}",B
Mercury_405950,What is the fundamental process by which both plants and animals convert nutrients into usable energy?,"{'text': ['Photosynthesis', 'Cellular Respiration', 'Fermentation', 'Transpiration'], 'label': ['A', 'B', 'C', 'D']}",B
MCAS_2004_9_5,"According to Ohm's Law, what is the precise relationship between voltage, current, and resistance in an electric circuit?","{'text': ['Voltage equals current times resistance.', 'Voltage equals resistance divided by current.', 'Voltage equals current divided by resistance.', 'Voltage equals the square of current times resistance.'], 'label': ['A', 'B', 'C', 'D']}",A
NCEOGA_2013_8_28,What is the precise definition of turbidity and the standard unit used to measure it in water quality analysis?,"{'text': ['Turbidity refers to the clearness of a liquid and is measured in parts per million (ppm).', 'Turbidity is the cloudiness or haziness of a fluid caused by large numbers of individual particles and is measured in Nephelometric Turbidity Units (NTU).', 'Turbidity is the amount of dissolved oxygen in water and is measured in milligrams per liter (mg/L).', 'Turbidity is the concentration of suspended organic matter in a fluid and is measured in micrograms per liter (µg/L).'], 'label': ['A', 'B', 'C', 'D']}",B
Mercury_SC_406451,What is the fundamental principle of energy conservation that explains how using energy-efficient light bulbs can lead to environmental benefits?,"{'text': ['The Second Law of Thermodynamics, which states that energy cannot be created or destroyed, only transformed or transferred.', 'The Principle of Energy Efficiency, which states that reducing energy consumption leads to a proportional decrease in environmental pollution.', 'The Law of Conservation of Energy, which states that energy cannot be created or destroyed, only transformed from one form to another.', 'The Principle of Environmental Sustainability, which states that all forms of energy use must be sustainable and renewable.'], 'label': ['A', 'B', 'C', 'D']}",C
Mercury_7109323,"What is the complete definition of a nebula in the context of astronomy, including its composition and role in star formation?","{'text': ['A nebula is a large cloud of dust and gas in space, primarily composed of hydrogen and helium, and it is a region where new stars are born.', 'A nebula is a small cloud of dust in space with no role in star formation, primarily composed of carbon and oxygen.', 'A nebula is a large cloud of dust and gas in space without any significant role in star formation, primarily composed of nitrogen and oxygen.', 'A nebula is a dense region of solid rock particles in space, primarily composed of silicon and iron, where planets form.'], 'label': ['A', 'B', 'C', 'D']}",A
Mercury_404132,What is the Law of Conservation of Mass as defined in chemistry?,"{'text': ['The total mass of substances is always conserved when they are dissolved in a solvent.', 'Matter can be created or destroyed in chemical reactions, but energy is always conserved.', 'In any closed system, the mass of the reactants must equal the mass of the products; matter is neither created nor destroyed.', 'The mass of a system is conserved only when the system is at absolute zero temperature.'], 'label': ['A', 'B', 'C', 'D']}",C
Mercury_7210210,"What is the exact and formal definition of fossil fuels, including the types of materials they originate from and their formation process?","{'text': ['Fossil fuels are energy sources derived from the remains of dead plants and animals buried under layers of sediment and subjected to intense heat and pressure over millions of years.', 'Fossil fuels are renewable energy sources formed from living plants and animals that have decayed over a few decades.', 'Fossil fuels are synthetic materials created from organic compounds in laboratories to mimic natural energy sources.', 'Fossil fuels are exclusively derived from ancient forests that have turned into coal due to volcanic activity.'], 'label': ['A', 'B', 'C', 'D']}",A
Mercury_SC_408042,What is the primary function of the chlorophyll found in the leaves of a sunflower plant?,"{'text': ['Chlorophyll is responsible for protecting the plant from herbivores by producing toxins.', 'Chlorophyll is responsible for absorbing sunlight and converting it into chemical energy during photosynthesis.', 'Chlorophyll helps in the transportation of nutrients from the roots to the rest of the plant.', 'Chlorophyll is involved in the production of seeds and reproductive processes in the plant.'], 'label': ['A', 'B', 'C', 'D']}",B
MCAS_2004_8_14,What is the exact chemical equation that represents the overall process of photosynthesis in plants?,"{'text': ['6CO2 + 6H2O + sunlight energy → C6H12O6 + 6O2', '6O2 + C6H12O6 → 6CO2 + 6H2O + sunlight energy', 'C6H12O6 + 6O2 → 6CO2 + 6H2O', '6CO2 + 6H2O → C6H12O6 + 6O2 + sunlight energy'], 'label': ['A', 'B', 'C', 'D']}",A
TIMSS_2011_4_pg5,What is the exact definition and characteristics of a biological predator in an ecological context?,"{'text': ['A predator is an organism that primarily feeds on plants and occasionally consumes small insects.', 'A predator is a species that competes with other species for the same resources within an ecosystem.', 'A predator is an organism that hunts, kills, and consumes other organisms, typically being higher on the food chain.', 'A predator is an organism that only scavenges for food, feeding on carcasses left by other animals.'], 'label': ['A', 'B', 'C', 'D']}",C
Mercury_SC_406833,What was the original hypothesis about the universe's expansion that was changed due to new observational data?,"{'text': ['The universe is static and unchanging over time.', 'The universe is constantly expanding at an accelerating rate.', 'The universe is finite and will eventually collapse.', 'The universe is expanding but at a decelerating rate.'], 'label': ['A', 'B', 'C', 'D']}",A
Mercury_7029558,"What is the scientific classification of aphids, including their order and family?","{'text': ['Order: Hemiptera, Family: Aphididae', 'Order: Coleoptera, Family: Coccinellidae', 'Order: Diptera, Family: Culicidae', 'Order: Lepidoptera, Family: Nymphalidae'], 'label': ['A', 'B', 'C', 'D']}",A
Mercury_7138390,What is the exact definition of eutrophication in the context of aquatic ecosystems?,"{'text': ['Eutrophication is the gradual increase of nutrients in a water body, causing a reduction in aquatic plant life and an increase in fish populations.', 'Eutrophication is the rapid increase of nutrients in a water body, often due to runoff, leading to an excessive growth of algae and subsequent depletion of oxygen.', 'Eutrophication refers to the introduction of pollutants into a water body that decrease biodiversity and increase water clarity.', 'Eutrophication is the process by which water bodies become clearer and more oxygen-rich due to the introduction of plant life.'], 'label': ['A', 'B', 'C', 'D']}",B
MEAP_2005_5_12,What is crop rotation and how does it benefit sustainable agriculture?,"{'text': ['Crop rotation is the practice of planting the same crop in the same field every year to maintain soil nutrients.', 'Crop rotation is the practice of alternating different crops in the same field across different growing seasons to improve soil health and control pests and diseases.', 'Crop rotation is the method of growing multiple types of crops at the same time in one field to maximize yield.', 'Crop rotation is the strategy of planting crops that require the least amount of water to save resources.'], 'label': ['A', 'B', 'C', 'D']}",B
MCAS_2000_4_30,What are the main components and functions of the transmission control protocol (TCP) in the context of internet communication?,"{'text': ['TCP provides a connectionless communication service that ensures data is delivered in sequence and without errors.', 'TCP is responsible for routing data packets across multiple networks and handling the addressing scheme.', 'TCP provides a connection-oriented communication service that ensures data is delivered in sequence, without errors, and retransmits lost packets.', 'TCP is used for encrypting data to ensure secure transmission over the internet.'], 'label': ['A', 'B', 'C', 'D']}",C
MCAS_1998_4_12,"Which of the following best describes the composition of soil, including its physical and chemical components?","{'text': ['Soil is primarily composed of organic matter, water, and oxygen only.', 'Soil is a homogeneous mixture of organic matter, minerals, gases, liquids, and countless organisms that together support life.', 'Soil consists solely of inorganic minerals and water, without any organic components.', 'Soil is made up exclusively of inorganic minerals and gases, with no organic matter or liquids present.'], 'label': ['A', 'B', 'C', 'D']}",B
Mercury_175840,"What is the detailed structural composition of the cell wall in plant cells, including its primary components and their specific functions?","{'text': ['The plant cell wall is primarily composed of cellulose, hemicellulose, and lignin, where cellulose provides tensile strength, hemicellulose cross-links cellulose fibers, and lignin adds rigidity and waterproofing.', 'The plant cell wall is mainly composed of chitin, which provides structural support and rigidity, similar to fungal cell walls.', 'The plant cell wall is primarily made up of peptidoglycan, which provides a flexible yet sturdy structure, similar to bacterial cell walls.', 'The plant cell wall consists mainly of phospholipids and proteins, which create a semi-permeable membrane for regulating substances entering and exiting the cell.'], 'label': ['A', 'B', 'C', 'D']}",A
Mercury_7099190,What is the fundamental role of plants in the carbon cycle within an ecosystem?,"{'text': ['Plants release carbon dioxide through photosynthesis, contributing to atmospheric carbon levels.', 'Plants absorb carbon dioxide during photosynthesis, converting it into organic matter and oxygen.', 'Plants do not play a significant role in the carbon cycle and primarily rely on soil for carbon sources.', 'Plants only store carbon temporarily and have no impact on atmospheric carbon levels.'], 'label': ['A', 'B', 'C', 'D']}",B
Mercury_SC_401605,What is the exact definition of 'evidence' as used in the context of a criminal investigation?,"{'text': ['Evidence refers to any item that can be reused after an investigation regardless of its relevance to the case.', 'Evidence is any item or testimony presented in a legal investigation to support or refute an allegation.', 'Evidence is a set of guidelines used by investigators to determine the guilt of a suspect.', 'Evidence includes only physical objects that have been used to commit a crime.'], 'label': ['A', 'B', 'C', 'D']}",B
TAKS_2009_5_36,What is the complete and detailed pathway of the visual information processing from the retina to the brain in mammals?,"{'text': ['Light enters the eye, is focused by the cornea and lens onto the retina, where it is converted into neural signals by photoreceptors, travels through the optic nerve, reaches the lateral geniculate nucleus of the thalamus, and is finally processed in the primary visual cortex.', 'Light enters the eye, is focused by the lens onto the cornea, where it is converted into neural signals by photoreceptors, travels through the optic nerve, reaches the superior colliculus, and is finally processed in the frontal lobe.', 'Light enters the eye, is focused by the cornea and lens onto the retina, where it is converted into neural signals by photoreceptors, travels through the optic nerve, reaches the lateral geniculate nucleus of the thalamus, and is finally processed in the auditory cortex.', 'Light enters the eye, is focused directly onto the optic nerve by the cornea, where it is converted into neural signals by photoreceptors, reaches the lateral geniculate nucleus of the thalamus, and is finally processed in the primary visual cortex.'], 'label': ['A', 'B', 'C', 'D']}",A
Mercury_7171570,What is the main function of the autonomic nervous system in relation to the regulation of the digestive system?,"{'text': ['The autonomic nervous system initiates voluntary muscle contractions in the digestive tract.', 'The autonomic nervous system regulates the speed and efficiency of digestion through the sympathetic and parasympathetic divisions.', 'The autonomic nervous system is responsible for absorbing nutrients from digested food.', 'The autonomic nervous system directly controls the secretion of digestive enzymes by the liver.'], 'label': ['A', 'B', 'C', 'D']}",B
Mercury_SC_402057,"What is the biological definition of mammalian endothermy, and what are its primary characteristics?","{'text': ['Endothermy in mammals is the ability to regulate body temperature through external sources, characterized by fluctuating body temperatures.', 'Endothermy in mammals is the reliance on external environmental conditions to maintain a stable body temperature.', 'Endothermy in mammals is the internal generation and regulation of body temperature, characterized by a high metabolic rate and insulation mechanisms like fur or fat.', 'Endothermy in mammals is the ability to withstand extreme cold by hibernation without any physiological temperature regulation.'], 'label': ['A', 'B', 'C', 'D']}",C
Mercury_SC_413628,"What is the precise definition of a microorganism in the context of microbiology, including the size range and types of organisms it encompasses?","{'text': ['Microorganisms are entities that can only be seen with the naked eye, typically larger than 1 millimeter, and include animals and plants.', 'Microorganisms are organisms that can be either multicellular or unicellular, typically smaller than 1 millimeter, and include bacteria, viruses, fungi, archaea, and protists.', 'Microorganisms are single-celled organisms visible with the naked eye and include protozoa and fungi.', 'Microorganisms are exclusively unicellular organisms that are visible with the naked eye, including viruses and bacteria.'], 'label': ['A', 'B', 'C', 'D']}",B
Mercury_LBS10131,What is the exact definition of conduction in the context of thermal energy transfer?,"{'text': ['Conduction is the transfer of thermal energy through the bulk movement of fluid from one place to another.', 'Conduction is the transfer of thermal energy through electromagnetic waves without involving particles.', 'Conduction is the transfer of thermal energy between neighboring molecules in a substance without any overall movement of the substance itself.', 'Conduction is the transfer of thermal energy through the exchange of particles between two objects in direct contact.'], 'label': ['A', 'B', 'C', 'D']}",C
Mercury_7032428,What is the formal definition of a placebo in the context of scientific experiments?,"{'text': ['A placebo is a treatment that contains active ingredients and is used to test the efficacy of new drugs.', 'A placebo is an inactive substance or treatment that is designed to have no therapeutic effect, used as a control in testing new drugs.', 'A placebo is a non-controlled variable in an experiment that can affect the results.', 'A placebo is a treatment given to the experimental group to enhance the effects of the active drug being studied.'], 'label': ['A', 'B', 'C', 'D']}",B
Mercury_7025008,What is the exact phrasing of the principle known as Newton's First Law of Motion?,"{'text': ['An object at rest will stay at rest, and an object in motion will continue in a straight line at constant speed unless acted upon by an external force.', 'An object will continue to move without any force acting upon it, regardless of external influences.', 'An object at rest will remain at rest, but an object in motion will eventually come to a halt without any external force.', 'An object in motion will remain in motion indefinitely without any external force.'], 'label': ['A', 'B', 'C', 'D']}",A
MEA_2011_8_19,What is the precise and comprehensive definition of an atom in classical physics?,"{'text': ['The smallest unit of a chemical element that retains its chemical properties, consisting of a nucleus surrounded by electrons.', 'A subatomic particle found in the nucleus of an atom, such as a proton or neutron.', 'A molecule that can combine with others to form a chemical compound.', 'A particle of light that exhibits both wave and particle properties.'], 'label': ['A', 'B', 'C', 'D']}",A
NYSEDREGENTS_2008_8_27,"What is the precise statement of Newton's Second Law of Motion, including its mathematical expression?","{'text': [""Newton's Second Law states that the acceleration of an object is directly proportional to the net force acting on it and inversely proportional to its mass, mathematically expressed as F = ma."", ""Newton's Second Law states that an object in motion will continue to move indefinitely in the same direction unless acted upon by a net external force."", ""Newton's Second Law states that the force acting on an object is equal to the product of its velocity and mass, mathematically expressed as F = mv."", ""Newton's Second Law states that the force acting on an object is equal to the product of its displacement and mass.""], 'label': ['A', 'B', 'C', 'D']}",A
VASoL_2007_5_22,What is the precise definition of a manipulated variable in the context of experimental research?,"{'text': ['A manipulated variable is the factor that is measured in an experiment to gather data.', 'A manipulated variable is the factor that remains constant throughout an experiment to ensure valid results.', 'A manipulated variable is the factor that is intentionally changed or varied by the researcher in an experiment to observe its effect.', 'A manipulated variable is the factor that is used to calibrate equipment before starting an experiment.'], 'label': ['A', 'B', 'C', 'D']}",C
NCEOGA_2013_5_19,What is the definition of genetic inheritance and how does it relate to the transmission of physical traits from parents to offspring?,"{'text': ['Genetic inheritance is the process by which individuals acquire traits during their lifetime that are passed down through environmental influence.', 'Genetic inheritance refers to the transmission of genetic information from parents to offspring through genes, influencing physical traits.', 'Genetic inheritance is the random distribution of traits that are acquired after birth due to lifestyle and diet.', 'Genetic inheritance is the process by which physical traits are developed independently of parental genes, solely through environmental factors.'], 'label': ['A', 'B', 'C', 'D']}",B
Mercury_7037555,What is the complete definition of a fume hood and its primary function in a laboratory setting?,"{'text': ['A fume hood is a ventilated enclosure in a chemistry laboratory, designed to limit exposure to hazardous or toxic fumes, vapors, or dust.', 'A fume hood is a storage cabinet for chemicals, designed to keep them organized and easily accessible.', 'A fume hood is a type of personal protective equipment worn by laboratory personnel to protect against chemical spills.', 'A fume hood is a machine used to filter and recycle air in a laboratory, providing oxygen to the room.'], 'label': ['A', 'B', 'C', 'D']}",A
Mercury_402132,What is the exact definition of a competitive swimming race and the standard criteria used to determine the rank of swimmers in such an event?,"{'text': ['A competitive swimming race is defined by the swimmer who completes the distance in the least amount of time, with rankings solely based on time.', ""A competitive swimming race is defined by the swimmer who has the best technique, with rankings based on judges' scores."", 'A competitive swimming race is defined by the swimmer who covers the greatest distance, with rankings based on distance covered.', 'A competitive swimming race is defined by the swimmer who shows the most improvement in speed, with rankings based on percentage improvement.'], 'label': ['A', 'B', 'C', 'D']}",A
MCAS_2006_8_24,What principle in physics explains why the water level rises when ice cubes are added to a glass of water?,"{'text': [""Archimedes' Principle"", ""Pascal's Principle"", ""Bernoulli's Principle"", ""Newton's Third Law""], 'label': ['A', 'B', 'C', 'D']}",A
Mercury_7128923,What is the definition of specific heat capacity and how does it relate to a substance's ability to absorb energy from the Sun?,"{'text': ['Specific heat capacity is the amount of heat required to change the temperature of a substance by one degree Celsius, and a higher specific heat capacity means the substance can absorb more energy without a significant rise in temperature.', ""Specific heat capacity is the amount of energy required to vaporize a substance, and it directly indicates the substance's ability to absorb solar energy."", 'Specific heat capacity is the thermal conductivity of a material, determining how quickly it can transfer heat received from the Sun.', 'Specific heat capacity is the total energy content of a substance, and it measures how much solar energy a substance can store.'], 'label': ['A', 'B', 'C', 'D']}",A
