id,question,choices,answerKey
Mercury_400780,What are the defining characteristics of transition metals in the periodic table that make them suitable for use in jewelry?,"{'text': ['Transition metals have high melting points, are typically brittle, and have low electrical conductivity.', 'Transition metals are shiny, malleable, have high melting points, and are good conductors of electricity.', 'Transition metals are dull, non-malleable, and poor conductors of electricity.', 'Transition metals are gases at room temperature and have high reactivity with water.'], 'label': ['A', 'B', 'C', 'D']}",B
NYSEDREGENTS_2008_8_32,"What is the complete and precise definition of a weather front, including its characteristics and effects on local weather conditions?","{'text': ['A weather front is a boundary separating two masses of air of different densities, which can lead to sudden changes in weather conditions such as temperature, humidity, and precipitation.', 'A weather front is a zone of high pressure that typically leads to clear skies and stable weather conditions.', 'A weather front is a region where wind speeds are the highest, often resulting in calm and dry weather.', 'A weather front is a boundary between two low-pressure systems, causing a decrease in wind speed and an increase in temperature.'], 'label': ['A', 'B', 'C', 'D']}",A
Mercury_SC_416104,What are the primary functions of plant stems in terms of structure and physiology?,"{'text': ['Stems primarily serve to absorb nutrients and water from the soil.', 'Stems are responsible for photosynthesis and storing excess sugars.', 'Stems provide support for leaves and flowers, transport water and nutrients, and store food.', 'Stems are involved in the reproduction process by producing seeds.'], 'label': ['A', 'B', 'C', 'D']}",C
Mercury_416646,"What unique plant-like structure, crucial for photosynthesis, is present in the colonial protist Volvox but absent in the unicellular protist Euglena?","{'text': ['Cell wall', 'Chloroplast', 'Flagellum', 'Starch granules'], 'label': ['A', 'B', 'C', 'D']}",A
Mercury_SC_405296,"What is the specific term for the part of an ecosystem that provides the necessary conditions for a squirrel's survival, including food, shelter, and the environment?","{'text': ['Niche', 'Biome', 'Habitat', 'Biosphere'], 'label': ['A', 'B', 'C', 'D']}",C
MCAS_2006_8_31,What is the balanced chemical equation for the process of photosynthesis in plants?,"{'text': ['6CO2 + 6H2O + light energy → C6H12O6 + 6O2', '6O2 + 6H2O + light energy → C6H12O6 + 6CO2', 'C6H12O6 + 6O2 + light energy → 6CO2 + 6H2O', '6CO2 + C6H12O6 + light energy → 6H2O + 6O2'], 'label': ['A', 'B', 'C', 'D']}",A
MCAS_2015_5_14,"What is the precise thermodynamic term used to describe the process of water transitioning from a liquid state to a solid state, and what are the specific conditions under which this occurs?","{'text': ['Freezing, at 0°C under standard atmospheric pressure', 'Sublimation, at -100°C under low pressure', 'Evaporation, at 100°C under standard atmospheric pressure', 'Condensation, at 50°C under high humidity'], 'label': ['A', 'B', 'C', 'D']}",A
Mercury_417465,"What is the term for ecosystems that rely on chemosynthesis instead of photosynthesis, where producers capture energy from inorganic molecules such as methane and hydrogen sulfide?","{'text': ['Rainforest ecosystems', 'Hydrothermal vent ecosystems', 'Desert ecosystems', 'Grassland ecosystems'], 'label': ['A', 'B', 'C', 'D']}",B
MCAS_1998_4_19,What is the precise statement of Kepler's First Law of Planetary Motion?,"{'text': ['All planets move in elliptical orbits, with the Sun at one focus.', 'All planets move in circular orbits, with the Sun at the center.', 'All planets move in elliptical orbits, with the Sun at the center.', 'All planets move in circular orbits, with the Earth at one focus.'], 'label': ['A', 'B', 'C', 'D']}",A
Mercury_7214778,Which of the following best describes the role of an independent variable in a scientific experiment?,"{'text': ['It is the variable that is kept constant throughout the experiment to ensure a fair test.', 'It is the variable that is measured or observed to determine the effect of changes.', 'It is the variable that is deliberately changed or manipulated by the researcher to observe its effect on the dependent variable.', 'It is the variable that is randomly assigned and not controlled by the researcher.'], 'label': ['A', 'B', 'C', 'D']}",C
Mercury_7123393,What are the specific characteristics that scientists look for to identify a meteorite impact site on Earth?,"{'text': ['Presence of tektites, shocked quartz, and a large, circular depression in the ground.', 'Presence of volcanic rocks, high levels of radiation, and unusual plant growth.', 'Presence of salt deposits, geysers, and a high concentration of iron in the soil.', 'Presence of large crystals, fault lines, and elevated magnetic fields.'], 'label': ['A', 'B', 'C', 'D']}",A
Mercury_7207550,"What is the principle that describes the observation that, in undisturbed rock layers, older layers are found below younger layers?","{'text': ['Law of Superposition', 'Law of Uniformitarianism', 'Principle of Original Horizontality', 'Principle of Cross-Cutting Relationships'], 'label': ['A', 'B', 'C', 'D']}",A
Mercury_SC_405827,What is the exact definition of Newton's Third Law of Motion?,"{'text': ['For every action, there is an equal and opposite reaction; forces always occur in pairs.', 'An object at rest will remain at rest unless acted upon by an external force.', 'The acceleration of an object is directly proportional to the net force acting on it and inversely proportional to its mass.', 'An object in motion will remain in motion with constant velocity unless acted upon by a net external force.'], 'label': ['A', 'B', 'C', 'D']}",A
NYSEDREGENTS_2015_4_11,"What is the precise term for the energy conversion that occurs when sound is produced by a mechanical action, such as blowing a whistle?","{'text': ['Mechanical to thermal energy conversion', 'Mechanical to sound energy conversion', 'Chemical to sound energy conversion', 'Electrical to sound energy conversion'], 'label': ['A', 'B', 'C', 'D']}",B
Mercury_404097,What is the most widely accepted explanation for why Earth's inner core remains solid despite the extreme temperatures?,"{'text': [""The inner core remains solid due to the rapid cooling of Earth's surface."", 'The immense pressure at the center of the Earth prevents the inner core from melting.', 'The inner core is composed of materials with an exceptionally high melting point.', 'The inner core remains solid because it is made entirely of ice that does not melt under high temperatures.'], 'label': ['A', 'B', 'C', 'D']}",B
AIMS_2009_4_4,What is the historical significance of the first televised presidential debates in the United States?,"{'text': ['The first televised presidential debates occurred in 1960 and featured John F. Kennedy and Richard Nixon, altering public perception and emphasizing the importance of image in politics.', 'The first televised presidential debates occurred in 1952 and featured Dwight D. Eisenhower and Adlai Stevenson, revolutionizing political campaigning.', 'The first televised presidential debates occurred in 1964 and featured Lyndon B. Johnson and Barry Goldwater, introducing live audience participation.', 'The first televised presidential debates occurred in 1976 and featured Gerald Ford and Jimmy Carter, marking the end of radio dominance in political communications.'], 'label': ['A', 'B', 'C', 'D']}",A
NCEOGA_2013_8_18,What is the formal definition and significance of transitional fossils in evolutionary biology?,"{'text': ['Transitional fossils are direct ancestors of modern species and show clear evolutionary progress from one species to another.', 'Transitional fossils are rare fossils that show the gradual change between one species and another, providing evidence for the theory of evolution.', 'Transitional fossils are those that show no significant evolutionary changes and remain constant over time.', 'Transitional fossils are hypothetical constructs without any real examples in the fossil record.'], 'label': ['A', 'B', 'C', 'D']}",B
Mercury_400884,What is the complete electron configuration of phosphorus (atomic number 15) according to the Aufbau principle?,"{'text': ['1s² 2s² 2p⁶ 3s² 3p²', '1s² 2s² 2p⁶ 3s² 3p³', '1s² 2s² 2p⁶ 3s¹ 3p⁴', '1s² 2s¹ 2p⁶ 3s² 3p⁴'], 'label': ['A', 'B', 'C', 'D']}",B
Mercury_7219678,What is the primary chemical process used in reverse osmosis desalination to separate salt from seawater?,"{'text': ['Distillation', 'Electrodialysis', 'Membrane filtration', 'Ion exchange'], 'label': ['A', 'B', 'C', 'D']}",C
ACTAAP_2010_5_7,"What is the complete definition of the solid state of matter, including its characteristic properties?","{'text': ['A solid state of matter has a definite shape and volume, with particles that are closely packed and vibrate in place.', 'A solid state of matter has no definite shape or volume, with particles that move freely past each other.', 'A solid state of matter has a definite shape but no definite volume, with particles that are loosely bound.', 'A solid state of matter has no definite shape but a definite volume, with particles that are tightly packed but can slide over one another.'], 'label': ['A', 'B', 'C', 'D']}",A
ACTAAP_2012_7_9,"What is the formal definition of organic chemistry, emphasizing the role and versatility of carbon in forming compounds?","{'text': ['Organic chemistry is the study of all compounds that contain carbon, which can form diverse structures due to its ability to create single, double, and triple bonds with itself and other elements.', 'Organic chemistry is solely the study of carbon and its ability to form inorganic compounds with metals.', 'Organic chemistry is the branch of chemistry dealing with compounds that do not contain carbon, focusing on the properties of non-carbon elements.', 'Organic chemistry is the study of the physical and chemical properties of metals and their reactions with oxygen.'], 'label': ['A', 'B', 'C', 'D']}",A
MCAS_2005_8_6,What is the fundamental principle of plate tectonics that explains the presence of marine fossils in elevated mountainous regions?,"{'text': ['The principle of continental drift, where continents move slowly over the Earth’s surface, causing marine fossils to be lifted as landmasses collide and form mountains.', 'The principle of subduction, where oceanic plates sink beneath continental plates, leading to the presence of marine fossils on land.', 'The principle of sea-floor spreading, where new oceanic crust is created, pushing marine fossils onto land.', 'The principle of erosion, where water erodes land and deposits marine fossils in mountainous regions.'], 'label': ['A', 'B', 'C', 'D']}",A
Mercury_SC_401162,"What is the exact definition of the Celsius scale, including its fundamental reference points?","{'text': ['The Celsius scale is a temperature scale where the freezing point of water is 0 degrees and the boiling point is 100 degrees, both at standard atmospheric pressure.', 'The Celsius scale is a temperature scale where the freezing point of mercury is 0 degrees and the boiling point is 100 degrees, both at standard atmospheric pressure.', 'The Celsius scale is a temperature scale where the freezing point of water is 32 degrees and the boiling point is 212 degrees, both at standard atmospheric pressure.', 'The Celsius scale is a temperature scale designed to use the average human body temperature as its reference point, set at 37 degrees.'], 'label': ['A', 'B', 'C', 'D']}",A
Mercury_SC_407710,"What is the precise definition of a scientific hypothesis, including its role in the scientific method?","{'text': ['A scientific hypothesis is a conjecture based on existing data that does not need to be tested.', 'A scientific hypothesis is a proposed explanation for a phenomenon, which can be tested through experimentation or observation.', 'A scientific hypothesis is a statement of fact that has been proven to be true by multiple experiments.', 'A scientific hypothesis is a theory that has been widely accepted by the scientific community without the need for testing.'], 'label': ['A', 'B', 'C', 'D']}",B
VASoL_2009_3_23,What is the fundamental property of sound waves that allows a vibrating metal rod to produce audible sound?,"{'text': ['Sound waves require a medium to travel, and they propagate through the air when the rod vibrates.', 'Sound waves are longitudinal waves that can travel through a vacuum, produced by the vibrating rod.', 'Sound waves are electromagnetic waves that are generated by the vibrating metal rod.', 'Sound waves are transverse waves that can only travel through solids, produced by the vibrating rod.'], 'label': ['A', 'B', 'C', 'D']}",A
Mercury_SC_402276,What is the formal definition and characteristics of learned behavior in the context of animal behavior studies?,"{'text': ['Learned behavior refers to instinctual actions that organisms perform without prior experience or training.', 'Learned behavior is a change in behavior that results from experience and is not genetically pre-determined.', 'Learned behavior is a type of behavior that is innate and occurs without any environmental influence.', 'Learned behavior only occurs in domesticated animals and is not observed in wild species.'], 'label': ['A', 'B', 'C', 'D']}",B
Mercury_400744,What is the main process by which forests help regulate atmospheric carbon dioxide levels?,"{'text': ['Photosynthesis, where plants absorb carbon dioxide and release oxygen.', 'Respiration, where plants absorb oxygen and release carbon dioxide.', 'Transpiration, where plants release water vapor into the atmosphere.', 'Decomposition, where dead plant material releases carbon dioxide.'], 'label': ['A', 'B', 'C', 'D']}",A
Mercury_SC_LBS10902,What is the most accurate and comprehensive description of the natural habitat conditions ideal for the growth of fern plants?,"{'text': ['Fern plants thrive in arid desert environments with minimal water availability and high temperatures.', 'Fern plants are most commonly found in tropical and subtropical regions that provide humid, shaded, and moist conditions.', 'Fern plants predominantly grow in alpine regions with cold temperatures and direct sunlight.', 'Fern plants prefer high-altitude tundra regions characterized by dry and windy conditions.'], 'label': ['A', 'B', 'C', 'D']}",B
Mercury_7133245,What is the primary form of energy transformation that occurs in a toaster when it is used to toast bread?,"{'text': ['Electrical energy to mechanical energy', 'Electrical energy to chemical energy', 'Electrical energy to thermal energy', 'Electrical energy to nuclear energy'], 'label': ['A', 'B', 'C', 'D']}",C
Mercury_7131530,"What is the precise definition of a chemical change, and how does it differ from a physical change?","{'text': ['A chemical change is a process where a substance changes its state of matter without altering its chemical structure, whereas a physical change results in the formation of new chemical substances.', 'A chemical change is a process that results in the formation of new substances with different chemical properties, whereas a physical change involves changes in state or form without changing the composition.', 'A chemical change involves changes in the physical state of a substance, such as melting or boiling, while a physical change involves a re-arrangement of atoms into new compounds.', 'A chemical change is a reversible process involving the separation of mixtures, while a physical change involves irreversible chemical reactions.'], 'label': ['A', 'B', 'C', 'D']}",B
Mercury_7041143,What is the exact definition of pH as it relates to the concentration of hydrogen ions in a solution?,"{'text': ['pH is the measure of the temperature of a solution.', 'pH is the measure of the electrical conductivity of a solution.', 'pH is the measure of the concentration of hydroxide ions in a solution.', 'pH is the measure of the negative logarithm (base 10) of the hydrogen ion concentration in a solution.'], 'label': ['A', 'B', 'C', 'D']}",D
MCAS_2010_5_11984,What is the exact definition of a learned behavior in the context of behavioral biology?,"{'text': ['A learned behavior is an action or response that is determined entirely by genetic predisposition and is present from birth.', 'A learned behavior is an action or response that is acquired through experience and interaction with the environment, often involving practice and reinforcement.', 'A learned behavior is an action or response that is instinctual and occurs in all members of a species without prior experience.', 'A learned behavior is an action that occurs spontaneously without any prior training or environmental influence.'], 'label': ['A', 'B', 'C', 'D']}",B
Mercury_7159285,"What is the primary ecological definition of an artificial reef, and what are its intended functions?","{'text': ['An artificial reef is any structure placed on the seabed to mimic the characteristics of a natural reef, intended primarily to boost local fish populations and prevent coastal erosion.', 'An artificial reef is a submerged natural structure intended to enhance marine biodiversity by providing habitat, shelter, and spawning grounds for marine organisms.', 'An artificial reef is a man-made underwater structure typically built to promote marine life, control erosion, block ship passage, and improve surfing conditions.', 'An artificial reef is a natural rock formation that is used to attract fish and aid in marine research.'], 'label': ['A', 'B', 'C', 'D']}",C
AIMS_2008_8_13,What is the precise definition of a neutralization reaction in chemistry?,"{'text': ['A neutralization reaction is a chemical reaction in which an acid reacts with a base to produce a salt and water, and the resulting solution has a pH closer to 7.', 'A neutralization reaction is a chemical process where a base reacts with a salt to produce an acid and water.', 'A neutralization reaction is a synthesis reaction where two acids combine to form a single compound with increased acidity.', 'A neutralization reaction is a process that involves the combination of hydrogen gas with a salt to form a base and water.'], 'label': ['A', 'B', 'C', 'D']}",A
MDSA_2013_8_20,What is the precise definition of the law of conservation of energy?,"{'text': ['Energy can neither be created nor destroyed; it can only be transformed from one form to another, with the total amount of energy remaining constant.', 'Energy can be created in large amounts but cannot be destroyed, and it remains in the same form indefinitely.', 'Energy can only be created by chemical reactions and cannot be converted to other forms without loss.', 'Energy is always conserved in mechanical systems, but not in systems involving thermal processes.'], 'label': ['A', 'B', 'C', 'D']}",A
Mercury_7114100,"What is the complete definition of a galaxy, including its components and how it is held together?","{'text': ['A galaxy is a large collection of stars, gas, and dust, all held together by gravity, sometimes containing billions of stars and often featuring a supermassive black hole at its center.', 'A galaxy is a small system of stars and planets, held together by static forces, with no black holes present.', 'A galaxy is a large group of planets and moons orbiting a central star, bound by electromagnetic forces.', 'A galaxy is a cloud of gas and dust with no stars, bound together by magnetic fields.'], 'label': ['A', 'B', 'C', 'D']}",A
Mercury_7213343,What is the precise environmental impact of building a dam on a river ecosystem?,"{'text': ['Building a dam on a river always increases the biodiversity of the river ecosystem.', 'A dam can disrupt the natural flow of sediments and nutrients, leading to the decline of downstream ecosystems.', 'Dams only have positive effects on fish populations by providing new habitats.', 'Building a dam prevents any changes in the water temperature, thus having no impact on aquatic life.'], 'label': ['A', 'B', 'C', 'D']}",B
Mercury_SC_LBS10597,Which of the following is the most accurate and comprehensive definition of a chemical change?,"{'text': ['A chemical change involves a change in the state of matter, such as from solid to liquid, without altering the chemical identity of the substances involved.', 'A chemical change is a process where one or more substances are altered into one or more new and different substances, involving the making or breaking of chemical bonds.', 'A chemical change refers to the rearrangement of atoms within a molecule, resulting in a change of phase but not in the chemical properties of the substance.', 'A chemical change occurs when physical properties such as color and texture change, but the composition of the substance remains the same.'], 'label': ['A', 'B', 'C', 'D']}",B
Mercury_7126263,What are the exact processes and forms of energy conversion that occur when a standard flashlight is turned on?,"{'text': ['Chemical energy in the batteries is converted into electrical energy, which is then converted into light and thermal energy in the bulb.', 'Electrical energy from the power source is directly converted into thermal energy in the bulb, producing light as a byproduct.', ""Mechanical energy is stored in the flashlight's components, which is released as electrical and light energy when turned on."", 'Nuclear energy stored in the batteries is converted directly into light energy without any intermediate forms.'], 'label': ['A', 'B', 'C', 'D']}",A
Mercury_7133613,What is the scientific name of the cactus moth that was introduced to Australia as a biological control agent in 1926?,"{'text': ['Cactoblastis cactorum', 'Opuntia stricta', 'Dactylopius coccus', 'Cylindropuntia fulgida'], 'label': ['A', 'B', 'C', 'D']}",A
Mercury_7234605,"What is the precise definition of uniform circular motion in physics, including the characteristics of the velocity and acceleration of the object?","{'text': ['Uniform circular motion refers to the motion of an object moving at a constant speed along a circular path, with a constant velocity and zero acceleration.', 'Uniform circular motion refers to the motion of an object moving at a constant speed along a circular path, where the velocity is constant in magnitude but changing in direction, resulting in a non-zero centripetal acceleration directed towards the center of the circle.', 'Uniform circular motion refers to the motion of an object moving at a variable speed along a circular path, with a constant velocity and acceleration directed towards the center of the circle.', 'Uniform circular motion refers to the motion of an object moving at a constant speed along a circular path, where both velocity and acceleration are constant in magnitude and direction.'], 'label': ['A', 'B', 'C', 'D']}",B
Mercury_SC_400839,What is the exact definition of a chemical property that would determine the compatibility of a container with an unknown liquid?,"{'text': [""A chemical property is any characteristic that can be observed or measured without changing the substance's chemical identity."", ""A chemical property is a characteristic that describes the substance's ability to undergo a specific chemical change or reaction."", 'A chemical property is a property that depends solely on the amount of matter present.', 'A chemical property is a feature that describes the physical appearance of a substance, such as color or shape.'], 'label': ['A', 'B', 'C', 'D']}",B
Mercury_SC_402984,What is the exact scientific definition of a 'reusable resource' in the context of scientific investigations?,"{'text': ['A reusable resource is any material that can be recycled for use in future experiments without any alteration.', 'A reusable resource is an item that can be used again in multiple investigations without losing its integrity or functionality.', 'A reusable resource is a material that cannot be consumed or degraded during an experiment.', 'A reusable resource is any item that can be redesigned and modified for new types of experiments.'], 'label': ['A', 'B', 'C', 'D']}",B
NYSEDREGENTS_2012_4_29,"What is the scientific method's definition, including its key steps and purpose?","{'text': ['The scientific method is a systematic approach that involves observing phenomena, forming questions, hypothesizing, conducting experiments, analyzing results, and drawing conclusions.', 'The scientific method is a casual set of actions primarily based on intuition and creativity without specific order or purpose.', 'The scientific method is a philosophical approach that involves debating ideas to reach a consensus without the need for empirical evidence.', 'The scientific method is purely theoretical and does not involve experimentation or observation.'], 'label': ['A', 'B', 'C', 'D']}",A
VASoL_2009_3_22,"What is the botanical definition of an apple, including its family and genus classification?","{'text': ['An apple is a type of drupe belonging to the Rosaceae family and the Malus genus.', 'An apple is a pome fruit that is part of the Rosaceae family and the Malus genus.', 'An apple is a citrus fruit belonging to the Rutaceae family and the Citrus genus.', 'An apple is a berry classified under the Ericaceae family and the Vaccinium genus.'], 'label': ['A', 'B', 'C', 'D']}",B
Mercury_409349,What is the exact atomic structure difference between the isotopes boron-10 and boron-11?,"{'text': ['Boron-10 has 5 protons and 5 neutrons, while boron-11 has 5 protons and 6 neutrons.', 'Boron-10 has 4 protons and 6 neutrons, while boron-11 has 5 protons and 6 neutrons.', 'Boron-10 has 5 protons and 6 neutrons, while boron-11 has 6 protons and 5 neutrons.', 'Boron-10 has 6 protons and 4 neutrons, while boron-11 has 5 protons and 6 neutrons.'], 'label': ['A', 'B', 'C', 'D']}",A
