id,question,choices,answerKey
Mercury_7175875,"What is the full and precise statement of the law of conservation of angular momentum in physics, including its application to isolated systems?","{'text': ['The total angular momentum of a system remains constant if the net external torque acting on the system is zero.', 'The total angular momentum of a system is always conserved, regardless of external forces or torques.', 'The angular momentum of each object in a system is conserved individually, irrespective of interactions with other objects.', 'Angular momentum is only conserved when a system is in a state of uniform circular motion.'], 'label': ['A', 'B', 'C', 'D']}",A
Mercury_SC_409171,What is the primary characteristic of an earthquake-resistant building design?,"{'text': ['It has a strong and rigid structure to completely resist movements.', 'It is designed to absorb and dissipate energy through flexible materials and structural systems.', 'It uses only lightweight materials to minimize the impact of an earthquake.', 'It relies on the use of deep foundations to anchor the building firmly into the ground.'], 'label': ['A', 'B', 'C', 'D']}",B
Mercury_SC_408547,What is the exact chemical equation representing the overall process of photosynthesis in plants?,"{'text': ['6CO2 + 6H2O + light energy -> C6H12O6 + 6O2', '6O2 + 6H2O + light energy -> C6H12O6 + 6CO2', 'C6H12O6 + 6O2 -> 6CO2 + 6H2O + energy', '6CO2 + 12H2O + light energy -> C6H12O6 + 6O2 + 6H2O'], 'label': ['A', 'B', 'C', 'D']}",A
Mercury_407327,"What is the fundamental principle that describes the relationship between an object's motion and the forces acting upon it, especially relevant when considering changes in an object's speed or direction?","{'text': [""Newton's First Law of Motion"", ""Newton's Second Law of Motion"", ""Newton's Third Law of Motion"", 'The Law of Conservation of Energy'], 'label': ['A', 'B', 'C', 'D']}",B
MCAS_2006_9_44,"What is the exact value of the acceleration due to gravity on the surface of the Moon, and how does it compare to Earth's gravity?","{'text': [""The acceleration due to gravity on the Moon is 1.62 m/s², which is approximately 1/6th of Earth's gravity."", ""The acceleration due to gravity on the Moon is 9.81 m/s², which is the same as Earth's gravity."", ""The acceleration due to gravity on the Moon is 3.71 m/s², which is approximately 1/4th of Earth's gravity."", ""The acceleration due to gravity on the Moon is 0.98 m/s², which is approximately 1/10th of Earth's gravity.""], 'label': ['A', 'B', 'C', 'D']}",A
Mercury_7270393,"What is the full scientific classification, including kingdom, phylum, class, order, family, genus, and species, of the organism responsible for Devil Facial Tumor Disease (DFTD) in Tasmanian devils?","{'text': ['DFTD is not caused by a traditional organism and therefore does not have a scientific classification.', 'Kingdom Animalia, Phylum Chordata, Class Mammalia, Order Dasyuromorphia, Family Dasyuridae, Genus Sarcophilus, Species Sarcophilus harrisii.', 'Kingdom Animalia, Phylum Chordata, Class Mammalia, Order Dasyuromorphia, Family Dasyuridae, Genus Dasyurus, Species Dasyurus viverrinus.', 'Kingdom Protista, Phylum Sarcomastigophora, Class Zoomastigophorea, Order Kinetoplastida, Family Trypanosomatidae, Genus Trypanosoma, Species Trypanosoma cruzi.'], 'label': ['A', 'B', 'C', 'D']}",A
MCAS_2014_5_7,"What specific species of small mammal, known for creating rock pile homes in the mountain regions of the western United States, is known for storing grasses and seeds as part of its ecological adaptations?","{'text': ['Yellowstone Marmot', 'American Pika', 'Mountain Cottontail', 'Desert Kangaroo Rat'], 'label': ['A', 'B', 'C', 'D']}",B
Mercury_7086660,What is the theory of continental drift and who first proposed it?,"{'text': ['The theory of continental drift suggests that continents are stationary and was first proposed by Alfred Wegener.', 'The theory of continental drift suggests that continents were once joined together and have since drifted apart, first proposed by Alfred Wegener.', 'The theory of continental drift suggests that continents float on a liquid outer core and was first proposed by Harry Hess.', 'The theory of continental drift suggests that continents were fixed in position and was first proposed by Charles Darwin.'], 'label': ['A', 'B', 'C', 'D']}",B
Mercury_7168805,"What is the definition of a food chain in ecological terms, and what roles do producers, consumers, and decomposers play within it?","{'text': ['A food chain is a linear sequence of organisms where each is eaten by the next member in the chain, with producers creating food from sunlight or chemicals, consumers eating other organisms, and decomposers breaking down dead material.', 'A food chain is a complex network of interconnected food webs, where all organisms are producers that create their own food.', 'A food chain is a circular pathway that involves only consumers who feed directly on primary producers.', 'A food chain is defined as a sequence of organisms in which each organism feeds on the one below it but does not involve producers or decomposers.'], 'label': ['A', 'B', 'C', 'D']}",A
MCAS_2003_8_11,"What is the precise atomic number and standard atomic weight of copper, as defined in the periodic table of elements?","{'text': ['Copper has an atomic number of 29 and a standard atomic weight of approximately 63.55.', 'Copper has an atomic number of 30 and a standard atomic weight of approximately 65.38.', 'Copper has an atomic number of 29 and a standard atomic weight of approximately 65.38.', 'Copper has an atomic number of 30 and a standard atomic weight of approximately 63.55.'], 'label': ['A', 'B', 'C', 'D']}",A
Mercury_7250058,What is the fundamental structural difference between prokaryotic and eukaryotic cells regarding the organization of their genetic material?,"{'text': ['Prokaryotic cells have their DNA enclosed within a nuclear envelope, whereas eukaryotic cells have free-floating DNA in the cytoplasm.', 'Prokaryotic cells have a single, circular DNA molecule located in the nucleoid region, while eukaryotic cells have multiple linear DNA molecules contained within a nucleus.', 'Prokaryotic cells have multiple linear chromosomes within a membrane-bound nucleus, whereas eukaryotic cells have a single circular chromosome in the cytoplasm.', 'Both prokaryotic and eukaryotic cells have their DNA organized in the same way, with no structural differences.'], 'label': ['A', 'B', 'C', 'D']}",B
Mercury_7012740,What is the precise role of the Sun in driving the Earth's oceanic circulation systems?,"{'text': ['The Sun directly heats the ocean surface, causing water to evaporate and form clouds, which then drive the oceanic currents.', 'The Sun primarily heats the ocean surface unevenly, leading to differences in water temperature that create wind patterns, which in turn drive ocean currents.', ""The Sun's gravitational pull directly influences the tides, which are the main drivers of oceanic circulation."", 'The Sun heats the ocean uniformly, resulting in a stable, non-dynamic oceanic system.'], 'label': ['A', 'B', 'C', 'D']}",B
Mercury_LBS10610,What is the exact Fahrenheit to Celsius conversion formula?,"{'text': ['°C = (°F - 32) / 1.8', '°C = (°F + 32) / 1.8', '°C = (°F - 32) * 1.8', '°C = (°F - 32) / 2'], 'label': ['A', 'B', 'C', 'D']}",A
Mercury_SC_407400,What is the exact definition of a scientific investigation and the essential steps it typically involves?,"{'text': ['A scientific investigation is a systematic process to test a hypothesis, involving steps such as forming a hypothesis, conducting experiments, analyzing data, and drawing conclusions.', 'A scientific investigation is an informal exploration of natural phenomena, often involving storytelling and anecdotal evidence.', 'A scientific investigation is a process of making observations and recording them without any specific goal or hypothesis.', 'A scientific investigation is the informal gathering of data without any specific procedures or objectives.'], 'label': ['A', 'B', 'C', 'D']}",A
Mercury_7212993,What is the precise composition and percentage of the most abundant greenhouse gas in Earth's lower atmosphere?,"{'text': ['Carbon dioxide (CO2) at approximately 0.04%', 'Methane (CH4) at approximately 0.00018%', 'Water vapor (H2O) with variable percentage around 0.25% to 4%', 'Ozone (O3) at approximately 0.000004%'], 'label': ['A', 'B', 'C', 'D']}",C
Mercury_SC_413240,"What is the precise definition of the Celsius temperature scale, particularly focusing on the point at which water transitions from liquid to solid?","{'text': ['The Celsius scale is defined by the freezing point of water at 0°C and the boiling point at 100°C, under standard atmospheric pressure.', 'The Celsius scale is defined by the freezing point of water at 0°C and the boiling point at 212°F, under any atmospheric pressure.', 'The Celsius scale is defined by the freezing point of water at 32°C and the boiling point at 212°C, under standard atmospheric pressure.', 'The Celsius scale is defined by the freezing point of water at 32°F and the boiling point at 100°C, under any atmospheric pressure.'], 'label': ['A', 'B', 'C', 'D']}",A
Mercury_7186358,What is the primary method used by paleontologists to determine the age of dinosaur fossils?,"{'text': ['Radiocarbon dating', 'Luminescence dating', 'Uranium-lead dating', 'Stratigraphy'], 'label': ['A', 'B', 'C', 'D']}",D
Mercury_7166425,What is the precise definition of thermal energy and its fundamental principle regarding heat flow?,"{'text': ['Thermal energy is the energy contained within a system that is responsible for its temperature, and it always flows from colder to hotter objects.', 'Thermal energy is the energy contained within a system that is responsible for its temperature, and it always flows from hotter to colder objects.', 'Thermal energy is the kinetic energy of molecules in a system, and it flows from areas of high molecular speed to low molecular speed.', 'Thermal energy is the potential energy stored in chemical bonds, and it can flow in any direction regardless of the temperature difference.'], 'label': ['A', 'B', 'C', 'D']}",B
MDSA_2007_8_3,"What is the formal definition of deforestation, including its primary causes and impacts on ecosystems?","{'text': ['Deforestation is the large-scale removal of forest trees without replanting, primarily caused by natural disasters and leading to increased biodiversity.', 'Deforestation is the clearing of forested land, typically for agricultural or commercial purposes, resulting in habitat loss, climate change, and biodiversity reduction.', 'Deforestation is a process where forests grow over time naturally, leading to increased carbon sequestration and biodiversity.', 'Deforestation refers to the selective cutting of trees in a forest for creating recreational areas, with minimal impact on ecosystems.'], 'label': ['A', 'B', 'C', 'D']}",B
Mercury_7094290,"What is the principle that states living organisms cannot arise from non-living matter, and who was the scientist primarily responsible for disproving the spontaneous generation theory?","{'text': ['The principle of abiogenesis, disproven by Louis Pasteur.', 'The principle of biogenesis, disproven by Francesco Redi.', 'The principle of biogenesis, disproven by Louis Pasteur.', 'The principle of spontaneous generation, disproven by Aristotle.'], 'label': ['A', 'B', 'C', 'D']}",C
Mercury_7186568,What is the comprehensive definition and primary function of lysosomes in eukaryotic cells?,"{'text': ['Lysosomes are organelles that synthesize proteins and are involved in energy production.', 'Lysosomes are membrane-bound organelles containing enzymes that break down waste materials, cellular debris, and foreign substances in the cell.', 'Lysosomes are organelles responsible for transporting nutrients throughout the cell and producing ATP.', 'Lysosomes are organelles that store lipids and are involved in the synthesis of carbohydrates.'], 'label': ['A', 'B', 'C', 'D']}",B
Mercury_402216,"What is the complete chemical equation for the electrolysis of water, including phase symbols and coefficients?","{'text': ['2H₂O(l) → 2H₂(g) + O₂(g)', 'H₂O(l) → H₂(g) + O₂(g)', '2H₂O(l) → H₂(g) + O₂(g)', 'H₂O(l) → 2H₂(g) + O₂(g)'], 'label': ['A', 'B', 'C', 'D']}",A
Mercury_404894,What is the precise taxonomic classification of penguins down to the family level?,"{'text': ['Animalia, Chordata, Aves, Spheniscidae', 'Animalia, Chordata, Mammalia, Spheniscidae', 'Animalia, Chordata, Aves, Anatidae', 'Animalia, Chordata, Mammalia, Anatidae'], 'label': ['A', 'B', 'C', 'D']}",A
MCAS_2002_8_11,What is Newton's Law of Cooling and how does it mathematically describe the rate of temperature change of an object relative to its surroundings?,"{'text': [""Newton's Law of Cooling states that the rate of change of temperature of an object is proportional to the difference in temperature between the object and its surroundings, expressed as \\\\( \\\\frac{dT}{dt} = -k(T - T_{env}) \\\\) where \\\\( T \\\\) is the temperature of the object, \\\\( T_{env} \\\\) is the ambient temperature, and \\\\( k \\\\) is a positive constant."", ""Newton's Law of Cooling states that the temperature of an object changes at a constant rate regardless of the temperature difference with its surroundings, mathematically expressed as \\\\( \\\\frac{dT}{dt} = -k \\\\)."", ""Newton's Law of Cooling implies that objects will cool down to absolute zero if left in a cooler environment, described by the equation \\\\( T = T_0 e^{-kt} \\\\), where \\\\( T_0 \\\\) is the initial temperature."", ""Newton's Law of Cooling states that the temperature difference between an object and its surroundings decreases linearly with time, without involving any exponential factors.""], 'label': ['A', 'B', 'C', 'D']}",A
Mercury_SC_405086,"What is the precise scientific classification for snow, rain, hail, and fog as forms of precipitation, and how are they fundamentally defined?","{'text': ['Snow, rain, hail, and fog are all forms of precipitation, which are defined as any form of water - liquid or solid - falling from the atmosphere to the ground.', 'Snow, rain, hail, and fog are forms of condensation, defined as the transition from the gaseous phase into the liquid phase.', 'Snow, rain, hail, and fog are classified as atmospheric phenomena that involve changes in air pressure.', 'Snow, rain, hail, and fog are all forms of sublimation, which is the transition of a substance from a solid to a gas without passing through the liquid phase.'], 'label': ['A', 'B', 'C', 'D']}",A
Mercury_SC_408324,What is the exact scientific term and process name for the transformation of a liquid into a solid state as experienced with juice when placed in a freezer?,"{'text': ['Evaporation, the process of liquid turning into vapor.', 'Condensation, the process of vapor turning into liquid.', 'Freezing, the process of a liquid turning into a solid.', 'Sublimation, the process of a solid turning directly into a gas.'], 'label': ['A', 'B', 'C', 'D']}",C
Mercury_7218820,What is the precise definition of a flash flood warning issued by meteorological services?,"{'text': ['A flash flood warning is issued when conditions are favorable for a flash flood to occur in the near future.', 'A flash flood warning is issued when a flash flood is imminent or occurring in the warned area, and immediate action is required to protect life and property.', 'A flash flood warning is a long-term forecast indicating the possibility of flash floods over a wide area.', 'A flash flood warning is an advisory that suggests monitoring weather conditions, but no immediate danger is present.'], 'label': ['A', 'B', 'C', 'D']}",B
Mercury_412202,"What is the fundamental principle that describes the relationship between the temperature of an object and the color of light it emits, known as Wien's Displacement Law?","{'text': [""Wien's Displacement Law states that the wavelength of peak emission is directly proportional to the temperature of the object."", ""Wien's Displacement Law states that the frequency of peak emission is inversely proportional to the temperature of the object."", ""Wien's Displacement Law states that the wavelength of peak emission is inversely proportional to the temperature of the object."", ""Wien's Displacement Law states that the intensity of emitted radiation is directly proportional to the temperature of the object.""], 'label': ['A', 'B', 'C', 'D']}",C
Mercury_SC_409139,What is the primary role of phytoplankton in the ocean ecosystem regarding the global carbon cycle?,"{'text': ['Phytoplankton are the main decomposers in the ocean, breaking down organic matter and releasing carbon dioxide into the atmosphere.', 'Phytoplankton photosynthesize, capturing carbon dioxide and converting it into organic matter, which is a crucial step in the oceanic carbon cycle.', 'Phytoplankton are responsible for the majority of nitrogen fixation in the ocean, providing nutrients to marine life.', 'Phytoplankton primarily consume dissolved carbon in the ocean and convert it into carbon monoxide, which is then released into the atmosphere.'], 'label': ['A', 'B', 'C', 'D']}",B
Mercury_400687,"What is the principle that explains why objects less dense than water float, and who is credited with its discovery?","{'text': [""Archimedes' Principle, discovered by Archimedes."", ""Pascal's Law, discovered by Blaise Pascal."", ""Bernoulli's Principle, discovered by Daniel Bernoulli."", ""Torricelli's Law, discovered by Evangelista Torricelli.""], 'label': ['A', 'B', 'C', 'D']}",A
Mercury_7171605,What is the principle of stratigraphy regarding the relative dating of rock layers?,"{'text': ['The principle of stratigraphy states that rock layers are deposited in a time sequence, with the oldest on the bottom and the youngest on the top.', 'The principle of stratigraphy asserts that all rock layers are the same age regardless of their position.', 'The principle of stratigraphy suggests that fossils within the same rock layer are from different time periods.', 'The principle of stratigraphy indicates that rock layers are random in age and cannot be used for dating fossils.'], 'label': ['A', 'B', 'C', 'D']}",A
Mercury_7210245,What is the precise definition and significance of the property of water known as 'high specific heat capacity'?,"{'text': ['High specific heat capacity means water can absorb a lot of heat without a significant rise in temperature, which helps stabilize the climate and maintain stable temperatures in living organisms.', ""High specific heat capacity refers to water's ability to dissolve a wide range of substances, making it an excellent solvent."", 'High specific heat capacity is the phenomenon where water expands upon freezing, which allows ice to float on liquid water.', 'High specific heat capacity describes the ability of water to conduct electricity, which is crucial for cellular processes.'], 'label': ['A', 'B', 'C', 'D']}",A
AKDE&ED_2008_4_25,Which of the following statements accurately defines the property of matter known as 'density'?,"{'text': ['Density is the total mass of an object divided by its volume.', 'Density is the amount of space an object occupies regardless of its mass.', 'Density is the weight of an object divided by the gravitational force acting on it.', 'Density is the total volume of an object multiplied by its mass.'], 'label': ['A', 'B', 'C', 'D']}",A
AKDE&ED_2008_4_19,"What is the definition of a scientific discovery, and what are the criteria that classify an event or finding as a scientific discovery?","{'text': ['A scientific discovery is any event that occurs during an experiment, regardless of its significance, and it does not require validation by the scientific community.', 'A scientific discovery is a new finding that must be verified, peer-reviewed, and accepted by the scientific community, contributing to the existing body of scientific knowledge.', 'A scientific discovery is an observation that leads to a new hypothesis, which must be proven true immediately after the initial observation.', 'A scientific discovery is the identification of a novel phenomenon that can only occur in theoretical physics and requires no empirical evidence.'], 'label': ['A', 'B', 'C', 'D']}",B
Mercury_SC_400402,What is the precise definition of a natural event in environmental science?,"{'text': ['A natural event is any phenomenon that occurs in nature without human intervention and includes processes like volcanic eruptions, earthquakes, and tornadoes.', 'A natural event is any occurrence in the natural world that is influenced by human activities and results in environmental changes.', 'A natural event refers to any event that occurs in a natural setting, regardless of whether it is caused by humans or naturally occurring processes.', 'A natural event is a phenomenon that only occurs in the atmosphere, such as storms or precipitation, and excludes geological or biological processes.'], 'label': ['A', 'B', 'C', 'D']}",A
Mercury_7234308,What is the formal definition of a transform plate boundary in plate tectonics?,"{'text': ['A transform plate boundary is where two tectonic plates are moving towards each other, leading to the formation of mountains.', 'A transform plate boundary is where two tectonic plates are moving away from each other, leading to the formation of new crust.', 'A transform plate boundary is where two tectonic plates slide past each other horizontally, resulting in earthquakes.', 'A transform plate boundary is where one tectonic plate is forced under another, leading to volcanic activity.'], 'label': ['A', 'B', 'C', 'D']}",C
ACTAAP_2014_5_8,"What is the classification of the Sun in terms of its spectral type and luminosity class within the Morgan-Keenan system, and what do these classifications indicate about its temperature and size?","{'text': ['The Sun is classified as a G2V star, indicating it is a white dwarf with high temperature and small size.', 'The Sun is classified as a K2III star, indicating it is a giant star with a cooler temperature and larger size than the Sun.', 'The Sun is classified as a G2V star, indicating it is a main-sequence star with a moderate temperature and size.', 'The Sun is classified as an M1V star, indicating it is a red dwarf with low temperature and small size.'], 'label': ['A', 'B', 'C', 'D']}",C
Mercury_400407,"What is the precise definition of the heliocentric model of the solar system, including its main proponent and fundamental principles?","{'text': ['The heliocentric model is a model of the solar system where Earth is at the center, and all planets, including the Sun, revolve around it, first proposed by Claudius Ptolemy.', 'The heliocentric model is a model of the solar system where the Sun is at the center, and all planets, including Earth, revolve around it, first proposed by Nicolaus Copernicus.', 'The heliocentric model is a model of the solar system where Earth and the Sun revolve around a common center, first proposed by Aristotle.', 'The heliocentric model is a solar system model where the Sun and Earth are treated as equal centers, first popularized by Galileo Galilei.'], 'label': ['A', 'B', 'C', 'D']}",B
Mercury_7116288,"Which specific organelle within plant cells is primarily responsible for carrying out the process of photosynthesis, and what key pigment does it contain that is essential for capturing light energy?","{'text': ['The mitochondrion, which contains chlorophyll.', 'The chloroplast, which contains chlorophyll.', 'The chloroplast, which contains hemoglobin.', 'The nucleus, which contains chlorophyll.'], 'label': ['A', 'B', 'C', 'D']}",B
MCAS_2004_9_15-v1,What is the fundamental difference in the medium used for transmitting power in hydraulic and pneumatic systems?,"{'text': ['Hydraulic systems use compressible gases, while pneumatic systems use incompressible liquids.', 'Hydraulic systems use incompressible liquids, while pneumatic systems use compressible gases.', 'Both hydraulic and pneumatic systems use compressible gases.', 'Both hydraulic and pneumatic systems use incompressible liquids.'], 'label': ['A', 'B', 'C', 'D']}",B
NYSEDREGENTS_2015_4_26,What is the scientific term for the behavior of animals using objects in their environment to groom themselves or remove parasites?,"{'text': ['Anthropomorphism', 'Autogrooming', 'Allogrooming', 'Self-anointing'], 'label': ['A', 'B', 'C', 'D']}",B
Mercury_SC_401620,"What is the exact term used to describe the Earth's rotation period relative to the Sun, which results in the cycle of day and night?","{'text': ['Sidereal day', 'Solar day', 'Lunar day', 'Astronomical day'], 'label': ['A', 'B', 'C', 'D']}",B
Mercury_400877,What is the definition of an isotope in terms of atomic structure?,"{'text': ['Isotopes are atoms of the same element with the same number of protons but different numbers of neutrons.', 'Isotopes are atoms of different elements with the same number of electrons but different numbers of protons.', 'Isotopes are atoms with the same number of neutrons but different numbers of protons and electrons.', 'Isotopes are atoms of the same element with the same number of neutrons and electrons.'], 'label': ['A', 'B', 'C', 'D']}",A
Mercury_7174213,"What is the primary factor that determines the speed of sound in a medium, considering the properties of solids, liquids, and gases?","{'text': ['The density of the medium, with denser mediums always allowing faster sound travel.', 'The elasticity of the medium, specifically how quickly it can return to its original shape after deformation.', 'The temperature of the medium, with higher temperatures always decreasing the speed of sound.', 'The molecular weight of the medium, with heavier molecules allowing faster sound travel.'], 'label': ['A', 'B', 'C', 'D']}",B
