id,question,choices,answerKey
Mercury_SC_407382,"What is the scientific class to which both ducks and turtles belong, and what are the defining characteristics of this class?","{'text': ['Both ducks and turtles belong to the class Mammalia, characterized by warm-blooded bodies and the presence of mammary glands.', 'Both ducks and turtles belong to the class Reptilia, characterized by cold-blooded metabolism and scales covering their bodies.', 'Both ducks and turtles belong to the class Aves, characterized by feathers and the ability to fly.', 'Both ducks and turtles belong to the class Vertebrata, characterized by having a backbone or spinal column.'], 'label': ['A', 'B', 'C', 'D']}",D
MDSA_2010_4_20,What is the definition of arable land and its significance in determining the types of crops that can be cultivated?,"{'text': ['Arable land is land suitable for grazing livestock and has no impact on crop cultivation.', 'Arable land is land that can be used for growing crops, characterized by fertile soil and favorable climate conditions.', 'Arable land is any land located near a water body, regardless of soil fertility or climate.', 'Arable land is land that is covered by forests and used for timber production.'], 'label': ['A', 'B', 'C', 'D']}",B
Mercury_SC_405019,What is the precise definition of an exothermic reaction in chemistry?,"{'text': ['An exothermic reaction is a chemical reaction that absorbs energy from its surroundings.', 'An exothermic reaction is a chemical reaction that releases energy by light or heat to its surroundings.', 'An exothermic reaction is a chemical reaction that occurs at a constant temperature.', 'An exothermic reaction is a reaction that requires a catalyst to proceed.'], 'label': ['A', 'B', 'C', 'D']}",B
Mercury_7123078,What is the exact definition of the gravitational force according to Newton's law of universal gravitation?,"{'text': ['The gravitational force is a force that attracts any two objects with mass towards each other and is directly proportional to the product of their masses and inversely proportional to the square of the distance between their centers.', 'The gravitational force is a force that acts only between celestial bodies like planets and stars, causing them to orbit each other.', ""The gravitational force is a force that only acts at close distances and is responsible for keeping humans and objects anchored to the Earth's surface."", 'The gravitational force is an electromagnetic force that acts between charged particles and depends on their relative velocities.'], 'label': ['A', 'B', 'C', 'D']}",A
Mercury_400084,What is the precise definition of a chemical equation in the context of a chemical reaction?,"{'text': ['A chemical equation is a mathematical formula used to calculate the energy released in a chemical reaction.', 'A chemical equation is a symbolic representation of a chemical reaction, showing the reactants and products with their respective proportions.', 'A chemical equation is a diagram illustrating the physical states and colors of substances involved in a reaction.', 'A chemical equation is a chart listing all possible reactions between given substances.'], 'label': ['A', 'B', 'C', 'D']}",B
Mercury_7139650,What is the fundamental principle behind regenerative braking systems used in some new cars?,"{'text': [""Regenerative braking systems convert kinetic energy into potential energy and store it in the car's suspension."", 'Regenerative braking systems convert thermal energy from the brake pads into electrical energy and store it in the battery.', 'Regenerative braking systems convert kinetic energy into electrical energy and store it in the battery.', 'Regenerative braking systems convert chemical energy from the fuel into kinetic energy to enhance braking efficiency.'], 'label': ['A', 'B', 'C', 'D']}",C
Mercury_417150,What are the primary processes in the water cycle that directly influence the salinity levels at the ocean's surface?,"{'text': ['Evaporation and precipitation', 'Runoff and infiltration', 'Condensation and transpiration', 'Sublimation and deposition'], 'label': ['A', 'B', 'C', 'D']}",A
Mercury_SC_402256,"What are the defining characteristics of the embryonic stage in the life cycle of both plants, such as apple trees, and animals, such as chickens?","{'text': ['The embryonic stage is characterized by rapid cell division and differentiation, leading to the formation of basic structures and organs.', 'The embryonic stage is when the organism is fully developed and begins to reproduce.', 'The embryonic stage involves the organism remaining dormant and waiting for environmental triggers to begin growth.', 'The embryonic stage is when the organism is fully mature and capable of independent living.'], 'label': ['A', 'B', 'C', 'D']}",A
TIMSS_2007_8_pg53,"What is the fundamental process by which an electrical current causes a chemical change in a solution, particularly leading to the formation of gas bubbles at one of the electrodes?","{'text': ['Electrolysis', 'Electroplating', 'Fermentation', 'Catalysis'], 'label': ['A', 'B', 'C', 'D']}",A
MCAS_2006_9_17-v1,"What is the precise definition of power in the context of physics, particularly in relation to work and time?","{'text': ['Power is the rate at which work is done or energy is transferred, and it is measured in joules.', 'Power is the total amount of work done, measured in newtons.', 'Power is the rate at which work is done or energy is transferred, measured in watts, where 1 watt equals 1 joule per second.', 'Power is the amount of force applied over a distance, measured in joules per meter.'], 'label': ['A', 'B', 'C', 'D']}",C
Mercury_401728,What is the complete sequence of stages in the life cycle of a typical apple tree?,"{'text': ['Germination, Seedling, Vegetative Growth, Flowering, Fruiting, Senescence', 'Seedling, Germination, Vegetative Growth, Fruiting, Flowering, Senescence', 'Germination, Vegetative Growth, Flowering, Fruiting, Dormancy', 'Germination, Fruiting, Flowering, Vegetative Growth, Senescence'], 'label': ['A', 'B', 'C', 'D']}",A
Mercury_7192798,What is the comprehensive definition of an ecosystem in the context of ecology?,"{'text': ['An ecosystem is a community of living organisms interacting with the non-living components of their environment, functioning as a single unit.', 'An ecosystem is a collection of species within a specific geographical area, not involving any interactions with non-living components.', 'An ecosystem refers to the climate and weather patterns of a region, excluding the interactions between living organisms.', 'An ecosystem is a term used to describe any natural environment where humans have introduced artificial structures.'], 'label': ['A', 'B', 'C', 'D']}",A
Mercury_7221078,"What is the role of blood parasites in the ecosystem, particularly in relation to their hosts?","{'text': [""Blood parasites are beneficial to their hosts as they enhance the host's immune response."", 'Blood parasites have no significant impact on their hosts and merely coexist without causing harm.', 'Blood parasites can weaken their hosts by consuming nutrients and damaging tissues, potentially leading to illness or death.', 'Blood parasites primarily serve as vectors for plant pollination.'], 'label': ['A', 'B', 'C', 'D']}",C
Mercury_7004953,What is the formal definition of classical conditioning in psychology?,"{'text': ['Classical conditioning is a learning process in which a neutral stimulus becomes associated with an involuntary response.', 'Classical conditioning is a method of training animals by using rewards and punishments.', 'Classical conditioning is a cognitive process where thoughts and emotions are involved in problem-solving.', 'Classical conditioning involves the use of positive reinforcement to increase the frequency of a behavior.'], 'label': ['A', 'B', 'C', 'D']}",A
TIMSS_2003_8_pg94,What is the exact classification of the Sun based on its spectral type and luminosity class?,"{'text': ['The Sun is classified as a G2V star, which indicates a main-sequence star with a spectral type of G2.', 'The Sun is classified as an M-type giant star, which indicates a red giant star.', 'The Sun is classified as an O-type supergiant star, which indicates a very hot and luminous star.', 'The Sun is classified as a K0V star, which indicates a main-sequence star with a spectral type of K0.'], 'label': ['A', 'B', 'C', 'D']}",A
Mercury_7095060,"What is the definition of a solution in chemistry, specifically in terms of its components and their interactions?","{'text': ['A solution is a homogenous mixture composed of two or more substances where the solvent is present in a smaller amount than the solute.', 'A solution is a heterogeneous mixture where the solute and solvent are visibly distinct phases.', 'A solution is a homogeneous mixture where the solute is uniformly distributed within the solvent, and the solvent is typically present in greater quantity.', 'A solution is a chemical compound formed by the reaction of solute and solvent molecules.'], 'label': ['A', 'B', 'C', 'D']}",C
Mercury_7123358,What is the precise definition of an orbit in the context of celestial mechanics?,"{'text': ['An orbit is the path that a celestial body follows as it travels around another body due to gravitational forces.', 'An orbit is the path that a celestial body follows only when influenced by electromagnetic forces.', 'An orbit is a random trajectory that a celestial body follows around another body without any defined pattern.', 'An orbit is the fixed path that a celestial body follows without any external influences.'], 'label': ['A', 'B', 'C', 'D']}",A
Mercury_7069020,What are the three primary components of the human body's first line of defense against infection and disease?,"{'text': ['Skin, mucous membranes, and secretions', 'White blood cells, antibodies, and skin', 'Lymph nodes, spleen, and skin', 'Antibodies, skin, and enzymes'], 'label': ['A', 'B', 'C', 'D']}",A
TIMSS_2003_8_pg117,What is the precise definition of a chemical element in terms of atomic structure and periodic table classification?,"{'text': ['A chemical element is a substance that can only be separated into simpler substances through chemical methods and is not listed on the periodic table.', 'A chemical element is a substance consisting of atoms which all have the same number of protons, and it is represented by a unique symbol on the periodic table.', 'A chemical element is a compound that can be broken down into simpler substances by chemical reactions.', 'A chemical element is a substance made up of molecules that contain more than one type of atom.'], 'label': ['A', 'B', 'C', 'D']}",B
VASoL_2008_3_32,"What is the scientific name for the oak tree species commonly found in North America, specifically known for its large leaves and acorns?","{'text': ['Quercus alba', 'Quercus robur', 'Quercus macrocarpa', 'Quercus palustris'], 'label': ['A', 'B', 'C', 'D']}",C
Mercury_SC_400142,What is the universally recommended first step in responding to a chemical spill in a laboratory setting according to standard safety protocols?,"{'text': ['Immediately try to neutralize the spill with a chemical neutralizer.', 'Evacuate the laboratory and alert emergency services.', 'Notify the instructor or responsible personnel immediately.', 'Begin cleaning up the spill using paper towels.'], 'label': ['A', 'B', 'C', 'D']}",C
Mercury_7163818,Which physical property of the Earth's atmosphere primarily determines the amount of friction experienced by a meteor during its entry?,"{'text': ['The density of the atmosphere at various altitudes.', 'The temperature of the atmosphere at the point of entry.', 'The chemical composition of the meteor itself.', 'The gravitational pull of the Earth on the meteor.'], 'label': ['A', 'B', 'C', 'D']}",A
Mercury_402502,"What is the complete electron configuration for the noble gas argon, including all subshells?","{'text': ['1s² 2s² 2p⁶ 3s² 3p⁶', '1s² 2s² 2p⁶ 3s² 3p⁴', '1s² 2s² 2p⁶ 3s² 3p⁵', '1s² 2s² 2p⁶ 3s² 3p³'], 'label': ['A', 'B', 'C', 'D']}",A
Mercury_7130778,"What is the primary distinction between producers and consumers in an ecosystem, focusing on their roles in energy flow?","{'text': ['Producers are organisms that synthesize their own food from sunlight or chemical energy, while consumers obtain energy by eating other organisms.', 'Producers are organisms that consume other organisms for energy, while consumers can synthesize their own food.', 'Producers are organisms that decompose organic material, whereas consumers are organisms that produce energy through photosynthesis.', 'Producers and consumers both obtain energy directly from sunlight, but producers consume other organisms as well.'], 'label': ['A', 'B', 'C', 'D']}",A
MEA_2010_8_18,"What is the formal definition of a renewable energy resource, specifically in relation to its rate of replenishment compared to its rate of consumption?","{'text': ['A renewable energy resource is one that can be replenished naturally at a rate equal to or greater than its rate of consumption.', 'A renewable energy resource is one that can be replenished only through technological advancements, regardless of the rate of consumption.', 'A renewable energy resource is one that exists in unlimited quantities and cannot be depleted over time.', 'A renewable energy resource is one that can be replenished naturally but at a slower rate than its rate of consumption.'], 'label': ['A', 'B', 'C', 'D']}",A
Mercury_7211033,"What is the complete and precise chemical equation for photosynthesis, including the reactants and products?","{'text': ['6CO2 + 6H2O + light energy -> C6H12O6 + 6O2', 'C6H12O6 + 6O2 -> 6CO2 + 6H2O + energy', '6CO2 + 12H2O + light energy -> C6H12O6 + 6O2 + 6H2O', '6CO2 + 6H2O -> C6H12O6 + 6O2 + energy'], 'label': ['A', 'B', 'C', 'D']}",A
NYSEDREGENTS_2008_8_17,What is the fundamental difference in genetic variation between sexual and asexual reproduction?,"{'text': ['Sexual reproduction results in offspring with identical genetic makeup to the parent, while asexual reproduction leads to genetic diversity.', 'Asexual reproduction results in offspring with genetic diversity, while sexual reproduction produces offspring identical to the parents.', 'Sexual reproduction results in greater genetic variation among offspring compared to asexual reproduction.', 'Asexual reproduction involves two parents contributing to genetic diversity, while sexual reproduction involves only one parent.'], 'label': ['A', 'B', 'C', 'D']}",C
NAEP_2005_8_S11+1,What is the fundamental principle of energy conversion in an electric fan and how does it function at a basic level?,"{'text': ['An electric fan converts electrical energy into chemical energy through the use of stored batteries.', 'An electric fan converts electrical energy into kinetic energy by using a motor to spin the blades.', 'An electric fan converts electrical energy into thermal energy to increase air temperature.', 'An electric fan converts electrical energy into sound energy as its primary function.'], 'label': ['A', 'B', 'C', 'D']}",B
Mercury_412774,What is the complete and balanced chemical equation for the reaction between carbon dioxide and water to form carbonic acid?,"{'text': ['CO2 + H2O -> H2CO3', 'CO2 + 2H2O -> 2H2CO3', 'CO2 + H2O -> CO + H2CO3', 'CO2 + H2O -> CO2 + H2O2'], 'label': ['A', 'B', 'C', 'D']}",A
MEA_2013_5_12,"What is the precise chemical formula of table salt, and what are the charges of its constituent ions?","{'text': ['The chemical formula of table salt is NaCl, with Na⁺ as the sodium ion and Cl⁻ as the chloride ion.', 'The chemical formula of table salt is NaCl₂, with Na²⁺ as the sodium ion and Cl⁻ as the chloride ion.', 'The chemical formula of table salt is NaCl, with Na⁻ as the sodium ion and Cl²⁺ as the chloride ion.', 'The chemical formula of table salt is Na₂Cl, with Na⁺ as the sodium ion and Cl₂⁻ as the chloride ion.'], 'label': ['A', 'B', 'C', 'D']}",A
Mercury_7098473,What is the exact definition of an action-at-a-distance force in classical physics?,"{'text': ['An action-at-a-distance force is a force that acts on an object without any physical contact, such as gravitational or electromagnetic forces.', 'An action-at-a-distance force is a force that requires physical contact to be transmitted between objects.', 'An action-at-a-distance force is a force that only acts over short ranges, such as nuclear forces.', 'An action-at-a-distance force is a fictional concept with no basis in classical physics.'], 'label': ['A', 'B', 'C', 'D']}",A
Mercury_417593,What is the principle of natural selection as first articulated by Charles Darwin in his work 'On the Origin of Species'?,"{'text': ['Natural selection is the process where organisms adapt to their environment and pass on favorable traits to their offspring, leading to evolution over time.', 'Natural selection is the process by which organisms with more desirable traits are artificially bred to enhance those traits in future generations.', 'Natural selection is the idea that all species are fixed and unchanging since creation, and no evolutionary process occurs.', 'Natural selection describes the random changes in the genetic material of organisms that result in new species over time.'], 'label': ['A', 'B', 'C', 'D']}",A
Mercury_7081743,"What is the formal definition of a species in biological taxonomy, including the criteria that must be met for classification?","{'text': ['A species is a group of organisms that can interbreed and produce fertile offspring, sharing common physical characteristics.', 'A species is any group of organisms that share a common ancestor and occupy the same habitat.', 'A species is a group of organisms that are physically indistinguishable from each other, regardless of their genetic compatibility.', 'A species is a group of organisms that inhabit the same geographical area and share the same ecological niche.'], 'label': ['A', 'B', 'C', 'D']}",A
Mercury_7018410,"What is the exact speed of electromagnetic waves, such as radio and infrared waves, in a vacuum?","{'text': ['\\(3.00 \\times 10^8\\) meters per second', '\\(2.99 \\times 10^8\\) meters per second', '\\(3.01 \\times 10^8\\) meters per second', '\\(2.98 \\times 10^8\\) meters per second'], 'label': ['A', 'B', 'C', 'D']}",A
Mercury_402563,"What is the complete and formal definition of an ion in chemistry, including the process by which it is formed and its effect on electrical charge?","{'text': ['An ion is an atom or molecule that has gained or lost one or more electrons, resulting in a net electrical charge, where gaining electrons yields a positive charge and losing electrons results in a negative charge.', 'An ion is an atom or molecule that has gained or lost one or more electrons, resulting in a net electrical charge, with gaining electrons resulting in a negative charge and losing electrons resulting in a positive charge.', 'An ion is an atom or molecule that has gained or lost protons, resulting in a net electrical charge, where gaining protons yields a positive charge and losing protons results in a negative charge.', 'An ion is an atom or molecule that has gained or lost neutrons, resulting in a net electrical charge, where gaining neutrons yields a positive charge and losing neutrons results in a negative charge.'], 'label': ['A', 'B', 'C', 'D']}",B
Mercury_416407,"What is the biochemical process called where glucose is converted into energy within human cells, and what are its main stages?","{'text': ['Photosynthesis, consisting of light-dependent reactions and the Calvin cycle.', 'Glycolysis, consisting of the energy investment phase and energy payoff phase.', 'Gluconeogenesis, consisting of initiation, elongation, and termination.', 'Oxidative phosphorylation, consisting of the Krebs cycle and electron transport chain.'], 'label': ['A', 'B', 'C', 'D']}",B
Mercury_SC_400400,What is the scientific term for the energy wasted as heat produced by a lightbulb?,"{'text': ['Thermal energy', 'Kinetic energy', 'Radiant energy', 'Chemical energy'], 'label': ['A', 'B', 'C', 'D']}",A
MCAS_2000_8_22,What is the key difference in the molecular structure and hydrogen bonding between ice and liquid water that accounts for their difference in density?,"{'text': ['In ice, the molecules are arranged in a more compact structure with fewer hydrogen bonds, making it denser than liquid water.', 'In ice, the molecules form a crystalline lattice with more stable hydrogen bonds, making it less dense than liquid water.', 'In liquid water, the molecules form a rigid lattice structure with more hydrogen bonds, making it less dense than ice.', 'In liquid water, the molecules are arranged in a highly ordered crystalline structure, similar to ice, resulting in the same density as ice.'], 'label': ['A', 'B', 'C', 'D']}",B
MCAS_8_2014_8,"What is the primary role of a Research and Development (R&D) department in a large corporation, particularly focusing on innovation and technological advancement?","{'text': ['The R&D department is primarily responsible for managing the financial transactions and budget allocations within the corporation.', 'The R&D department primarily focuses on maintaining and monitoring the production line to ensure quality and efficiency.', 'The R&D department is primarily tasked with creating new products, improving existing products, and driving innovation to maintain competitive advantage.', ""The R&D department is mainly involved in marketing and promoting the corporation's products to increase sales.""], 'label': ['A', 'B', 'C', 'D']}",C
Mercury_7206430,What is the precise definition of a controlled experiment in scientific research?,"{'text': ['A controlled experiment is one in which all variables except one are kept constant to observe the effect of the variable being tested.', 'A controlled experiment is one in which all variables are allowed to change naturally to observe the overall effect.', 'A controlled experiment is one where only the dependent variable is altered to measure the result on the independent variable.', 'A controlled experiment is one that does not include a control group and allows all conditions to vary freely.'], 'label': ['A', 'B', 'C', 'D']}",A
Mercury_7185343,"What is the formal ecological term for the significant cascading effects resulting from the introduction or removal of a top predator in an ecosystem, such as the reintroduction of wolves in Yellowstone Park?","{'text': ['Keystone Species Effect', 'Trophic Cascade', 'Ecological Succession', 'Habitat Fragmentation'], 'label': ['A', 'B', 'C', 'D']}",B
OHAT_2010_8_8,"What is the biological definition of parasitism, including the roles of the host and the parasite in this relationship?","{'text': ['Parasitism is a symbiotic relationship where both organisms benefit from the interaction, with the host providing nutrients to the parasite.', 'Parasitism is a relationship where one organism benefits by harming the host, which provides nutrients or resources to the parasite.', ""Parasitism is a mutualistic relationship where the parasite and host equally benefit from each other's presence."", 'Parasitism is a temporary interaction where the parasite uses the host for transportation and protection without causing harm.'], 'label': ['A', 'B', 'C', 'D']}",B
Mercury_405462,What are the essential components of the scientific method that a scientist must follow to validate a discovery?,"{'text': ['Observation, prediction, experimentation, and conclusion.', 'Hypothesis, experimentation, analysis, and publication.', 'Observation, hypothesis, experimentation, analysis, and conclusion.', 'Theory development, experimentation, peer review, and publication.'], 'label': ['A', 'B', 'C', 'D']}",C
Mercury_SC_LBS10337,What is the exact mechanism by which the Earth maintains its energy balance despite radiating heat into space?,"{'text': ['The Earth maintains its energy balance solely through geothermal energy from its core.', 'The Earth maintains its energy balance by absorbing solar radiation and re-emitting it as infrared radiation, while also being insulated by its atmosphere.', 'The Earth maintains its energy balance by constantly generating new heat through volcanic activity.', 'The Earth maintains its energy balance by reflecting all incoming solar radiation back into space.'], 'label': ['A', 'B', 'C', 'D']}",B
Mercury_7142520,What are the main components and functions of the human thermoregulatory system responsible for maintaining a normal body temperature of 98.6°F?,"{'text': ['The thermoregulatory system consists of the skin, blood vessels, and nerve endings and functions by solely constricting blood vessels to increase body temperature.', 'The thermoregulatory system includes the hypothalamus, skin, sweat glands, and blood vessels, and it functions by regulating heat production and heat loss to maintain a stable internal temperature.', 'The thermoregulatory system comprises the heart, lungs, and brain, and it maintains body temperature by regulating heart rate and respiratory rate.', 'The thermoregulatory system consists only of the sweat glands and functions by releasing sweat to decrease body temperature.'], 'label': ['A', 'B', 'C', 'D']}",B
Mercury_SC_405501,What are the primary reasons and purposes for recording data during a scientific experiment?,"{'text': ['To ensure the experiment can be repeated exactly and to provide a basis for analyzing results.', 'To make the experiment appear more legitimate to others.', 'To confuse competitors who may attempt the same experiment.', 'To increase the number of pages in the lab notebook.'], 'label': ['A', 'B', 'C', 'D']}",A
