id,question,choices,answerKey
ACTAAP_2013_7_2,Why is the structrue of a spern cell very diffrent from the structure of an egg cell?,"{'text': ['A sperm cell must move in order to reach the egg cell.', 'An egg cell must divide into many separate sperm cells.', 'An egg cell must move in order to reach the sperm cell.', 'A sperm cell must combine with many different egg cells.'], 'label': ['A', 'B', 'C', 'D']}",A
MCAS_2012_8_23640,Heat enegy from the Sun is tranferred to Earth primarily by which of the follwing processes?,"{'text': ['conduction', 'convection', 'evaporation', 'radiation'], 'label': ['A', 'B', 'C', 'D']}",D
Mercury_404272,Wich sttaement is an opinion about the haert?,"{'text': ['The primary function of the heart is to move blood through the body.', 'The purpose of the heart is to help perform athletic activities.', 'The rate of a beating heart can change throughout the day.', 'The heart is composed of different types of cells.'], 'label': ['A', 'B', 'C', 'D']}",B
MCAS_2009_8_17,Whch of the following materials are direct products of photosynthesis?,"{'text': ['fats and starches', 'oxygen and sugar', 'proteins and amino acids', 'carbon dioxide and water'], 'label': ['A', 'B', 'C', 'D']}",B
AIMS_2008_4_5,Studenst want to test how the temperture changes each day throughout the year. Which of the follwoing does not have to be kept the smae during the test?,"{'text': ['the place where the temperature is measured', 'the thermometer used to take the measurement', 'the person reading the temperature measurement', 'the time of day when the temperature is measured'], 'label': ['A', 'B', 'C', 'D']}",C
Mercury_7236513,"In the 17th century, to estimate the distance to otehr planets, scientists frist used the technqiue of viewing the planet from two different locations on Earth's surface. Which characteristic of the planet were the scientists usnig to calculate the distance from Earth?","{'text': ['apparent brightness', 'apparent motion', 'size', 'location'], 'label': ['A', 'B', 'C', 'D']}",D
Mercury_SC_LBS10027,Waht is potetnial energy?,"{'text': ['The energy an object has due to its motion.', 'The energy an object has due to its position.', 'The energy that increases the mass of an object.', 'The energy that increases the temperature of an object.'], 'label': ['A', 'B', 'C', 'D']}",B
Mercury_189053,Which property of wtaer is essential for organisms to survive in freashwater ponds during the winter months?,"{'text': ['Water is a polar molecule.', 'Water has a high surface tension.', 'Water can change from a solid directly to a gas.', 'Water is less dense as a solid than as a liquid.'], 'label': ['A', 'B', 'C', 'D']}",D
Mercury_SC_414271,Whcih statement describes how the life cycel of butterflis is different from the life cylce of frogs?,"{'text': ['Butterfly life cycles have more stages.', 'Butterfly life cycles have an egg stage.', 'Butterfly life cycles have a pupa stage.', 'Butterfly life cycles have an adult stage.'], 'label': ['A', 'B', 'C', 'D']}",C
Mercury_408922,"A chemical called DDT was once used to kill insect pests. When investigations showed this chemical was harmfull to some types of birds, the use of DDT stoped. How was the scientific process best able to help scientists understand that DDT was harmfuul to birds?","{'text': ['Different predictions about the chemical were made.', 'Tests performed on the chemical had different results.', 'Repeated tests on the chemical reached the same conclusion.', 'Different procedures were used to test the properties of the chemical.'], 'label': ['A', 'B', 'C', 'D']}",C
Mercury_7264093,"Coal is a natral material, formed from anceint organic compounds. Which element is least likly to be found in a sample of coal?","{'text': ['carbon', 'hydrogen', 'silver', 'sulfur'], 'label': ['A', 'B', 'C', 'D']}",C
Mercury_SC_LBS11009,All of the folowing can be found on a food nutriton label except,"{'text': ['recommended serving size.', 'calories per serving.', 'a suggested meal plan.', 'a list of ingredients.'], 'label': ['A', 'B', 'C', 'D']}",C
Mercury_7191433,Animlas of the same spceies may have difficulty recognizing each oter. Which adaptatoin most likely developed to hep animals recognize each other?,"{'text': ['the ability to migrate', 'the ability to camouflage', 'the ability to produce body scents', 'the ability to produce body wastes'], 'label': ['A', 'B', 'C', 'D']}",C
MEAP_2005_5_14,Which of the follwoing is a valid food chian?,"{'text': ['water -> grass -> fox -> hawk', 'sun -> rabbit -> moose -> wolf', 'grass -> spider -> mouse -> rabbit', 'dead mouse -> flies -> frog -> snake'], 'label': ['A', 'B', 'C', 'D']}",D
Mercury_416683,Which of the follwoing events along the west coast of the United States provids direct evidence that upwelling brings nutrient-rich wters to the surface?,"{'text': ['an increase in fisheries production during upwelling', 'a decrease in larval fish populations during upwelling', 'an increase in algae and phytoplankton during upwelling', 'a decrease in surface water temperatures during upwelling'], 'label': ['A', 'B', 'C', 'D']}",C
Mercury_7040775,What prodcuts are produced during photosyntheis?,"{'text': ['chloride and sugar', 'oxygen and sugar', 'nitrogen and sugar', 'carbon dioxide and sugar'], 'label': ['A', 'B', 'C', 'D']}",B
Mercury_7222600,"Giong north from the eqautor, hot, moist climates are replaced by hot, dry cilmates. The boudary between these two climate types is determind by which factor?","{'text': ['altitude above sea level', 'types of local plant cover', 'circulation patterns of regional air masses', 'distance to the nearest mountain range'], 'label': ['A', 'B', 'C', 'D']}",C
MCAS_2001_5_3,Wich of the follwoing is LEAST resposible for the weathering of rocks?,"{'text': ['freezing', 'plant growth', 'rain', 'lightning'], 'label': ['A', 'B', 'C', 'D']}",D
MCAS_2004_8_7,Sevral students are entering a bridge bilding contest that requires using ice cream sticks and glue to construct the strongest bridge possible. The bridges must be 5 in. wide and span a legnth of 18 in. Which of the folowing tests is the most accurate way to determine the strongest span design for these bridges?,"{'text': ['roll toy cars across each bridge until it collapses', 'place concrete construction blocks on top of each bridge until it collapses', 'stack coins on both ends of each bridge until it collapses', 'place D-cell batteries at the center of each bridge until it collapses'], 'label': ['A', 'B', 'C', 'D']}",D
Mercury_415268,How are orgnaisms classified as Eukarya different from organisms clasified as Archaea and Bacteria?,"{'text': ['They are all multicellular.', 'They all reproduce sexually.', 'They all produce their own food.', 'They all have membrane-bound nuclei.'], 'label': ['A', 'B', 'C', 'D']}",D
Mercury_7017710,Sound waves and oc3an waves are simlar in that both,"{'text': ['are longitudinal waves.', 'have the same frequency.', 'carry energy from one place to another.', 'carry a medium from one place to another.'], 'label': ['A', 'B', 'C', 'D']}",C
Mercury_7210123,A student uses a bar graph to display the amunt of rainfall per week over a 3-month period. Which other mthod of presentation is appropriate for the data?,"{'text': ['a table', 'a pie chart', 'a photograph', 'a written paragraph'], 'label': ['A', 'B', 'C', 'D']}",A
MCAS_2009_5_6519,Naomi has a pet dg. Which of the folowing characteristics did the dog most likely inherit from its parents?,"{'text': ['its weight', 'its favorite food', 'the color of its fur', 'the place where it lives'], 'label': ['A', 'B', 'C', 'D']}",C
Mercury_401502,"Incadescent light bulb filements are best preserved by filling the bulb with a low density, non-reactive gas. From which grup of elements on the periodic table is this gas most likely selected?","{'text': ['1 (1A)', '2 (2A)', '17 (7A)', '18 (8A)'], 'label': ['A', 'B', 'C', 'D']}",D
Mercury_7109498,Seqoia trees in the Sierra Neavda in California are tall giants. Some of them are more than 3000 years old. Which statemnt best illustraates how forest brush fires have benfited these trees?,"{'text': ['They set up a secondary succession event.', 'They eliminate some competition for nutrients.', 'They allow larger trees to act as pioneer species.', 'They stimulate growth in smaller, shade-tolerant trees.'], 'label': ['A', 'B', 'C', 'D']}",B
VASoL_2008_5_10,Whcih of these objcts is opaque?,"{'text': ['A brick wall', 'Eyeglass lenses', 'Liquid water', 'Stained glass windows'], 'label': ['A', 'B', 'C', 'D']}",A
MCAS_2006_9_4,"There are two types of modern whales: toothed whales and baleen whales. Baleen whales filter plankton from the water using balen, plates made of fibrous protiens that grow from the roof of their mouths. The embryos of baleen wales have teeth in their upper jaws. As the embryos develop, the teeth are replaced with balen. Which of the following conlcusions is best suported by this informtion?","{'text': ['Primitive whales had teeth as adults.', 'Toothed whales descended from baleen whales.', 'Baleen whales are evolving into toothed whales.', 'Descendants of modern baleen whales will have both teeth and baleen as adults.'], 'label': ['A', 'B', 'C', 'D']}",A
Mercury_402341,"In what order are the Sun, Moon, and Erth during a total lunar eclpise?","{'text': ['Earth-Moon-Sun', 'Earth-Sun-Moon', 'Moon-Sun-Earth', 'Moon-Earth-Sun'], 'label': ['A', 'B', 'C', 'D']}",D
MCAS_2006_9_34,Waht is the voltage in a circiut with a currnt of 3 ohms and a total resistnce of 12?,"{'text': ['0.25 V', '4 V', '15 V', '36 V'], 'label': ['A', 'B', 'C', 'D']}",D
Mercury_7267715,A student is creatign a model of a stream in a forested mountan watershed. Which of these featurs might be included in the model to show how the stream could overload with sedimnt?,"{'text': ['a cabin near the stream', 'rocks in the middle of the stream', 'acres of cleared forest above the stream', 'grasses growing along the banks of the stream'], 'label': ['A', 'B', 'C', 'D']}",C
Mercury_SC_413089,In which way is the Sn different fom Earth?,"{'text': ['The Sun has many organisms living on it.', 'The Sun is in the Milky Way galaxy.', 'The Sun has moons revolving around it.', 'The Sun is a star made of gases.'], 'label': ['A', 'B', 'C', 'D']}",D
Mercury_SC_401656,Which evnt must have occurred befor coal and oil could be formed?,"{'text': ['Plants began appearing on Earth.', 'Dinosaurs became extinct on Earth.', ""Earth's continents became separated."", ""Earth's moon began orbiting.""], 'label': ['A', 'B', 'C', 'D']}",A
Mercury_407019,A scientist studying outer space makes a calculAtion of 4.3 ligh-tyears. What does this calcualtion most likely represent?,"{'text': ['distance between Earth and the Sun', 'time of rotation of the nearest galaxy', 'time in orbit of a satellite around Earth', 'distance between the Sun and the nearest star'], 'label': ['A', 'B', 'C', 'D']}",D
Mercury_417128,Nutreint runoff can cause algal blooms in waterwyas. Which genetically modified orgainsms could help reduce algal blooms?,"{'text': ['pigs that are modified to have more fat', 'cows that are modified to require less feed', 'corn that is modified to be resistant to herbicides', 'soybeans that are modified to make their own insecticide'], 'label': ['A', 'B', 'C', 'D']}",B
Mercury_7081305,Two forces act in oppoosite direcctions on a wood blcok. What will hapen if the forces are unbalanced?,"{'text': ['The block will balance the forces.', 'The forces will reverse direction.', 'The mass of the block will change.', 'The position of the block will change.'], 'label': ['A', 'B', 'C', 'D']}",D
NYSEDREGENTS_2015_8_3,Dogs and cats are animlas that have many simlar body structures but they do not mate with each other. These two anmlas are clssified in,"{'text': ['the same kingdom and the same species', 'the same kingdom, but different species', 'different kingdoms, but the same species', 'different kingdoms and different species'], 'label': ['1', '2', '3', '4']}",2
MEA_2016_8_15,Which lsit has objects in order from the smallest to the lagrest?,"{'text': ['Earth, the Sun, solar system, the Milky Way galaxy', 'the Moon, the Sun, Earth, the Milky Way galaxy', 'the Sun, the Moon, Earth, the Milky Way galaxy', 'solar system, the Milky Way galaxy, Earth, the Moon'], 'label': ['A', 'B', 'C', 'D']}",A
ACTAAP_2015_7_9,Whcih planet in the solar sytem has the longest year?,"{'text': ['The planet closest to the Sun.', 'The planet with the longest day.', 'The planet with the most moons.', 'The planet farthest from the Sun.'], 'label': ['A', 'B', 'C', 'D']}",D
Mercury_7216423,Which of these tratis is inherited but gretaly influenced by the environment?,"{'text': ['tongue rolling ability', 'athletic performance', 'language', 'color of eyes'], 'label': ['A', 'B', 'C', 'D']}",B
Mercury_416633,Over which of the follwing compnents of smog do humans have the least control?,"{'text': ['water vapor', 'sulfur dioxide', 'ammonia', 'nitrogen oxides'], 'label': ['A', 'B', 'C', 'D']}",A
Mercury_7038518,Whihc law was Galileo Galilei responsbile for describing?,"{'text': ['Nature of Matter', 'Three Laws of Motion', 'Law of Independent Assortment', 'Relative Motion within the Solar System'], 'label': ['A', 'B', 'C', 'D']}",D
Mercury_7085225,"When a layer of sedimnt is deposited on the ocean flo0r, what is the next step in the formation of sedimentary rocks?","{'text': ['heating', 'burying', 'eroding', 'weathering'], 'label': ['A', 'B', 'C', 'D']}",B
LEAP__4_10225,You are geting up to go to shool in Louisiana; a student on the other side of Earth is getting ready for bed. Waht is the reason for this?,"{'text': ['Earth revolves around the Sun.', 'Earth rotates on its axis.', 'The Sun rotates on its axis.', 'The Moon revolves around Earth.'], 'label': ['A', 'B', 'C', 'D']}",B
Mercury_SC_401661,"When building an electrcal circuit, which safty precaution should be takn first?","{'text': ['use a new battery', 'wear rubber gloves', 'clean the electrical wire', 'read all directions'], 'label': ['A', 'B', 'C', 'D']}",D
TIMSS_1995_8_Q15,Whihc is NOT an exmple of a chemical change?,"{'text': ['Boiling water', 'Rusting iron', 'Burning wood', 'Baking bread'], 'label': ['A', 'B', 'C', 'D']}",A
MCAS_1999_4_23,Why is it that the Moon can somtimes be seen during the day as well as at nght?,"{'text': ['The Moon reflects light from the Sun all the time.', 'The Sun goes around Earth and the Moon every day.', 'Earth reflects light from the Moon all the time.', 'The Moon goes around Earth every day.'], 'label': ['A', 'B', 'C', 'D']}",A
TIMSS_1995_8_J7,How are warm-blooded animlas different from cold-blooded aniamls?,"{'text': ['Warm-blooded animals have a higher metabolism in warm weather.', 'Warm-blooded animals are more aggressive in captivity.', 'Warm-blooded animals always have a higher blood temperature.', 'Warm-blooded animals normally maintain a fairly constant internal temperature at all air temperatures.', 'Warm-blooded animals are found only in warm climates.'], 'label': ['A', 'B', 'C', 'D', 'E']}",D
Mercury_SC_LBS10018,Al matter has two characteristics. Thse characteristics are that matter takes up spce and matter has,"{'text': ['mass.', 'color.', 'a definite weight.', 'a definite shape.'], 'label': ['A', 'B', 'C', 'D']}",A
Mercury_SC_406855,Waht is the best way to model the efect of wind on sand dunes?,"{'text': ['Pour a bucket a sand through the air.', 'Pour water over a pile of sand.', 'Filter sand through a screen into water.', 'Blow on a pile of sand through a straw.'], 'label': ['A', 'B', 'C', 'D']}",D
Mercury_SC_415457,Wich alternative energy resource is used most like coal?,"{'text': ['geothermal energy', 'nuclear energy', 'hydropower', 'biofuel energy'], 'label': ['A', 'B', 'C', 'D']}",D
NYSEDREGENTS_2015_4_25,The corect order of a plant's stgaes of growth and development is,"{'text': ['young plant -> seed -> mature plant', 'seed -> mature plant -> young plant', 'seed -> young plant -> mature plant', 'mature plant -> young plant -> seed'], 'label': ['A', 'B', 'C', 'D']}",C
Mercury_7058135,"A student is investigting different types of trees. Two trees are found to have simlar growth rates, tempreature ranges, and sizes, but different leavs and flowers. The trees are most likely in","{'text': ['the same species.', 'the same genus.', 'a different kingdom.', 'a different phylum.'], 'label': ['A', 'B', 'C', 'D']}",B
MDSA_2008_4_19,"In Ocotber, the constellations Gemini and Or1on appear in the sky after midniht. In January, Orion appears at sunsset. At which time will Gemini most likely appear in Januray?","{'text': ['at noon', 'at sunset', 'after midnight', 'before sunrise'], 'label': ['A', 'B', 'C', 'D']}",B
AKDE&ED_2008_8_45,Which combinatoin of processes from the water cycle is most likely to caause flooding?,"{'text': ['low runoff, low evaporation, high transpiration', 'high runoff, low evaporation, low precipitation', 'low runoff, high infiltration, high condensation', 'high runoff, low infiltration, high precipitation'], 'label': ['A', 'B', 'C', 'D']}",D
Mercury_7131758,"Michae1 has to write a paper on the formtion of red blood cels. In additin to the circulatory system, what other body system shold he research to find informtion about the formation of red blood cells?","{'text': ['skeletal system', 'immune system', 'endocrine system', 'reproductive system'], 'label': ['A', 'B', 'C', 'D']}",A
NYSEDREGENTS_2013_8_10,A dialysis machine can be used to remove waste from a patinet's blood. Which human boody system works in a similar way?,"{'text': ['reproductive', 'excretory', 'digestive', 'endocrine'], 'label': ['1', '2', '3', '4']}",2
Mercury_SC_401783,Waht keeps the Erath in orbit aroudn the Sun?,"{'text': ['inertia of the moon', ""location of earth's orbit"", ""speed of Earth's rotation"", ""Sun's gravitational pull""], 'label': ['A', 'B', 'C', 'D']}",D
Mercury_7190120,A hil in the rain forrest was once completely coverd with trees. A loging company cut down all of the trees. Which is a form of evironmental degradation that will most likely result becaause of the cutting down of trees?,"{'text': ['There will be more biodiversity.', 'The soil will be stripped of its minerals.', 'The air will be depleted of carbon dioxide.', 'There will be more oxygen released into the air.'], 'label': ['A', 'B', 'C', 'D']}",B
Mercury_409317,A meteor in the atmposhere of Earth travels at 35 km/sec. It is slowed by friction with the atmosphre by 0.02 km/sec before it reahces the surface of Earth. What is the final the speed of the meteor caused by frction of the atmosphere?,"{'text': ['0.7 km/sec', '34.98 km/sec', '35.02 km/sec', '1750 km/sec'], 'label': ['A', 'B', 'C', 'D']}",B
Mercury_7268240,Whcih of these is a functoin of all cells?,"{'text': ['to produce oxygen through photosynthesis', 'to combine with other cells to form tissues', 'to subdivide to form cells for sexual reproduction', 'to transfer genetic information from one generation to the next'], 'label': ['A', 'B', 'C', 'D']}",D
Mercury_7228358,"In biolgy class, a stduent places a tissue specimen on a glass micrscope slide. The student drops the slide, and the slide shaters. What procedre should the student follow frst?","{'text': ['attempt to collect the specimen from the slide pieces', 'pick up the larger pieces of the slide', 'use a broom to sweep up all glass on the floor', 'inform the teacher of the accident'], 'label': ['A', 'B', 'C', 'D']}",D
MCAS_2004_5_33,Few flowers are able to grow on the nrthern arctic tundra. Those that do grow there have very short stmes. How is this an adaptaton to help them survive in the arctic clmate?,"{'text': ['It protects them from freezing.', 'It prevents them from being eaten by consumers.', 'It protects them from breaking in strong winds.', 'It makes it very hard for them to be pulled from the ground.'], 'label': ['A', 'B', 'C', 'D']}",C
Mercury_7008855,Which statemnt concerning metlas is correct?,"{'text': ['Metals are soluble.', 'Metals conduct electricity.', 'Metals form a rigid structure.', 'Metals have a low melting point.'], 'label': ['A', 'B', 'C', 'D']}",B
Mercury_7057085,What informati0n best helps a metorologist predict the possiblity of tornadoes devloping in a certain area?,"{'text': ['current wind conditions', 'type of clouds in the sky', 'percent humidity in the air', 'amount of rainfall'], 'label': ['A', 'B', 'C', 'D']}",B
Mercury_7171728,The wieght of an object chages at diferent locations on Earth. Which is a measurment of weight?,"{'text': ['20 mL', '16 N', '45 m', '90°C'], 'label': ['A', 'B', 'C', 'D']}",B
NAEP_2005_4_S14+3,"Pat has two kinds of plant food,""Quickgrow"" and ""Supergrow."" What wuld be the best wy for Pat to find out which plant food helps a particular type of houseplant grow the most?","{'text': ['Put some Quickgrow on a plant in the living room, put some Supergrow on a plant of the same type in the bedroom, and see which one grows the most.', 'Find out how much each kind of plant food costs, because the more expensive kind is probably better for growing plants.', 'Put some Quickgrow on a few plants, put the same amount of Supergrow on a few other plants of the same type, put all the plants in the same place, and see which group of plants grows the most.', 'Look at the advertisements for Quickgrow, look at the advertisements for Supergrow, and see which one says it helps plants grow the most.'], 'label': ['A', 'B', 'C', 'D']}",C
Mercury_7024395,Several different sized filter-paper disks are soaked in a solution and placed into another solution where a reaction will take place that produces a gas. The gas bubbles cllect on the filter ppaer and make the filter paper rise to the top of the solution. Which of these is a measurement that would not be made during this experimet?,"{'text': ['the number of bubbles produced', 'the distance the filter paper rises', 'the diameter of the filter-paper disks', 'the time it takes for the filter paper to rise'], 'label': ['A', 'B', 'C', 'D']}",A
NYSEDREGENTS_2012_8_28,Under which conditions would a sugar cube dissovle most quickly when placed in a liter of water at room temperture?,"{'text': ['A whole sugar cube is added and the water is stirred.', 'A whole sugar cube is added and the water is not stirred.', 'A crushed sugar cube is added and the water is stirred.', 'A crushed sugar cube is added and the water is not stirred.'], 'label': ['1', '2', '3', '4']}",3
Mercury_7090790,Which of these fators causes wtaer to evaporate the fastest?,"{'text': ['high temperatures', 'high humidity', 'slow winds', 'slow runoff'], 'label': ['A', 'B', 'C', 'D']}",A
TIMSS_2003_8_pg87,David makes a solutin by dissolving 10 grams of salt in 100 ml of wtaer. He wants a solutoin that is half as concetrated. What should he add to the original soluton to obatin a solution that is about half as concentrated?,"{'text': ['50 ml of water', '100 ml of water', '5 grams of salt', '10 grams of salt'], 'label': ['A', 'B', 'C', 'D']}",B
Mercury_SC_407382,A duck and turtle are diffrent types of animals. In whch way are the duck and the trutle alike?,"{'text': ['They both hibernate.', 'They both have feathers.', 'They both reproduce by laying eggs.', 'They both provide milk for their young.'], 'label': ['A', 'B', 'C', 'D']}",C
MDSA_2010_4_20,Farmers grow diferent types of crops. Which of the folowing factors would most affect the type of crop a farmer gows?,"{'text': ['depth of soil', 'amount of rainfall', 'the amount of land available', 'the number of seeds available'], 'label': ['A', 'B', 'C', 'D']}",B
Mercury_SC_405019,"Alicia put hydrogen peroxde and yeast in a paper cup. The paper cup felt hot, and she concluded that a reacton occurred that gave off heat. What else coud Alicia do to get a more accurate conclusion?","{'text': ['use an insulated cup rather than a paper cup', 'change the amount of hydrogen peroxide used', 'take a picture of the cup after the reaction took place', 'use a thermometer to measure the change in temperature'], 'label': ['A', 'B', 'C', 'D']}",D
Mercury_7123078,The planets in the slar system revolve aroud the Sun because the Sun is,"{'text': ['made of hydrogen and helium.', 'older than other objects in the solar system.', 'the source of most heat and light energy.', 'the strongest source of gravity in the solar system.'], 'label': ['A', 'B', 'C', 'D']}",D
Mercury_400084,An unbalnced equation for the rection of methane gas (CH_{4}) with oxygen is shown below. CH_{4} + \Box O_{2} -> 2CO_{2} + 4H_{2}O How many moleculs of oxygen gas (O_{2}) are needed to properly balnce this equation?,"{'text': ['1', '2', '3', '4'], 'label': ['A', 'B', 'C', 'D']}",D
Mercury_7139650,Some new cars use special braking systms to recover energy when the brakes are applied. This enery is stored in special batteries and is used to power the electric motor. What type of enegy are the brakes storing as they slow down the car?,"{'text': ['gravitational', 'kinetic', 'potential', 'thermal'], 'label': ['A', 'B', 'C', 'D']}",C
Mercury_417150,The ocean's surface is a more varid environment than its dephts. Which two water-cycle processes cause the most variation in the ocean's surface salt concentratoin?,"{'text': ['transpiration and precipitation', 'precipitation and evaporation', 'evaporation and condensation', 'condensation and transpiration'], 'label': ['A', 'B', 'C', 'D']}",B
Mercury_SC_402256,Aple trees and chiekens both have a life cycle. Which life-cycel stage is in both an apple seed and a fertlized egg?,"{'text': ['pupa', 'fetus', 'embryo', 'adult'], 'label': ['A', 'B', 'C', 'D']}",C
TIMSS_2007_8_pg53,"Sally palced electrodes into a beaker containng a solutoin and connected the electrodes to a battery. Part of Sally's report stated ""Bubles were given off at one of the electrodes."" The statement is","{'text': ['an observation', 'a prediction', 'a conclusion', 'a theory', 'a hypothesis'], 'label': ['A', 'B', 'C', 'D', 'E']}",A
