id,question,choices,answerKey
Mercury_7168053,"The roots of a plant can grow throuhg cracks in a driveway, evntually causing the driveway to break. Which kind of process woud be taking place?","{'text': ['erosion', 'exfoliation', 'weathering', 'sedimentation'], 'label': ['A', 'B', 'C', 'D']}",C
AKDE&ED_2008_8_1,A scientist is perfroming an experimnt to determine the melting point of a new susbtance. Which action could increase the likelihood of obtaining accurate results?,"{'text': ['repeating the experiment three times', 'experimenting with multiple substances', 'writing out the procedure after the experiment', 'using three types of thermometers in the experiment'], 'label': ['A', 'B', 'C', 'D']}",A
Mercury_SC_415476,Which is most likley a learned behavior for a racoon?,"{'text': ['making a den in the hollow of a tree', 'opening a trashcan looking for food', 'moving four legs while running', 'having a litter of four babies'], 'label': ['A', 'B', 'C', 'D']}",B
Mercury_7106960,A student is studing nonrenewable resorces. Which of these resouces could the student be studing?,"{'text': ['coal', 'trees', 'water', 'wind'], 'label': ['A', 'B', 'C', 'D']}",A
Mercury_7160563,Animlas can affect their habitats through activties of finding food and raising their young. Sometimes these activites have a positive effect on the habitat of other orgnaisms. Which is the best example of an activity that has a positve effect?,"{'text': ['elephants stripping bark from trees', 'viruses infecting the cells of certain birds', 'beavers constructing dams to make ponds for lodges', 'semi-aquatic rodents feeding on the roots of aquatic plants'], 'label': ['A', 'B', 'C', 'D']}",C
Mercury_7068583,Whaat is one condition necesary to produce diamonds?,"{'text': ['high altitude', 'intense pressure', 'quick cooling', 'low temperatures'], 'label': ['A', 'B', 'C', 'D']}",B
Mercury_404638,A scinetist categorized a rock as an extrusive igneous rokc. Another scientst could accurately categorize the same rock as,"{'text': ['intrusive igneous.', 'clastic sedimentary.', 'metamorphic.', 'volcanic.'], 'label': ['A', 'B', 'C', 'D']}",D
Mercury_SC_407138,Which of thse will form new soil the fastset?,"{'text': ['A log rotting in a forest.', 'Water running in a stream.', 'A rock sitting in a garden.', 'Waves breaking on a beach.'], 'label': ['A', 'B', 'C', 'D']}",A
MCAS_2000_4_10,Irene needs to join two bords together. Which would NOT be used to jon the boards together?,"{'text': ['glue', 'screws', 'nails', 'saw'], 'label': ['A', 'B', 'C', 'D']}",D
Mercury_177748,"Gabbro and baslat are clasified as igneous rocks. Even though the names are diferent, they have the smae chemical composition. Geologists normally use what feautre for identification purpoes to differentiate between these two rock types?","{'text': ['color', 'texture', 'hardness', 'origin'], 'label': ['A', 'B', 'C', 'D']}",D
MCAS_2004_9_21-v1,A party shop delivers helium-filled baloons to homes and businsses. The owners relize from experience that on hot summer days they should inflate the baloons only three-quartrs full. On cold winter days they can fully inflate the ballons. Which of the following is the best hypthesis to explain this observation?,"{'text': ['The helium gas is more active in the winter season.', 'Air outside the balloons leaks into the balloons.', 'As the temperature increases, the helium in the balloons expands.', 'Outdoor air pressure in the summer is less than indoor air pressure.'], 'label': ['A', 'B', 'C', 'D']}",C
MDSA_2007_5_16,Trees are a renewble natural resorce. Which of these industires has the least need for trees?,"{'text': ['automobile manufacturing', 'home building', 'landscaping', 'newspaper'], 'label': ['A', 'B', 'C', 'D']}",A
Mercury_401763,"An aluminm ion has a charge of +3, and an oxide ion has a charge of -2. Which would be the product of a rection between these two elememts?","{'text': ['Al_{2}O', 'Al_{2}O_{3}', '2AlO_{3}', 'Al_{3}O_{2}'], 'label': ['A', 'B', 'C', 'D']}",B
Mercury_7268118,Why is it difficlt to cretae a terrarium ecosystem that will last a long time without human help?,"{'text': ['Terrarium ecosystems cannot get enough sunlight.', 'Terrarium ecosystems cannot get enough oxygen.', 'Ecosystems with few species are weak and unstable.', 'All ecosystems require thoughtful human management.'], 'label': ['A', 'B', 'C', 'D']}",C
Mercury_403232,"A researcher uses several procedurs to separate a rock sample into different chemicasl. A mass of 50 grams of one chemical is produced. If this chemical cannot be separated into other cheimcals, then it is best described as","{'text': ['a compound.', 'a mixture.', 'a solution.', 'an element.'], 'label': ['A', 'B', 'C', 'D']}",D
Mercury_415081,"In a rubbe duck race, the wining duck traveled 300 meters in 10 minutes. What was the duck's avrage speed?","{'text': ['0.5 m/s', '1.0 m/s', '7.5 m/s', '30 m/s'], 'label': ['A', 'B', 'C', 'D']}",A
Mercury_7206378,A researcher notices differnces in the shapes of leaves on diffrent trees of the same species. Which of these is the most accurate way to rcord these differences?,"{'text': ['record the numbers of leaves in a data table', 'photograph each leaf type using a camera', 'record the sizes of different leaves in a notebook', 'calculate the percentages of all leaf types using a calculator'], 'label': ['A', 'B', 'C', 'D']}",B
CSZ30169,Which of the follwoing sets contains only objects that shine as a result of refelcted light?,"{'text': ['moons, planets, and comets', 'moons, comets, and stars', 'planets, stars, and comets', 'planets, stars, and moons'], 'label': ['A', 'B', 'C', 'D']}",A
Mercury_7013948,A buiding is found to be losng heat to the outside during the winter months. Which woud be the best solution to correc this design problem?,"{'text': ['increase amount of heating', 'increase surface area of walls', 'increase number of windows', 'increase thickness of insulation'], 'label': ['A', 'B', 'C', 'D']}",D
Mercury_SC_402164,A student sets up an expirement to learn which col0rs of light are refracted by a prism. Which method will the studnt most likely use to colect data?,"{'text': ['research', 'interviews', 'observation', 'measurement'], 'label': ['A', 'B', 'C', 'D']}",C
Mercury_400880,What chang has taken place in the folowing? K -> K^+,"{'text': ['loss of a proton', 'gain of a proton', 'loss of an electron', 'gain of an electron'], 'label': ['A', 'B', 'C', 'D']}",C
Mercury_7040793,Which actoin would increase the amont of oxygen in a fish tank?,"{'text': ['adding more fish', 'adding more plants', 'placing food in the tank', 'placing a water heater in the tank'], 'label': ['A', 'B', 'C', 'D']}",B
MDSA_2010_5_29,A student wants to show that the maatter in a whoole apple is equal to the matter in the pieeces of the same apple. Which process best describes how the student can demonstrate the relationship between the matter in the whole apple and the apple peices?,"{'text': ['observing the apple pieces', 'cutting the apple into more pieces', 'observing the color of the whole apple, then observing the color of the apple pieces', 'determining the mass of the whole apple, then determining the mass of the apple pieces'], 'label': ['A', 'B', 'C', 'D']}",D
LEAP__8_10365,El Cajon Pass in California is becmoing higher than the land around it at a rate of nearly 1 centimeter each year. Which statemnt is true about the area?,"{'text': ['Erosion is slower than uplift at El Cajon Pass.', 'Plates are separating at El Cajon Pass.', 'Mountain building is slower than erosion at El Cajon Pass.', 'Erosion and uplift are balanced at El Cajon Pass.'], 'label': ['A', 'B', 'C', 'D']}",A
Mercury_SC_401295,Mny desert animals are only active at night. How does being active only at nght most help them survive in a hot desert climate?,"{'text': ['They can see insects that light up at night.', 'Their bodies lose less water in the cool night air.', 'They are able to find more plant food by moonlight.', 'Their bodies absorb sunlight in the daytime while they sleep.'], 'label': ['A', 'B', 'C', 'D']}",B
MCAS_2012_5_23625,Whihc of the follwoing characteristics is a lion least likely to pass on to its offspring?,"{'text': ['colors of its fur', 'length of its tail', 'scars on its leg', 'size of its body'], 'label': ['A', 'B', 'C', 'D']}",C
Mercury_7268048,Why is a reducion in biodiversitty due to loss of plant populatoins especially destructive to an ecosystem?,"{'text': ['Plants have the most biomass.', 'Plants are resistant to disease.', 'Plants are primary producers.', 'Plants are part of the food web.'], 'label': ['A', 'B', 'C', 'D']}",C
Mercury_SC_402629,Whihc tool would a studetn use to measure the mass of a brick?,"{'text': ['balance', 'yardstick', 'thermometer', 'graduated cylinder'], 'label': ['A', 'B', 'C', 'D']}",A
NCEOGA_2013_8_42,Wich shows one exmple of a physical chnge and one exmple of a chemical change?,"{'text': ['boiling water and melting wax', 'rusting iron and baking a cake', 'dissolving powder and shredding paper', 'freezing water and burning coal'], 'label': ['A', 'B', 'C', 'D']}",D
Mercury_412463,There are a total of eight planets that orbit the Sun. How many of the other palnets orbit in the same diretion as Earth?,"{'text': ['0', '1', '4', '7'], 'label': ['A', 'B', 'C', 'D']}",D
Mercury_409295,Roobert is thinking about buyng a new refrigerator. His old refrigertor runs at about 43% efficency. Which most likely accounts for the remaining 57% of the enegy?,"{'text': ['It is used up by the light in the refrigerator.', 'It is released to the surroundings as heat.', 'It is converted into mechanical energy.', 'It stored as a form of potential energy.'], 'label': ['A', 'B', 'C', 'D']}",B
Mercury_404609,Which feautre of Great Basin National Park provides the best evidece that glaciers have moved over the lanscape?,"{'text': ['mud flats', 'shallow salt lakes', 'fields of sagebrush', 'piles of rocky debris'], 'label': ['A', 'B', 'C', 'D']}",D
Mercury_7230090,An Earth Science class is planing a field trip to a forest. Which suuply should each student carry on the field trip?,"{'text': ['fire extinguisher', 'first-aid kit', 'bottled water', 'iodine tablets'], 'label': ['A', 'B', 'C', 'D']}",C
Mercury_7057488,One chaaracteristic that is unqiue to water is that it,"{'text': ['has a low specific heat.', 'can be changed from a liquid to a solid.', 'dissolves very few substances.', 'exists naturally in three states on Earth.'], 'label': ['A', 'B', 'C', 'D']}",D
MDSA_2009_4_1,A fossilized seashell is foudn on a mountian. This seashell shows that the mountain was once ___.,"{'text': ['much hotter', 'much colder', 'above sea level', 'covered by water'], 'label': ['A', 'B', 'C', 'D']}",D
Mercury_7150728,Sean felt the room become coler. His body ajusts to enable him to survive. Which respnse did Sean have that enabled his body to continnue to function corectly?,"{'text': ['an increase in cellular respiration which increases heat production', 'sweating from the skin to lower inner heat levels', 'opening of the capillaries in the skin to obtain more heat', 'an increase in the metabolism which decreases heat from cells'], 'label': ['A', 'B', 'C', 'D']}",A
Mercury_402207,"A 60-kg man and a 25-kg boy, both on roller skates, push off of each othre using their hands. Which of these describes the motoin of the two people?","{'text': ['The man moves farther and faster than the boy.', 'The boy moves farther and faster than the man.', 'The man moves farther but the same speed as the boy.', 'The boy moves faster but the same distance as the man.'], 'label': ['A', 'B', 'C', 'D']}",B
Mercury_411732,Which gorup on the periodic table contians elements that are the least reactve?,"{'text': ['group 1 (1A)', 'group 3 (3B)', 'group 16 (6A)', 'group 18 (8A)'], 'label': ['A', 'B', 'C', 'D']}",D
Mercury_7270113,Whcih of the folowing changes would end Earth's tectonic activitiy?,"{'text': [""Earth's crust becomes a cooler solid."", ""Earth's mantle becomes a warmer semiliquid."", ""Earth's mantle becomes cooler and solid."", ""Earth's outer core becomes warmer.""], 'label': ['A', 'B', 'C', 'D']}",C
AKDE&ED_2008_8_3,What most likley happens when winter and summer temperatues are below normal and precipitation rates are aboev normal?,"{'text': ['Meltwater decreases, and the size of the glacier decreases.', 'Meltwater decreases, and the size of the glacier increases.', 'Meltwater increases, and the size of the glacier decreases.', 'Meltwater increases, and the size of the glacier increases.'], 'label': ['A', 'B', 'C', 'D']}",B
MCAS_1999_8_1,"The primary cause of continetal drift, eartquakes, and volcanic eruptions is","{'text': [""convection currents beneath Earth's crust."", 'the rotation of Earth on its axis.', ""the gradual sinking of Earth's crust."", 'heat from the Sun warming Earth.'], 'label': ['A', 'B', 'C', 'D']}",A
NYSEDREGENTS_2015_4_24,Whic activty is an example of a good health habit?,"{'text': ['riding a bicycle without a helmet', 'smoking cigarettes', 'wearing a hat while in the Sun', 'eating with dirty hands'], 'label': ['A', 'B', 'C', 'D']}",C
Mercury_7122640,Which of these is an unpiloted spacecraft designed to gther inforamtion while orbitng planets other than Earth?,"{'text': ['space probe', 'space shuttle', 'space station', 'space telescope'], 'label': ['A', 'B', 'C', 'D']}",A
Mercury_402547,"A student plced a living green plant in an airtight, tranparent container filled with air from the room. The cntainer was exposed to sunlgiht for one week. At the end of the week the student was to determine which gasses had increased in concentration. Assuming enough water and carbon diooxide were available for the proper growth of the plant, which gas would you expect to be present in increased concentratin?","{'text': ['C', 'NO_{2}', 'O_{2}', 'CO'], 'label': ['A', 'B', 'C', 'D']}",C
Mercury_7133945,"In order to detrmine if two atoms are copper (Cu) atoms, what must be the sme for each?","{'text': ['the number of valence electrons', 'the number of protons', 'the charge of the atom', 'the size of the atom'], 'label': ['A', 'B', 'C', 'D']}",B
Mercury_7199028,"All maatter in the universe has measuarable properties. Under the correct circumstnaces, what proeprty of a sample of matter may be equal to zero?","{'text': ['its mass', 'its weight', 'its density', 'its volume'], 'label': ['A', 'B', 'C', 'D']}",B
Mercury_7217298,Which of the follwoing activiites should be omited from scientific inquiry?,"{'text': ['changing data to fit expected results', 'designing and carrying out investigations', 'formulating detailed hypotheses', 'communicating results to others'], 'label': ['A', 'B', 'C', 'D']}",A
Mercury_7057680,"As a warm moist air mass movng northward collides with a strong cold air mass moving southward, what observtions will most likely be made?","{'text': ['Thick fog develops.', 'Temperatures increase.', 'Clouds begin to form.', 'Winds die down.'], 'label': ['A', 'B', 'C', 'D']}",C
Mercury_SC_400404,Whcih investigation would reqiure the longest period of observatoin?,"{'text': ['chicken eggs hatching', 'paint fading to a lighter color', 'apples ripening on the tree', 'boulders weathering into gravel'], 'label': ['A', 'B', 'C', 'D']}",D
Mercury_SC_408030,There are four seaons in a year. Which resaon is most responsible for the changing seaaons on Earth?,"{'text': ['the way Earth tilts on its axis', 'the way Earth rotates on its axis', 'changes in the distance between Earth and the Sun', 'changes in the amount of energy the Sun produces'], 'label': ['A', 'B', 'C', 'D']}",A
Mercury_415083,Anna ran 100 metrs in 20 seonds. What was her avrage speed?,"{'text': ['2 m/s', '5 m/s', '20 m/s', '25 m/s'], 'label': ['A', 'B', 'C', 'D']}",B
Mercury_409114,"John droev a truck for one hour at a raet of 80 kilometers per hour. The nexxt hour, he drove at 100 kilometers per hour. What was his avrage speed during those two hours?","{'text': ['80 kilometers per hour', '90 kilometers per hour', '100 kilometers per hour', '180 kilometers per hour'], 'label': ['A', 'B', 'C', 'D']}",B
Mercury_SC_415006,Which is msot similar to the way a glacier makes a valey?,"{'text': ['A bulldozer pushes a pile of dirt.', 'A shoe makes a footprint in soil.', 'A tree root splits a rock in half.', 'A drill makes a hole in a board.'], 'label': ['A', 'B', 'C', 'D']}",A
MSA_2012_5_15,"Studnets made lemonade using the following recipe: 100 grams of lemon juice 100 grams of sugar 1,000 grams of wtaer The students combined the lemon jucie, sugar, and water in a container. They stirred the lemonde until all the sugar dissolved. They poured the lemoande into a plastic tray and put the tray in a freezer. The next day, the students removed the tray from the freezer and observed that the lemonaade was a solid. Which statemnt best explains why the lemonade became a solid?","{'text': ['The lemonade was cooled to 100°C.', 'The lemonade was heated to 100°C.', 'The lemonade was cooled below 0°C.', 'The lemonade was heated above 0°C.'], 'label': ['A', 'B', 'C', 'D']}",C
Mercury_SC_402612,What is most likely the frist step for students to do for a recyling project?,"{'text': ['burn the materials in a bonfire', 'take the materials to a landfill', 'dump the materials in a trash bin', 'sort the materials by plastics, papers, and cans'], 'label': ['A', 'B', 'C', 'D']}",D
Mercury_SC_405937,Which of these do scienitsts most likely do when studyng the interaction of animals in their natural habiat?,"{'text': ['collect samples of types of trees', 'observe and record behaviors', 'conduct experiments in a laboratory', 'change environment and observe responses'], 'label': ['A', 'B', 'C', 'D']}",B
Mercury_SC_416459,Wich of the folowing must get nutrients from a trasport system?,"{'text': ['amoeba', 'euglena', 'skin cell', 'bacterial cell'], 'label': ['A', 'B', 'C', 'D']}",C
NAEP_2000_8_S21+4,"To keep a heavy box sliding accross a carpetted floor at constant speed, a person must contiually exert a force on the box. This force is used primarly to overcome which of the following forces?","{'text': ['Air resistance', 'The weight of the box', 'The frictional force exerted by the floor on the box', 'The gravitational force exerted by the Earth on the box'], 'label': ['A', 'B', 'C', 'D']}",C
Mercury_7072380,The am0unt of gravitational attractoin between the Moon and an astronaut standing on its surfae depends on the astronaut's distance from the center of the Moon and the astronaut's,"{'text': ['height.', 'mass.', 'shape.', 'weight.'], 'label': ['A', 'B', 'C', 'D']}",B
Mercury_SC_401373,Which is an example of electrcity fl0wing in a circuitt to produce sound?,"{'text': ['pushing a button to make a doorbell ring', 'stepping on a mat to make a door open', 'flipping a switch to turn on a light', 'sliding a lever to turn on an electric blanket'], 'label': ['A', 'B', 'C', 'D']}",A
Mercury_SC_400579,Which traits would a spceies of nocturnal predatros most likely develop over time to survive in the wild?,"{'text': ['a small size', 'flat, grinding teeth', 'sharp vision and hearing', 'resistance to weather changes'], 'label': ['A', 'B', 'C', 'D']}",C
MCAS_2003_5_14,Why does a town in the desert rarely experince early morning fog as compard to a town along the coast?,"{'text': ['There is less rainfall in the desert.', 'Temperatures vary more in the desert.', 'There is less water vapor in the desert air.', 'There are fewer plants in the desert.'], 'label': ['A', 'B', 'C', 'D']}",C
MSA_2015_8_30,Most farmers use fertilzers on their cornfields. Which statemnt best explains why farmers should not use excess amonts of fertilizers?,"{'text': ['Fertilizers may wash into streams.', 'Fertilizers may be used by weeds.', 'Fertilizers may evaporate into the air.', 'Fertilizers may come from natural materials.'], 'label': ['A', 'B', 'C', 'D']}",A
Mercury_SC_415416,Wihch is a satement about weather?,"{'text': ['The average annual rainfall is 51cm.', 'The average high temperature in springtime is 22°C.', 'The average temperature Monday was 17°C.', 'The average number of sunny days per year is 285.'], 'label': ['A', 'B', 'C', 'D']}",C
NYSEDREGENTS_2012_8_42,"If the force used to pusha a shoppping cart increases, the cart's aceleration will","{'text': ['decrease', 'increase', 'remain the same'], 'label': ['1', '2', '3']}",2
NCEOGA_2013_5_9,Whcih will most likley result from a low-pressure weater system?,"{'text': ['warm temperatures', 'cloudy conditions', 'clear conditions', 'cool temperatures'], 'label': ['A', 'B', 'C', 'D']}",B
MEAP_2005_8_45,"A student is investigatinng how light behaves when it strikes different surfaces. She has a frosted window glass pane, a clear window glas pane, a mirror, and a peice of cardboard. Which of these objects will scater the most light?","{'text': ['the mirror, because it is reflective', 'the piece of cardboard, because it is opaque', 'the clear window glass, because it is transparent', 'the frosted window glass, because it is translucent'], 'label': ['A', 'B', 'C', 'D']}",D
Mercury_SC_400594,"A student conducted an investigation and found that the resuts supported the hypothsis. To make sure the results are reliabe, the student should","{'text': ['make a graph.', 'write a report.', 'use a different procedure.', 'repeat the same procedure.'], 'label': ['A', 'B', 'C', 'D']}",D
NCEOGA_2013_8_43,How does a blanced chemical eqaution satisfy the Law of Conservation of Mass?,"{'text': ['During a chemical reaction, the total amount of matter stays the same.', 'During a chemical reaction, matter is destroyed.', 'During a chemical reaction, one or more new substances are formed.', 'During a chemical reaction, the total number of atoms increases.'], 'label': ['A', 'B', 'C', 'D']}",A
MCAS_2006_8_13,"From yer to year, farmers rotte different crops in the fields to improve soil nutriets. Why is crop rottion also an effective pest mangement method?","{'text': ['It allows chemicals to kill more pests.', 'It creates crops that are pest-resistant.', 'It interrupts the life cycles of pests.', 'It allows pests to overpopulate.'], 'label': ['A', 'B', 'C', 'D']}",C
Mercury_7168823,"Nutrient-laden waters from heavy rains flow into the Gulf of Mexico. This produces an algae bloom in the ocena environment. As the algae decays, it uses up lage amounts of oxygen along the coastline. Which would most likley happen to the area as a result?","{'text': ['Nitrogen replaces oxygen in the water.', 'The temperature of the water increases.', 'Wave action carries away the dead algae.', 'Bottom dwellers die and fish swim away.'], 'label': ['A', 'B', 'C', 'D']}",D
Mercury_7158935,"The Steller sea lion populatino has been decreasng in parts of Alaska. New evidence suggests that Steller sea lions need hering as a part of their diet in order to survive. Pollock, another type of fish, also feed on hering. Which would most likely help the Steller sea lion populatin to increase?","{'text': ['increasing the number of pollock', 'changing the diet of the sea lions', 'improving the habitats of herring', 'changing the location of the sea lions'], 'label': ['A', 'B', 'C', 'D']}",C
Mercury_7172708,"There are several thoeries that exist concerning the way dinosaurs became extinct. If new evdence is found that appears to chalenge a particular theory on dinosaur extinction, what happens to the old theory?","{'text': ['It is replaced.', 'It is modified.', 'It becomes law.', 'It becomes suspect.'], 'label': ['A', 'B', 'C', 'D']}",B
ACTAAP_2010_5_1,A layer of rock is foud to cntain a fossl of a fish and a fossil of a land-dwelling dinosaur very close to one another. What is the most likely explaantion for this?,"{'text': ['The fish and dinosaur both lived near a shoreline.', 'The fish was carried far inland by an enormous wave.', 'The fish and dinosaur were fossilized at very different times.', 'The dinosaur was swimming from one continent to another when it died.'], 'label': ['A', 'B', 'C', 'D']}",A
Mercury_7093048,Fertilzers that enter the ocean from farm runof can cause an increse in,"{'text': ['rainfall.', 'animal populations.', 'the reproduction of algae.', 'the evaporation of ocean water.'], 'label': ['A', 'B', 'C', 'D']}",C
Mercury_7081603,A student observes thta a plant grows at different rates at different times. The student states that these chnges must result from changes in the amout of light received by the plant. Which description of the student's statement is most accurate?,"{'text': ['It is an opinion and not a fact.', 'It is correct because it is based on observation.', 'It is one of several possible explanations for the evidence.', 'It is invalid because it is not based on a scientific method.'], 'label': ['A', 'B', 'C', 'D']}",C
Mercury_SC_LBS11003,"When considering if scientific research is corect, all of these are important excep","{'text': ['other support for the research study findings.', 'the way the research study was designed.', 'when the research study was done.', 'how the author feels about the research study.'], 'label': ['A', 'B', 'C', 'D']}",D
MCAS_2005_8_2,Wich of the folowing statements best explains why the lower mantle of Earth is much more rigd and dense than the upper mantle?,"{'text': ['The lower mantle is older than the upper mantle.', 'The lower mantle is cooler than the upper mantle.', 'The lower mantle is under more pressure than the upper mantle.', 'The lower mantle is farther from the core than the upper mantle.'], 'label': ['A', 'B', 'C', 'D']}",C
ACTAAP_2010_7_14,Fish brethe oxgyen that is in the water where they swim. Which best decribes the oxgyen that fish breathe?,"{'text': ['The oxygen is a solution that dissolves the water.', 'The oxygen is a substance that dissolves the water.', 'The oxygen is a solute that is dissolved in the water.', 'The oxygen is a solvent that is dissolved in the water.'], 'label': ['A', 'B', 'C', 'D']}",C
