Unnamed: 0,question,subject,choices,answer
682,"As nations worldwide continue to advance in healthcare and quality of life, the average lifespan of individuals has significantly increased. This demographic shift has led to a higher proportion of elderly citizens within the population. In this context, what is a significant issue faced by nations experiencing a swift increase in their elderly population?",high_school_geography,"['Medical services', 'Child care centers', 'Renewable energy sources', 'Sufficient educational institutions', 'Vaccination programs']",0
683,"Regions are often defined by a variety of characteristics that can include physical geography, cultural elements, economic activities, or political boundaries. These characteristics help differentiate one region from another, providing a framework for analyzing spatial relationships and human interactions. All of the following are common characteristics of regions, except one. Which characteristic is not typically associated with regions?",high_school_geography,"['borders.', 'clearly delineated.', 'situational position.', 'shared characteristics.', 'economic activities.']",1
684,"Throughout history, as civilizations began to form and expand, various factors came into play that influenced where communities settled and thrived. Consider the impact of trade routes, agricultural development, and protection from invasions. With these in mind, what geographic features have historically influenced the formation of densely populated areas and early communities?",high_school_geography,"['Abundance of mineral resources', 'Scarcity of wooded areas', 'Proximity to commercial pathways', 'Favorable weather conditions typical of the Mediterranean region', 'Increase in industrial production']",2
685,"In the context of a country's governance and societal structure, there are various ways in which a nation can approach religious matters. Some countries may integrate religious principles into their legal system, while others may maintain a clear separation between religion and state. Considering these different approaches, what term describes a country's stance when it either dismisses or remains unconcerned with religious matters?",high_school_geography,"['Integration of cultural traditions with religious practices.', 'Belief in a single deity.', 'Separation of religion from civic affairs and institutions.', 'Attribution of spiritual essence to natural objects.', 'Belief in multiple gods.']",2
686,"In the study of global economic patterns, various theories attempt to explain the distribution of power and resources among countries. One such theory, world systems theory, provides a framework for understanding the hierarchical organization of the global economy. According to world systems theory, how is the global economic structure categorized?",high_school_geography,"['affluent and impoverished.', 'central, marginal, and intermediate zones.', 'core, periphery, and semi-periphery.', 'wealthy and destitute.', 'industrialized and non-industrialized.']",1
687,"Throughout history, cities have played a crucial role in shaping cultural and religious landscapes. Many of these cities are not only centers of commerce and governance but also hold deep spiritual significance for millions of people. For instance, Varanasi in India is renowned for its temples and ghats along the Ganges River, while Mecca in Saudi Arabia is famous for the annual Hajj pilgrimage. Considering their importance in the context of religious practices, what do the cities of Varanasi in India and Mecca in Saudi Arabia have in common in terms of their significance to people who practice their respective religions?",high_school_geography,"['hubs for a significant portion of the global economy', 'historical centers of ancient empires', 'capitals of nations that were once under British rule', 'models of contemporary city design', 'sites visited by large numbers of religious travelers']",4
688,"In recent decades, many countries have sought innovative strategies to stimulate their economic development. One approach involves creating specific zones within their borders to encourage specific types of activities and investments. These zones often feature relaxed regulations and policies to attract foreign businesses and investors. Which Asian country is known for having such designated areas aimed at boosting economic growth by offering these relaxed economic regulations?",high_school_geography,"['The Republic of Korea', 'The Socialist Republic of Vietnam', 'The Kingdom of Thailand', ""The People's Republic of China"", 'The Land of the Rising Sun']",3
689,"In today's globalized world, communication across different cultures is becoming increasingly important. Considering the vast number of languages spoken across the globe, which language is spoken by the most people worldwide?",high_school_geography,"['The language with the second highest number of native speakers globally is Spanish.', 'Hindi is the language with the largest number of speakers when combining native and second-language speakers.', 'The language spoken by the most people worldwide is English.', 'The language with the most native speakers in Russia is Russian.', 'Mandarin Chinese is the language with the most native speakers in the world.']",4
690,"In recent years, climate change has been a topic of growing concern globally, with its impacts felt in various regions, including South Asia. This area, known for its diverse ecosystems and rapid population growth, relies heavily on seasonal weather patterns for agriculture and water resources. Considering the recent unpredictability of the wet season in South Asia, how might this change adversely impact certain aspects of the region?",high_school_geography,"['Demographic trends', 'Urban infrastructure development', 'Agricultural output', 'Conservation of wildlife', 'Tourism']",2
691,"Rivers have been shaping landscapes for millions of years, creating valleys, deltas, and floodplains through the processes of erosion and deposition. The speed of the river flow, the sediment load it carries, and the gradient of the riverbed all contribute significantly to these processes. Climatic conditions and human activity can also influence the landscape over time. Which of the following factors is least likely to contribute to the formation of landscapes shaped by river deposits?",high_school_geography,"['Regular inundation', 'Extensive cutting and wearing away', 'Mostly gentle inclines', 'Dense vegetation growth', 'A thick layer of unconsolidated materials']",1
692,"In the early 20th century, sociologist Ernest Burgess developed a model to understand the spatial organization of urban areas, which he applied to the city of Chicago. This model proposed that cities grow in concentric rings emanating from the central business district. As urban areas expand, different zones emerge, each characterized by distinct social and economic features. In this model, which area is characterized by poverty, ethnic enclaves, and urban decay?",high_school_geography,"['Innermost zone', 'Middle-class zone', 'Outer residential zone', 'Suburban business district', 'Transitional zone']",0
693,"Imagine you are planning a vacation and considering various destinations around the world. You notice that some places have bustling agricultural markets, while others focus more on manufacturing or service industries. Understanding that each region's primary economic activities can be influenced by its unique geographical and environmental conditions, what kind of economic activity is directly influenced by natural environmental conditions?",high_school_geography,"['Activities involving the extraction of natural resources', 'Knowledge-based and research activities', 'Services and customer interactions', 'Manufacturing and industrial processes', 'Digital and virtual economy activities']",0
694,"In many countries, historical, cultural, and economic factors contribute to a rich tapestry of diversity. However, this diversity can sometimes present challenges to national unity, particularly when linguistic differences are involved. Identify a country where linguistic differences create challenges to national unity.",high_school_geography,"['The nation north of the United States', 'The country with 50 states', 'The South American country known for Portuguese', 'Norway', 'Switzerland']",0
695,"Turkey, a country that straddles Eastern Europe and Western Asia, has a rich cultural heritage and is known for its historical sites such as the Hagia Sophia and the ancient city of Troy. Pakistan, located in South Asia, has diverse landscapes from mountains to deserts and is famous for its archaeological sites like Mohenjo-daro. Considering these attributes, what is the capital city of Turkey and the capital city of Pakistan classified as?",high_school_geography,"['capitals founded during the colonial period.', 'cities located in arid regions.', 'competing urban centers.', 'newly established capital cities designed to promote development.', 'capitals known for their ancient historical landmarks.']",3
696,"Since the 1980s, the United States has experienced various changes in immigration patterns due to economic opportunities, political climates, and global events. Considering these factors, from which regions have most immigrants to the United States originated since 1980?",high_school_geography,"['Europe and Northern Africa', 'Africa south of the Sahara and the Pacific Islands', 'Eastern Europe and Australia', 'Central America and the Caribbean', 'Asia and South America']",4
697,"In a nation with diverse cultural backgrounds, rich historical narratives, and varying economic interests, what factor might lead to division or conflict within the nation?",high_school_geography,"['External military aggression', 'An inspiring leader of the nation', 'A day of national celebration', 'A common language spoken nationwide', 'Conflicts arising from religious beliefs']",4
698,"Many countries have unique geographical features that impact their economic development and trade capabilities. For example, some nations are landlocked, which can pose significant challenges for accessing international markets and importing or exporting goods due to the lack of direct access to the sea. Identify a nation that experiences significant challenges in trade because of its geographical position.",high_school_geography,"['An island nation known for its extensive canal system in Europe', 'A European nation with a famous festival known as La Tomatina', 'A landlocked Asian country between Russia and China', 'A Mediterranean country known for its boot-shaped peninsula', 'A major global shipping hub in Southeast Asia']",2
699,"Many urban models attempt to explain the spatial organization of cities, each highlighting different features such as transportation networks, economic activities, or residential patterns. In one particular model, there is a notable residential corridor that extends from the central business district along a major roadway, often influenced by historical development patterns and modern transportation routes. Which urban model does this describe?",high_school_geography,"['African south of the Sahara', 'Islamic', 'South American', 'European-style', 'North American grid model']",2
700,"Imagine you are organizing a small community event, and you have a list of potential attendance numbers from previous similar events. These numbers are 13, 35, 26, 8, 24, 10, 22, 10, and 32. In planning for this event, you wish to understand the typical attendance number. To get a sense of this, determine the middle value of these numbers when they are arranged in ascending order.",elementary_mathematics,"['Twenty-three', 'Twenty-two', 'Twenty-seven', 'Twenty', 'Eighteen']",1
701,"Imagine you are baking a cake, and you realize you need to measure out some ingredients precisely. You have a digital scale that shows weights in decimals. While measuring, you notice that adding 2.9 grams to a particular ingredient's weight results in a total of 11 grams. What was the original weight of the ingredient before you added the 2.9 grams?",elementary_mathematics,"['Eight and two tenths', 'Thirteen and nine tenths', 'Eight and one tenth', 'Eight and nine tenths', 'Nine and one tenth']",2
702,"Imagine you are a financial analyst working on a report. You are tasked with analyzing two sets of sales figures from two different regions. The first region reported sales of 46,911 units, while the second region reported sales of 653,092 units. To accurately present the total sales in your report, you need to combine these figures. What is the result of this addition?",elementary_mathematics,"['Nine hundred thirteen thousand two hundred three', 'Six hundred ninety-nine thousand nine hundred three', 'Seven hundred thousand three', 'One million one hundred twenty-two thousand two hundred two', 'Seven hundred thousand']",2
703,"Imagine you're hosting a small gathering and plan to serve canned pears as part of the dessert. You realize you have three cans on hand, but you anticipate needing more due to the number of guests. At the local grocery store, the price for three cans of pears is $2.37. Using the $9.48 you have set aside for groceries, how many additional cans can you purchase?",elementary_mathematics,"['Buy 3 tins', 'Purchase 36 tins', 'Acquire 12 tins', 'Obtain 13 tins', 'Calculate the cost of 5 cans and see if it fits the budget']",2
704,"A car rental service, which has been in business for over a decade and prides itself on accurate mileage tracking, recorded a total of 300.5849 miles driven by one of their customers in a day. This customer rented a car for a business trip that involved visiting multiple clients across different towns, ensuring that the vehicle was returned on time and in excellent condition. How many miles did they record, rounded to the nearest hundredth?",elementary_mathematics,"['Three hundred point five eight', 'Three hundred point six', 'Three hundred point five nine', 'Three hundred point five eight five', 'Three hundred']",0
705,"Imagine you are organizing a small charity event, and you have a budget plan for various expenses. After allocating funds for venue, food, and entertainment, you notice that the amount left for miscellaneous expenses is represented by the equation \( w + 23 = 14 \). Determine the value of \( w \), which represents the remaining funds you can allocate to miscellaneous expenses.",elementary_mathematics,"['Negative nine', 'Thirty-seven', 'Fifty-seven', 'Nine', 'Negative thirty-seven']",0
706,"Erin recently bought several cartons of her favorite juice from a local farmers' market, and she now has a total of 12 pints of this juice stored in her refrigerator. Erin, who enjoys a consistent routine, drinks exactly 3 cups of juice each day as part of her breakfast. Considering her daily consumption, how many days will it take for her to finish all the juice she has?",elementary_mathematics,"['Forty-eight hours', 'Thirty-six cups', 'One hundred ninety-two hours', 'Two hundred sixteen hours', 'Ninety-six hours']",2
707,"In a community project, a group of volunteers is planning to plant a variety of flowers in a trapezoidal garden located in the center of a public park. The garden is designed to attract butterflies and enhance the park's natural beauty. The length of the shorter parallel side of the garden is 130 yards, while the longer parallel side is 390 yards. The perpendicular distance between these two sides, which defines the garden's height, is 75 yards. Calculate the area of this garden to determine how much space the volunteers have for planting.",elementary_mathematics,"['Twenty-nine thousand two hundred fifty square yards', 'Thirty-nine thousand square yards', 'The perimeter of the trapezoid is six hundred yards', 'Nineteen thousand five hundred square yards', 'Nine thousand seven hundred fifty square yards']",3
708,"During a local charity event, Joe and Mike participated in a race organized to raise funds for a community park. Joe, a seasoned runner known for his consistent performance, crossed the finish line 4 minutes earlier than Mike, who had taken a break from running due to a recent injury. Despite the setback, Mike managed to complete the race at 4:02 p.m. At what time did Joe complete the race?",elementary_mathematics,"[""Two minutes after eight o'clock in the evening"", 'Two minutes past noon', 'Six minutes past four in the afternoon', ""Three minutes before four o'clock in the afternoon"", ""Two minutes before four o'clock in the afternoon""]",4
709,"During her bird watching trip to the scenic wetlands, Keiko noticed a variety of bird species and even took notes on their behaviors. She observed 34 more birds in the morning compared to the afternoon. While enjoying her lunch under a large oak tree, she tallied her total count and found she had seen 76 birds throughout the day. How many birds did she observe in the afternoon?",elementary_mathematics,"['Forty birds', 'Twenty-one birds', 'Eighty-four birds', 'Forty-two birds', 'Thirty-eight birds']",1
710,"
In the town of West Valley, there are 2,817 houses. The town, known for its annual summer festival and beautiful parks, has a population that enjoys a moderate climate with occasional rainfall. If each house consumes an average of 380 gallons of water daily, calculate the total daily water consumption for all the houses in West Valley. How many gallons of water are used in total each day by these houses?
",elementary_mathematics,"['Ten million, seven hundred four thousand, six hundred gallons', 'Eight hundred seventy thousand, four hundred sixty gallons', 'Eight hundred sixty thousand, four hundred sixty gallons', 'One million, sixty thousand, four hundred sixty gallons', 'One million, seventy thousand, four hundred sixty gallons']",4
711,"In a bustling city, a new skyscraper is being constructed. The building is designed with a modern aesthetic and features advanced eco-friendly technologies. Each floor of the skyscraper is 14.3 feet in height. The total height of the building, from the ground to the top of the penthouse, reaches 185.9 feet. Considering the uniform floor height, how many floors does the building have?",elementary_mathematics,"['Fifteen flights of stairs', 'Seventeen stories', 'Nine tiers', 'A total of ten floors', 'Thirteen levels']",4
712,A group of students is planning a road trip to a science museum that is 118 miles away. They have a car that consumes fuel at a rate of 5.7 miles per gallon. Use numbers that are easy to work with to approximate the number of gallons of fuel they will need for the trip by dividing 118 by 5.7.,elementary_mathematics,"['roughly 30', 'roughly 10', 'roughly 40', 'roughly 50 (by using whole numbers 100 ÷ 2)', 'roughly 20']",4
713,"In a recent survey, a mathematician was analyzing the effectiveness of various problem-solving strategies. During her study, she encountered a scenario where she needed to express, using an algebraic expression, four times the difference when you subtract 22 from a variable x. How would she write this expression in algebraic terms?",elementary_mathematics,"['Multiply x by 4, then subtract 22', '4 times the difference when x is decreased by 22', '4 multiplied by 22, then subtract x', '4 times the result of subtracting x from 22', '4 times the sum of x and 22']",1
714,"Marcus decided to wash his car on a sunny Saturday afternoon. He visited the local car wash that was offering a weekend discount. Marcus used $3.25 worth of quarters to operate the car wash, and he had just cleaned his car's interior the week before. If each quarter provides 1 minute of washing time, how many minutes did he spend washing his car?",elementary_mathematics,"['A span of 780 seconds', '1,950 seconds', 'A duration of 600 seconds', 'A period of 960 seconds', '1,560 seconds']",0
715,"Imagine you are an archaeologist exploring an ancient site. In one of the chambers, you discover a series of carvings on the wall that depict the sequence of numbers: 5, 9, 13, 17, 21, 25, 29. According to inscriptions, these numbers were used by the ancient civilization to keep track of their ceremonial events. What is the rule that describes how each number is formed from the previous number in the sequence?",elementary_mathematics,"['Begin at 0. Increase by 4 to find each successive number.', 'Begin at 1. Increase by 6 to find each successive number.', 'Begin at 5. Increase by 5 to find each successive number.', 'Begin at 0. Increase by 5 to find each successive number.', 'Begin at 5. Increase by 4 to find each successive number.']",4
716,"In a classroom setting where students are learning about least common multiples and greatest common divisors, the teacher presents the following problem: Consider two friends, Alice and Bob, who both have a collection of marbles. Alice has 24 marbles, and Bob has 36 marbles. They want to organize their marbles into bags with the same number of marbles in each bag, without any marbles left over. What is the smallest positive integer that both 24 and 36 divide evenly into without a remainder?",elementary_mathematics,"['10 dozen', 'Twelve dozen', 'Six dozen', 'Four times twenty-four', 'The greatest common divisor of 24 and 36']",2
717,"Paul is training for a marathon and has decided to adjust his diet accordingly. Last week, he consumed 2 cookies daily for 5 days as part of his carbohydrate intake. This week, he continued to eat 2 cookies daily for 4 days to maintain his energy levels. How can we express the total number of cookies Paul consumed over these two weeks using an arithmetic expression?",elementary_mathematics,"['(2 plus 5) times (2 plus 4)', '2 times (5 times 4)', '2 plus (5 times 4)', '(2 times 5) times (2 times 4)', '2 times (5 plus 4)']",4
718,Imagine you have 36 apples and you want to distribute them evenly among a group of friends so that each friend receives 4 apples. How many friends are in the group?,elementary_mathematics,"['The number of days in a week', 'One more than half a dozen', 'Twice four', 'The number of fingers on a hand', 'One less than ten']",4
719,"Imagine you are managing the budget for a small event. You start with a budget of $142.76. After purchasing supplies, you notice that you spent $16.5 on decorations. Calculate the remaining budget.",elementary_mathematics,"['126.76', 'Fourteen thousand one hundred eleven', '2.224', '126.26', '159.26']",3
720,"Imagine you are reading a story where a character, Alex, is reflecting on a decade of adventures, friendships, and challenges they faced from 2010 to 2020. During this period, Alex learned valuable life lessons and experienced personal growth. With this in mind, how many years make up ten years?",elementary_mathematics,"['Five years', 'One and a half decades', 'Two decades', 'Half of a decade', 'Ten years']",4
721,"Imagine you are keeping track of expenses while planning a cross-country road trip. During a segment of your journey, you mistakenly recorded your fuel expenses as a negative value instead of positive. You've noted down a fuel cost of negative forty dollars for one of your stops. To correct this, you need to recalculate your average expense per stop by dividing this incorrect figure by the number of stops, which is negative eight. Calculate the result of this division.",elementary_mathematics,"['Positive five', 'Zero', 'Negative five', 'Negative one divided by five', 'One divided by five']",0
722,"Imagine you are baking a cake and need to use a specific proportion of ingredients. You have 27 cups of flour and 36 cups of sugar, and you want to simplify the ratio of flour to sugar to its lowest terms. Express the fraction 27/36 in its lowest terms.",elementary_mathematics,"['Two thirds', 'One fifth', 'Three fifths', 'Three quarters', 'Four ninths']",3
723,"A marine biologist is conducting a comprehensive study on the migration patterns of whale species, focusing on how environmental factors such as ocean currents and temperature changes affect their travel routes. As part of this research, the biologist is tracking the travel distances of two specific whale species. Over a period of 28 days, the humpback whales covered a distance of 2,240 miles. Meanwhile, during a 32-day period, the gray whales traveled 2,368 miles. The biologist is particularly interested in comparing the travel efficiency of these whales over extended periods. Assume the humpback whales maintained their travel speed for 32 days. Calculate how many additional miles they would have covered compared to the gray whales.",elementary_mathematics,"['Two hundred eighty miles farther', 'One hundred twenty-eight more miles', 'Four hundred eight extra miles', 'One hundred ninety-two additional miles', 'Two hundred thirty-two more miles based on average speed']",3
724,"During her recent basketball game, Jess played against the Tigers, a team known for their strong defense. Despite the challenging opponents, she managed to earn a total of 18 points. If each basket she scored was valued at 2 points, how many baskets did she successfully make?",elementary_mathematics,"['Double the number eight', 'Twice as many as ten', 'Three times three', 'Half of eighteen', 'Four more than four']",3
725,Imagine you are organizing a small bookshelf and need to arrange some books by their page numbers in ascending order. Each book represents a different number. Arrange the following numbers in ascending order to help you organize your bookshelf.,elementary_mathematics,"['10,354; 10,600; 104,321; 106,213', '160,233; 171,141; 11,645; 16,703', '167,213; 161,455; 17,400; 11,633', '12,209; 12,902; 125,466; 125,464', '11,000; 10,500; 12,345; 13,000']",0
