Unnamed: 0,question,subject,choices,answer
169,"In today's world, where global conflicts, economic disparities, and cultural tensions are prevalent across various regions, how would you describe the essence of peace studies as a field that seeks to address these complex issues?",security_studies,"['Peace studies focus on understanding the root causes of issues in international relations, adopting a global perspective, using an interdisciplinary approach, seeking peaceful changes, applying both analytical and normative methods, and using a multi-layered analysis that connects theory with practical research.', 'Since the end of the Cold War, peace studies have grown into a distinct and self-sufficient field that tackles issues like conflict resolution, economic security, and reducing violence on both global and local scales. It stands apart from development studies and international relations.', ""Peace studies cannot be pinned down to a single academic approach due to its ever-changing research focus and the wide range of topics it covers. However, after the Cold War, the field's success is evident in its numerous research centers and its attraction of worldwide, interdisciplinary interest."", ""Peace studies are characterized by their focus on finding peaceful ways to resolve conflicts. Researchers in this field use a 'top-down' method, concentrating on violence-related issues and aiming to make the key actors the focus of security."", 'Peace studies primarily focus on the historical development of military strategies and the evolution of warfare techniques to understand and prevent future conflicts.']",0
170,"In the aftermath of World War II, the international community witnessed a significant shift towards recognizing and protecting individual rights, leading to the establishment of various human rights organizations and treaties. Considering this historical context, in what ways does a focus on human rights influence the liberal school of thought that prioritizes human rights?",security_studies,"[""A liberalism approach centered on human rights may support the division of states if it's believed to prevent unavoidable violence and conflict."", 'A human rights-focused liberalism prioritizes economic growth over individual freedoms.', 'This version of liberalism concentrates on individuals facing issues such as economic hardship, sexual and gender-based discrimination, religious intolerance, and political oppression.', 'All of these options.', 'Contemporary liberalism focused on human rights emphasizes the importance of self-governance.']",3
171,"In the complex landscape of international relations, states are often faced with the challenge of ensuring their security amidst a myriad of threats. This challenge becomes particularly pronounced for states with limited power and resources, as they navigate alliances, economic constraints, and regional conflicts. Given these constraints, how does the 'security dilemma' manifest for such states, and what strategies might they employ to mitigate its effects?",security_studies,"[""The dilemma for weak states arises from internal competition where societal groups strive to safeguard their interests. Meanwhile, the ruling elite remain detached from these struggles, creating a policy challenge; using force to restore order can weaken the regime's core infrastructure."", 'When a state is unable to maintain stability, different groups within the society vie to ensure their own security, leading to ongoing insecurity. This creates a persistent state of chaos, as attempts to secure the regime lead to increased opposition.', 'The security dilemma for weak states mainly arises from geopolitical alliances. By aligning with stronger nations, weak states can effectively mitigate internal issues and stabilize their political environment without addressing root causes.', 'The insecurity of weak states stems from a lack of centralized political and institutional power. While deploying armed forces can potentially strengthen institutions, failure to establish a strong sense of statehood may lead to ongoing unrest and partial anarchy.', 'The insecurity dilemma of a weak state is largely an external issue, resembling a state of anarchy. When a weak state tries to enhance its position in the region, it inadvertently causes instability in the area.']",1
172,"The Human Development Report, first published in 1990 by the United Nations Development Programme, was a pivotal document that shifted the global focus from economic growth to human-centered development strategies. This report emphasized the importance of addressing various dimensions of human well-being beyond mere income levels. It also introduced concepts that have been widely accepted and integrated into the field of human security. What concepts introduced in the Human Development Report have been widely accepted and integrated into the field of human security?",security_studies,"['Concentrating on security only through the lens of violent conflicts is limiting.', 'All of these options.', 'Human security primarily focuses on traditional state sovereignty concerns.', 'Restricting security analysis solely to military action is insufficient.', 'The concept of security is open to interpretation.']",1
173,"In recent years, global discussions have increasingly focused on the interplay between various forms of security, particularly as the world continues to navigate the challenges of climate change and geopolitical tensions. As countries strive to ensure stable and sustainable development, understanding the connections between different security areas becomes crucial. With this context in mind, which areas of security are fundamentally connected to the concept of energy security?",security_studies,"['Technological advancement and innovation.', 'All of these options.', 'Government stability and global security.', 'Financial and developmental security.', 'Ecological and societal security.']",1
174,"In recent years, global geopolitical dynamics have shifted significantly, with rising powers asserting their influence and established powers reevaluating their strategies. In this complex international landscape, how can external forces pose challenges to states with limited power or stability?",security_studies,"[""Powerful nations can use diplomatic tactics to pressure weak states into following international rules. These tactics might include imposing economic sanctions and halting arms deals, which can weaken the state's financial stability or military supply, potentially leading to dissatisfaction within the army and increasing the likelihood of a coup."", ""Weak states may face external challenges due to climate change, as rising sea levels can lead to the loss of territory. This environmental threat could prompt international intervention to relocate affected populations, potentially undermining the state's sovereignty."", ""Weak states are unable to avoid the effects of globalization, which results in more open borders and increased migration. To remain competitive in a globalized economy, these states often seek loans or aid from international bodies. However, this reliance can dilute the state's dominant ideology and blur societal identity, making it harder for the state to maintain its ideological influence."", 'The spread of small arms presents a threat to weak states, as these weapons can be used to challenge state authority. Such arms are easily accessible through both legal and illegal means and are widespread in areas controlled by warlords, criminal groups, and private militias.', 'All of these options.']",4
175,"The Great Law of Peace, established by the Haudenosaunee Confederacy, is a foundational governance system that has influenced many democratic principles. The Haudenosaunee, also known as the Iroquois Confederacy, is a union of several Indigenous nations in North America. Considering the historical context and its impact on governance systems, what are some accurate statements about the Great Law of Peace as established by the Haudenosaunee Confederacy?",security_studies,"['The Great Law highlights the issue of neglecting ongoing critical analysis.', 'The Great Law was primarily concerned with economic trade agreements between the Haudenosaunee and European settlers.', 'The Great Law poses a challenge to conventional security studies by offering a successful alternative to state-centric approaches.', 'All of these.', 'The example of the Great Law demonstrates the significance of questioning methods of research and how knowledge is generated.']",3
176,"In recent years, the global security landscape has evolved significantly, with challenges ranging from cybersecurity threats to geopolitical tensions. This has led to varying approaches to security studies across different regions. Considering these dynamics, how can we account for the variations in the approaches to security studies between the United States and Europe?",security_studies,"[""The different perspectives on what security means: in Europe, it's more about academic self-reflection by those studying security, while in the US, it's more about a basic necessity to define terms."", 'The differing views on what type of knowledge is important. The US leans towards rationalism, focusing on cause-effect analysis, whereas Europe tends to be more reflective, considering broader ideational factors.', 'In the US, major theories focus either on its liberal dominance or on a power-based stability in a world where counterbalancing seems difficult due to presumed unipolarity.', 'The influence of climate change policies, where US and European strategies are primarily driven by environmental rather than security concerns.', 'All of these options.']",4
177,"In the study of educational theories, social constructivism is often contrasted with other paradigms like behaviorism and cognitivism. Considering the emphasis social constructivism places on the role of social interactions and cultural contexts in the development of knowledge, which of the following is not considered a core ontological belief of social constructivism?",security_studies,"['Social constructivism relies heavily on biological determinism to explain social phenomena.', 'The significance of identities cannot be overlooked.', 'Normative or ideational frameworks are significant and can be as influential as physical frameworks.', 'The relationship between agents and structures is one of mutual creation.', 'The concept of anarchy is an unavoidable aspect of global relations.']",4
178,"During the 1960s and 1970s, a time marked by significant social and political changes such as the civil rights movement, the Vietnam War, and the space race, what developments played a role in the rise of environmental security concerns?",security_studies,"['Developing countries began to experience a collective environmental awareness.', 'Starting in the 1970s, several scholars began to challenge traditional security ideas and methods, pointing out their failure to address environmental threats to national and global security.', 'There was an increasing awareness that environmental changes threaten not just natural ecosystems, but also human well-being.', 'All of these options.', 'The rapid industrialization in the 1960s led to a focus on economic development rather than environmental concerns.']",3
179,"Liberalism, a political and economic ideology that emphasizes individual freedoms, representative democracy, and the protection of human rights, has been influential in shaping modern Western societies. Throughout its history, liberalism has been subject to various critiques from different ideological perspectives, including conservatism, socialism, and other schools of thought. Considering these critiques and the foundational principles of liberalism, identify which of the following is not commonly considered a critique of liberalism.",security_studies,"['Liberalism is often self-contradictory, which limits its usefulness as a practical guide.', 'Liberalism fails to recognize the impact of economic interdependence on international stability.', 'It overlooks the significance of a diverse array of participants in shaping international policy decisions.', 'Liberalist ideals primarily echo Western power, which might reduce their future significance.', 'Liberalism struggles to clearly define situations where military intervention is justified or necessary.']",2
180,"In recent decades, the growing awareness of climate change, biodiversity loss, and other ecological challenges has sparked widespread debate among policymakers and the public. As nations grapple with these environmental issues, they are often discussed not only in terms of ecological sustainability but also as matters of national and global security. How have environmental issues been framed as security concerns, and what impact has this had on policy and society?",security_studies,"[""Viewing environmental issues through a national security lens has diluted the effectiveness of the environmental security concept. The emphasis on military aspects has hindered policymakers' ability to address the true nature of environmental problems and their impact on social vulnerability. Balancing environmental security with national interests and global changes is challenging without compromising state security interests."", 'By framing environmental security issues as high-priority concerns, both international and national security policymakers and organizations have become more aware of their importance. It is now widely accepted that environmental changes can be seen as significant security matters.', 'Environmental security has led to a reallocation of resources, prioritizing environmental issues over military ones. There is a strong focus on linking environmental changes to potential conflicts and addressing threats that arise from various causes, not just domestic ones.', 'The securitization of environmental issues has primarily resulted in increased public awareness and grassroots movements, which have effectively pressured governments to completely overhaul existing security policies to focus exclusively on environmental protection.', 'Environmental issues have been positioned as critical political concerns, elevating their importance among decision-makers. However, despite this increased attention, there has been minimal progress in changing policies or actions regarding what is protected under environmental security.']",4
181,"In the history of military strategy and technology, there have been significant shifts that have fundamentally altered the nature of warfare. These shifts are often driven by technological advancements, changes in doctrine, and the evolution of military tactics. Considering these factors, what is a Revolution in Military Affairs and how is it characterized?",security_studies,"['A pivotal technological innovation that changes the core nature of warfare.', 'A groundbreaking technological breakthrough, like the invention of nuclear arms.', 'A strategic reallocation of military resources to improve efficiency and effectiveness.', 'An internal military takeover that removes existing leaders from power.', 'A complete transformation in the methods and understanding of warfare.']",0
182,"In the rapidly evolving field of recent RMA (Retail Management Analytics) terminology, businesses strive to enhance their operational efficiency and customer engagement through data-driven insights. Considering the various trends and terminologies that emerge within this context, identify the phrase that is least likely to signify authenticity.",security_studies,"['Guided missile', 'Precision engagement', 'Carefully planned attack', 'Targeted strike', 'Random assault']",4
183,"In the rapidly evolving field of cyber-security, professionals must stay updated with the latest technological advancements and threat landscapes. They often engage in technical discussions that cover a wide range of topics, from encryption methods to incident response strategies. However, some concepts may not be directly related to these technical discussions. Identify the concept below that is unrelated to the technical discussions typically associated with cyber-security.",security_studies,"['Computer networks', 'Corporate networks', 'Anti-virus sector', 'Encryption algorithms', 'IT specialists']",1
184,"In the study of postcolonial theory, scholars often explore the impacts of colonialism on cultures and societies. This includes examining various forms of resistance and transformation that occur as a result of colonial dominance. Postcolonial theory identifies several types of violence that are prevalent in colonial and postcolonial contexts. Considering this framework, which of these options does not represent one of the three types of violence recognized by postcolonial theory?",security_studies,"['Cultural violence', 'Intellectual violence', 'Physical violence', 'Systemic violence', 'Pervasive violence']",4
185,"In recent decades, global challenges such as climate change, pandemics, and transnational terrorism have shifted the focus of traditional security studies, which historically emphasized state-centric and military concerns. In this changing landscape, how does the idea of 'human security' influence our perspective on the field of security studies, particularly in addressing the complex needs of individuals and communities?",security_studies,"['The idea of human security has struggled to earn recognition among scholars and policymakers in the field of security studies. There is a widespread lack of acknowledgment regarding the political and academic significance of human security as a concept.', 'Human security has become the prevailing framework for understanding modern security studies. Since the end of the Cold War, the focus on state security has been deemed obsolete, and now there is a widespread consensus that security should prioritize individuals within states.', 'Human security gained prominence in the mid-1990s, bringing attention to key issues. Especially, it has emphasized the problem of violence within states, which has become a primary focus for security studies after the Cold War.', 'Human security does not undermine the traditional state-focused view on protecting states from external military threats. However, it reveals the inadequacy of state-centric realism because it fails to address the safety of individuals within countries.', 'Human security is primarily concerned with the economic growth of nations and prioritizes the development of large-scale infrastructure projects to ensure national prosperity.']",3
186,"In recent years, there has been a growing focus on understanding the impact of prolonged academic careers on personal and professional development. Researchers have been exploring various metrics and methods to assess how long individuals remain engaged in academic settings. What methods can be used to evaluate the duration of academic institutionalization?",security_studies,"['All of these options.', 'Think tanks began focusing on specific technical issues, leading to a narrow approach and losing strategic depth, particularly as the foundational idea of deterrence became less coherent.', 'Peace research evolved on a separate path, with its critical aspects being viewed as distinct from security studies by both its advocates and those involved in security studies.', 'Strategic studies became recognized as a specialized field primarily developed in the United States and then introduced to Europe, where European approaches were seen as secondary to the established theories.', 'The rise of online learning platforms diminished the traditional role of academic institutions in strategic studies, leading to a decentralization of knowledge and a lack of standardized approaches.']",0
187,"In the world of finance, companies often seek to optimize their portfolios and increase liquidity by transforming a collection of financial assets into marketable securities. This process is crucial for banks, corporations, and financial institutions to manage risk and enhance cash flow. Considering the importance of this financial strategy, what steps are involved in transforming a collection of financial assets into marketable securities?",security_studies,"[""Securitization means moving issues from a standard political context to a more intense political level beyond usual decision-making processes. Once it's elevated above typical political considerations, it becomes a matter of state interest and cannot easily return to public debate."", 'Securitization is the process by which issues are categorized based on their economic impact. It involves analyzing market trends and financial data to determine if an issue should be elevated to a critical economic concern requiring immediate intervention.', 'An issue can be framed as a security concern when it transitions from being politicized to being securitized. In the securitization process, the actors use rhetoric to convince an audience of the urgency and importance of the issue, portraying it as an existential threat to a specific target.', 'Securitization occurs when an issue not previously part of the political agenda becomes politicized, requiring government involvement. This involves policy-making, resource distribution, and collective governance.', ""A securitizing actor can push for an issue to be considered a security concern when it lies outside the normal political realm. An existential threat can be elevated to state concern even if it hasn't yet become a public debate topic. Securitization involves acknowledging the threat before it appears in political discussions.""]",2
188,"In the realm of international relations, particularly in regions with a history of conflict and shifting alliances, weak states often find themselves in precarious positions when it comes to ensuring their security. This is especially true in areas where major powers have competing interests, leading to an environment where mistrust and the potential for escalation are high. Given these complexities, can the security dilemma faced by weak states be avoided or mitigated?",security_studies,"['The fight against terrorism, particularly the Global War on Terror, has positively influenced the state-building process by focusing global attention and resources on addressing insecurities. This includes efforts to address the various factors that contribute to terrorism, such as controlling the spread of weapons.', 'The international community has successfully addressed the issue of weak state insecurity by increasing military interventions and imposing strict sanctions, which have led to the rapid development of political and economic institutions in these states.', 'The shortcomings of liberal reforms have made alternative political structures to the state appear more viable. Sub-state entities offer practical solutions for areas plagued by chronic issues like weapon proliferation and poverty, while regional organizations provide a sustainable framework in regions like Africa and Latin America.', 'Weak states are undergoing a lengthy and challenging journey to become effective nations. As part of long-term security strategies, they have implemented measures such as establishing multiple political parties, pursuing economic liberalization, and joining the international community to mitigate adverse effects.', ""The issue of weak state insecurity hasn't been a top priority internationally, and attempts to resolve it have largely been limited to promoting liberal democracy and free-market capitalism. So far, none of the imposed neo-liberal strategies, whether through conditions, regime changes, or peace-building efforts, have successfully transformed a weak state into a strong one.""]",4
189,"In the study of international relations, different theoretical perspectives offer varying explanations for the role and development of identity among states and actors. Realism, with its focus on power and state interests, often contrasts with the more ideational approach of social constructivism. Considering these differing views, how do the perspectives of realism and social constructivism contrast in their understanding of identity in the context of international relations theory?",security_studies,"['Realism and social constructivism both prioritize the economic capabilities of a state over its identity, viewing economic power as the primary determinant of state actions in international relations.', ""Social constructivism incorporates causal theories when examining international relations and emphasizes that identity is a product of social construction. In contrast, realism views the actions of states in the international arena as following a predictable 'action-reaction' framework."", 'Social constructivists view the state as a separate entity whose actions are determined by the demands of the international environment, whereas realists see state interactions as a natural outcome of identity development.', 'Realism sees identity as a key factor in international relations, operating under the premise that identity influences how states behave.', 'Realism is founded on the principle of causation, while social constructivism focuses on identity theories rooted in shared meanings.']",4
