Unnamed: 0,question,subject,choices,answer
400,"In the late 19th and early 20th centuries, Russia underwent significant social and political changes, with the Russian Empire transitioning to the Soviet Union following the 1917 Revolution. During this period, education and literacy were focal points of Soviet policy. Given the data on literacy rates among the Russian-speaking population from 1897 to 1955, how might a historian who views Soviet communism positively interpret this information to support their perspective?",high_school_world_history,"[""The goals of the Russian Revolution were not fulfilled by Lenin's and Stalin's governments."", 'Russia has implemented communism more effectively than China.', ""Lenin and Stalin greatly enhanced Russia's military strength."", 'Although Lenin and Stalin committed wrongdoings, the Soviet government achieved notable progress.', ""The Soviet Union's economic policies were solely responsible for the increased literacy rates.""]",3
401,"In the passage above, Martin Luther discusses various criticisms of the Church's practices during the Reformation period. The Church at this time held significant power and influence over religious and secular matters across Europe. One of the key issues Luther addresses is the way the Church maintains control over the interpretation of sacred texts. Specifically, when Luther mentions the ""second wall,"" what concept or belief is he criticizing regarding the authority over interpreting the Scriptures?",high_school_world_history,"['The contrasting beliefs between Catholics and Reformers regarding the definition of ""Holy Ghost""', 'The contrasting beliefs between Catholics and Reformers on the role of saints in salvation', 'The contrasting beliefs between Catholics and Reformers on the method of performing baptisms', ""The contrasting beliefs between Catholics and Reformers about theological views on Jesus's divinity"", 'The contrasting beliefs between Catholics and Reformers on how biblical texts should be used and understood']",4
402,"During the Age of Exploration, as European powers sought to expand their influence and control over new territories, navigational challenges and the quest for maritime supremacy were at the forefront. In this era, what technological advancements directly influenced the agreement described in the treaty, which aimed to resolve territorial disputes between Spain and Portugal in the 15th century?",high_school_world_history,"['The understanding of disease transmission', 'Printing press', 'Navigational instruments', 'High-quality metal alloys', 'Firearms']",2
403,"During the period of the Industrial Revolution, when technological advancements and global trade networks were rapidly expanding and transforming societies, which factor played the smallest role in enabling European powers to dominate and exploit Africa between 1750 and 1900 C.E.?",high_school_world_history,"['The widespread use of telegraphy to communicate over long distances', 'The creation of automatic firearms', 'The introduction of steamships', 'The development of immunizations for diseases found in tropical regions', 'The rise of companies that allowed multiple investors to pool resources']",4
404,"During the mid-20th century, the world was embroiled in Cold War tensions between the United States and the Soviet Union, each vying for influence over emerging nations. The Bandung Conference of 1955 was a historic assembly where leaders from 29 Asian and African countries gathered to discuss cooperation and mutual interests in the face of colonialism and global power struggles. Indonesian leader Sukarno, in his speech, emphasized the importance of peace and unity among these nations. Like many other leaders from these regions, what challenge did Sukarno face in attempting to keep his country unaligned during these global tensions?",high_school_world_history,"['the Cuban Missile Crisis.', 'the conflicts in Vietnam.', 'the conflict on the Korean peninsula.', 'the global tension between the Western bloc and the Eastern bloc.', 'the conflict between Arab countries and Israel.']",3
405,"As the Roman Empire expanded across vast territories from the Mediterranean to the British Isles, it encountered diverse cultures and peoples, which required complex governance and military strategies. According to the author, how did the success and expansion of the Roman Empire contribute to its eventual downfall, considering these expansive challenges and the internal dynamics of the empire?",high_school_world_history,"['The leaders accumulated excessive wealth and were subsequently toppled.', 'The Roman military became the most advanced in the world.', 'Conquest and prosperity cannot coexist.', 'Decay starts the moment something begins to grow.', 'The empire expanded beyond a manageable size.']",4
406,"In the late 11th century, Europe was a place of significant religious fervor and political maneuvering. During this time, the papacy held considerable influence, and there was growing concern over the control of sacred sites. Pilgrimages were common, and the faithful often faced challenges on their journeys. In this context, the passage above reflects the historical context of which significant event, where religious and military motivations were intertwined in response to perceived threats against Christian lands and holy sites?",high_school_world_history,"['The religious movement challenging Catholic doctrines', 'The incursions of the Mongols into the lands of the Middle East', 'The consolidation of the Holy Roman Empire under Charlemagne', 'The period of European global exploration', 'The military campaigns to the Holy Land']",4
407,"During the period of significant global trade expansion, various regions were involved in the exchange of goods, such as spices, textiles, and precious metals. European nations were navigating new sea routes and establishing trade posts across Asia. Based on these trade dynamics, aside from Japan and India, which region supplied the largest amount of silver that flowed into China during this period?",high_school_world_history,"['Inner Asia', 'The European continent', 'Southeast Asia', 'The Americas', 'Southwest Asia']",3
408,"In the late 19th and early 20th centuries, Western imperialism expanded across Asia, Africa, and the Americas, driven by a variety of economic, political, and cultural motivations. Many Western powers justified their actions by claiming they were bringing civilization, religion, and progress to the regions they colonized. Given this historical context, how does the first passage challenge the widely held belief about the motivations and responsibilities of Western imperial powers?",high_school_world_history,"['That European colonizers occasionally intervened in local religious customs', 'That European colonizers were always enthusiastic about imposing their cultural beliefs on indigenous people', 'That European colonizers frequently used military force to enforce their authority on colonial subjects', 'That European colonizers prioritized financial gain', 'That European colonizers sought to integrate indigenous peoples into their political systems']",1
409,"During the period from 1450 to 1750 C.E., European powers were involved in numerous technological and cultural exchanges, such as the Columbian Exchange, which had profound impacts on societies around the world. In this context, which factor was the least significant in allowing Western European powers to establish their dominance over other regions of the world?",high_school_world_history,"['The establishment of companies with shared ownership', 'Advancements in firearms technology', 'The transfer of agricultural products between Europe and the Americas', 'The invention and use of steam-powered machinery', 'The spread of European languages to other continents']",3
410,"In the years following the establishment of the People's Republic of China in 1949, Mao Zedong sought to rapidly transform the country into a socialist society, emphasizing the collectivization of agriculture and the development of heavy industry as key components of his vision. This approach was intended to promote equality and enhance the self-sufficiency of the nation, as well as to strengthen the alliance between workers and peasants. However, historical evaluations reveal that not all outcomes aligned with the initial expectations. Considering Mao's vision of transforming agriculture and industry into a socialist model, which subsequent event would most contradict the expectation that this approach would lead to widespread rural prosperity and strengthen the worker-peasant alliance?",high_school_world_history,"[""The establishment of Special Economic Zones along China's coastline led to an economic boom in the country."", 'The creation of agricultural collectives and focus on rural steel production resulted in widespread hunger and hardship for Chinese farmers.', 'Political tensions with the Soviet Union caused China to align more closely with the United States during the Cold War.', 'The introduction of the One Child Policy in the late 20th century aimed to control population growth in China.', 'Dissenting members of the Communist Party, such as Deng Xiaoping, were purged during the Cultural Revolution.']",1
411,"During the 13th century, as various regions across Eurasia experienced significant changes due to the expansion of the Mongol Empire, what was a lasting impact on Russia as a result of the Mongol invasions?",high_school_world_history,"['Russia established a unified system of government administration.', 'Russia gained significance by becoming the focal point for Mongol governance.', 'Islam became the primary religion practiced in Russia.', 'Russia became a major center for the production and export of silk.', 'Russia was isolated from the cultural and intellectual movements of Western Europe, such as the Renaissance.']",4
412,"During a time when Europe was facing various socio-political challenges, and the Byzantine Empire was seeking assistance against the Seljuk Turks, which historical event occurred as a direct consequence of the speech given by Pope Urban II at the Council of Clermont in 1095 C.E., as recorded by Robert the Monk?",high_school_world_history,"['The initiation of the First Crusade to reclaim Jerusalem', 'The inability of Christian forces to successfully recapture the Holy Land', 'The takeover of Constantinople by Western European Christians', 'The reduction of trade through the Mediterranean Sea', 'The overwhelming victory of Byzantine troops over the Seljuk Turks']",2
413,"During the early 20th century, Russia underwent significant political and social changes, transitioning from the Russian Empire to the Soviet Union. Under the leadership of Joseph Stalin, the country embarked on a series of ambitious industrialization and modernization efforts. Stalin emphasized the need to transform the Soviet Union into a formidable industrial power to prevent the nation from being defeated due to its historical backwardness. Which historical event demonstrated the success of Stalin's push to modernize Russia, as he described overcoming the nation's history of being repeatedly defeated due to its backwardness?",high_school_world_history,"['The competition with the United States to achieve advancements in space exploration', 'The German attack on Russia in 1941', 'The conflict between Poland and the Soviet Union during the early 1920s', 'The signing of the Molotov-Ribbentrop Pact in 1939', 'The involvement of Western countries in the Russian Civil War']",1
414,"During the Anglo-Zulu War, various individuals faced complex political and personal challenges. The author, who was deeply affected by the events of the war, mentioned taking legal action against the British government. What does this suggest about his situation during the Anglo-Zulu War?",high_school_world_history,"['Assign responsibility to both his own nation and the Zulus', 'Show his disapproval of the current conflict', 'Mock the British authorities', 'Emphasize how much property the author has lost', 'Highlight the legal expertise of the author in handling disputes']",0
415,"In a world where nations are continually vying for influence amidst geopolitical tensions and economic challenges, leaders often propose various strategies to boost their countries' standing. Kwame Nkrumah, a prominent figure in African history, contributed significantly to discussions on how Africa can increase its global influence. Based on the passage by Kwame Nkrumah, how does he suggest Africa can enhance its influence and respect on the global stage, and what examples does he use to support his viewpoint?",high_school_world_history,"['Advocacy for increased economic investment in African infrastructure', ""Strong disapproval of capitalism's impact on Africa"", 'Reactions to unsuccessful attempts at African unity', ""A suggestion to elevate Africa's position in the contemporary world"", 'An appeal for the United Nations to take action in Africa']",3
416,"Kwame Nkrumah, the first Prime Minister and President of Ghana, was a leading advocate for Pan-Africanism during a time when many African nations were gaining independence from colonial rule. He believed that the newly independent states faced numerous challenges, such as economic dependency and political instability, which could be better addressed through collective effort. Why does Nkrumah believe it is essential for African countries to unite politically rather than remain divided?",high_school_world_history,"['The continent of Africa has already gone through numerous internal conflicts.', 'The international community equates power with the extent of size and influence.', 'African countries can only gain true independence if they unite.', 'A lack of unity is the reason many African countries have struggled.', 'African unity will lead to the immediate resolution of all economic issues on the continent.']",1
417,"In ancient Mesopotamia, cities often emerged near river valleys due to their fertile land and access to resources. These cities, such as Uruk, played a significant role in the development of early civilization, including the invention of writing and the construction of monumental architecture. Based on the description of Uruk in the second paragraph, what inference can be made about the characteristics or planning of ancient cities?",high_school_world_history,"['Ancient cities were primarily constructed of wood and thatch.', 'Ancient cities included spaces dedicated to the worship of their main gods.', 'Ancient cities often decorated their religious buildings in simple ways.', 'Ancient cities had designated areas for military training.', 'Ancient cities were not well-protected against invasions.']",1
418,"During the late 16th century, European powers were expanding their influence across the globe, establishing trade networks and colonies in various continents. The Portuguese, in particular, were known for their maritime explorations and the establishment of trade routes that connected Europe with Asia, Africa, and the Americas. Based on the given passage, how does the trade route described in the first paragraph illustrate a key historical trend involving Portuguese maritime activities during this period?",high_school_world_history,"['Jesuit missionary work in Japan and China', 'Involvement of Europeans in trade networks across East Asia', 'Establishment of permanent European colonies in Japan', 'The dominance of East Asian trade by Chinese traders', 'Rivalry between Dutch and Portuguese merchants over access to Japanese markets']",1
419,"During the period from 1450 to 1750 C.E., European exploration and the Age of Discovery led to increased maritime trading routes and exchanges across the world. In what ways did interactions with European traders impact Sub-Saharan African societies during this time, and why are these interactions considered significant in the context of global trade and cultural exchanges of the period?",high_school_world_history,"['Sub-Saharan Africans sought European alliances to expand their trade networks into Asia.', 'Sub-Saharan Africans depended on European merchants to boost their population by continually bringing in food crops from the Americas.', 'Sub-Saharan Africans partnered with European nations to remove Muslim and Arab trading leaders who threatened their autonomy.', 'Sub-Saharan Africans relied on European traders as the exclusive buyers of enslaved people.', 'Sub-Saharan Africans strengthened new political entities by exchanging goods with Europeans for weapons.']",4
420,"In various cultures, intoxicants like wine and practices such as gambling have been subjects of debate and differing viewpoints. Some ancient texts provide guidance on these matters that reflect the values and norms of their time. Consider the two excerpts: one advises believers to avoid intoxicants and gambling as negative influences, while the other suggests enjoying wine during a specific time. What do these excerpts primarily address in terms of their themes or messages?",high_school_world_history,"['Cultural expressions and artistic achievements in Islamic history.', 'Evolving roles of men and women in Islamic culture.', 'Fundamental economic activities in Islamic culture.', 'Creation and consumption of food and beverages in Islamic culture.', 'Spiritual guidelines for individual conduct in Islamic culture.']",4
421,"In the wake of significant political upheavals and shifts in governance structures during the late 18th century, various leaders emerged to shape the foundational documents that would guide future governmental systems. With this context in mind, and considering the influences of Enlightenment thinkers as well as the socio-political challenges of the time, who played the key role in establishing the constitutional frameworks mentioned in the provided sources?",high_school_world_history,"['Uprisings led by local elites in Latin American regions', 'Indigenous people collaborating with local leaders to establish governing documents', 'Colonial rulers setting up their colonies for self-rule', 'Nationalist movements promoting the idea of uniting the Americas', 'Influences from European democratic revolutions inspiring new government structures']",0
422,"During the 19th century, European powers were heavily involved in expanding their empires through colonization, driven by economic interests, the desire for new markets, and a belief in cultural superiority. This period saw significant advancements in technology and transportation, which facilitated greater exploration and exploitation of distant lands. The excerpts provided reflect the attitudes and policies of colonial powers in the 19th century. In what historical context are these statements situated, particularly in relation to the control and influence over colonized regions?",high_school_world_history,"['Deployment of armed forces from colonial regions', 'Endorsement of forced labor in foreign territories', 'Promotion of Western religious conversions in occupied lands', 'Establishment of trade monopolies in colonized regions', 'Implementation of colonial authority over indigenous populations']",4
423,"In the poem ""Ballad of the Army Carts"" by Du Fu, which vividly depicts the hardships faced by conscripted soldiers and the emotional toll on their families during the height of the Tang dynasty's military campaigns, what significant factor contributed to the eventual decline of the later Tang dynasty as depicted in the text?",high_school_world_history,"['A bureaucracy that lacks effectiveness and leadership that is inadequate', 'Invasion by foreign forces into the central regions of the Tang Empire', 'Increased trade with neighboring states leading to economic instability', ""The rise of Buddhism and Taoism in response to the state's promotion of Confucianism"", 'Peasant dissatisfaction due to heavy taxes']",4
424,"During the height of the Mughal Empire, Northern India experienced significant socio-economic transformations under the rule of emperors like Akbar, who was known for his administrative reforms and promotion of a centralized government structure. According to W.H. Moreland's account, the relationship between the Mughal Empire and its regional leaders in Northern India involved complex dynamics of revenue collection and authority. How does this illustrate the nature of political control and autonomy within the empire during this period, considering the backdrop of these administrative changes and the diverse cultural landscape of the region?",high_school_world_history,"['The situation in Rajputana was representative of the norm throughout the Mughal Empire.', 'Only individuals adhering to specific faiths were obligated to contribute revenue to the empire.', 'Revenue collection practices were uniform across all regions of the Mughal Empire.', 'Regional variations could have impacted which groups were responsible for paying taxes.', 'Collecting revenue was the exclusive means by which the Mughal Empire was financed.']",3
425,"The late 19th century and early 20th century were periods of significant global migration, influenced by industrialization, economic opportunities, and political changes. During this time, countries like Australia and the United States implemented policies that reflected their prevailing social and economic attitudes toward immigrants. Given this historical backdrop, how do the Immigration Restriction Act of 1901 in Australia and the Chinese Exclusion Act of 1882 in the United States illustrate a broader pattern of social or economic attitudes toward immigration during the 19th century?",high_school_world_history,"['Increasing interest in recruiting skilled foreign workers', 'Protectionist trade policies', 'The emergence of anti-Jewish beliefs', 'Intensification of opposition to immigration', 'Expansion of colonial empires in Africa']",3
426,"During the 1200s to 1400s, both Europe and China were undergoing significant social and technological transformations. In Europe, the feudal system was giving way to more centralized forms of governance, while in China, the Yuan and then Ming dynasties were in power, emphasizing different military strategies and technological advancements. How does the information in the passage contradict the conventional understanding of how gunpowder weaponry developed differently in Europe and China during this period?",high_school_world_history,"['That early gunpowder weapons were primarily developed in the Americas and later adopted by Eurasian civilizations', ""That Europe's rise in global dominance was due to China's disregard for technological advancements"", ""That China's authoritarian governance stifled military and technological progress"", 'That China has always lacked technological advancement compared to other Afro-Eurasian civilizations', ""That China's development was blocked by religious extremism when trying to modernize""]",1
427,"During the early 16th century, European exploration and expansion were at their peak, characterized by a series of maritime expeditions and the establishment of trade networks across various continents. In this era, the Kingdom of Kongo, located in Central Africa, engaged in significant interactions with European powers, particularly Portugal. Based on the content of the letters, which historical circumstances best explain the nature of the exchanges between the Kingdom of Kongo and Portugal during this period?",high_school_world_history,"['Portuguese voyages along the West African coastline', 'Efforts to spread Catholicism in regions south of the Sahara', 'Growth of the slave trade in Sub-Saharan Africa', 'Competition for trade routes in the Indian Ocean', 'The process of forming political structures in Sub-Saharan Africa']",2
428,"During the tumultuous period of early 20th century Russia, marked by widespread social unrest, economic difficulties, and the strains of World War I, considering the context provided by Source 1, which events or circumstances best explain the reasons behind Tsar Nicholas II's decision to abdicate his throne?",high_school_world_history,"[""General disapproval of Nicholas' acceptance of political opponents"", 'Influence of Western political ideologies on Russian governance', 'Harassment of ethnic and religious groups', 'Economic success that led to animosity toward the nobility', 'Significant defeats in the war and dissatisfaction among laborers']",4
429,"During the period of European exploration and colonization, many countries were involved in extensive trade networks and sought new resources to fuel their economies. In this context, how did the output of the mines described in the passage impact global economic systems between 1450 and 1750 C.E.?",high_school_world_history,"[""The Spanish Hapsburgs' ability to engage in numerous military conflicts worldwide"", 'A reduction in the financial support for religious endeavors by the Spanish rulers', 'The establishment of new trade routes across the Pacific Ocean', 'The rise of a thriving business class in Spain', 'A reduction in the number of exploration trips conducted by the Spanish']",0
