Unnamed: 0,question,subject,choices,answer
0,"A commuter, who works as a graphic designer and often travels via subway to reach his office located in the bustling downtown area, boarded a subway train at the downtown station. Finding no empty seats, he opted to stand and held onto a pole for stability. During the ride, he noticed another passenger, a woman standing nearby, who appeared to be engrossed in a book about modern architecture. When the train, which was known for its occasional abrupt stops due to ongoing track maintenance, came to a sudden halt, the commuter briefly lost his footing. Instinctively, he put his arms around the woman to steady himself. After regaining his balance, he apologized, released her, and resumed holding the pole. In a lawsuit filed by the woman against the commuter, what is the likely legal outcome for the commuter's actions?",professional_law,"['not responsible, because what the rider did was considered acceptable behavior given the circumstances.', 'responsible, because the rider thought the girl agreed to the contact given the situation.', 'responsible for committing a battery.', 'not responsible, because the girl did not suffer any harm from the contact.', 'responsible, because the rider did not apologize immediately after the incident.']",0
1,"A mother brought her young child to the hospital emergency room for treatment after the child had fallen from a playground slide and suffered a minor fracture. The hospital was renowned for its pediatric care and had been recommended by several friends. During the treatment, while the child was alone with the attending doctor because the mother had stepped out temporarily to answer a phone call, the doctor engaged in inappropriate conduct with the child. Two weeks later, after the family had celebrated the child's birthday, the child revealed the incident to her mother, causing the mother to experience intense emotional distress and physical illness. The mother, who had taken time off work to deal with her emotional turmoil, is considering legal action. If the mother files a lawsuit against the doctor for the intentional infliction of emotional distress, is she likely to succeed in her claim?",professional_law,"[""No, because the mother was neither directly affected by the doctor's actions nor did she witness them happen."", ""Yes, because the mother's emotional suffering was a predictable result of the doctor's behavior."", ""Yes, because the doctor's actions were extremely inappropriate."", 'No, because the mother was at fault for leaving the child alone with the doctor during treatment.', 'Yes, because the doctor breached the standard of care owed to the child.']",0
2,"A property owner, who enjoyed spending weekends at their rustic cabin on a hill near a serene lake, found it inconvenient to reach the cabin due to rough terrain. To make it easier to reach the cabin, the owner made a deal with a neighbor who owned the adjacent land. The neighbor, who had been living there for over 20 years and enjoyed gardening, gave the property owner, in writing, permission to use a 30-foot-wide and quarter-mile-long strip of land along the edge of the neighbor's property. The property owner paved the strip with asphalt to improve vehicle access without telling the neighbor, who was busy expanding their garden. Years later, the neighbor started a delivery business requiring heavy transport, which damaged the asphalt. Ten years after the business started, the property owner sold the cabin to an artist who loved painting landscapes. When the artist moved in, the neighbor blocked the road with wooden barriers, cutting off access to the artist's cabin. What kind of interest did the property owner originally have in the road when the agreement was made with the neighbor?",professional_law,"['an easement that arises out of necessity.', 'an easement established by historical use.', 'an easement explicitly granted in writing.', 'a personal easement.', 'an easement by prescription.']",2
3,"A plaintiff, who is a resident of California, is filing a lawsuit against a defendant who operates a business in Texas. They are filing this lawsuit in their home state's court, arguing that the defendant has violated a federal law that governs consumer protection. The federal law in question is relatively new and has not yet been interpreted by any federal courts. Interestingly, a state law in California also provides a similar claim for consumer protection, but the plaintiff has chosen to base their lawsuit solely on the federal law. This federal law allows claims to be filed in any appropriate court. Given these circumstances, is it appropriate for the California state court to take on the case?",professional_law,"['No, because state courts should wait for a federal court ruling on federal law issues before hearing such cases.', 'No, because the plaintiff must first seek administrative remedies before approaching any court.', 'Yes, because state courts are required to treat federal law cases the same as any other cases.', 'No, because federal law cases are exclusively within the jurisdiction of federal courts.', 'Yes, because the lack of different state citizenships prevents the case from being heard in federal court.']",2
4,"A business owner, who recently expanded his enterprise by opening two new branches and was featured in a local business magazine for his innovative practices, received a letter from a rival. The letter accused him of being highly incompetent in his profession and labeled him as one of the worst business owners locally. Despite having a supportive family and a loyal customer base, the letter was only seen by the business owner, who kept it hidden and never showed it to anyone else. If the business owner decides to file a lawsuit against the rival for defamation because of this letter, is it likely that the court will dismiss the case? Explain based on the principles of common law defamation.",professional_law,"['Yes, it will dismiss because the letter was only seen by the manager and not shared with others.', 'Yes, it will dismiss because the letter constitutes fair comment and is protected under free speech.', 'No, it will not dismiss since all the necessary elements to prove defamation are present in this situation.', 'No, it will not dismiss because the plaintiff has an unconditional right to have a jury determine the outcome in a defamation case.', ""Yes, it will dismiss because the wording does not harm the manager's reputation.""]",0
5,"
A seller, who inherited a charming Victorian house from their grandparents, agreed to sell this property to a buyer for $300,000. The agreement, signed at a local coffee shop known for its artisanal brews, stated that the transaction would finalize 60 days after signing. The seller, who was eager to move to a coastal town for a quieter life, promised to provide a ""marketable title"" through a quitclaim deed at the closing. There were no additional terms about the title in the contract. Upon investigation, it was discovered that the property was encumbered by an unpaid $50,000 mortgage and a right-of-way easement, which had been in place since the property was first built. The buyer, who had envisioned starting a small bed-and-breakfast, argues that this makes the title unmarketable and refuses to complete the purchase. Is the buyer justified in this refusal?
",professional_law,"['No, because the purchaser agreed to accept a quitclaim deed.', 'No, because there is nothing in these circumstances that would make the title defective.', 'Yes, because the existing mortgage makes the title defective.', 'Yes, because the use of a quitclaim deed inherently makes the title unmarketable.', 'Yes, because the presence of the right-of-way easement makes the title defective.']",4
6,"In a bustling city neighborhood known for its heavy pedestrian traffic and multiple crosswalks, a lawsuit arises involving injuries sustained by a pedestrian struck by a car. The pedestrian claims he was hit while using a crosswalk, a common practice encouraged by local safety campaigns, while the driver argues the pedestrian ran into the street away from the crosswalk. The driver, who had just left a nearby coffee shop after a long day of work, wants to use testimony from a local resident who often sees the pedestrian crossing outside crosswalks. How likely is it that this testimony will be admitted in court to support the driver's claim?",professional_law,"[""accepted, because it demonstrates that the defendant had prior knowledge of the plaintiff's behavior."", ""accepted, as it indicates the plaintiff's negligence."", ""not allowed, because her statement is not permissible as it attempts to use character evidence to infer the plaintiff's actions on this specific occasion."", ""accepted, since it provides evidence of the plaintiff's routine behavior of crossing outside the crosswalk."", 'not allowed, because the neighbor did not witness the event in question.']",3
7,"During a high-profile art exhibition in a bustling city, a renowned painting was stolen in a daring heist. The following week, the getaway driver, caught for speeding in a neighboring town, confessed to the police about his involvement in the art theft. He revealed that he had not received any payment for the stolen painting; instead, the payment was given to his two accomplices, who were known art thieves with a history of similar crimes. Can this confession be used as evidence against the accomplices during their trial for the theft of the painting?",professional_law,"[""Yes, because it's a statement made by one of the people involved against themselves."", 'Yes, because it negatively impacts the interests of the other people on trial.', ""No, because the statement doesn't relate to the execution or promotion of the theft, making it inadmissible hearsay."", 'No, because the statement was not made under oath, which makes it unreliable.', 'No, since it was said while he was detained, which makes it questionable.']",2
8,"A baseball enthusiast was excited to attend a game at the newly renovated local stadium, which had recently hosted a famous international match. He called the stadium's ticket office and learned that tickets would go on sale there at 9:00 a.m. the next day. Since he worked as a bricklayer on a prestigious construction project that required his presence, he couldn't leave work to buy the tickets himself. He asked his neighbor, who was an avid baseball fan and also wanted to buy tickets, if he could go to the stadium and purchase the tickets for him. The neighbor agreed, but mentioned his car was broken due to an incident during a recent road trip. The fan, who had just serviced his car for optimal performance, offered to lend it to the neighbor, and the neighbor accepted. The next morning, the fan handed his car keys and cash for the tickets to the neighbor. The neighbor drove the fan's car to the stadium, purchased both sets of tickets, and was supposed to return the car afterward. However, the neighbor decided to visit a friend 120 miles away, who had recently moved to the area and was hosting a housewarming party. On this unplanned trip, another car hit him, severely damaging the fan's car, with repair costs exceeding the car's value. If the fan sues the neighbor for damages from the accident, what is the likely outcome of the case?",professional_law,"['recover the cost of the baseball tickets as compensation for the inconvenience caused by the accident.', ""be awarded the car's market value."", 'recover damages, because the neighbor was driving the car carelessly when the accident happened.', 'receive no compensation, because the neighbor was engaged in a shared venture at the time of the incident.', 'be awarded the cost of fixing the car.']",1
9,"An indigent defendant, who has recently lost his job and is struggling to support his family, was arrested for possessing less than one ounce of marijuana. This is classified as a misdemeanor under state law, with a potential penalty of up to one year in jail and/or a $500 fine. During his trial, the courtroom was filled with spectators, including members of the press, and the defendant, who could not afford legal representation, asked for a court-appointed attorney. Despite the presence of local media, the judge denied this request. If the defendant is convicted, what is the harshest penalty that can be imposed on him without violating constitutional rights?",professional_law,"['A half-year incarceration.', 'A twelve-month imprisonment.', ""No penalty, due to the violation of the defendant's right to legal representation."", 'A suspended sentence with mandatory community service.', 'A monetary penalty of $500.']",4
10,"In a personal injury lawsuit following a car accident on a rainy evening when visibility was poor, the defendant's medical expert, who has over 20 years of experience in orthopedic evaluation, evaluated the plaintiff and examined historical medical records. The expert testified that the plaintiff's injuries were not caused by the accident because previous medical records indicated a chronic condition. The jury, considering all evidence, awarded the plaintiff nominal damages. During the trial, the plaintiff's attorney had thoroughly cross-examined the defendant's expert but later contested the admissibility of the expert's testimony. The plaintiff claimed it was hearsay since it relied on records from other doctors who could not be cross-examined. According to the Federal Rules of Evidence, how should the court rule on this issue?",professional_law,"[""Statements about the plaintiff's health condition before the incident are not relevant, making the statements unacceptable as evidence."", 'The Federal Rules of Evidence permit the inclusion of hearsay if the statements were intended for medical assessment or care.', ""Medical evidence that pertains to the case's issues is always permissible in the defendant's favor because it is deemed consistently trustworthy."", 'Expert witnesses are allowed to present hearsay evidence if it forms the basis of their professional opinion, and the jury can decide its credibility.', 'The statements are hearsay and cannot be used because there is a constitutional right to question the doctors who authored the earlier records.']",1
11,"A seller has entered into a contract to deliver a large shipment of goods to a buyer. Due to an unforeseen natural disaster, the seller's primary manufacturing facility was severely damaged, leading to a significant delay in production. As a result, the seller claims that it is now difficult to fulfill the sales contract. Which statement about the termination of a contract due to impracticability is incorrect?",professional_law,"['Not excusing performance would lead to a significant unfairness.', 'The parties must have expressly agreed that impracticability would discharge the duty.', 'The issue must not have been caused by the party trying to use this defense.', 'An increase in cost is enough to cancel the contract.', 'The impracticality must relate to a fundamental assumption of the contract.']",3
12,"A driver, who was an avid cyclist and participated in local racing events, was hurt in a car accident and went to the hospital for treatment. While there, a traction device was used to support his injured leg. The driver had been looking forward to an upcoming cycling marathon, which he had been training for months, but now faced a setback due to his injuries. Unfortunately, the traction device had a design flaw due to a missing safety feature, and the driver's leg was injured further when it fell out of the stirrup. If the driver decides to sue the company that made the traction device, what is the most likely outcome of his claim against the manufacturer?",professional_law,"['win, because the stirrup failed during regular operation of the traction equipment.', ""lose, because the hospital was responsible for ensuring the safety of the equipment during the driver's treatment."", 'win, because lacking a safety latch rendered the traction device faulty.', 'lose, because the traction device was no longer overseen by the manufacturer.', 'lose, if the doctor did not correctly secure the stirrup when setting up the traction equipment.']",2
13,"A homeowner, who recently purchased an old Victorian house in a neighborhood known for its unpredictable weather, approached a well-regarded local roofer and said, ""I have a leaky roof and suspect the tiles are cracked. I'll pay you $5,000 if you replace them with new ones."" The homeowner had previously experienced multiple issues with the house, including plumbing and electrical problems, and was eager to resolve the roofing issue before the upcoming storm season. The roofer, who had a reputation for being extremely busy but reliable, replied, ""Okay, if I can find time in my busy schedule."" The homeowner responded, ""That's fine, but please let me know soon."" Three days later, the roofer arrived at the homeowner's property with the necessary materials and tools to start the roofing work. Upon seeing this, the homeowner, who had just attended a DIY workshop and felt confident in their ability to repair the roof, rushed out and shouted, ""Stop! I've changed my mind. I'll fix the roof myself."" Considering all these details, in a lawsuit by the roofer against the homeowner for breach of contract, what would be the roofer's strongest argument for recovery?",professional_law,"[""The homeowner's offer suggested a unilateral contract, and the roofer showed his intention to accept the offer by starting the work and unloading the supplies and tools at the homeowner's property."", 'A bilateral contract was established when the roofer bought the supplies and tools necessary to complete the work.', 'A bilateral contract was established when the roofer responded, ""Sure, if I can clear my busy schedule.""', ""The homeowner's offer suggested a unilateral contract, which became non-cancellable once the roofer acquired the supplies and tools for the job."", ""The roofer is entitled to recover under the doctrine of promissory estoppel because the homeowner's promise induced the roofer to take action.""]",0
14,"A man owned a 10-acre quarry that had been in his family for generations, and he was known for his meticulous record-keeping and attention to detail. One sunny afternoon, he decided to give a deed to a friend, instructing the friend to deliver it to his niece, who had always shown interest in the family's land and had recently completed a degree in environmental science. The niece was traveling abroad, exploring sustainable mining practices, and was unaware of the deed. The friend, who had been a trusted confidant for many years, recorded the deed officially the following week, noting the man's wishes in his personal diary. After the man passed away a month later, his will, which had been drafted several years ago, left the quarry to his daughter, who had no interest in the quarry business and was pursuing a career in law. Upon returning, the niece claims ownership of the quarry, leading to a legal dispute that captured the attention of the local community, who had mixed opinions about the rightful ownership. The court ruled that the quarry belongs to the niece. What legal principle is most likely the reason for this decision?",professional_law,"['The deed was filed before the will took effect.', ""The niece's return from Africa was necessary for the gift to be effective."", 'The transfer was valid when the widower gave the deed to his friend.', 'The transfer was valid when the friend officially registered the deed.', 'The gift was effective because it was made in anticipation of death.']",2
15,"In the context of criminal law, solicitation is an inchoate offense that involves urging or requesting another person to engage in illegal conduct. This offense is distinct from attempt and conspiracy, as it focuses on the act of convincing someone else to commit a crime, rather than directly participating in the crime itself. Considering these distinctions, which of the following is not a characteristic of the offense of solicitation in criminal law?",professional_law,"['It consists of urging someone else to carry out a serious crime.', 'The mere act of asking someone is sufficient for the crime to take place.', 'Generally, taking back the request is not considered a valid defense.', 'Solicitation requires the completion of the crime solicited.', 'It involves a mutual agreement between parties to carry out a criminal act.']",4
16,"In a small town known for its historic riverfront, a local festival draws crowds each year. Amidst the festivities, the riverside warehouse stood as a quiet sentinel, housing various goods. Two individuals were informed by the defendant, a former employee of a medical equipment company, that this warehouse was being used to store defibrillators. The company had recently upgraded their inventory system, and the defendant, disgruntled after a recent layoff, shared this information with them. One night, under the cover of the festival's fireworks, they broke into the warehouse and began loading crates of defibrillators onto their vehicle. As they left, one accidentally dropped a lit cigarette onto a pile of old cardboard and paper. Despite having the chance to extinguish the resulting small fire without risk, they chose to escape instead. The fire rapidly spread, destroying the entire warehouse. If the defendant faces charges as an accomplice, is he likely to be found liable?",professional_law,"['someone who knowingly aided or encouraged the crime.', 'not responsible.', 'someone who accidentally became involved without any prior knowledge of the crime.', 'someone who helped plan the crime but was not present at the scene.', 'someone who was present at the crime scene and assisted in its commission.']",1
17,"In 1972, a person was working for a small-town newspaper that had been struggling financially. To boost its revenue, the newspaper started accepting various types of advertisements. One such advertisement provided details on how to obtain an abortion in a different state and offered guidance on finding a service that could assist. The local law at the time criminalized the distribution of information related to abortion services. The person was found guilty of distributing these paid advertisements. Considering the legal environment and the First Amendment rights, will the courts validate the conviction?",professional_law,"[""No, the statute infringes upon the Sixth Amendment's protection of privacy rights."", ""No, the statute infringes upon the First Amendment's protection of commercial speech."", ""Yes, the right to terminate a pregnancy doesn't extend to advertising where services are available."", 'Yes, there is no entitlement to distribute or promote speech that is of a commercial nature.', ""No, the statute violates the Fourteenth Amendment's equal protection clause.""]",1
18,"In the early 2000s, an environmentalist, deeply concerned about the rapid deforestation and loss of biodiversity, decided to make a lasting impact by transferring ownership of a large, untouched forest to the state. This forest, home to several endangered species and ancient trees, has been the subject of numerous studies and documentaries highlighting its ecological importance. With the condition that if any part of the forest is ever used for commercial activities or changed from its natural state (except for recreational, scientific, or educational uses), the environmentalist or their successors have the right to reclaim the property. How would you best describe the state's interest in this land?",professional_law,"['complete ownership that ends automatically upon a specified event', 'ownership that automatically transfers to a third party if a condition is met', 'a temporary right to possess and use land that reverts to the grantor after a set period of time', ""the right to use someone else's land for a specific purpose"", ""complete ownership that can be terminated at the grantor's discretion if a condition is violated""]",4
19,"After a long day of reviewing multiple bids from various contractors, the homeowner decided to take a break and think over the offers. In the midst of a busy real estate market, where prices can fluctuate frequently, the contractor proposed several prices for building a new house, including an offer of $100,000. Which of the following actions would allow the homeowner to still accept that specific offer later on, without it being invalidated?",professional_law,"['The home owner asks for more details about the construction timeline.', 'The contractor informs the home owner that the offer is no longer available.', 'The home owner responds, ""I agree to your offer but the price must be $97,000 instead.""', 'The home owner inquires if the contractor would consider building the house for $95,000.', ""The contractor passes away prior to the home owner accepting, but the contractor's son plans to continue the business.""]",3
