Unnamed: 0,question,subject,choices,answer
0,一名乘客在42街站进入地铁车厢。因为所有座位都被占用了，乘客站在地铁车厢里抓住了一根扶杆以保持平衡。当地铁车厢向市区方向行驶时，乘客瞥了一眼站在他旁边的女孩。突然，地铁车厢意外地停了下来。乘客一时失去平衡，为了避免摔倒，他抓住了女孩的腰。在乘客恢复平衡后，他把手从女孩的腰上移开，再次抓住扶杆。在女孩对乘客提起的民事诉讼中，他最有可能被判定为,professional_law,"['对电池负责。', '负责，因为乘客认为女孩在这种情况下同意接触。', '不负责，因为乘客的行为在这种情况下被认为是可以接受的。', '不负责，因为女孩没有因为接触而受到任何伤害。', '负责，因为乘客在事件发生后没有立即道歉。']",2
1,一位母亲带着她五岁的孩子去医院急诊室接受治疗。医院的一名医生在为孩子治疗时对她进行了性骚扰。当时，治疗室里除了医生和孩子外没有其他人；母亲离开房间去买咖啡了。两周后，当孩子告诉母亲在治疗室里发生的事情时，母亲遭受了严重的情绪困扰，导致身体不适。在母亲以自己的名义对医生提起的故意造成情绪困扰的诉讼中，母亲是否可能获胜？,professional_law,"['否，因为母亲在治疗期间将孩子单独留给医生存在过失。', '否，因为母亲既没有直接受到医生行为的影响，也没有目睹这些行为的发生。', '是，因为医生的行为极其不当。', '是，因为母亲的情绪痛苦是医生行为的可预测结果。', '是，因为医生违反了对孩子应尽的护理标准。']",1
2,一位婚礼策划人在湖边拥有一座夏季小屋。为了便于进入位于湖上山丘上的小屋，婚礼策划人与邻居（一位毗邻土地的所有者）达成了一项协议，根据该协议，邻居以书面形式授予婚礼策划人在邻居财产东侧边缘一条宽30英尺、长四分之一英里的土地通行权。在未通知邻居的情况下，婚礼策划人按照他的计划将道路铺上沥青，以便更方便机动车通行。几年后，邻居开始了一项沙子生意，这需要进行重型运输，随后破坏了道路上的沥青表面。邻居开始他的沙子生意十年后，婚礼策划人将他的湖滨物业卖给了一位艺术家。艺术家接管小屋和财产后不久，邻居在道路上竖起了木制屏障，从而阻碍了艺术家进入其财产。婚礼策划人在通道路上获得的权益最好描述为,professional_law,"['个人地役权。', '通过历史使用确立的地役权。', '因必要而产生的地役权。', '以书面形式明确授予的地役权。', '通过习惯取得的地役权。']",3
3,原告在双方居住的州法院起诉了被告。原告仅指控根据一项联邦法规提起的诉讼事由，尽管州法律提供了类似的诉讼事由。该联邦法规规定，依据该法规的诉求可以在任何有管辖权的法院提出。该法规尚未被任何联邦法院解释。州法院是否应该审理此案？,professional_law,"['不，因为联邦法律案件专属于联邦法院的管辖范围。', '不，因为州法院在审理此类案件之前应等待联邦法院对联邦法律问题的裁定。', '是，因为州法院有义务将联邦法律案件与其他案件同等对待。', '是，因为缺乏不同的州公民身份阻止了联邦法院审理此案。', '不，因为原告必须首先寻求行政补救措施，然后才能向任何法院提起诉讼。']",2
4,一位经理的竞争对手寄了一封诽谤信给他，指责他专业无能，并称他是镇上最差的商人之一。这封信是寄给经理的。他读了信，把它放在一个私人抽屉里，并没有再读。后来，他试图因为这封信而起诉竞争对手诽谤。法院是否可能批准被告的驳回动议，并以何种理由？请根据普通法对诽谤的定义作答。,professional_law,"['是的，它会驳回，因为信件只有经理看到，并没有与他人分享。', '是的，它会驳回，因为措辞并没有损害经理的声誉。', '不，它不会驳回，因为在这种情况下证明诽谤的所有必要元素都存在。', '不，它不会驳回，因为原告有无条件的权利来让陪审团决定诽谤案的结果。', '是的，它会驳回，因为这封信构成公平评论，并受到言论自由的保护。']",0
5,卖方与买方签订以30万美元出售土地的合同。合同规定成交将在签署合同后60天内进行，并且卖方将通过契据在成交时向买方转让“可销售的产权”。合同中没有其他关于提供给买方的产权的条款。产权调查显示，该土地有一笔未偿还的5万美元抵押和一部分土地的通行权地役权。买方现在声称产权不可销售并拒绝成交。买方的说法正确吗？,professional_law,"['不正确，因为在这些情况下没有什么会导致产权有缺陷。', '不正确，因为买方同意接受契据。', '正确，因为通行权地役权的存在使得产权有缺陷。', '正确，因为现有的抵押使得产权有缺陷。', '正确，因为使用契据本身使得产权不可销售。']",2
6,一名原告因被被告的汽车撞伤而起诉被告。在审判中，原告作证说，当被告的车撞到他时，他正在人行横道内过马路。此行为发生在一个有法律规定所有司机必须停车并允许行人在指定人行横道过马路的管辖区。被告声称原告是在人行横道外跑进马路的。此外，被告作证说，当他看到原告突然跑进马路时，他立即刹车，但未能及时停车以避免撞到他。为了支持被告的证词，被告请一位邻居作证，她声称在她住在那条街的几年中经常观察到原告，并且原告“总是在人行横道外过马路。”邻居的证词可能会,professional_law,"['被接受，因为这表明原告的过失。', '被接受，因为它提供了原告常常在横道外过马路的例行行为的证据。', '不被允许，因为邻居没有目击事件本身。', '不被允许，因为她的陈述不允许用来推断原告在这次事件中的行为。', '被接受，因为这表明被告事先知道原告的行为。']",1
7,几个人一起从一个艺术博物馆盗走了一幅画。其中一个是司机，他在实施另一项犯罪时被抓住。他告诉警方：“我甚至没有从艺术博物馆得到任何钱。钱都给了第一个人和第二个人。”当第一个人和第二个人因盗窃艺术画作而受审时，司机的陈述在法庭上是否可采纳？,professional_law,"['是的，因为这是参与者之一自证其罪的陈述。', '是的，因为这对其他被审判的人产生了负面影响。', '不，因为这是在他被拘留时说的，这使其值得怀疑。', '不，因为该陈述与盗窃的执行或推进无关，因此属于不可采纳的传闻证据。', '不，因为该陈述不是在宣誓下作出的，这使其不可靠。']",3
8,一个狂热的棒球迷想购买即将在当地体育场举行的棒球比赛门票。他联系了体育场的售票处，售票处建议他所有门票将在次日上午9:00在体育场开始销售。这位粉丝是一名砖瓦工，他意识到自己不能离开工作去买票。因此，他打电话给隔壁邻居，问他是否有兴趣去体育场购买棒球票。邻居告诉这位粉丝，他很乐意为他购买门票，并且他（邻居）也想为自己买票。然而，邻居说他的车坏了，没有交通工具去体育场。粉丝建议他可以把车借给邻居。邻居同意了，第二天早上两人在粉丝家门前见面。粉丝把车钥匙和购买棒球票的钱给了邻居。之后，邻居开着粉丝的车去了体育场，为粉丝买了票，并用自己的钱也买了一套票。粉丝指示邻居在去体育场后将车送回他家。然而，在离开体育场后，邻居决定去一个距离他家120英里的城镇拜访朋友。当邻居朝城镇行驶时，一辆汽车撞上了他，导致粉丝的车严重受损。修理这辆车的费用被判定超过了汽车的零售价。在粉丝起诉邻居以追讨事故造成的损害赔偿的诉讼中，粉丝最有可能,professional_law,"['不会得到任何赔偿，因为事发时邻居正在进行共同冒险。', '获得修车费用的赔偿。', '获得汽车的市场价值赔偿。', '获得赔偿，因为事故发生时邻居开车不小心。', '获得棒球票的费用作为事故造成的不便的赔偿。']",2
9,一名被告是贫困者，被逮捕并被指控持有少于一盎司的大麻。根据相关州法律，持有少于一盎司的大麻是轻罪，最高可判处一年监禁和/或500美元罚款。在审判时，被告不认罪并要求为其指定一名律师。审判法官拒绝了被告的律师请求。如果被告随后被判有罪，以下哪种是可以依法施加的最严厉的刑罚？,professional_law,"['500美元的罚款。', '半年监禁。', '十二个月监禁。', '由于违反被告的辩护权，不予处罚。', '缓刑并强制社区服务。']",0
10,一名在事故中受伤的司机因其损害而起诉过失的另一司机。辩方医学专家进行了独立医学检查并审查了所有医疗记录。该专家作证称，事故并没有导致伤害，因为医疗记录证明了长期的既往治疗相同症状的历史。陪审团作出了对原告有利的裁决，但仅判给了10美元的赔偿。在审后动议中，原告辩称专家证词是不可接受的传闻证据，因为他是基于之前治疗医生的记录，而这些医生无法进行交叉质询。根据联邦证据规则，正确的裁定是什么？,professional_law,"['关于原告在事件前健康状况的陈述不相关，因此这些陈述不可作为证据。', '联邦证据规则允许包含传闻证据，如果这些陈述是为了医疗评估或护理的目的。', '涉及案件问题的医学证据总是可以被允许对被告有利，因为其被认为是一贯可信的。', '这些陈述是传闻证据，不能使用，因为宪法赋予质询撰写早期记录的医生的权利。', '如果传闻证据构成专家意见的基础，专家证人可以提出传闻证据，并由陪审团决定其可信度。']",1
11,卖方声称发生了一种情况，使得履行销售合同变得不切实际。以下关于因不切实际而解除合同的说法哪一项不正确？,professional_law,"['问题不应由试图使用此抗辩的当事方引起。', '成本增加足以取消合同。', '不豁免履行将导致显著的不公平。', '不切实际必须与合同的基本假设有关。', '双方必须明确同意不切实际将解除义务。']",1
12,周五晚上，一名司机在他的车辆被一名身份不明的司机刮擦后在一次汽车事故中受伤。事故发生后，司机被送往医院接受治疗。在医院期间，司机被诊断为背部骨折。他被打上了石膏，并置于牵引状态。司机的医生组装了牵引装置，并将司机的左腿以40度角置于悬空的马镫中。医生指示司机平躺在床上。周六早晨早餐后，司机向护士请求便盆。当她把便盆放在司机的身体下面时，支撑他腿的马镫断裂了。这导致司机的腿撞到了床边的金属框架上，导致他的胫骨骨折。牵引装置有缺陷，因为制造商没有在马镫装置上安装一个安全锁，以防止它如果没有牢固固定在适当位置时掉落。如果司机对制造商提出索赔，他很可能,professional_law,"['胜诉，因为马镫在牵引设备的常规操作中失效。', '胜诉，因为缺少安全锁使牵引装置存在缺陷。', '败诉，因为牵引装置不再由制造商监管。', '败诉，如果医生在设置牵引设备时没有正确固定马镫。', '败诉，因为医院有责任确保司机治疗期间设备的安全。']",1
13,一个房主对一个屋顶工说：“我的屋顶漏水了。我认为旧瓦片裂了。如果你能用全新的瓦片替换它们，我会付给你5000美元。” 屋顶工回答：“当然，如果我能腾出繁忙的日程。” 然后房主说：“没关系，但请尽快通知我。” 三天后，屋顶工开着他的皮卡车来到房主家，卸下了进行屋顶工作所需的材料和设备。当房主从窗户往外看看到正在发生的事情时，他立刻跑到外面喊道：“停！交易取消。我决定自己修理屋顶。” 在屋顶工因违约对房主提起的诉讼中，以下哪一项将为屋顶工提供最佳的索赔理论？,professional_law,"['当屋顶工购买了完成工作所需的用品和工具时，建立了一个双边合同。', '当屋顶工回答“当然，如果我能腾出繁忙的日程”时，建立了一个双边合同。', '房主的提议暗示了一个单边合同，一旦屋顶工为工作采购了用品和工具，就无法取消。', '房主的提议暗示了一个单边合同，屋顶工通过在房主的财产上开始工作并卸下用品和工具来表示接受提议的意图。', '由于房主的承诺诱使屋顶工采取行动，屋顶工有权根据允诺禁反言原则获得赔偿。']",3
14,一个鳏夫是一个10英亩采石场的完全所有者。8月1日，鳏夫将一份将采石场转让给他侄女的契约交给他的朋友，并对朋友说：“把这个交给我侄女。” 鳏夫不知道的是，侄女在非洲。下一周，朋友在记录处正确记录了这份契约。一个月后，鳏夫去世了，在他的遗嘱中，他将采石场遗赠给他的女儿。此后，侄女从非洲回来，侄女和女儿之间就采石场的所有权发生了争执。在一场为了确认采石场所有权的诉讼中，法院裁定侄女胜诉。该裁决最有可能基于以下哪一项？,professional_law,"['赠与有效，因为这是在预期死亡时进行的。', '鳏夫将契约交给朋友时转让有效。', '朋友正式登记契约时转让有效。', '契约在遗嘱生效之前已被提交。', '侄女从非洲返回是赠与有效的必要条件。']",1
15,一个犯罪行为人犯下了唆使罪。以下哪一项不适用于唆使罪？,professional_law,"['它涉及双方达成协议以实施犯罪行为。', '它包括敦促其他人实施严重犯罪。', '仅仅是要求某人就足以构成犯罪。', '通常，收回请求不被视为有效的抗辩理由。', '唆使罪要求被唆使的犯罪已完成。']",0
16,被告告诉两名男子，一家医疗器械公司现在正在使用河边的旧仓库来存放其除颤器的供应。一个深夜，这两名男子闯入仓库，并开始将大箱的除颤器装上他们的卡车。在他们离开时，其中一名男子不小心将他的烟蒂扔进了一堆旧纸板箱和纸张的垃圾堆里。不久之后，垃圾堆着火了。尽管这两名男子有时间在没有危险的情况下扑灭火，但他们并没有这样做，而是逃走了。同时，火迅速蔓延，整个仓库被大火吞噬。如果被告后来被控为共谋者，他很可能会被视为,professional_law,"['参与策划犯罪但未在犯罪现场出现的人。', '在犯罪现场出现并协助实施犯罪的人。', '明知故犯地协助或鼓励犯罪的人。', '不负责任的人。', '无意中卷入且事先对犯罪毫不知情的人。']",3
17,一名男子因发布付费报纸广告而被逮捕并定罪，广告内容涉及如何在其他州进行堕胎以及如何找到转介服务。根据一项刑事法规，传播此类信息被视为犯罪。法院会维持这一定罪吗？,professional_law,"['不，该法规侵犯了第六修正案对隐私权的保护。', '不，该法规侵犯了第一修正案对商业言论的保护。', '是，终止妊娠的权利不包括宣传服务可用地点的广告。', '是，没有权利分发或推广具有商业性质的言论。', '不，该法规违反了第十四修正案的平等保护条款。']",1
18,一位著名的环保主义者拥有一大片原始森林。这位环保主义者将这片土地“以绝对产权的形式转让给本州人民；但前提是，如果该土地的任何部分被用于或开发用于任何商业目的或以其他方式从其自然状态转换（用于娱乐、科学或教育目的的情况除外），则转让人或其继承人有权以转让人原有财产的形式重新进入。”该州对这片土地的权益最好被描述为一个,professional_law,"['在特定事件发生时自动终止的完全所有权', '如果违反条件，转让人可以自行决定终止的完全所有权', '为特定目的使用他人土地的权利', '如果满足某个条件，所有权自动转移给第三方', '在设定的时间后权利回归给转让人的临时拥有和使用土地的权利']",1
19,一位承包商和房主正在就新房建设的价格进行谈判。承包商向房主提出了多个建设报价，其中包括一个10万美元的报价。以下哪种沟通不会终止该报价，从而使后续的接受可以生效？,professional_law,"['房主询问承包商是否愿意以95,000美元建造房屋。', '承包商通知房主该报价不再有效。', '承包商在房主接受之前去世，但承包商的儿子计划继续经营业务。', '房主回应：“我同意你的报价，但价格必须是97,000美元。”', '房主要求更多关于施工时间表的细节。']",0
20,一名被告被怀疑入室盗窃了邻居的公寓。邻居报告说他的公寓被洗劫一空，几件衣物被盗。在调查过程中，两名警探前往被告的工作地点采访他。在被告知他的米兰达权利后，被告请求允许打电话给他的律师。虽然他的律师不在，但律师的接待员告诫他不要说任何话。被告告诉警探，在律师在场的情况下，他不会再说什么。随后，警探问他是否愿意陪他们去警局回答一些关于无关盗窃案的问题。被告同意了。在开往警局的途中，被告被问到他所穿靴子是在哪里买的，他拒绝回答。当他们到达警局时，警探要求他签署放弃律师权利的声明。被告回答说在律师不在的情况下他不会签署任何东西。随后他被安置在一个审讯室。不久之后，被告被告知如果愿意说出他在哪里买的靴子就可以离开。被告承认他是从一个朋友那里买的靴子和一些衬衫。根据此信息，警探获得了搜查令并前往被告的家，在那里找到了被盗的衣物。被告被指控入室盗窃公寓。在审判中，法院应该,professional_law,"['允许将供述作为证据，因为它是自愿的，并允许衣物作为通过合法搜查令发现的证据。', '排除供述，因为它违反了他的第六修正案律师权利，但允许衣物，因为它是通过合法搜查令发现的。', '排除供述，因为被告没有签署放弃权利的声明，但允许衣物，因为它是通过合法搜查令发现的。', '排除供述，因为它违反了他的第五修正案律师权利，并排除衣物，因为搜查令是基于供述的。', '允许将供述作为证据，因为被告最终选择了说话，并允许衣物作为与案件有关的证据。']",3
21,一名女子在一家百货商店担任销售员。她在女式内衣区工作。某天傍晚快要打烊时，该女子从百货商店的珠宝区的一个柜子里拿出一条钻石项链，并用纸巾包裹住。然后，该女子偷偷地把项链塞进购物袋，打算在离开商店时带走。过了一会儿，店主走过来告诉她需要加班做库存。当该女子正在做库存时，店主发现了项链并报警。该女子最有可能被判定有罪的是,professional_law,"['企图盗窃。', '盗窃。', '通过欺骗获取财产。', '滥用受托财产。', '非法侵入。']",1
22,一名女子在商场的公共洗手间里。当她在水槽边时，一名男子进入洗手间并告诉她不要出声。受到惊吓的女子跑向洗手间里的一个打开的窗户，并跳到逃生梯上。当她从逃生梯下去时，女子不小心摔倒，擦伤了腿。以下哪项罪行，若有的话，最有可能导致该男子被定罪？,professional_law,"['威胁行为', '造成伤害的身体接触', '以性侵犯为目的的威胁行为', '无罪', '在限制区域内的非法入侵']",3
23,一名买家从市场购买了一加仑脱脂牛奶。牛奶装在一个塑料容器中，是由一家乳品厂加工和包装的。那天晚上，买家在准备晚餐时，从在市场购买的容器中倒了一杯牛奶。他坐下来吃饭，并喝了一口牛奶。就在这时，买家感到有东西毛茸茸的东西卡在嘴里。他立刻吐出了毛茸茸的东西，看到那是一只死老鼠。买家遭受了严重的情绪困扰，但没有身体疾病或伤害。如果买家基于疏忽制造对乳品厂提出索赔，他很可能会,professional_law,"['获得赔偿，因为他所经历的情绪困扰是显著的。', '获得赔偿，因为该情况本身就说明了一切。', '不会获得赔偿，因为乳品厂的疏忽仅导致精神痛苦。', '不会获得赔偿，因为买家正确的法律索赔应该是故意造成情绪困扰。', '获得赔偿，因为食物中出现异物是违反合同的。']",2
24,在酒吧喝了几杯酒后，一个男人和他的朋友开车经过一栋灯光熄灭的大房子。男人坐在副驾驶座位上，朋友把车停了下来。他们因为喝酒而感到醉酒和好斗。经过讨论，他们决定进入房子看看能拿些什么。他们破门而入，拿走了几包珠宝。在驾车离开时，他们被拦下并因入室盗窃被逮捕。乘客辩称他因为太醉而无法形成进入房子的特定意图以实施重罪。这里描述的事实是否表明该辩护在审判中可能会成功？,professional_law,"['是的，因为他的醉酒程度使他无法具备实施入室盗窃所需的意图。', '不是，因为醉酒从来不能作为实施重罪的有效辩护。', '不是，因为证据表明他有能力形成入室盗窃所需的意图。', '是的，因为他的醉酒状态改变了他的精神状态，从而消除了所需的犯罪意图。', '是的，因为乘客自己并没有实际进入房子。']",2
25,一名铁路工人的遗孀在联邦法院对铁路公司提起了一项因过失导致死亡的诉讼，声称铁路公司的过失导致了她丈夫的死亡。在审判中，遗孀提供了丈夫的一名同事的证词。同事作证说，他看到丈夫所乘坐的铁路车辆减速，而后面的车辆加速。该同事还表示，他后来听到了巨大的撞击声，但没有回头查看，因为在院子里响亮的噪音很常见。另有三名铁路员工作证说，没有发生碰撞。在证据结束时，铁路公司申请依法判决，但被驳回，案件被提交给陪审团。陪审团做出对遗孀有利的裁决。铁路公司提出了重新申请依法判决的动议。法院应适用何种标准来决定如何裁决这一动议？,professional_law,"['证据是否显示出支持遗孀案件的重要事实存在真正的分歧。', '陪审团的裁决是否与提交的大部分证据相矛盾。', '遗孀是否提供了哪怕极少量的证据来支持陪审团的裁决。', '假设所有有争议的问题都按有利于遗孀的方式解释，案件中是否有足够重要的证据来维持陪审团的裁决。', '陪审团在做出裁决时，是否考虑了遗孀的情感痛苦。']",3
26,2月1日，一名男子向一位机械师寄出了以下信件：“我的车最近运行得不太好。如果你能在2月10日前换油、换油滤清器并调整化油器，我将支付你275美元。” 机械师在2月3日收到了这封信。同一天，他打电话给一家汽车供应公司，订购了进行维修所需的材料。两天后，机械师在一个聚会上遇到了这名男子，并进行了以下对话： 男子：“忽略我上周给你寄的信。” 机械师：“不行，我已经从汽车供应公司订购了材料。” 男子：“对不起，我昨天卖掉了我的车，所以别做维修了。” 如果机械师因违反合同而提起诉讼，以下哪一项是该男子最有力的论点，以证明双方之间没有形成可以执行的合同？,professional_law,"['机械师在男子取消他的提议之前尚未完成工作。', '男子的提议要求通过口头或书面同意来接受。', '由于男子是通过信件提出他的提议，机械师只能以同样的方式接受。', '尽管机械师正在准备进行维修，但在男子撤回其提议时，他尚未开始实际工作。', '机械师的接受无效，因为他在订购材料之前没有通知该男子他的接受。']",3
27,一名原告因在被告家人行道上摔倒而受伤，向被告提起诉讼。原告的投诉称，人行道被一层厚厚的冰覆盖，该冰是由于被告的疏忽而在那儿放置了好几天。在他的答辩中，被告指出冰是在一夜之间形成的，原告在被告有机会清除之前就已经摔倒了。在审判期间，一名医生，他的办公室就在被告家隔壁，作证说他看到原告摔倒，并且冰已经存在了好几天，至少有两英寸厚。在交叉询问中，被告的律师问医生以下问题：“在您当天对原告的治疗过程中，原告是否告诉您他摔倒是因为在头晕之后失去平衡？”在原告律师的反对下，医生的证词将被裁定,professional_law,"['允许，因为这与诊断或治疗有关。', '允许，因为医生直接观察了原告的伤害。', '不允许，因为辩护律师没有建立必要的背景。', '不允许，因为医生的陈述与证明原告声称的伤害不真实或夸大无关。', '不允许，因为医生不是滑倒和摔伤案件的专家证人。']",0
