Unnamed: 0,question,subject,choices,answer
544,一个将能量作为其反应物之一的反应被称为,high_school_biology,"['一种释放能量的反应。', '一种利用水分解化合物的反应。', '一种需要能量输入的反应。', '一种涉及电子转移的反应。', '一种在室温下自发发生的反应。']",2
545,以下哪项陈述最准确地解释了EcoR1是什么？,high_school_biology,"['它是人类结肠中发现的一种微生物。', '它是一种感染大肠杆菌的著名病毒。', '它是从大肠杆菌中获取的限制性内切酶。', '它是一种在科学研究中广泛使用的DNA形式。', '它是遗传工程实验中常用的一种质粒。']",2
546,在脊椎动物胚胎中，以下哪一种发育过程最直接导致三个主要胚层的形成？,high_school_biology,"['形成神经管的过程', '形成一个空心细胞球', '受精后的快速细胞分裂', '三个胚层的发展', '原肠胚形成过程']",3
547,以下哪项陈述是正确的？,high_school_biology,"['水从溶质浓度较高的区域移动到溶质浓度较低的区域。', '正在发芽的种子消耗的氧气比未发芽的种子少。', '风速的增加导致蒸腾速度的降低。', '在凝胶电泳中，较小的DNA片段比较大的片段移动得更快。', '在凝胶电泳中，DNA片段由于带正电而向阴极移动。']",3
548,一位研究人员在她的实验室中培养了一群蕨类植物。她注意到，经过几代之后，出现了一种具有独特表型的新变种。当她尝试将原始表型与新变种杂交时，没有产生后代。然而，当她繁殖新的变种时，产生了看起来像新变种的后代。这个例子说明了哪种类型的物种形成？,high_school_biology,"['由于地理隔离导致的物种形成', '在相同地理区域内发生的物种形成', '由生殖隔离引起的物种形成', '通过染色体数目加倍的物种形成', '由于与不同物种杂交导致的物种形成']",1
549,在被认为生命开始的时期，原始地球的大气中含有大量的以下所有气体，除了,high_school_biology,"['双原子氧', '双原子氢', '氮化三氢', '甲基氢化物', '二氧化碳']",0
550,以下哪项陈述是不正确的？,nutrition,"['纯素食饮食有缺乏足够蛋白质的风险', '谷物通常含有低水平的赖氨酸', '豆类和豌豆通常缺乏蛋氨酸', '乳制品是色氨酸的良好来源', '所有植物性食物都是完全蛋白质']",0
551,以下哪些可能导致碘缺乏？,nutrition,"['摄入较少的水果和蔬菜', '只吃在非洲中部种植的食物', '摄入的卡路里不足', '缺乏阳光照射', '饮水过量']",1
552,高摄入以下哪种膳食成分会导致认知能力加速下降？,nutrition,"['含有高碳水化合物且迅速提升血糖水平的食物', 'ω-6脂肪酸相对于ω-3脂肪酸的不平衡', '长链饱和脂肪酸', '以上所有', '含有高膳食纤维的食物']",3
553,使用BMI（身体质量指数）作为体脂测量方法的主要限制是什么？,nutrition,"['它不能为典型个体提供精确的测量', '它比传统的身高体重表提供更高的准确性', '它无法区分脂肪组织和瘦组织', '以上所有', '它是衡量运动表现的有效工具']",2
554,超重的定义是什么？,nutrition,"['BMI 大于 25 kg/m2', 'BMI 等于 25 kg/m2', 'BMI 范围为 25 到 29.9 kg/m2', 'BMI 范围为 25 到 30 kg/m2', 'BMI 大于 30 kg/m2']",2
555,体内最大的内源性底物来源是什么？,nutrition,"['储存在肝脏中的糖原', '储存在肌肉中的糖原', '储存在肌纤维中的脂肪', '储存在体脂组织中的脂肪', '储存在骨骼肌中的蛋白质']",3
556,麸质,nutrition,"['可能导致碳水化合物的吸收不良', '是燕麦蛋白中的一种成分', '是玉米的主要蛋白质', '可能在溃疡性结肠炎中被建议避免', '是膳食纤维的主要来源']",0
557,偶尔会有婴儿出生时免疫系统功能不正常。哪些迹象最能表明严重联合免疫缺陷？,nutrition,"['频繁且严重的感染', '婴儿死亡原因不明的家族史', '接种 BCG 疫苗后疫苗株的广泛传播', '所给选项均正确', '生长和发育迟缓']",3
558,急性酗酒与什么相关？,nutrition,"['欢乐心综合征', '家庭心综合征', '海边心综合征', '庆祝心综合征', '假日心综合征']",3
559,为了达到最佳营养状态，建议老年人摄入：,nutrition,"['高热量的饮食。', '富含营养的饮食。', '低热量的饮食。', '每天服用抗氧化剂补充剂。', '高加工食品的饮食。']",1
560,关于糖分摄入量与龋齿风险之间关联的最佳可用证据来自哪种类型的研究设计？,nutrition,"['随机分配的对照试验', '无随机分配的对照研究', '横断面性质的观察性研究', '纵向研究', '病例对照研究']",3
561,关于暴食症，以下哪项是不正确的：,nutrition,"['暴食症患者的暴食行为通常比神经性贪食症患者摄入的卡路里更多，导致肥胖。', '暴食症患者更有可能成为肥胖症患者。', '对于病情较轻的患者，减肥手术可能是一种治疗选择。', '暴食症可能会在没有干预的情况下自行消退。', '暴食症患者经常通过呕吐或过度运动来弥补暴食行为。']",0
562,以下哪项会在维生素D缺乏时增加？,nutrition,"['血液中凝血酶原的水平', '血液中前凝血酶原的水平', '血液中碱性磷酸酶的活性水平', '血液中酸性磷酸酶的活性水平', '血液中钙的水平']",2
563,肠道乳糖酶缺乏导致乳糖消化不良，进而可能导致乳糖不耐症，即引起临床症状。婴儿和儿童通常表达足够的乳糖酶水平，不会出现临床症状。总体而言，成年人可以被分类为乳糖酶持续者或乳糖酶非持续者。全球乳糖酶非持续者的比例大约是多少？,nutrition,"['45% 到 50%', '70% 到 75%', '10% 到 15%', '30% 到 35%', '80% 到 85%']",1
564,以下哪项不是维生素A的功能,nutrition,"['参与血液凝固的蛋白质的生产', '触发维生素D受体的活性', '启动涉及甲状腺激素受体的过程', '控制基因活动和细胞特化过程', '维持正常视力']",0
565,以下哪种维生素在胶原蛋白合成中的羟化反应中提供辅因子？,nutrition,"['维生素H', '维生素B3', '维生素B2', '抗坏血酸', '维生素K']",3
566,用于检测过去8-10周平均血浆葡萄糖浓度的测试是：,nutrition,"['糖化血红蛋白测试', '涉及葡萄糖摄入和随时间测量的测试', '测量短期葡萄糖水平的糖化蛋白测试', '禁食一段时间后的葡萄糖水平测量', '对葡萄糖摄入的胰岛素水平测量']",0
567,以下哪项陈述是正确的？,nutrition,"['由于硫磺二氧化物有破坏维生素的效果，含有硫磺二氧化物的食物应避免含有硫胺素。', '由于硫磺二氧化物有破坏维生素的效果，含有硫磺二氧化物的食物应避免含有烟酸。', '由于硫磺二氧化物有破坏维生素的效果，含有硫磺二氧化物的食物应避免含有维生素E。', '由于硫磺二氧化物有破坏维生素的效果，含有硫磺二氧化物的食物应避免含有维生素C。', '由于硫磺二氧化物有破坏维生素的效果，含有硫磺二氧化物的食物应避免含有维生素D。']",0
568,哪种维生素是昏暗光线下视力所需的？,nutrition,"['视黄醇对低光视力至关重要', '对骨骼健康至关重要的营养素', '抗氧化维生素', '对血液凝固重要的维生素', '支持免疫功能的维生素']",0
569,以下关于糖原代谢的陈述哪一项是正确的？,nutrition,"['糖原合成的一个关键步骤涉及生成UDP-葡萄糖', '在禁食期间的肌肉组织中，糖原首先被分解为葡萄糖6-磷酸，然后变成游离葡萄糖', '糖原主要储存在肝脏和大脑中', '胰高血糖素促进糖原的生产', '糖原磷酸化酶受胰岛素激活以促进糖原分解']",0
570,母亲为纯素食者的新生儿可能面临缺乏哪种营养素的风险增加？,nutrition,"['抗坏血酸', '叶酸', '钴胺素', '钙', '铁']",2
571,以下哪一项最接近由β-胡萝卜素形成的视黄醇的量？,nutrition,"['每个β-胡萝卜素分子产生的视黄醇是其两倍', '每个β-胡萝卜素分子产生的视黄醇相等', '每个β-胡萝卜素分子生成的视黄醇是其0.15倍', '每个β-胡萝卜素分子生成的视黄醇是其0.1倍', 'β-胡萝卜素转化为视黄醇的效率为100%']",2
572,关于植物来源的氨基酸在人类营养中的作用，下列哪项陈述是正确的？,nutrition,"['每种植物性蛋白质都缺乏某些必需氨基酸', '每种植物性蛋白质都包含所有必需氨基酸，但某些可能含量较低', '每种植物性蛋白质中赖氨酸含量都较低', '每种植物性蛋白质中含硫氨基酸含量都较低', '每种植物性蛋白质的蛋白质含量都高于动物性蛋白质']",1
573,额外的膳食蛋白可能：,nutrition,"['增加髋部骨折的可能性', '减少尿液中排出的钙含量', '促进类似于胰岛素的生长激素的生成', '导致肌肉质量和力量的下降', '增加肾结石形成的风险']",2
574,胃肠道的功能可以以多种方式进行分类。以下哪项功能在餐后立即对生存最为重要？,nutrition,"['吸收和保存液体和矿物质', '去除有害物质', '维持保护功能', '从食物营养中获得最大利益', '产生消化激素']",0
575,计划怀孕的女性建议在怀孕前和怀孕的前三个月每天摄入400微克叶酸补充剂。这样的补充对所生孩子的印记基因IGF2的甲基化有什么影响？,nutrition,"['没有影响。', 'IGF2的甲基化水平升高。', 'IGF2的甲基化水平降低。', '结果受到孩子性别的影响。', 'IGF2的甲基化水平影响孩子的整体身高和体重。']",1
576,哪些食物在威尔士和苏格兰（截至2020年）消费量较低？,nutrition,"['动物蛋白', '甜食和糖果', '新鲜农产品', '土豆', '乳制品']",2
577,以下哪种身体组成的变化与老年人的衰老有关？,nutrition,"['更高的骨密度', '更高的肌肉质量', '更多的体脂', '以上全部', '新陈代谢增加']",2
578,补充哪种脂溶性维生素已被证明可以减少心血管疾病？,nutrition,"['维生素A和D', '维生素A和K', '维生素D和E', '没有提到的维生素', '维生素E和K']",3
579,在预防与年龄相关的认知衰退方面，哪种营养素有最好的证据支持？,nutrition,"['Omega-3脂肪酸', '植物化合物', 'Omega-6脂肪酸', '长链饱和脂肪', '抗氧化剂']",0
580,以下关于评估人类营养中蛋白质质量的方法的说法中，哪一项是正确的？,nutrition,"['使用大鼠蛋白质效率比（PER）试验来评估人类蛋白质质量是有效的。', '大鼠净蛋白质利用（NPU）测试是确定人类饮食中蛋白质质量的最准确方法。', '在评估人类膳食蛋白质时，动物生长试验往往低估了它们的质量。', '生长中的大鼠是评估人类营养中蛋白质质量的合适模型。', '可消化不可缺少氨基酸评分（DIAAS）在评估人类蛋白质质量方面不如基于动物的测定法可靠。']",2
581,全球化对粮食安全有什么影响？,nutrition,"['富国的补贴和贸易限制阻碍了发展中国家利用全球化改善粮食安全的能力。', '世界贸易组织的规则将农业排除在外，因此全球化对粮食安全没有真正影响。', '目前食品和农业的全球化仅限于超市。', '为了最大化全球化的收益，发展中国家必须建立政府控制的粮食储备。', '全球化导致全球农业实践的一致性，消除了区域性的粮食安全挑战。']",0
582,肠道微生物将L-肉碱代谢成哪种代谢物，这种代谢物已被证明会增加心血管疾病的风险？,nutrition,"['一种参与脂质代谢的必需营养素', '一种源自胆碱氧化的化合物', '一种由微生物对L-肉碱作用产生的化合物', '以上全部', '一种增强运动表现的化合物']",2
583,以下哪一项将为短期高强度活动（如短跑）中的肌肉收缩提供主要燃料？,nutrition,"['储存在肌肉中的脂肪', '血液中循环的脂肪酸', '以极低密度脂蛋白（VLDL）形式在血液中携带的脂肪', '储存在肌肉中的碳水化合物', '肌肉中的蛋白质分解']",3
584,在过去的二十年中，随着流行病学研究发现早期经历与后期健康之间的联系，人们对母亲营养的兴趣大大增加。以下哪项陈述是正确的：,nutrition,"['虽然早期生活似乎至关重要，但观察到的与心血管疾病和2型糖尿病风险的联系大多可以归因于成年后的习惯。', '早期经历与后期健康结果之间的联系仅在英国进行的研究中有所记录。', '流行病学研究的证据表明，由于编程导致的生理差异仅与产前事件有关。', '流行病学研究的证据表明，由于编程导致的生理差异与产前事件和早期婴儿期的经历有关。', '早期营养对健康结果的影响已为人所知，并且在不同人群或环境背景中没有变化。']",3
585,以下关于蛋白质需求的说法哪个是正确的,nutrition,"['蛋白质需求是需求与利用效率的乘积。', '蛋白质需求等于需求除以利用效率。', '蛋白质需求可能低于需求。', '蛋白质需求在所有情况下都与需求相同。', '蛋白质需求总是需求的两倍。']",1
586,是什么导致了2007-2008年的食品价格飙升？,nutrition,"['价格飙升是由于长期忽视农业和农村发展。', '作物被转用于生物燃料生产导致食品价格上涨。', '大宗商品市场的投机活动是导致价格飙升的一个因素。', '以上所有因素都导致了价格的上涨。', '全球人口减少导致食品需求下降，从而引发价格飙升。']",3
587,为什么支持人类饮食胆固醇与血浆LDL胆固醇水平之间关系的证据不确定？,nutrition,"['身体调节胆固醇吸收及其通过脂蛋白分布的复杂性质。', '肝脏从肠道中移除携带胆固醇的脂蛋白的复杂过程。', '肝脏内细胞对胆固醇水平增加的各种内部反应。', '以上所有。', '身体无法自然产生胆固醇，使得饮食来源成为唯一的贡献者。']",3
588,下列哪种类型的研究结果为饮食与骨骼健康之间的关联提供了强有力的证据：,nutrition,"['长期干预试验，参与者人数众多，以骨折发生率为关键结果指标', '通过生化指标评估骨重塑的对照研究', '仅进行一次骨密度和骨含量评估的试验', '个别患者的病例报告', '没有骨健康临床测量的饮食习惯调查']",0
589,女性在粮食安全中扮演什么角色？,nutrition,"['她们的主要贡献是烹饪食物。', '她们作为食品生产者、自然资源管理者、收入赚取者和家庭营养提供者是至关重要的。', '她们负责清除田地里的杂草，但不犁地或种植，因为这些任务需要归因于男性的力量。', '她们主要照料菜园和家禽，而男性则负责谷物种植和大型牲畜。', '她们专门负责粮食储存和保存，这是粮食安全中最重要的方面。']",1
590,肥胖流行的主要原因是什么？,nutrition,"['摄入的卡路里增加和身体活动减少', '在空闲时间减少了锻炼的时间', '基因构成的改变', '所有给出的选项都不正确', '对健康饮食的认识和教育增加']",0
591,食品补充剂，包括微量矿物质和维生素，通常宣传具有良好的健康益处。以下哪种物质可能会被过量摄入，即远超出每日推荐需求？,nutrition,"['抗坏血酸', '胆钙化醇', '一种在少量中必需的金属元素', '视黄醇', '生育酚']",0
592,动物研究中的毒性和剂量反应数据，连同以下哪种类型的数据一起，用于评估食品物质的安全性？,nutrition,"['人们食用含有添加物质的食物的频率', '食物中该物质的含量', '个人食用该食物时每天摄入的该物质的量', '一个人在一生中对该物质的累积摄入量', '含有该物质的食物的营养价值']",2
593,减重手术用于治疗肥胖症，但手术后肥胖个体的2型糖尿病发病率减少了多少？,nutrition,"['2型糖尿病病例减少80-90%', '发生率无下降', '大约减少50%', '所提供的选项均不准确', '2型糖尿病病例增加10-20%']",0
594,在常规实践中评估生长应是：,nutrition,"['2型糖尿病病例减少80-90%', '发生率无下降', '大约减少50%', '所提供的选项均不准确', '2型糖尿病病例增加10-20%']",2
595,以下哪项陈述是正确的？,nutrition,"['被称为类黄酮的群体包括类黄酮和异黄酮。', '加工不会改变大豆食品中异黄酮的可消化性和生物利用度。', 'β-胡萝卜素和番茄红素都有可能作为维生素A原。', '多酚包括类胡萝卜素和类黄酮。', '异黄酮是一类主要存在于柑橘类水果中的类胡萝卜素。']",0
596,下列哪项是葡萄糖完全氧化成二氧化碳和水时的ATP产量？,nutrition,"['十', '二十五', '三十', '三十二', '四十二(在无氧条件下)']",3
597,基础代谢率（BMR）：,nutrition,"['在一个人舒适地坐着时测定', '无论甲状腺功能异常与否都保持不变', '随着体重增加而增加，因为增加的体重中有一部分是瘦组织', '在体重减轻后不会改变', '在肌肉量较低的人中比肌肉量较高的人更高']",2
598,由于许多铁状态标志物在感染时会发生变化，铁缺乏的诊断可能因同时存在的感染而变得复杂。在铁缺乏和严重感染同时存在的情况下，以下哪种铁状态标志物的组合最有可能被发现？,nutrition,"['血红蛋白减少，铁蛋白升高，血清转铁蛋白受体增加，铁调素升高', '血红蛋白减少，铁蛋白减少，血清转铁蛋白受体增加，铁调素减少', '血红蛋白减少，铁蛋白减少，血清转铁蛋白受体正常，铁调素升高', '血红蛋白减少，铁蛋白减少，血清转铁蛋白受体减少，铁调素升高', '血红蛋白正常，铁蛋白升高，血清转铁蛋白受体正常，铁调素减少']",0
599,以下哪些因素可以降低结直肠癌的风险？,nutrition,"['抗坏血酸', '粗纤维', '乙醇', '雌激素', '饱和脂肪']",1
600,以下哪一项现代人类的特征最为古老，早于晚期石器时代、上旧石器时代，甚至早于解剖学意义上的现代人？,prehistory,"['复杂的埋葬习俗', '更大规模的社区', '石器制作技术的进步', '创作艺术作为象征性表达的形式', '书面语言的发展']",2
601,印加帝国何时开始在南美洲进行军事扩张？,prehistory,"['2世纪', '10世纪', '15世纪中期', '17世纪中期', '13世纪末']",2
602,在中国对仰韶遗址的发掘显示了哪些驯化作物？,prehistory,"['豆类、一种谷物和玉米。', '面包谷物、水生谷物和一种豆科植物。', '一种草类作物、古代小麦和植物种子。', '一种谷物、叶类蔬菜和水生谷物。', '水果、一种根茎类蔬菜和块茎。']",3
603,在作者的两小时电影中，代表宇宙的历史，人类家族最早的成员何时出现？,prehistory,"['在电影的开头', '大约在电影的中间', '在电影进行到1小时30分钟时', '在电影最后3秒钟', '在片尾字幕前的最后一分钟']",3
604,在兰德尔·怀特看来，个人装饰品在旧石器时代晚期意味着什么？,prehistory,"['渴望长途旅行', '夜间在篝火旁消磨时间的活动', '日益认识和重视个人身份', '智力增强和合作意愿', '在严酷气候中节约资源的方法']",2
605,查科峡谷的普韦布洛祖先文化包括：,prehistory,"['大约75个大型定居点和超过300个小型社区。', '拥有纪念性建筑的超过500个城镇和村庄。', '30到40个农业农庄和三个主要的普韦布洛。', '一个大型城市中心和超过300个周围的农庄。', '众多分散的小型村落，主要以狩猎和采集为主。']",0
606,以下哪一项表示主要背景？,prehistory,"['一个整个社区的废物聚集的垃圾场', '由于侵蚀而暴露在表面上的物品、自然遗骸和骨头', '在它们最初放置的位置找到一组文物', '以上所有', '为了保存而移至博物馆的物品']",2
607,1797年，约翰·弗里尔做出了一个发现，他描述为：,prehistory,"['动物的骨头散布在地表。', '已知最古老的文字记录。', '在地下深处发现的古代石器。', '具有类似猿类特征的人类头骨。', '古代文明的陶器碎片。']",2
608,奥瑞纳文化的技术与穆斯特文化的技术有何不同？,prehistory,"['穆斯特文化的技术创造了更多的投射点。', '穆斯特文化的技术产生了更大面积的可用刀刃。', '奥瑞纳文化的技术产生了更大面积的可用刀刃。', '奥瑞纳文化的技术强调手斧的制作。', '奥瑞纳文化的技术专注于使用磨光石器。']",2
609,在鼎盛时期，印加帝国中只有大约 _______ 是由印加族人组成的。,prehistory,"['仅仅1%', '大约10%', '大约30%', '帝国的一半', '整个人口都是印加族人']",0
610,与大多数其他早期文明不同，米诺斯文化很少显示出以下哪种证据：,prehistory,"['商业交流', '军事冲突', '建立统一的精神信仰体系', '统治阶级的奢华展示', '先进的建筑技术']",3
611,米诺斯经济可能特别容易受到自然灾害的影响，因为它严重依赖于：,prehistory,"['农业', '海上贸易', '金属加工', '奴隶劳动', '宗教仪式']",1
612,墨西哥谷地的人口靠以下手段得以支持：,prehistory,"['进行长途贸易，开采盐，并用石头制作工艺品。', '通过觅食、水产收获和种植块茎植物生存。', '运用先进的医疗保健、工艺技能和金属加工技术。', '使用灌溉系统、修建梯田和创造被称为chinampas的人工岛屿。', '依靠猎杀大型猎物、驯养动物和编织纺织品。']",3
613,对两种主要稻米品种（粳稻，短粒型和籼稻，长粒型）的遗传研究表明：,prehistory,"['这两种稻米品种在遗传上比与各自的野生祖先更接近，表明它们最近在东亚发展。', '这两种稻米品种在遗传上比彼此更接近各自的野生祖先，表明它们分别在东亚和南亚被独立驯化。', '这两种稻米品种之间没有遗传关系，暗示它们分别在东亚和西欧被驯化。', '稻米品种在遗传上与其当地的野生祖先相似，表明驯化发生在不超过2000年前。', '这两种稻米品种在遗传上完全相同，显示它们是从非洲的单一祖先驯化而来的。']",1
614,考古学与关于远古外星人的伪科学猜测和幻想有何不同：,prehistory,"['考古学不遵循证据或科学方法。', '考古学家对科幻不感兴趣，对古代历史缺乏了解。', '考古学家已经完全解决了关于过去的每个谜团和争论。', '考古学家使用科学方法，并受到证据存在与否的限制。', '考古学家更喜欢依赖民俗和神话，而不是实证研究。']",3
615,特奥蒂瓦坎这个名字是由谁给这个城市的：,prehistory,"['阿兹特克人，他们在城市被废弃后仍继续访问该地。', '西班牙征服者，他们在很大程度上摧毁了它。', '城市的首位统治者，以他偏爱的神命名。', '奥尔梅克商人，他们对其宏伟感到惊叹。', '玛雅文士，他们在其手抄本中记录了其历史。']",0
616,几乎所有在欧洲新石器时代重要的作物：,prehistory,"['是在集体农场同时种植的。', '是在人们定居下来之前种植的。', '是在欧洲内部分别驯化的。', '是从不同地区引进的。', '是在没有人类干预的情况下自然演化的。']",3
617,以下哪些是文明的四个特征？,prehistory,"['充足的食物、专业化的工人、城市和记录保存方法', '充足的食物、常备军、艺术和管道系统', '充足的食物、大型建筑、礼拜场所和文化机构', '文化机构、知识库、大型建筑和艺术', '充足的食物、技术创新、社会等级和复杂的宗教']",0
618,北美西北海岸的原住民是：,prehistory,"['玉米农民', '基本采集者', '富有的采集者', '被阿兹特克征服', '熟练的渔民']",2
619,后冰川期欧洲食物资源基础最显著的特征是：,prehistory,"['依赖大型动物。', '采集和狩猎。', '依赖拥有珍贵毛皮的动物。', '多样性。', '热带水果的种植。']",3
620,在密西西比文化中心卡霍基亚的僧侣墩的作用是：,prehistory,"['用于观察或信号火的结构。', '具有平等地位部落的公共区域。', '作为埋葬地。', '一个或多个重要建筑的基础。', '贸易和市场活动的场所。']",3
621,根据对在古湖泊沉积物中发现的腹足动物壳的氧同位素比例的分析，印度河流域的文明发生了什么?,prehistory,"['由于降水量增加和适合农业的延长期，这一文明变得更加复杂。', '由于气候变化和长期干旱，这一文明最终解体。', '由于季风活动加剧和毁灭性的洪水，这一文明崩溃。', '这一文明转变为沿水道和湖边的城市中心网络。', '这一文明迁移到沿海地区，以利用海上贸易机会。']",1
