Unnamed: 0,question,subject,choices,answer
404,这个问题涉及以下信息。没有任务比维护和平更紧迫。没有和平，我们的独立就毫无意义。我们国家的复兴和重建将没有意义。我们的革命将无法顺利进行。我们能做什么？我们能做很多！我们可以将理性的声音注入国际事务中。我们可以动员亚洲和非洲所有的精神力量、道德力量、政治力量来支持和平。是的，我们！我们，亚洲和非洲的人民，14亿人。印度尼西亚领导人苏加诺，1955年万隆会议主题演讲。与非洲、亚洲和中东的众多其他领导人一样，苏加诺试图但未能完全成功地在以下期间保持中立立场,high_school_world_history,"['阿拉伯国家与以色列之间的冲突。', '朝鲜半岛的冲突。', '西方集团与东方集团之间的全球紧张局势。', '越南的冲突。', '古巴导弹危机。']",2
405,以上段落的作者声称：“繁荣催熟了衰败的原则；随着征服范围的扩大，毁灭的原因倍增。”他这句话是什么意思？,high_school_world_history,"['领导者积累了过多的财富，随后被推翻。', '帝国扩张到了无法管理的规模。', '衰败从事物开始成长的那一刻起就开始了。', '征服与繁荣不能共存。', '罗马军队成为了世界上最先进的军队。']",1
406,上面这段演讲最适合理解为以下哪种背景？,high_school_world_history,"['蒙古人入侵中东地区', '挑战天主教教义的宗教运动', '欧洲全球探险时期', '前往圣地的军事活动', '查理曼大帝下神圣罗马帝国的巩固']",3
407,这个问题涉及以下信息。 “当葡萄牙人从中国的澳门前往日本时，他们带了很多白丝绸、黄金、麝香和瓷器：而他们从日本带回的只有银子。他们有一艘大船每年去那里，带回大约六百枚银币：所有这些日本的银子，以及每年从印度带来的另外二十万枚银币，他们在中国用这些银子谋取巨大的利益：他们从那里带回金、麝香、丝绸、铜、瓷器，以及许多其他非常昂贵和镀金的东西。 当葡萄牙人来到中国广州进行贸易时，他们只能在那儿待几天：当他们进入城市大门时，必须在一本书中登记他们的名字，晚上出去时必须注销名字。他们不能在镇上过夜，必须在镇外的船上过夜。时间到了，如果有人还留在那里，他会被监禁。” 拉尔夫·费奇，1599年他的远东旅行记。 除了第一段中提到的银子来源外，最大量的额外银子来自于以下哪个地区？,high_school_world_history,"['中亚', '欧洲大陆', '西南亚', '美洲', '东南亚']",3
408,第一段可以说削弱了关于西方帝国主义的哪种普遍假设？,high_school_world_history,"['欧洲殖民者偶尔会干预当地的宗教习俗', '欧洲殖民者优先考虑经济利益', '欧洲殖民者总是热衷于将他们的文化信仰强加于土著人民', '欧洲殖民者经常使用武力来对殖民地居民施加权威', '欧洲殖民者试图将土著人民融入他们的政治体系']",2
409,根据您对世界历史的了解，以下哪一项对1450年至1750年期间西欧的全球霸权贡献最小？,high_school_world_history,"['欧洲与美洲之间农业产品的转移', '火器技术的进步', '蒸汽动力机械的发明和使用', '股份公司的建立', '欧洲语言向其他大陆的传播']",2
410,以下哪个后来的发展最有可能削弱毛泽东在倒数第二行中表达的希望？,high_school_world_history,"['在中国沿海地区设立经济特区导致国家经济繁荣。', '与苏联的政治紧张关系导致中国在冷战期间与美国更加接近。', '农业集体化的创建和对农村钢铁生产的重视导致中国农民普遍饥饿和困苦。', '文化大革命期间，像邓小平这样的共产党异议成员被清洗。', '20世纪末推出的独生子女政策旨在控制中国的人口增长。']",2
411,根据以下信息回答问题。 在蒙古可汗或统治者的权力达到顶峰时，蒙古的领土构成了一个广阔的帝国，其中曾经敌对的民族和平共处，几乎所有宗教都被容忍。……成吉思汗首次颁布的法典规范了人类的互动。结果是国际联系进入了一个重要的新阶段。从东欧到中国南部，商人和旅行者可以在治安良好的蒙古领土上自由穿行，而不必担心他们的生命或财产。覆盖或连接了大部分欧洲、亚洲和中东的大块蒙古领土成为了东半球文明之间的桥梁。穿越蒙古土地的商队和使团将新食物、发明和思想从一个文明中心传递给另一个文明中心，并从文明中心传递给作为中介的游牧民族。安全的贸易路线带来了繁荣的商人和富裕、国际化的城市。它们还促进了食物[和]发明的传播……是经济和社会发展及文明生活提升的主要力量。 —罗伯特·吉塞皮，1992年 以下哪一项是13世纪蒙古征服俄罗斯的长期后果？,high_school_world_history,"['俄罗斯与西欧的文化和知识运动（如文艺复兴）隔绝。', '俄罗斯因成为蒙古统治的焦点而获得重要性。', '伊斯兰教成为俄罗斯主要的宗教信仰。', '俄罗斯建立了统一的政府行政体系。', '俄罗斯成为丝绸生产和出口的主要中心。']",0
412,"本问题涉及以下信息。
“从耶路撒冷和君士坦丁堡的限制中，一个可怕的故事已经传出，并且非常频繁地传到我们耳中，即从波斯王国来的一个种族，一个被诅咒的种族，一个完全与上帝疏远的种族，确实是一个没有将其心灵指向上帝，也没有将其精神托付给上帝的世代，入侵了那些基督徒的土地，并通过剑、掠夺和火焰使它们荒无人烟；它已经将一部分俘虏带入自己的国家，另一部分通过残酷的酷刑毁灭；它要么完全摧毁了上帝的教堂，要么占为己用进行其宗教仪式……希腊的王国现在被他们肢解，失去了如此广大面积的领土，以至于需要两个月的行军才能横穿。 因此，谁来承担为这些不公复仇和收复这片领土的责任呢，不是你们吗？你们，神在所有民族中赋予了显著的武勇、巨大的勇气、身体活力和力量，以谦卑那些抵抗你们的人的多毛头皮。让你们祖先的事迹感动你们，并激励你们去取得男子汉的成就；查理大帝和他的儿子路易，以及你们其他国王的荣耀和伟大，他们摧毁了异教徒的王国，并在这些土地上扩展了圣教会的领土。让我们的救世主的圣墓特别激励你们，它被不洁的民族占有，以及那些现在被羞辱和不敬地玷污的圣地。哦，最勇敢的士兵和无敌祖先的后代，不要堕落，而要回忆你们祖先的勇气。耶路撒冷是世界的肚脐；这片土地比其他地方更为肥沃，像另一个乐园。这位人类的救世主通过他的降临使其辉煌，通过居住使其美化，通过受难使其神圣，通过死亡赎回，通过埋葬荣耀。因此，这座位于世界中心的皇家城市现在被他的敌人俘虏，屈服于那些不认识上帝的人，屈服于异教徒的崇拜。因此，她寻求并渴望被解放，并不停地恳求你们来帮助她。尤其是她向你们请求援助，因为，正如我们已经说过的，神在所有国家中赋予了你们巨大的武勇。因此，为了赦免你们的罪，承诺获得天国的不朽荣耀，踏上这段旅程。”
教皇乌尔班二世在克莱蒙会议上的讲话，记录于修士罗伯特，公元1095年。
以下哪个事件最直接是上述演讲的结果？",high_school_world_history,"['基督教力量无法成功夺回圣地', '地中海贸易的减少', '君士坦丁堡被西欧基督徒占领', '拜占庭军队对塞尔柱突厥人的压倒性胜利', '第一次十字军东征以收复耶路撒冷的启动']",2
413,斯大林提到“不断被打”的理由来推动俄罗斯前进的努力，在哪一历史事件中得到证实？,high_school_world_history,"['与美国竞争以实现太空探索的进步', '1920年代初期波兰与苏联之间的冲突', '西方国家参与俄国内战', '1941年德国对俄罗斯的攻击', '1939年签署的《莫洛托夫-里宾特洛甫条约》']",3
414,作者对英国政府的未决诉讼的包含旨在做以下哪一项？,high_school_world_history,"['强调作者失去了多少财产', '表明他对当前冲突的不满', '嘲讽英国当局', '将责任归于他自己的国家和祖鲁人', '突出作者在处理纠纷方面的法律专长']",3
415,"这个问题涉及以下信息。
“非洲对世界和平的最大贡献是通过创建一个政治联盟来避免分裂所固有的所有危险，而这个政治联盟也将通过其成功，成为对分裂世界的一个榜样。非洲国家联盟将更有效地展现非洲的个性。它将赢得世界的尊重，而世界只重视规模和影响力。对法国在撒哈拉进行的核试验非洲反对的轻微关注，以及联合国在刚果对宪法细枝末节争论不休而共和国摇摇欲坠的可耻景象，证明了大国对非洲独立的冷酷无情的漠视。”
加纳领导人克瓦米·恩克鲁玛，1961年
这段话最明显地是以下哪种情况的例子？",high_school_world_history,"['对非洲统一不成功尝试的反应', '呼吁联合国在非洲采取行动', '提升非洲在当代世界地位的建议', '强烈反对资本主义对非洲的影响', '倡导增加对非洲基础设施的经济投资']",2
416,"这道题目涉及以下信息。""非洲对世界和平的最大贡献是通过建立一个成功的政治联盟，避免分裂所带来的所有危险，同时也作为一个分裂世界的榜样。一个非洲国家联盟将更有效地展现非洲的个性。它将赢得一个只关注规模和影响力的世界的尊重。对撒哈拉法国核试验的非洲反对意见的漠视，以及联合国在刚果共和国陷入无政府状态时对宪法细节的争论的可耻场面，都是大国对非洲独立的冷漠无视的证据。""",high_school_world_history,"['只有团结起来，非洲国家才能获得真正的独立。', '缺乏团结是许多非洲国家挣扎的原因。', '非洲大陆已经经历了许多内部冲突。', '国际社会将权力等同于规模和影响力的大小。', '非洲的团结将立即解决大陆上的所有经济问题。']",3
417,关于乌鲁克的描述，以下哪项关于古代城市的陈述最能得到第二段的支持？,high_school_world_history,"['古代城市对入侵的防御不够严密。', '古代城市包括专门用于崇拜主要神灵的空间。', '古代城市经常以简单的方式装饰他们的宗教建筑。', '古代城市有指定的区域用于军事训练。', '古代城市主要由木材和茅草建造。']",1
418,"本问题涉及以下信息。""当葡萄牙人从中国的澳门前往日本时，他们携带大量的白丝绸、黄金、麝香和瓷器：他们从日本带回的只有白银。他们有一艘大卡拉克船每年都去那里，每年从那里带回大约六百枚硬币：所有这些日本的银子，以及他们每年从印度带来的另外二十万枚银币，他们在中国用来获得巨大的利益：他们从那里带来黄金、麝香、丝绸、铜、瓷器以及许多其他非常昂贵和镀金的东西。当葡萄牙人来到中国的广州进行贸易时，他们只能在那里待几天：当他们进入城市的大门时，他们必须在一本书上登记他们的名字，晚上离开时他们必须注销名字。他们不能在城里过夜，而必须在城外的船上过夜。时间到了，如果有人留在那里，他将被监禁。"" 拉尔夫·菲奇，记述他于1599年在远东的旅行。第一段中描述的葡萄牙水手所走的路线最直接支持下列哪一历史发展？",high_school_world_history,"['东亚贸易由中国商人主导', '荷兰和葡萄牙商人为了进入日本市场的竞争', '欧洲人参与东亚贸易网络', '耶稣会在日本和中国的传教工作', '在日本建立永久的欧洲殖民地']",2
419,"这个问题是指以下信息。 ""关于谁以及什么导致非洲欠发达的问题可以从两个层面来回答。首先，答案是帝国主义体系的运作对非洲经济停滞负有主要责任，因为它通过掠夺非洲财富并使大陆资源无法更快地开发。其次，必须处理那些操纵该体系的人以及那些是该体系的代理人或不知情的同谋者。西欧的资本家是那些积极将其剥削从欧洲内部扩展到覆盖整个非洲的人。"" 沃尔特·罗德尼，历史学家，1974年《欧洲如何导致非洲欠发达》以下哪一项最能解释1450年至1750年期间与欧洲人贸易接触对撒哈拉以南非洲人的重要性？",high_school_world_history,"['撒哈拉以南非洲人依赖欧洲商人通过不断引入美洲的粮食作物来增加他们的人口。', '撒哈拉以南非洲人通过与欧洲人交换商品以换取武器来加强新的政治实体。', '撒哈拉以南非洲人依赖欧洲商人作为奴隶的唯一买家。', '撒哈拉以南非洲人与欧洲国家合作，去除威胁他们自治的穆斯林和阿拉伯贸易领袖。', '撒哈拉以南非洲人寻求欧洲联盟以扩展他们的贸易网络到亚洲。']",1
420,此问题涉及以下信息。信仰的人啊！烈酒、赌博和偶像……只是撒旦手工的污秽。抛弃它，以便你们成功。《古兰经》，第5章：89。一旦你听到玫瑰盛开，那就是我爱人，倒酒的时候。《奥玛·凯亚姆的鲁拜集》这两段诗句最密切相关的是,high_school_world_history,"['伊斯兰文化中的基本经济活动。', '伊斯兰文化中的食物和饮料的创造与消费。', '伊斯兰文化中的个人行为的精神指导。', '伊斯兰文化中男女角色的演变。', '伊斯兰历史中的文化表达和艺术成就。']",2
421,以下哪个最直接导致了上述宪法的制定？,high_school_world_history,"['鼓吹美洲团结的民族主义运动', '拉丁美洲地区由当地精英领导的起义', '原住民与当地领导人合作制定治理文件', '殖民统治者为自我统治设置殖民地', '受到欧洲民主革命影响而启发的新政府结构']",1
422,这个问题涉及以下信息。无论是继续还是终止实行萨蒂的做法，决定都伴随着可怕的责任。当有能力阻止成百上千的无辜受害者年复一年地被送往残酷而过早的死亡时，没有良心可以不带恐惧地考虑这种困境。但是，另一方面，采取相反的做法可能会危及大英帝国在印度的安全，这种选择本身可能被视为更大的邪恶。当我们有强大的邻国并且更有理由怀疑自己的安全时，权宜之计可能会建议采取更谨慎的行动，但现在我们处于至高无上的地位，我的意见明确支持公开和全面的禁止。,high_school_world_history,"['支持在外国领土上强迫劳动', '对土著居民实施殖民权威', '在被占领土推动西方宗教转换', '从殖民地区部署武装力量', '在殖民地建立贸易垄断']",1
423,"这问题涉及以下信息。
我沿着队伍走，问这是什么事。
一个士兵简单地说：“他们每天都召集更多的人。
我们中的一些人在十五岁时被派往黄河以北，
现在四十岁了，我们又要去西部的驻军。
第一次服役时，村长不得不给我们系头巾。
当我们回来时，头发已经白了，但仍然有更多的动乱。
边境驻军的血流成河，足以填满大海，
但武皇的领土野心尚未达到顶峰。
在山东以东的百个地区，整个汉地，
一定有一万个村庄现在被荆棘侵占。
即使妻子们强壮到足以操持锄头和犁，
庄稼也长得杂乱无章，田地一片狼藉。
对山西人来说最难受，因为他们有战士的名声：
他们像狗或鸡一样被集合，每个男性都被征召。
“但先生，虽然您关心地问，
抱怨不是士兵的任务。
我们只能摇头。就拿这个冬天来说：
山西的部队从未被遣返。
地区官员要求地税，
但这从哪里来呢？你无法从石头里榨出血来！
我真心觉得现在生男孩是坏运气，
生女孩更好：至少她可以结婚
和邻居住在一起。
但男孩最终会躺在某个遥远的草原上。”
杜甫，《兵车行》，约公元750年
这首诗提供了以下哪一项作为唐朝后期衰落的一个主要原因的证据？",high_school_world_history,"['农民因重税而不满', '外国势力入侵唐帝国的中部地区', '佛教和道教的兴起以应对国家对儒家的推崇', '缺乏效率的官僚机构和不够胜任的领导', '与邻国的贸易增加导致经济不稳定']",0
424,莫尔兰对莫卧儿帝国税收的描述最好被视为以下哪种概括的证据？,high_school_world_history,"['只有信仰特定宗教的个人才有义务向帝国缴税。', '区域差异可能影响哪些群体需要缴纳税款。', '征收税款是莫卧儿帝国唯一的融资方式。', '拉贾斯坦的情况代表了整个莫卧儿帝国的常态。', '税收征收的做法在莫卧儿帝国的所有地区都是统一的。']",1
425,这个问题涉及以下信息。 一项法案对移民施加某些限制，并规定从联邦中驱逐禁止的移民。 … 3. 任何以下段落中描述的人员（以下简称“禁止移民”）进入联邦是被禁止的，即 (a) 任何人在被官员要求时未能按照官员指定的欧洲语言以口述形式写出并在官员面前签署五十字的段落； (b) 任何人根据部长或官员的意见成为公众或任何公共或慈善组织的负担； … (g) 根据合同或协议在联邦内进行体力劳动的任何人：但部长豁免因澳大利亚所需的特殊技能的工人不适用本段…… 1901年移民限制法案（澳大利亚） 鉴于美国政府认为中国劳工进入该国危害某些地区的良好秩序； 因此， 美国合众国参议院和众议院在国会集会时颁布，从该法案通过后的九十天后起，暂停中国劳工进入美国；在此暂停期间，任何中国劳工进入美国是非法的，或在该九十天到期后进入美国的中国劳工在美国境内停留是非法的。 第二节。 每艘船的船长如果故意带中国劳工进入美国，并在该船上登陆或允许其登陆，将被视为轻罪，并在定罪后，每带入一名中国劳工将被处以不超过五百美元的罚款，并可能被判处不超过一年的监禁…… 1882年中国排华法案（美国） 这些段落最好被视为 1800 年代哪个显著社会或经济趋势的例子？,high_school_world_history,"['反犹太信念的出现', '保护主义贸易政策', '对招聘技术外国工人兴趣的增加', '对移民反对的加剧', '在非洲扩张殖民帝国']",3
426,"这一问题指的是以下信息。
火药武器：欧洲与中国
在13世纪至15世纪的西欧，尽管早期的大炮又重又慢，但在这段时期主导战争的长期围攻中，它们被证明足够有用，以至于政府认为值得为其支付费用，并进行最终产生更强大、更易移动的火药武器的实验。相比之下，中国，特别是在14世纪中期以后，主要受到高度机动的草原游牧民族的威胁，早期火药武器由于其笨重，对这些敌人几乎没有用处。因此，中国将其努力致力于改进骑射兵部队，这些部队能够有效对抗国家最致命的敌人。
这段文字似乎挑战了世界历史上的哪种传统观点？",high_school_world_history,"['中国在技术上一直落后于其他非洲欧亚文明', '中国的集权治理抑制了军事和技术进步', '当试图现代化时，中国的发展被宗教极端主义阻碍', '欧洲在全球崛起是因为中国忽视了技术进步', '早期火药武器主要在美洲发展，后来被欧亚文明采用']",3
427,这些信件中描述的互动最好理解为以下哪个背景？,high_school_world_history,"['葡萄牙沿西非海岸线的航行', '在撒哈拉以南地区传播天主教的努力', '在撒哈拉以南非洲形成政治结构的过程', '撒哈拉以南非洲奴隶贸易的增长', '在印度洋贸易路线的竞争']",3
428,对沙皇尼古拉二世在来源1中的退位声明的最佳理解是基于以下哪一项？,high_school_world_history,"['经济成功导致对贵族的敌意', '普遍反对尼古拉接受政治对手', '战争中的重大失败和工人不满', '对民族和宗教团体的骚扰', '西方政治意识形态对俄罗斯治理的影响']",2
429,"这道题涉及以下信息。
“瓦卡维利卡的水银矿是贫苦的印第安人被如此严厉惩罚的地方，他们在那里受到折磨，许多印第安人死去；王国的高贵卡西克（酋长）也在那里被折磨和毁灭。其他所有矿山也一样：波托西的银矿[及其他]……矿山的所有者和管事，无论是西班牙人、混血儿还是印第安人，都是如此的暴君，无惧上帝或正义，因为他们没有被审计，也没有每年检查两次……
他们没有得到往返矿山的劳动报酬，也没有得到在矿山工作时间的报酬。印第安人以采矿工作的名义，被迫在工作日放牧牛群和运送货物；他们被派往平原，印第安人就这样死去。这些印第安人没有得到报酬，他们的工作被隐藏。
[矿主]还在他们的住所中留有印第安厨娘；他们以烹饪为借口收纳妾侍……他们强迫印第安人自费接受玉米、肉或奇恰酒（玉米啤酒），并从他们的劳动和工作日中扣除价格。通过这种方式，印第安人最终变得非常贫穷，负债累累，无法支付他们的贡品。
对此没有补救措施，因为任何进入的[殖民官员]都会与矿主达成协议，所有业主都联手贿赂他……甚至印第安人的保护者也是无用的；……他[不]警告陛下或您的皇家法庭关于对贫苦印第安人的伤害。”
摘自《第一新年鉴与好政府》，费利佩·瓜曼·波马·德·阿亚拉，由大卫·弗莱选编、翻译和注释。版权2006年哈克特出版公司。经出版商许可转载。
费利佩·瓜曼·波马·德·阿亚拉，《第一新年鉴与好政府》，约1610年
上述段落中提到的矿产生产在1450-1750年期间最直接地促成了以下哪一项？",high_school_world_history,"['西班牙哈布斯堡家族在全世界进行众多军事冲突的能力', '西班牙兴起的繁荣商业阶层', '西班牙统治者对宗教事务财政支持的减少', '西班牙进行探险旅行次数的减少', '跨越太平洋的新贸易路线的建立']",0
430,从第一段的角度来看，卡恩普尔的英国公民的死亡,high_school_world_history,"['似乎表明一个“优越”群体对一个“劣等”群体的信任被违反。', '应该被视为一个不幸但可以预防的错误。', '可以被认为是英国自身行为的后果。', '被那些责任者视为履行宗教义务。', '代表了对外国统治强加的正当反应。']",0
431,"这个问题涉及以下信息。你是美国，你是未来的入侵者，将要侵略拥有印第安血统的美洲土著，这些土著仍然祈祷耶稣基督并仍然说西班牙语。......你是亚历山大-尼布甲尼撒。你认为生命是火焰，进步是爆发，无论射向哪里都能击中未来。不。......但我们的美洲，自古以来就有诗人，从内扎瓦尔科约特尔时代开始，......它仰望星空，它了解亚特兰蒂斯，这个响亮的名字源自柏拉图，自其生命的遥远时代以来，便活在光明、火焰、香气和爱中，大蒙特祖马的美洲，印加的美洲，哥伦布的芳香美洲，天主教的美洲，西班牙的美洲，贵族夸乌特莫克曾说：""我并不在玫瑰床上""，那美洲在飓风中颤抖并活在爱中，它活着，你们这些有撒克逊眼睛和野蛮灵魂的人。它在梦想，它在爱，它在震动，它是太阳的女儿。小心点。西班牙美洲万岁！有一千只小狮子被西班牙狮子释放。罗斯福，即便是上帝本人，也必须是那个恐惧的步枪手和强壮的猎手，才能用你的铁爪抓住我们。而且，尽管你拥有一切，你仍然缺少一样东西：上帝！——改编自鲁本·达里奥《致罗斯福》，1904年。哪种说法最能反映这首诗的主题？",high_school_world_history,"['拉丁美洲的人过于信任，应该更加积极抵抗。', '拉丁美洲经受住了许多征服者，并将继续战胜他们。', '西班牙人已经破坏了拉丁美洲文化。', '转变是进步的关键。', '这首诗表明，接受外来影响是进步的关键。']",1
