Unnamed: 0,question,subject,choices,answer
154,核聚变装置与核裂变装置有哪些不同之处？,security_studies,"['核聚变弹包括三个阶段，首先是通过内爆机制引发核裂变反应，随后导致核聚变反应。这种类型的武器称为热核或氢弹，以其巨大的破坏力而闻名。', '核聚变反应发生在两个较轻元素的原子核合并时，导致较重的元素分裂成更小的碎片。这个过程释放能量，其破坏能力有限，取决于所用材料的数量。', '核聚变装置通过两个阶段运行，其中一种炮式机制引发一系列核裂变反应，最终形成无限热能的高能爆炸闪光。', '核聚变炸弹具有精确的破坏效果。由核裂变反应形成的重元素及两个轻核的质量差转化为爆炸能量，可以精确计算。即使是多兆吨级的炸弹，在军事上也有无限的应用，其破坏力可根据目标量身定制。', '核聚变装置主要依赖于氢同位素之间化学反应所释放的能量，这些同位素被包含在金属外壳中，外壳通过电磁相互作用放大爆炸，提供一种可控且可持续的能量释放。']",0
155,变化的全球安全环境将以何种方式影响二十一世纪发展中的冲突性质？,security_studies,"['人类迁移将成为全球权力、财富和资源分配不均的结果。人口缺乏权力将引发竞争和暴力，导致跨境流动，而环境威胁和资源稀缺可能导致冲突。', '国家之间的经济联系将增强全球安全，减少全球范围内的冲突。尽管人类迁移可能导致过度拥挤和资源短缺，但这些问题将在大多数移民定居的发展中国家通过技术进步得到缓解。', '国际和地方层面的冲突将主要源于意识形态分歧，因为资源稀缺、人口增长和迁移将使不同群体更紧密地接触。', '国际安全的直接威胁，如全球经济危机，将优先于环境问题，导致原教旨主义意识形态和暴力的兴起。迁移将在现有全球经济框架内得到控制，尽管贫困将限制流动，并且由于缺乏权力和资源短缺，国际起义的风险较小。', '先进通信技术的出现将确保通过对话而非暴力解决冲突。随着全球互联性的增强，传统权力结构的影响将减弱，导致资源的更公平分配，迁移因冲突而减少。']",0
156,以下哪一项是对人类安全概念的常见批评？,security_studies,"['人类安全是一种新的殖民主义形式。', '人类安全支持全球资本主义的扩张。', '人类安全的范围过于广泛。', '以上所有选项。', '人类安全仅关注军事威胁。']",3
157,布赞的“社会安全”概念如何标志着对传统安全理解的偏离？,security_studies,"['确保国家的可持续发展依赖于将社会安全视为一个独立的优先事项，而不是其他领域（包括军事领域）的次要事项。', '冷战后，安全研究扩展到超越以现实主义和新现实主义为主的观点，对非军事安全方面的兴趣日益增加。倡导更广泛范围的人们将资源和环境等因素作为新的分析点。', '社会安全涉及维护传统的军事能力。军事威胁通过考虑基础设施、技术、人员以及军事安全的经济和政治基础来进行分析。', '全球化和社会冲突需要开发新的概念工具，将重点从国家转向其他实体。安全依赖于超越地理生存的因素，更加强调民族国家的生存而非国家的生存。', '社会安全主要关注一个国家的经济稳定，重点在于财政政策和国际贸易协议，以确保国家的繁荣。']",1
158,1994年由联合国开发计划署发布的《人类发展报告》在何种方式上挑战了传统的安全范式？,security_studies,"['该报告确定了人类安全的七个关键方面，这些方面值得增加政治关注和投资：经济安全、粮食安全、健康安全、环境安全、个人安全、社区安全和政治安全。', '该报告强调了传染病如艾滋病、结核病和疟疾在发展中国家的重大影响。', '该报告提出了一个人类安全框架，以解决传统安全研究中存在的失衡问题。', '以上所有选项。', '该报告将军事技术的进步作为实现人类安全的主要手段。']",3
159,全球不平等如何可能对全球安全构成威胁？,security_studies,"['全球不平等对人类安全构成风险，因为世界上很大一部分人口没有享受到全球化的好处。然而，这种不平等并未导致政治动荡或军事冲突。', '全球不平等导致边缘化群体对其境况不满，但他们没有权力或手段进行变革或抗议。', '有革命运动的可能性；被新自由主义全球化忽视的人可能会激进化，并抵制那些从这些失败的经济策略中获益的人。', '全球不平等不被认为是对全球安全的重大威胁。', '全球不平等加强了国际合作，因为各国共同努力解决差距，从而减少潜在的冲突。']",2
160,以下哪一项是“能源安全纽带”的重要结果？,security_studies,"['对全球南方能源资源的主导努力影响了大国如何维持联盟，而由此产生的地缘政治紧张局势影响了全球安全。', '所有这些选项。', '对能源生产和供应的共同关注迫使国际参与者进行对话，从而增加了国家间的合作。', '由于其理想的能源资源，全球南方国家在世界舞台上获得了影响力，有助于解决南北之间的差距和不平等问题。', '对可再生能源的关注消除了对传统地缘政治联盟的需要，导致国际紧张局势的减少。']",0
161,哪些因素促使了20世纪90年代跨国犯罪的扩展？,security_studies,"['跨国犯罪的增长是因为各国减少了国防开支和军事力量，使得非法活动显得风险较小。', '跨国犯罪的概念在学术界流行起来，与人类安全和弱势国家的发展联系起来，以帮助解决冲突并在欧洲建立和平。', '跨境犯罪活动一直存在，但由于情报和通信技术的进步，政策界对这些活动的兴趣增加，揭示了这些活动的广泛程度。', '全球化无意中为跨国犯罪的繁荣创造了机会，打开了这类活动的新领域。', '可再生能源技术的进步减少了对化石燃料的依赖，导致全球经济力量动态的转变，间接导致跨国犯罪的增加。']",3
162,全面的国家国防贸易控制系统的具体要素是什么？,security_studies,"['政府应在其法律框架中纳入关于军火贸易违规的法律、法规和处罚。', '政府需要确保国防制造商在其产品上标注一个独特的标识符。', '执法和军事单位必须对武器库存实施适当的安全措施，国家机构应监督过时或多余武器的收集和销毁。', '所有这些选项。', '政府应优先考虑国际合作而不是国家法规来控制国防设备的贸易。']",3
163,精英们有哪些内部安全政策选项可用？,security_studies,"['精英们通过使用再分配来排除他人掌权来设立不支持政权的惩罚。这可能涉及重新分配资源、解除武装团体并限制进入贸易路线。', '由于能力有限和缺乏广泛支持，弱国的领导人通常依赖武力。然而，他们面临军队可能对其权威构成威胁的挑战，这导致他们有意削弱军事力量。', '精英们努力创造一种新的身份认同，在这种身份认同中，种族联系被政权中心的意识形态所取代。', '弱国寻求其他国家的支持，并开始民主改革以获得内部民众的支持并改善其国际地位。', '精英们优先考虑技术创新和经济增长而非内部安全措施，相信一个繁荣的经济自然会导致一个更稳定和安全的社会。']",1
164,后结构主义批判在安全研究中有什么价值？,security_studies,"['帮助我们理解传统安全叙事忽视的政治身份如何运作。', '比标准分析更深入地探讨权力的基础和形成。', '质疑先进技术和智能武器是当今塑造安全的主要因素的观点。', '以上所有。', '建立一个分析所有安全威胁的明确框架。']",3
165,在当代网络安全中，指代对象是什么？,security_studies,"['数字化的机密数据', '重要的数字基础设施', '政府计算机网络', '通信系统', '个人社交媒体资料']",1
166,20世纪80年代和平研究的重要性是什么？,security_studies,"['和平研究涉及多个学科，并具有政治驱动性，直接负责为主要政治力量提供答案。', '与传统大学的国际关系学不同，和平研究面临着解决相关问题和提供迅速政策解决方案的重大压力。', '尽管不直接负责政策，欧洲安全研究由于和平运动引发的安全问题关注增加而变得具有政治意义。', '背景是由政治理论作为主要学科所塑造，同时与其他各领域的理论发展保持独立。', '20世纪80年代的和平研究主要关注经济发展和贸易关系，作为实现长期国际稳定的一种手段。']",2
167,哪个陈述最能描述自由主义者对国际组织的态度？,security_studies,"['自由主义主张国际组织可以加强国家和全球安全。它支持非政府组织和其他实体的参与，以促进合作和建立社区。', '自由主义者认为通过合作来改善安全的观点受到国际组织（如国际联盟）在阻止全球冲突方面缺陷的挑战。', '在自由主义的各个分支中，有一个共同的信念，即国际组织在政治上的存在最终削弱了安全，因为它们将权力从国家作为单一行为体中夺走。', '以上所有选项。', '自由主义将国际组织视为不必要的实体，它们使国际关系复杂化，并更倾向于将双边协议作为国家间合作的主要手段。']",0
168,以下哪些原因可能影响一个国家决定加入像北约这样的联盟？,security_studies,"['更有影响力的国家可能会结成联盟以保护实力较弱的盟国。', '如果一个国家觉得自身的能力不足以独立保卫其独立性和安全性，它可能会选择加入一个联盟。', '当一个可能的主导国家对该地区的其他国家构成威胁时，联盟可能会对国家变得具有吸引力。', '所有这些选项。', '国家可能会加入联盟，以通过更强的外交关系增加其贸易机会和经济增长。']",3
169,在当代背景下，和平研究如何被最佳定义？,security_studies,"['自冷战结束以来，和平研究已发展成为一个独立和自给自足的领域，解决诸如冲突解决、经济安全以及在全球和本地范围内减少暴力等问题。它与发展研究和国际关系区别开来。', '和平研究的特点是专注于寻找和平解决冲突的方法。该领域的研究人员使用“自上而下”的方法，专注于与暴力相关的问题，旨在将关键参与者作为安全的焦点。', '由于研究重点的不断变化和涵盖广泛的主题，和平研究无法被限定为单一的学术方法。然而，在冷战之后，该领域的成功在其众多研究中心和吸引全球跨学科兴趣中得到了体现。', '和平研究专注于理解国际关系问题的根本原因，采用全球视角，运用跨学科方法，寻求和平变革，应用分析和规范性方法，并使用多层次分析将理论与实际研究相结合。', '和平研究主要关注军事战略的历史发展和战争技术的演变，以理解和防止未来的冲突。']",3
170,对人权的关注如何影响以人权为导向的自由主义学派？,security_studies,"['当代关注人权的自由主义强调自治的重要性。', '以人权为中心的自由主义方法可能支持国家的分裂，如果认为这样可以避免不可避免的暴力和冲突。', '这种自由主义版本集中在面临经济困难、性别和性别歧视、宗教不宽容和政治压迫等问题的个人。', '以上所有选项。', '以人权为重点的自由主义优先考虑经济增长而非个人自由。']",3
171,弱国面临的“安全困境”是什么？,security_studies,"['当一个国家无法维持稳定时，社会内部的不同群体争相确保自身安全，导致持续的不安全状态。这创造了一种持久的混乱状态，因为试图保障政权反而导致反对力量增加。', '弱国的不安全困境在很大程度上是一个外部问题，类似于无政府状态。当一个弱国试图在地区中提升地位时，它无意中导致了该地区的不稳定。', '弱国的困境源于内部竞争，社会群体努力保护自身利益。同时，统治精英对这些斗争保持疏离，这创造了政策挑战；使用武力恢复秩序可能削弱政权的核心基础设施。', '弱国的不安全源于缺乏集中的政治和制度力量。虽然部署武装力量可能加强机构，但如果不能建立强烈的国家认同感，可能导致持续的动荡和局部无政府状态。', '弱国的安全困境主要源于地缘政治联盟。通过与强国结盟，弱国可以有效缓解内部问题并稳定其政治环境，而无需解决根本原因。']",0
172,自《人类发展报告》以来，下列哪些理念已成为人类安全的主流趋势？,security_studies,"['仅将安全分析限制在军事行动上是不够的。', '安全的概念是开放解释的。', '仅通过暴力冲突的视角关注安全是有限的。', '以上所有选项。', '人类安全主要关注传统的国家主权问题。']",3
173,以下哪些安全领域与能源安全密切相关？,security_studies,"['金融和发展安全。', '政府稳定和全球安全。', '生态和社会安全。', '所有这些选项。', '技术进步和创新。']",3
174,弱国可能会以哪些方式受到外部挑战？,security_studies,"['强国可以使用外交手段来施压弱国遵循国际规则。这些手段可能包括实施经济制裁和停止军火交易，这可能削弱国家的财政稳定或军事供应，可能导致军队内部不满并增加政变的可能性。', '小型武器的扩散对弱国构成威胁，因为这些武器可以用来挑战国家权威。这类武器通过合法和非法途径都很容易获得，并且在由军阀、犯罪集团和私人武装控制的地区广泛存在。', '弱国无法避免全球化的影响，这导致边界更加开放和移民增加。为了在全球化经济中保持竞争力，这些国家通常寻求国际机构的贷款或援助。然而，这种依赖可能会削弱国家的主导意识形态并模糊社会身份，使国家更难维持其意识形态影响。', '所有这些选项。', '由于气候变化，弱国可能面临外部挑战，因为海平面上升可能导致领土损失。这种环境威胁可能促使国际社会干预以重新安置受影响的人口，从而可能削弱该国的主权。']",3
175,以下哪项是关于海登诺索尼邦联的《大和平法》的正确描述？,security_studies,"['《大和平法》强调了忽视持续批判性分析的问题。', '《大和平法》的例子展示了质疑研究方法以及知识如何产生的重要性。', '《大和平法》通过提供一种成功的替代方案来挑战传统的安全研究，这种替代方案不以国家为中心。', '以上皆是。', '《大和平法》主要关注海登诺索尼与欧洲定居者之间的经济贸易协议。']",3
176,如何解释美国和欧洲安全研究之间的不同关系？,security_studies,"['对安全含义的不同视角：在欧洲，安全更多是关于研究者自我反思，而在美国，则更多是一种定义术语的基本必要性。', '对重要知识类型的不同看法。美国倾向于理性主义，专注于因果分析，而欧洲则更具反思性，考虑更广泛的意识形态因素。', '在美国，主要理论要么集中于其自由主义主导地位，要么集中于在一个由于假定的单极性而难以实现平衡的世界中的基于力量的稳定性。', '所有这些选项。', '气候变化政策的影响，美国和欧洲的策略主要由环境而非安全问题驱动。']",3
177,以下哪一项不构成社会建构主义的基本本体论原则？,security_studies,"['规范性或观念性框架是重要的，并且可能与物理框架同等有影响力。', '身份的重要性不容忽视。', '无政府状态的概念是全球关系中不可避免的方面。', '代理人与结构之间的关系是相互创造的。', '社会建构主义在解释社会现象时严重依赖生物决定论。']",2
178,以下哪些事件可被视为促成20世纪60年代和70年代环境安全出现的因素？,security_studies,"['从20世纪70年代开始，一些学者开始挑战传统的安全理念和方法，指出其未能解决对国家和全球安全构成威胁的环境问题。', '人们越来越意识到环境变化不仅威胁自然生态系统，还威胁人类福祉。', '发展中国家开始经历集体环境意识的觉醒。', '所有这些选项。', '20世纪60年代的快速工业化导致人们更关注经济发展而非环境问题。']",3
179,以下哪一项不是自由主义方法的所谓局限性？,security_studies,"['自由主义难以明确界定何种情况下军事干预是正当或必要的。', '自由主义常常自相矛盾，这限制了其作为实用指南的价值。', '它忽视了多样化参与者在塑造国际政策决定中的重要性。', '自由主义理想主要反映了西方势力，这可能会削弱其未来的重要性。', '自由主义未能认识到经济相互依赖对国际稳定的影响。']",2
180,环境在多大程度上以及在何种效果下被安全化？,security_studies,"['通过将环境安全问题作为优先事项，国际和国家安全政策制定者和组织对其重要性有了更高的认识。现在普遍接受环境变化可以被视为重要的安全问题。', '环境安全导致资源重新分配，优先考虑环境问题而非军事问题。人们高度关注将环境变化与潜在冲突联系起来，并解决各种原因产生的威胁，而不仅仅是国内原因。', '环境问题被定位为关键的政治关切，提高了其在决策者中的重要性。然而，尽管关注度增加，但在改变政策或行动以保护环境安全方面进展甚微。', '从国家安全的角度看待环境问题削弱了环境安全概念的有效性。对军事方面的强调阻碍了政策制定者解决环境问题的真实性质及其对社会脆弱性的影响。平衡环境安全与国家利益和全球变化的挑战在不损害国家安全利益的情况下是困难的。', '环境问题的安全化主要导致了公众意识的提高和草根运动的兴起，这些运动有效地迫使政府彻底改革现有的安全政策，专注于环境保护。']",2
181,以下哪一项定义了军事革命？,security_studies,"['内部军事接管，罢免现有领导人。', '战争方法和理解的彻底变革。', '突破性的技术突破，如核武器的发明。', '改变战争核心性质的关键技术创新。', '战略性地重新分配军事资源以提高效率和效能。']",3
182,以下哪个短语在RMA的新术语中不太可能表明合法性？,security_studies,"['精心策划的攻击', '随机攻击', '制导导弹', '定点打击', '精确打击']",1
183,以下哪个概念不属于网络安全的技术讨论内容？,security_studies,"['企业网络', 'IT专家', '杀毒行业', '计算机网络', '加密算法']",0
184,以下哪一项不是后殖民主义识别出的三种暴力形式之一？,security_studies,"['身体暴力', '知识暴力', '系统性暴力', '普遍性暴力', '文化暴力']",3
185,“人类安全”概念在我们对安全研究的理解中扮演了什么角色？,security_studies,"['人类安全的理念在安全研究领域的学者和政策制定者中一直难以获得认可。对于人类安全作为一个概念在政治和学术上的重要性，普遍缺乏承认。', '人类安全在20世纪90年代中期获得了显著关注，引起了对关键问题的关注。尤其是，它强调了国家内部的暴力问题，这在冷战后成为安全研究的主要焦点。', '人类安全并没有削弱传统的以国家为中心的保护国家免受外部军事威胁的观点。然而，它揭示了国家中心现实主义的不足，因为它未能解决国内个人的安全问题。', '人类安全已经成为理解现代安全研究的主要框架。自冷战结束以来，对国家安全的关注被认为是过时的，现在普遍认为安全应该优先考虑国家内的个人。', '人类安全主要关注国家的经济增长，并优先发展大型基础设施项目以确保国家繁荣。']",2
186,如何评估学术机构化的时期？,security_studies,"['战略研究成为一个专门领域，主要在美国发展，然后引入欧洲，欧洲的方法被视为次于已建立的理论。', '智库开始关注具体技术问题，导致方法狭窄，尤其是在威慑的基础思想变得不那么连贯时，失去了战略深度。', '和平研究走上了一条独立的道路，其批判性方面被其倡导者和安全研究参与者视为与安全研究不同。', '所有这些选项。', '在线学习平台的兴起削弱了学术机构在战略研究中的传统角色，导致知识的去中心化和缺乏标准化的方法。']",3
187,证券化的过程是如何完成的？,security_studies,"['证券化发生在一个问题尚未成为政治议程的一部分时，变得政治化，需要政府介入。这涉及政策制定、资源分配和集体治理。', '当某个问题位于正常政治领域之外时，一个证券化的行为者可以推动将其视为安全问题。即使尚未成为公共讨论话题，生存威胁也可以被提升为国家关注的问题。证券化涉及在威胁出现在政治讨论之前承认它的存在。', '证券化意味着将问题从标准政治背景移至超出通常决策过程的更激烈的政治层面。一旦超出典型政治考虑，它就成为国家利益问题，无法轻易回到公共辩论中。', '当一个问题从政治化转变为证券化时，可以被框定为安全问题。在证券化过程中，行为者使用言辞说服观众该问题的紧迫性和重要性，将其描绘为对特定目标的生存威胁。', '证券化是根据经济影响对问题进行分类的过程。它涉及分析市场趋势和财务数据，以确定一个问题是否应提升为需要立即干预的关键经济关注。']",3
188,弱国的安全困境是否是不可避免的条件？,security_studies,"['打击恐怖主义，特别是全球反恐战争，通过将全球的关注和资源集中在解决不安全问题上，对国家建设进程产生了积极影响。这包括努力解决导致恐怖主义的各种因素，如控制武器扩散。', '国际上对弱国不安全问题的关注度不高，解决这一问题的尝试主要限于推动自由民主和自由市场资本主义。目前，通过条件、政权更迭或和平建设努力等方式强加的新自由主义策略，没有一个成功将弱国转变为强国。', '自由改革的缺点使得国家之外的其他政治结构显得更具可行性。次国家实体为那些长期受武器扩散和贫困困扰的地区提供了实际解决方案，而区域组织为非洲和拉丁美洲等地区提供了可持续的框架。', '弱国正经历漫长而艰难的历程以成为有效国家。作为长期安全战略的一部分，它们采取了多党制、经济自由化及加入国际社会等措施来减轻不利影响。', '国际社会通过增加军事干预和实施严格制裁，成功解决了弱国不安全问题，这导致这些国家的政治和经济机构得以快速发展。']",1
189,在国际关系中，现实主义与社会建构主义在身份理论化方面有何不同？,security_studies,"['社会建构主义在研究国际关系时采用因果理论，并强调身份是社会建构的产物。相反，现实主义认为国家在国际舞台上的行为遵循可预测的“行动-反应”框架。', '现实主义将身份视为国际关系中的一个关键因素，认为身份会影响国家的行为。', '现实主义基于因果原则，而社会建构主义则专注于基于共同意义的身份理论。', '社会建构主义者将国家视为一个独立实体，其行为由国际环境的要求决定，而现实主义者则认为国家互动是身份发展的自然结果。', '现实主义和社会建构主义都优先考虑国家的经济能力，而不是身份，认为经济实力是决定国家在国际关系中行为的主要因素。']",2
190,HM在冷战期间及之后是如何发展的？,security_studies,"['在冷战之后，安全研究的分析方法与HM之间的差距越来越大，HM被边缘化，并未纳入主要学术研究的重点。', 'HM在冷战期间获得了普及，随后逐渐融入安全讨论，现在被认为是安全研究中的关键框架之一。', '冷战期间对HM的负面看法限制了其影响力，使其未能进入主流安全研究。然而，随着安全研究范围的扩大，HM越来越被认为是一个重要的研究领域。', 'HM作为一种研究安全的方法是在冷战后建立的，并在随后的安全环境中蓬勃发展。其成功得益于与冷战期间有影响力人物的关联。', '冷战结束导致HM在安全研究中的相关性下降，因关注点完全转向经济和环境问题，使得HM在当代讨论中几乎没有角色。']",2
