Unnamed: 0,question,subject,choices,answer
144,"Transformed scores increase the interpretability of raw scores and allow comparison to the rest of the distribution. From your knowledge about Transformed Scores, which statement is not about the Z SCOREs?",professional_psychology,"['scores expressed in terms of standard deviations', 'the result of subtracting the mean from a score and dividing by the standard deviation', 'allows for comparisons across various tests and metrics', 'indicates how many standard deviations a score is from the mean']",3
145,Research on women who have had abortions indicates that,professional_psychology,"['later issues with sexual adjustment and interactions with men are often encountered', 'the majority of women who undergo abortions give the event no more thought than they would to having a wisdom tooth extracted', 'the mental effects are no more severe than those experienced by women who decide to continue their pregnancies and deliver', 'the event often leads to significant psychological effects, typically manifesting as guilt and depression']",2
146,"A psychologist emphasizes that parents should use appropriate consequences when dealing with their childrens misbehavior. In addition, the psychologist explains that the goal of misbehavior can be to confirm an assumed disability, or to get attention, power, or revenge. Which of the following theoretical orientations is being used",professional_psychology,"['The Rogerian approach', 'The method of transactional analysis', 'The Adlerian perspective', 'The psychodynamic theory']",2
147,"When the corpus callosum is cut in a right-handed patient, often the patient",professional_psychology,"['is unable to perform well-learned motor skills using the left hand', 'Cannot identify objects placed in the right hand even if they are visible to the patient', 'is unable to identify objects placed in the left hand when they are not visible to the patient', 'exhibits a reduction in verbal intelligence']",2
148,Gestalt therapy is designed to achieve integration of,professional_psychology,"['patterns of motivation and patterns of habit', 'thinking, emotions, and behavior', 'previous, current, and upcoming', 'external processes as well as internal ones']",1
149,"If a researcher implemented a brief motivational interviewing intervention to increase client motivation in the hopes that increased motivation would lead to lower levels of problem alcohol use, motivation would be a ___________.",professional_psychology,"['Facilitator', 'Intermediary', 'Control variable', 'Threat to construct validity']",1
150,How do institutional constraints affect behaviour?,security_studies,"['Institutional constraints restrict the resources that can be allocated to a certain good and compel individuals to decide how to manage the scarce wealth they possess.', ""Institutions represent the societal norms and expectations that influence an individual's objectives and aspirations."", 'Institutional constraints are exemplified by state mechanisms such as schools, prisons, and hospitals; supplying resources for these institutions places demands on political figures.', 'Institutions are constraints created by humans that organize human interactions; they are man-made rules that direct decision-making and regulate behavior.']",3
151,To what extent have biological agents been weaponized?,security_studies,"['Military experts assert that most biological agents can maintain their stability enough to be utilized as weapons. The resources needed are minimal since equipment used for vaccine production can be repurposed for military use, and only small amounts of the agent are necessary to create highly lethal impacts, making them both efficient and effective weapons.', ""Developing methods to deploy biological weapons in warfare has concentrated on using vectors like lice, fleas, or mosquitoes to spread the agents as military weapons. These vectors are preferred because they make it challenging for the target to control the outbreak source, thereby straining the target nation's infrastructure."", ""Biological agents include bacterial, viral, and toxin agents. However, not all diseases can serve as the foundation for a successful biological weapon. Factors such as an agent's storage, delivery method, transmission mode, and resilience can influence its impact on a target population."", 'Vaccination programs against naturally occurring diseases have eliminated the potential for viral agents to trigger a global pandemic. The ability to vaccinate has weakened the arguments for turning viral agents into weapons, as most public health organizations have plans to manage a possible outbreak.']",2
152,In what ways can a distinction be made between limited force and full-scale force?,security_studies,"['Differentiating between limited force and full-scale force is the second aspect of coercive diplomacy. Coercive diplomacy is deemed unsuccessful if the coercer does not meet its specified objectives and fails to overcome its opponent in the second phase.', 'Typically, the difference between brute and limited force is minimal. Utilizing air or naval power offers a coercive capacity equivalent to that of a traditional ground attack. Military action is always a consequence of negotiation failures and a transition from diplomatic efforts to military engagement.', ""The distinction between limited force and brute force is significant because the level of force applied to achieve the coercer's goals determines the type of result obtained. If a favorable policy result is secured, it indicates that limited force has been used."", 'The difference between limited force and full-scale war is vital because resorting to brute force signifies a failure of diplomacy. This distinction is not about the quantity or type of force, but rather the intention behind the use of force and the degree of choice left to the adversary. Essentially, limited force serves as a tool for negotiation.']",3
153,Which of the following was not stated as an objective of the Commission on Human Security when it was launched?,security_studies,"['To enhance public comprehension, involvement, and backing for human security along with its fundamental requirements.', 'To refine the human security concept as a practical instrument for the creation and execution of policies.', 'To suggest a specific plan of action to tackle significant and widespread threats to human security.', 'To establish a novel international justice system aimed at strengthening human security.']",3
154,In what ways is a fusion nuclear device different from a fission device?,security_studies,"['A fusion weapon is a type of three-stage bomb that employs an implosion mechanism to initiate a fission reaction, which subsequently triggers a fusion reaction. This weapon is commonly known as a thermo-nuclear or hydrogen bomb and possesses limitless destructive power.', 'A fusion reaction occurs when the nuclei of two light elements merge, leading to the formation of heavier elements that then break into smaller parts. This process releases energy with limited destructive capacity, with the amount of energy released depending on the mass of the material involved.', 'A fusion device involves a two-stage process where a gun-type mechanism initiates a series of fission reactions, ultimately resulting in a high-energy flash explosion with limitless thermal energy.', 'Fusion weapons have a very specific destructive impact. The heavier element produced from a fission reaction, combined with the mass difference from the two lighter nuclei (converted into an energy explosion), can be precisely calculated. Even bombs in the multi-megaton range have unlimited military applications, as their destructive power can be tailored to the target.']",0
155,In what ways will the changing global security environment shape the nature of developing conflicts in the twenty-first century?,security_studies,"['Human migration will occur due to global disparities in the allocation of power, wealth, and resources. The disempowerment of populations will result in competition and violence, expressed through transnational movements; moreover, environmental threats and resource scarcity will cause conflict.', 'Economic interdependence among states will enhance global security and reduce international conflict. Human migration will result in overcrowding and resource shortages, but technological advancements in developing nations, which will receive the majority of migrants, will address these issues.', 'The main reason for conflict, at both international and sub-national levels, will stem from ideological differences between groups as resource scarcity, population growth, and human migration bring diverse identity groups into closer proximity.', 'Environmental issues will be eclipsed by urgent threats to international security, caused by a global economic crisis and the subsequent rise of fundamentalist ideologies and violence. Human migration will be managed within the existing global economic framework, as poverty limits mobility, though there remains a slight risk of transnational revolt due to disempowerment and resource scarcity.']",0
156,Which of the following is a common criticism of the human security concept?,security_studies,"['Human security represents a form of neo-colonialism.', 'Human security supports the expansion of global capitalism.', 'Human security is overly inclusive.', 'All of the above options.']",3
157,How does Buzan's concept of 'societal security' mark a departure from traditional understandings of security?,security_studies,"['Ensuring the sustainable development of the state relied on societal security as an independent interest, which was not subordinate to or reliant on other sectors, including the military.', 'The conclusion of the Cold War enabled security studies to expand beyond the limits of the prevailing realist and neorealist viewpoints, with a growing interest in other, non-military, notions of security. Proponents of a broader scope for security studies urged the inclusion of resources, the environment, and other referent points for analysis.', 'Societal security pertained to the sustainable development of traditional military capability patterns. Military threats could be broken down to include infrastructural strength, technology, personnel, and the economic and political foundations of the military security sector.', 'Modern globalization processes and societal conflicts necessitated the development of new conceptual tools that went beyond the state as the referent object. Security depended on factors beyond geographically defined survival: the survival of the nation (ethnic) state took precedence over the survival of the state.']",1
158,"In what ways did the Human Development Report, published by the United Nations Development Program in 1994, challenge the traditional security paradigm?",security_studies,"['The report identified seven key areas or components of human security that should receive increased political focus and resources from policymakers: economic security, food security, health security, environmental security, personal security, community security, and political security.', 'The report emphasized the significant impact that infectious diseases still have in the developing world, including HIV/AIDS, tuberculosis, and malaria.', 'The report supports a human security analysis framework designed to address the perceived imbalance in security perspectives that has dominated traditional security studies.', 'All of these options.']",3
159,How might global inequality present a threat to global security?,security_studies,"[""Global inequality poses a threat to human security because a portion of the world's population does not benefit from globalization. Nonetheless, this inequality does not lead to political instability or result in military conflict."", 'The disparity on a global scale results in marginalized groups who are dissatisfied with their conditions but do not have the means to revolt or demonstrate.', 'There is a likelihood of revolutionary uprisings; individuals worldwide who have been marginalized by neoliberal globalization might become radicalized and rise up against those who have gained from the economic policies that have let them down.', 'Global inequality is not a substantial threat to worldwide security.']",2
160,Which of the following is an important outcome of the 'energy security nexus'?,security_studies,"['Attempts to control energy resources in the South affect the durability of cooperation among major powers; the rise of geopolitical competitions over this control affects global security.', 'All of these choices.', 'Driven by shared concerns about the extraction and distribution of energy resources, international players are compelled to negotiate, leading to increased cooperation between nations.', ""Due to their energy resources, which the global 'North' seeks to access, countries in the 'South' gain influence in the international sphere and have addressed the global North-South disparity and related inequalities.""]",0
161,What factors enabled the expansion of transnational crime (TNC) in the 1990s?,security_studies,"['The rise of transnational crime can be attributed to decreased defense spending and the disbanding of armies, which lowered the threat of such activities.', 'The idea of transnational crime (TNC) emerged in academic discussions, connected to concerns about human security and development in fragile states, serving as a means for conflict resolution and peacebuilding in Europe.', ""Transnational criminal activities have been a constant element in the global system. The policy sector's growing interest in TNC is driven by advancements in intelligence and communication technologies, which have allowed for a clearer understanding of the magnitude and extent of the issue."", 'Global trends like globalization might have inadvertently created new opportunities for the growth of transnational crime.']",3
162,What are the specific elements of a comprehensive national defence trade control system?,security_studies,"['Governments ought to incorporate laws and penalties for breaches into their regulations on the arms trade.', 'Governments must make sure that defense manufacturers label their weapons with a distinct identifier.', 'Police and military forces should implement proper measures to secure weapon stockpiles, and national authorities are responsible for the collection and destruction of obsolete, outdated, and surplus weaponry.', 'All of these options.']",3
163,What internal security policy options are available to elites?,security_studies,"[""Elites generate negative incentives for those who do not support the regime. Redistribution serves as a method to deny power by 'elite disenfranchisement,' which might involve diverting resources, disarming, and blocking access to commercial pathways."", 'Due to a lack of infrastructure and broad social legitimacy, elites in weak states often resort to using coercive power. Nonetheless, a major issue is that these violent tools can threaten the regime itself, necessitating the intentional weakening of the armed forces.', ""Elites strive to promote a new political identity where ethnic awareness is replaced by ideologies centered around the regime's mythology."", 'Weak states have developed international backing and have begun democratic reforms to secure internal popular legitimacy while strengthening their external international legitimacy.']",1
164,What is the value of a post-structuralist critique in security studies?,security_studies,"['To help us comprehend the mechanisms of political identities that are excluded from conventional security discussions.', 'To explore the foundation of power and how it is constructed, more thoroughly than traditional analysis.', 'To question the notion that advanced weapons and technology are the primary agents defining security today.', 'All of these.']",3
165,What is the referent object in contemporary cyber-security?,security_studies,"['Sensitive data that is stored in digital form', 'Essential systems and assets related to information technology', 'IT systems managed by the government', 'Networks used for communication purposes']",1
166,What was the importance of peace research during the 1980s?,security_studies,"['The study of peace was an interdisciplinary field with a political focus, directly accountable for policy implications to the main powers within the political system.', 'Unlike university-level international relations, peace research faced considerable pressure to address pertinent issues with an expectation for immediate policy solutions.', 'While there was a detachment from direct policy responsibility, European security studies became politically significant due to the increased political focus on security issues during the period influenced by the peace movement.', 'The environment was shaped by political theory as the leading discipline while being disconnected from theoretical developments in other academic fields.']",2
167,Which statement best describes the liberalist attitude towards international organisations?,security_studies,"['Liberalism posits that international organizations can bolster both national and global security. It supports the engagement of non-governmental organizations and other entities to promote collaboration and foster community building.', 'The liberalist belief that cooperation enhances security is challenged by the inability of international organizations like the League of Nations to prevent worldwide conflicts.', ""Within the various schools of liberal thought, there is a broad agreement that the participation of international organizations in the political arena ultimately weakens security by reducing the state's power as a single entity."", 'All of these options.']",0
168,Which of the following reasons might influence a state's decision to join an alliance such as NATO?,security_studies,"['Stronger states might form alliances to offer protection to weaker allied states.', 'Countries may consider joining an alliance if they find their own resources insufficient to uphold their sovereignty and ensure their security.', 'An alliance may become appealing to countries when a potential dominant power poses a threat to other states within the system.', 'All of the above choices.']",3
169,"In the contemporary context, how can peace studies best be defined?",security_studies,"['After the expansion of peace studies following the end of the Cold War, the field has become an independent and self-sufficient area of study that tackles issues related to conflict resolution, economic security, and the halting of violence on both international and sub-national scales. As a research discipline, peace studies are best characterized by their differentiation from development studies and international relations.', ""Peace studies are most accurately characterized by their research focus on identifying non-violent methods to resolve conflict. Peace researchers utilize a 'top-down' strategy for conflict resolution that emphasizes issues related to violence and the use of force, concentrating on initiating agents to ensure that these actors become the central objects of security."", 'Peace studies cannot be classified as a distinct academic approach due to the ever-changing nature of its research focus and the wide array of interests pursued by peace researchers. However, since the Cold War, the field has gained such success that it now includes numerous research institutes and draws global and interdisciplinary interest.', 'Peace studies are defined by an interest in the root causes of phenomena in international relations, a global perspective, an interdisciplinary methodology, the pursuit of non-violent change, an analytical and normative approach, and the application of multi-level analysis that bridges theory and practice in research.']",3
170,How does the preoccupation with human rights affect the human rights orientated school of liberalism?,security_studies,"['Contemporary liberalism focused on human rights emphasizes the importance of self-governance.', 'Liberalism guided by human rights principles will support separation when it seems that conflict and bloodshed can only be avoided through such means.', 'Liberalism that is oriented around human rights is especially attentive to individuals who face economic, sexual, gender, religious, or political persecution, discrimination, or deprivation.', 'All of these options.']",3
171,What is the 'security dilemma' that faces weak states?,security_studies,"['When the state fails to ensure stability, it leads to a scenario where different parts of society compete to maintain their welfare, resulting in insecurity. This situation sustains itself, creating a nearly constant state of emerging chaos, as efforts to secure the regime incite more resistance.', 'The weak state insecurity dilemma is largely an external issue, creating circumstances for the weak state akin to structural anarchy, where a weak state induces insecurity in the region while attempting to enhance its own standing in the area.', ""The weak state insecurity problem arises from the competition among societal components to ensure and safeguard their long-term interests and well-being. Nonetheless, the ruling elite remain detached from the social arena of conflict, creating a policy challenge: using the monopoly on violence to restore order will diminish the regime's core infrastructure."", ""Weak state insecurity issues stem from a lack of central political and institutional control with a monopoly on force. However, deploying armed forces to bolster institutions might halt this process. The failure to establish 'stateness' is countered by the use of violence. Social unrest becomes a nearly constant state of emerging but undeveloped chaos.""]",0
172,Which of the following ideas have become mainstreamed within human security since the Human Development Report?,security_studies,"['Restricting security analysis solely to military engagement is overly limiting.', 'The concept of security is open to debate.', 'Concentrating solely on violent conflicts when considering security is too narrow.', 'All of these options.']",3
173,Which of the following security sectors are intrinsically linked with energy security?,security_studies,"['Security related to economic growth and development.', 'The stability of governments and global safety.', 'Protection of the environment and the well-being of people.', 'All of the above choices.']",3
174,In what ways may weak states be challenged externally?,security_studies,"[""Mighty nations might use diplomatic influence to compel weaker countries to adhere to international standards. This could include economic sanctions and the suspension of arms deals, which weakens the state's capacity to finance or equip its military, thereby raising the possibility of military dissatisfaction and potential coups."", 'The spread of small firearms poses a threat to weak nations as they can be utilized to challenge state authority. Light and small arms are accessible through both legal and illegal means and are widespread in areas dominated by warlords, criminals, and private militias.', 'Weak countries cannot avoid the impacts of globalization. Borders that are increasingly open lead to migration and immigration. To compete in a global market, these countries seek financial-credit support or aid from international bodies. However, these processes dilute the dominant notion of the state, blurring societal identity and making it challenging for the state to maintain its ideological influence.', 'All of these options.']",3
175,Which of the following are true of the Great Law of Peace of the Haudenosaunee Confederacy?,security_studies,"['The Great Law warns academics about the issue of not maintaining critical analysis.', 'The example of the Great Law highlights the necessity of critically examining research practices and the production of knowledge.', 'The Great Law poses a challenge to conventional security studies because it exemplifies an effective non-state strategy.', 'All of these.']",3
176,In what ways can the different relationship between US and European security studies be explained?,security_studies,"[""The distinct approach to the idea of security: in Europe, the discussion remains a part of the intellectual self-examination of academics who study security, while in the US, the concept of security is often reduced to merely a 'define your terms' exercise."", 'The differing views on the specific type of knowledge deemed important. The US leans towards rationalism, whereas Europe leans towards reflectivism. In the US, discussions in security studies often involve testing hypotheses through cause-and-effect relationships, incorporating them into broader debates, and evaluating ideational variables.', ""In the US, major competing perspectives highlighted either the US's liberal dominance or the stability enforced by sheer power in a presumed unipolar world where balancing becomes unfeasible."", 'All of these options.']",3
177,Which of the following does not constitute a fundamental ontological principle of social constructivism?,security_studies,"['Normative or ideational frameworks are significant and hold as much, if not more, importance than physical structures.', 'Identities hold significance.', 'Anarchy is an unavoidable aspect of the international system.', 'Agents and structures are interdependently formed.']",2
