Unnamed: 0,question,subject,choices,answer
0,"A rider entered a subway car at the 42nd Street station. Because all of the seats were occupied, the rider stood in the subway car and grabbed a pole to secure his balance. As the subway car was proceeding downtown, the rider glanced at a girl standing next to him. Suddenly, the subway car made an unexpected stop. The rider momentarily lost his balance and grabbed the girl around the waist (to avoid falling). Once the rider regained his balance, he removed his hands from the girl's waist and grasped the pole again. In a civil action instituted by the girl against the rider, he will most likely be found",professional_law,"['responsible for battery.', 'responsible, because the rider thought the girl agreed to the contact given the situation.', ""not responsible, because the rider's actions were deemed appropriate by societal standards under the circumstances."", 'not responsible, because the girl did not suffer any harm from the contact.']",2
1,"A mother took her five-year-old child to a hospital emergency room for treatment. A doctor on the hospital staff molested the child while treating her. At the time, no one was in the treatment room except the doctor and the child; the mother had left the room to get a cup of coffee. Two weeks later, when the child told her mother what had occurred in the treatment room, the mother suffered severe emotional distress that caused her to become physically ill. In an action against the doctor by the mother on her own behalf to recover for intentional infliction of emotional distress, is the mother likely to prevail?",professional_law,"['No, because the mother was partly at fault for leaving the child unattended with the doctor during the procedure.', ""No, because the mother was neither directly harmed by the doctor's actions nor did she witness them happening."", ""Yes, because the doctor's behavior was egregious."", ""Yes, because the distress experienced by the mother was a predictable and natural outcome of the doctor's actions.""]",1
2,"A wedding planner owned a summer cottage on the lake. In order to facilitate the access to the cottage, which is located on a knoll above the lake, the wedding planner entered into an agreement with a neighbor, an adjoining land owner, whereby the neighbor, in writing, granted the wedding planner a right-of-way over a strip of land 30 feet in width and a quarter of a mile in length along the eastern margin of the neighbor's property. Without notif'ing the neighbor, the wedding planner proceeded with his plan to improve the roadbed by having the road asphalted in order to make it more accessible for motor vehicle traffic. Several years later, the neighbor started a sand business, which required him to do heavy hauling that subsequently destroyed the asphalted surface on the road. Ten years after the neighbor started his sand business, the wedding planner sold his lakefront property to an artist. Shortly after the artist took possession of the cottage and property, the neighbor erected wooden barriers across the roadway, thus obstructing the access to the artist's property. The interest that the wedding planner acquired in the access road may best be described as",professional_law,"['a personal easement.', 'an easement that is assumed due to previous usage.', 'an easement required for access.', 'a clearly stated easement.']",3
3,"A plaintiff has sued a defendant in a court of the state in which both parties reside. The plaintiff alleges only a cause of action arising under a federal statute, although state law provides a similar cause of action. The federal statute provides that claims under the statute can be brought in any court of competent jurisdiction. The statute has not yet been interpreted by any federal court. Should the state court hear the case?",professional_law,"['No, because cases involving federal law must be resolved in a federal court.', 'No, because state courts are required to wait in cases involving federal law until a federal court has addressed the federal matter.', 'Yes, because state courts are not allowed to show bias against cases that pertain to federal law.', 'Yes, because the parties are unable to proceed in federal court as there is no diversity of citizenship.']",2
4,"A manager's competitor sent a defamatory letter to the manager accusing him of professional incompetence and calling him one of the worst businessmen in town. It was addressed to the manager. He read it, put it in a private drawer, and did not read it again. Later, he tried to sue the competitor for defamation as a result of the letter. Will the court likely grant the defendant's motion to dismiss, and on what grounds? Base your answer on the common law definition of defamation.",professional_law,"['Yes, it will be dismissed on the grounds that the publication was only made to the manager.', ""Yes, it will be dismissed because the language does not harm the manager's reputation."", 'No, it will not be dismissed since the circumstances indicate that all elements of defamation are present.', 'No, it will not be dismissed because a plaintiff in a defamation case has an unequivocal right to a jury trial to establish defamation.']",0
5,"A seller contracted to sell land to a buyer for $300,000. The contract provided that the closing would be 60 days after the contract was signed and that the seller would convey to the buyer a ""marketable title"" by a quitclaim deed at closing. The contract contained no other provisions regarding the title to be delivered to the buyer. A title search revealed that the land was subject to an unsatisfied $50,000 mortgage and a right-of-way easement over a portion of the land. The buyer now claims that the title is unmarketable and has refused to close. Is the buyer correct?",professional_law,"['No, because nothing in these circumstances makes the title unmarketable.', 'No, because the purchaser agreed to accept a quitclaim deed.', 'Yes, because the right-of-way easement causes the title to be unmarketable.', 'Yes, because the outstanding mortgage causes the title to be unmarketable.']",2
6,"A plaintiff sued a defendant for injuries that the plaintiff suffered when he was struck by the defendant's car. At trial, the plaintiff testified that he was walking across the street inside a crosswalk at the time the defendant's car hit him. This action takes place in a jurisdiction that has a statute in effect requiring all motorists to stop and permit pedestrians to cross streets at designated crosswalks. The defendant contended that the plaintiff ran into the street outside the crosswalk. Furthermore, the defendant testified that he immediately applied his brakes when he saw the plaintiff dart into the street, but couldn't stop his car in time to avoid hitting him. In support of the defendant's testimony, the defendant calls a neighbor to testify that she has observed the plaintiff frequently during the years that she has lived on that street, and that the plaintiff ""always crosses the street outside the crosswalk. ""The neighbor's testimony is likely to be",professional_law,"['admitted, since it suggests that the plaintiff was negligent.', ""admitted, as it provides evidence of the plaintiff's usual practice of crossing the street outside the designated crosswalk."", 'excluded, because the neighbor did not witness the accident firsthand.', ""excluded, as her testimony is inadmissible as it attempts to use character evidence to demonstrate the defendant's plaintiff's behavior on a specific occasion.""]",1
7,"Several persons together stole a painting from an art museum. One of them, who was the driver, was caught during the commission of another crime. He told police that ""I didn't even get any money from the art museum. It all went to the first guy and the second guy."" When the first and second guy go on trial for the theft of the art painting, is the driver's statement admissible in court?",professional_law,"['Yes, it is an acknowledgement by an opposing party.', 'Yes, it qualifies as a declaration against the interest of the other defendants.', 'No, it was made during detention, rendering it unreliable.', 'No, because the statement was not made during or in support of the conspiracy, making it hearsay.']",3
8,"An avid baseball fan wanted to purchase tickets for an upcoming baseball game being held at the local stadium. He contacted the stadium's ticket sales office, which advised him that all tickets were to be placed on sale at the stadium at 9:00 a. m. the following day. The fan, who was employed as a bricklayer, realized that he could not leave work to purchase the tickets. Consequently, the fan telephoned his next-door neighbor and asked him if he would be interested in going to the stadium to purchase the baseball tickets. The neighbor told the fan that he would be happy to purchase the tickets for him and that he (the neighbor) also wanted to buy tickets for himself. However, the neighbor said that his car had broken down and that he did not have available transportation to get to the stadium. The fan suggested that he could lend his car to the neighbor. The neighbor agreed, and the following morning the two men met in front of the fan's home. The fan gave the neighbor the keys to his car and also money with which to buy his baseball tickets. Thereafter, the neighbor drove the fan's car to the stadium where he purchased the tickets for the fan and (using his own money) also bought a set of tickets for himself. The fan had instructed the neighbor to return the car to the fan's home after his trip to the stadium. After the neighbor left the stadium, however, he decided to visit a friend in a town located 120 miles from his home. As the neighbor was driving toward the town, an automobile crashed into him, causing significant damage to the fan's car. The cost of repairing the fan's car was determined to be more than the retail value of the auto. In an action by the fan against the neighbor to recover damages resulting from the accident, the fan will most likely",professional_law,"['obtain no compensation, as the neighbor was engaged in a joint venture at the time of the accident.', 'claim the expenses for repairing the vehicle.', 'recoup the market value of the automobile.', 'be entitled to compensation, since the neighbor was carelessly driving the car when the accident happened.']",2
9,"A defendant, who was an indigent, was arrested and charged with possession of less than one ounce of marijuana. Under the relevant state statute, possession of less than one ounce of marijuana is a misdemeanor, punishable by a maximum of one year in jail and/or a fine of $500. At trial, the defendant pleaded not guilty and requested that an attorney be appointed to represent him. The trial judge refused to honor the defendant's request for an attorney. If the defendant is subsequently found guilty, which of the following is the most severe sentence that can constitutionally be imposed?",professional_law,"['A penalty of $500.', 'Incarceration for six months.', 'Imprisonment for one year.', 'No punishment, due to the defendant being deprived of the right to legal representation.']",0
10,"A motorist who was injured in an accident sued the negligent other driver for his damages. The defense medical expert did an independent medical examination and reviewed all medical records. The expert testified that the accident did not cause the injuries because the medical records proved a long history of prior treatment for the same symptoms. The jury returned a verdict for the plaintiff but awarded only $10 in damages. On post-trial motions, the plaintiff argued that the expert's testimony was inadmissible hearsay because he based it on prior treating physicians' records, and the prior doctors were not available for cross-examination. Under the Federal Rules of Evidence, what is the correct ruling?",professional_law,"[""Testimony about the plaintiff's condition before the accident is not relevant and thus cannot be admitted."", 'According to the Federal Rules of Evidence, hearsay statements made for the purpose of medical diagnosis or treatment can be admitted.', ""Relevant medical testimony is always included in the defendant's case because it is deemed reliable."", 'The testimony is considered inadmissible hearsay because there was a constitutional right to cross-examine the doctors responsible for the previous records under these circumstances.']",1
11,Seller says a circumstance has occurred that makes performing a sales contract impractical. Which of the following is not correct about discharge for impracticability?,professional_law,"['The issue should not have been caused by the mistake of the party trying to use the defense.', 'An increase in price alone is enough to justify a discharge.', 'Not excusing performance would lead to severe injustice.', 'The impracticality must affect a fundamental assumption underlying the creation of the contract.']",1
12,"On Friday night, a driver was injured in an automobile accident after his vehicle was sideswiped by an unidentified motorist. Following the accident, the driver was admitted to the hospital where he was treated for his injuries. While at the hospital, the driver was diagnosed with a broken back. He was put in a body cast and then placed in traction. The driver's physician assembled the traction apparatus and positioned the driver's left leg in an overhead stirrup at a 40-degree angle. The driver was instructed to lie on his back on the bed. On Saturday morning after breakfast, the driver requested a bedpan from a nurse. She was placing the bedpan under the driver's body when the stirrup, which was holding his leg, broke. This caused the driver's leg to fall against the metal framing along the side of the bed, fracturing his tibia. The traction apparatus was defective because the manufacturer had not included a safety latch on the stirrup device to prevent its falling off if not securely fastened in place. If the driver asserts a claim against the manufacturer, he will most likely",professional_law,"['succeed, because the stirrup failed while the traction device was being used as intended.', ""succeed, because the traction device was rendered faulty by the manufacturer's omission of a safety latch."", ""not succeed, because the traction device had left the manufacturer's control."", 'not succeed, if the doctor incorrectly attached the stirrup during the assembly of the traction device.']",1
13,"A homeowner said to a roofer, ""My roof leaks. I think the old tiles are cracked. If you will replace them with all new tiles, I will pay you $5,000. "" The roofer replied, ""Sure, if I can clear my busy schedule. "" The homeowner then remarked, ""That's all right, but let me know soon. "" Three days later, the roofer drove his pickup truck to the homeowner's home and unloaded the materials and equipment needed to perform the roofing job. When the homeowner looked out his window and saw what was transpiring, he immediately ran outside and exclaimed, ""Stop! The deal's off. I decided to repair the roof myself. ""In an action by the roofer against the homeowner for breach of contract, which of the following would provide the roofer with his best theory of recovery?",professional_law,"['A bilateral contract came into existence when the roofer acquired the materials and tools necessary for the job.', ""A bilateral contract was established when the roofer responded, 'Certainly, if I can manage to free up my packed schedule.'"", 'The homeowner extended an offer suggesting a unilateral contract, which became non-revocable when the roofer obtained the materials and tools required for the task.', ""The homeowner extended an offer suggesting a unilateral contract, and the roofer demonstrated an intention to accept the offer by starting the task, unloading the materials and equipment at the homeowner's residence.""]",3
14,"A widower was the owner in fee of a 10-acre quarry. On August 1, the widower handed his friend a deed conveying the quarry to his niece and said to the friend, ""Give this to my niece. "" Unknown to the widower, the niece was in Africa. The next week, the friend properly recorded the deed with the Recorder's Office. One month later, the widower died, and in his will he devised the quarry to his daughter. Thereafter, the niece returned from Africa, and a dispute arose between the niece and the daughter regarding ownership of the quarry. In a suit to quiet title to the quarry, the court ruled in favor of the niece. The ruling was most likely based upon which of the following?",professional_law,"[""A 'causa mortis' gift was successfully made."", 'The transfer was completed when the widower gave the deed to the friend.', 'The transfer was completed when the friend filed the deed.', 'The deed was filed prior to the execution of the devise.']",1
15,A criminal actor committed the crime of solicitation. Which of the following does not apply to solicitation?,professional_law,"['It involves a pact among two or more individuals to carry out a crime.', 'It refers to urging someone else to carry out a felony.', 'Beyond the solicitation, no further action is required.', ""Typically, retracting one's involvement is not considered a valid defense.""]",0
16,"Two men were told by the defendant that a medical devices company was now using the old warehouse on the river for storing its supply of defibrillators. Late one night, the two men broke into the warehouse and proceeded to load the large crates of defibrillators onto their truck. As they were leaving, one of the men inadvertently threw his cigarette butt into a refuse pile of old cardboard boxes and papers. Soon afterward, the refuse ignited into a small fire. Although the men had time to douse the fire without any danger to themselves, they did not do so. Instead, they fled. Meanwhile, the fire quickly spread, engulfing the entire warehouse in flames. If the defendant is later charged as a co-conspirator, in all likelihood he would be held responsible as",professional_law,"['someone who aids in the commission of a crime beforehand.', 'a person who assists in the crime as it happens.', 'a partner in crime.', 'not accountable.']",3
17,A man was arrested and convicted of publishing paid newspaper advertisements giving information on how to get an abortion in another state and how to find a referral service. A criminal statute made it a crime to disseminate such information. Will the courts uphold the conviction?,professional_law,"['No, the law infringes upon the Sixth Amendment right to privacy.', 'No, the law infringes upon the First Amendment right to distribute protected commercial speech.', 'Yes, the right to an abortion does not encompass the right to advertise where to obtain one.', 'Yes, there is no entitlement to publish or spread speech that is commercial in nature.']",1
18,"A famous environmentalist was the owner of a large tract of virgin forest. The environmentalist conveyed the tract ""to the people of the state in fee simple; provided, however, that if any portion of said tract shall ever be used or developed for any commercial purpose or otherwise converted from its natural state (with exception for recreational, scientific, or educational purposes), then the grantor or his successors in interest may re-enter as of the grantor's former estate. ""The interest of the state in the tract would be best described as a (an)",professional_law,"['a fee simple estate that automatically ends upon the occurrence of a specified event.', 'a fee simple estate that is subject to termination upon the occurrence of a specified event, but requires action to terminate.', 'a type of easement that benefits a particular piece of land and is transferred with it.', 'a determinable fee estate that will transfer to another party if a specified condition occurs.']",1
19,"A contractor and home owner were bargaining on the price for the construction of a new home. The contractor made a number of offers for construction to the home owner including one for $100,000. Which of the following communications would not terminate the offer so that a subsequent acceptance could be effective",professional_law,"['The property owner inquires if the builder is willing to construct the house for a sum of $95,000.', 'The builder reaches out to the property owner to inform them that the offer has been revoked.', ""The builder passes away before the property owner can accept the offer, but the builder's son plans to continue the business."", ""The property owner says, 'I agree to your offer, but the price should be $97,000.'""]",0
20,"A defendant was suspected of having burglarized his neighbor's apartment. The neighbor reported that his apartment had been ransacked and several items of clothing had been stolen. During the course of their investigation, two police detectives went to the defendant's place of work to interview him. After being advised of his Miranda rights, the defendant requested permission to call his attorney. Although his attorney was unavailable, the attorney's receptionist admonished him not to say anything. The defendant told the detectives he would have nothing further to say unless his attorney was present. The detectives then asked him if he would accompany them to the police station to answer some questions about an unrelated robbery. The defendant agreed. As they were driving to the police station, the defendant was asked where he had purchased the boots that he was wearing. He refused to answer. When they arrived at the police station, the detectives requested that he sign a waiver of his right to counsel. The defendant replied that he would not sign anything in the absence of his attorney. He was then placed in an interrogation room. Shortly thereafter, the defendant was told he could leave if he would be willing to say where he had purchased his boots. The defendant admitted that he had bought the boots and some shirts from a friend. From this information, the detectives obtained a search warrant and went to the defendant's home where they found the stolen clothing. The defendant is charged with burglarizing the apartment. At trial, the court should",professional_law,"['accept the confession as it was made voluntarily, and the clothing since it was obtained through a valid search warrant.', 'exclude the confession due to its acquisition in violation of his Sixth Amendment right to legal representation, but accept the clothing because it was gathered through a valid search warrant.', 'exclude the confession because the defendant did not sign the waiver, but accept the clothing as it was obtained with a valid search warrant.', 'exclude the confession because it was obtained in violation of his Fifth Amendment right to legal representation, and the clothing since the search warrant was obtained as a consequence of the confession.']",3
21,"A woman was employed as a sales clerk at a department store. She worked in the women's lingerie section. One evening around closing time, the woman took a diamond necklace from a cabinetin the jewelry section of the department store and wrapped it in tissue paper. The woman then surreptitiously stuffed the necklace in a shopping bag, intending to remove it when she left the store. Moments later, the store owner approached the woman and told her she needed to stay late in order to do inventory. While the woman was completing inventory, the owner discovered the necklace and called the police. The woman is most likely guilty of",professional_law,"['tried theft.', 'theft.', 'deception by false representations.', 'misappropriation.']",1
22,"A woman was in a public restroom at a mall. While the woman was at the sink, a man entered the restroom and told her not to make a sound. Frightened, the woman ran to an open window in the bathroom and jumped onto the fire escape. As she exited down the fire escape, the woman accidentally fell, bruising her legs. Which of the following crimes, if any, would the man most likely be convicted of?",professional_law,"['Physical attack.', 'Physical harm.', 'Attack with the intention to commit rape.', 'No legal offense.']",3
23,"A buyer purchased a gallon of nonfat milk from a market. The milk, which was sold in a plastic container, had been processed and packaged by a dairy. That evening, the buyer was preparing dinner and poured himself a glass of milk from the container purchased at the market. He then sat down to eat his meal and proceeded to take a mouthful of milk. As he did so, the buyer felt something furry lodge in his mouth. He immediately spat out the furry object and saw that it was a dead mouse. The buyer suffered severe emotional distress but did not suffer any physical illness or injury. If the buyer asserts a claim against the dairy based on negligent manufacturing, he will most likely",professional_law,"['be able to recover, since he experienced significant emotional distress.', 'recover, based on the principle of res ipsa loquitur.', ""not recover, because the dairy's carelessness only resulted in mental disturbance."", 'not recover, because the appropriate legal claim for the buyer is intentional infliction of emotional distress.']",2
