Unnamed: 0,question,subject,choices,answer
408,"This question refers to the following information.
Whether the question be to continue or to discontinue the practice of sati, the decision is equally surrounded by an awful responsibility. To consent to the consignment year after year of hundreds of innocent victims to a cruel and untimely end, when the power exists of preventing it, is a predicament which no conscience can contemplate without horror. But, on the other hand, to put to hazard by a contrary course the very safety of the British Empire in India is an alternative which itself may be considered a still greater evil. When we had powerful neighbours and greater reason to doubt our own security, expediency might recommend a more cautious proceeding, but now that we are supreme my opinion is decidedly in favour of an open and general prohibition.
William Bentinck, Govenor-General of India, ""On the Suppression of Sati,"" 1829
I have made it my study to examine the nature and character of the Indians [who trade with us], and however repugnant it may be to our feelings, I am convinced they must be ruled with a rod of iron, to bring and keep them in a proper state of subordination, and the most certain way to effect this is by letting them feel their dependence on [the foodstuffs and manufactured goods we sell them].
George Simpson, Head of Northern Department, Hudson's Bay Company, 1826
The first passage can be said to undermine which commonly held assumption about Western imperialism?",high_school_world_history,"['European colonizers sometimes meddled with indigenous religious customs', 'European colonizers were primarily focused on generating profits', 'European colonizers consistently wanted to impose their cultural practices on native societies', 'European colonizers frequently used military force to enforce their authority over imperial subjects']",2
409,"This question refers to the following information.
""At least one of the [world's] societies would have to somehow enormously increase its productivity [in order to achieve global hegemony]. That quantum jump would have to be made before the various scientific, technological, agricultural, and industrial revolutions on which our post-quantum-leap world rests. It could only be accomplished by exploiting the ecosystems, mineral resources, and human assets of whole continents outside the lands of the society making the jump. Western Europe did just that by means of its brutality and guns and, more important, by geographical and ecological luck.""
Copyright  2015 Cambridge University Press.
Alfred Crosby, historian, Ecological Imperialism, 2004
Based on your knowledge of world history, which of the following contributed LEAST to Western European global hegemony between 1450 and 1750 C.E.?",high_school_world_history,"['The transfer of food supplies between Europe and the Americas', 'Advancement in gunpowder technology', 'The creation and utilization of steam-driven technologies', 'The establishment of joint-stock corporations']",2
410,"This question refers to the following information.
""The spontaneous forces of capitalism have been steadily growing in the countryside in recent years, with new rich peasants springing up everywhere and many well-to-do middle peasants striving to become rich peasants. On the other hand, many poor peasants are still living in poverty for lack of sufficient means of production, with some in debt and others selling or renting out their land. If this tendency goes unchecked, the polarization in the countryside will inevitably be aggravated day by day. Those peasants who lose their land and those who remain in poverty will complain that we are doing nothing to save them from ruin or to help them overcome their difficulties. Nor will the well-to-do middle peasants who are heading in the capitalist direction be pleased with us, for we shall never be able to satisfy their demands unless we intend to take the capitalist road. Can the worker-peasant alliance continue to stand in these circumstances? Obviously not! There is no solution to this problem except on a new basis. And that means to bring about, step by step, the socialist transformation of the whole of agriculture simultaneously with the gradual realization of socialist industrialization and the socialist transformation of handicrafts and capitalist industry and commerce; in other words, it means to carry out co-operation and eliminate the rich-peasant economy and the individual economy in the countryside so that all the rural people will become increasingly well off together. We maintain that this is the only way to consolidate the worker-peasant alliance.""
Mao Zedong, On the Question of Agricultural Co-operation, 1955
Which of the following later developments would most undermine the hopes expressed by Mao in the second-to-last line of the passage?",high_school_world_history,"[""The establishment of Special Economic Zones along China's coastline led to economic prosperity for the nation."", 'Political tensions with the Soviet Union during the Cold War pushed China closer to the United States.', 'The formation of peasant cooperatives on agricultural land and the focus on rural steel production resulted in famine and impoverishment among Chinese farmers.', 'During the Cultural Revolution, dissenting voices within the Communist Party, led by figures such as Deng Xiaopeng, were eliminated and suppressed.']",2
411,"This question refers to the following information.
At the peak of their power, the domains of the Mongol khans, or rulers, made up a vast realm in which once-hostile peoples lived together in peace and virtually all religions were tolerated. . . . The law code first promulgated by Chinggis Khan ordered human interaction. The result was an important new stage in international contact. From eastern Europe to southern China, merchants and travelers could move across the well-policed Mongol domains without fear for their lives or property. The great swath of Mongol territory that covered or connected most of Europe, Asia, and the Middle East served as a bridge between the civilizations of the Eastern Hemisphere. The caravans and embassies that crossed the Mongol lands transmitted new food, inventions, and ideas from one civilized pool to others and from civilized pools to the nomadic peoples who served as intermediaries. Secure trade routes made for prosperous merchants and wealthy, cosmopolitan cities. They also facilitated the spread of foods [and] inventions . . . a major force for economic and social development and the enhancement of civilized life.
Robert Guisepi, 1992
Which of the following was a long-term consequence of the Mongol conquest of Russia in the 1200s?",high_school_world_history,"['Russia was not part of the developments in Western Europe, such as the Renaissance.', 'Russia gained advantages by serving as the hub for Mongol political operations.', 'Islam became the predominant faith in Russia.', 'Russia established a centralized administrative system.']",0
412,"This question refers to the following information.
""From the confines of Jerusalem and the city of Constantinople a horrible tale has gone forth and very frequently has been brought to our ears, namely, that a race from the kingdom of the Persians, an accursed race, a race utterly alienated from God, a generation forsooth which has not directed its heart and has not entrusted its spirit to God, has invaded the lands of those Christians and has depopulated them by the sword, pillage and fire; it has led away a part of the captives into its own country, and a part it has destroyed by cruel tortures; it has either entirely destroyed the churches of God or appropriated them for the rites of its own religion.The kingdom of the Greeks is now dismembered by them and deprived of territory so vast in extent that it cannot be traversed in a march of two months. On whom therefore is the labor of avenging these wrongs and of recovering this territory incumbent, if not upon you? You, upon whom above other nations God has conferred remarkable glory in arms, great courage, bodily activity, and strength to humble the hairy scalp of those who resist you.
Let the deeds of your ancestors move you and incite your minds to manly achievements; the glory and greatness of king Charles the Great, and of his son Louis, and of your other kings, who have destroyed the kingdoms of the pagans, and extended in these lands the territory of the holy church. Let the holy sepulchre of the Lord our Savior, which is possessed by unclean nations, especially incite you, and the holy places which are now treated with ignominy and irreverently polluted with their filthiness. Oh, most valiant soldiers and descendants of invincible ancestors, be not degenerate, but recall the valor of your progenitors.
Jerusalem is the navel of the world; the land is fruitful above others, like another paradise of delights. This the Redeemer of the human race has made illustrious by His advent, has beautified by residence, has consecrated by suffering, has redeemed by death, has glorified by burial. This royal city, therefore, situated at the center of the world, is now held captive by His enemies, and is in subjection to those who do not know God, to the worship of the heathens. She seeks therefore and desires to be liberated and does not cease to implore you to come to her aid. From you especially she asks succor, because, as we have already said, God has conferred upon you above all nations great glory in arms. Accordingly undertake this journey for the remission of your sins, with the assurance of the imperishable glory of the kingdom of heaven.""
Pope Urban II, Speech at the Council of Clermont as recorded by Robert the Monk, 1095 C.E.
Which of the following events was most directly the result of the speech presented above?",high_school_world_history,"['The inability of any Christian effort to recapture the Levant', 'The reduction in activity along Mediterranean trade routes', 'The takeover of Constantinople by Latin Christians', 'The significant defeat of the Seljuk Turks by Byzantine military forces']",2
413,"This question refers to the following information.
""To slacken the tempo would mean falling behind. And those who fall behind get beaten. But we do not want to be beaten. No, we refuse to be beaten! One feature of the history of old Russia was the continual beatings she suffered because of her backwardness. She was beaten by the Mongol khans. She was beaten by the Turkish beys. She was beaten by the Swedish feudal lords. She was beaten by the Polish and Lithuanian gentry. She was beaten by the British and French capitalists. She was beaten by the Japanese barons. All beat herbecause of her backwardness, because of her military backwardness, cultural backwardness, political backwardness, industrial backwardness, agricultural backwardness. They beat her because it was profitable and could be done with impunity. You remember the words of the pre-revolutionary poet: ""You are poor and abundant, mighty and impotent, Mother Russia."" Those gentlemen were quite familiar with the verses of the old poet. They beat her, saying: ""You are abundant,"" so one can enrich oneself at your expense. They beat her, saying: ""You are poor and impotent,"" so you can be beaten and plundered with impunity. Such is the law of the exploitersto beat the backward and the weak. It is the jungle law of capitalism. You are backward, you are weaktherefore you are wrong; hence you can be beaten and enslaved. You are mightytherefore you are right; hence we must be wary of you.
That is why we must no longer lag behind.""
Joseph Stalin, speech delivered at the first All-Union Conference of Leading Personnel of Socialist Industry, February 4, 1931
Stalin's efforts to advance Russia as justified by his mention of the ""continual beatings"" were vindicated by which of the following historical events?",high_school_world_history,"['The competition in space exploration between the United States and the Soviet Union', 'The conflict between Poland and Soviet Russia in the early 1920s', 'The involvement of Western countries in the Russian Civil War', 'The 1941 German assault on Russia']",3
414,"This question refers to the following information.
""My little homestead in the city, which I recently insured for 2,000 would no doubt have shared the common fate, as the insurance companies will not make good that which is destroyed by the Queen's enemies. And although I have a farm of 50 acres close to the town, no doubt the crops and premises would have been destroyed. In fact, this has already partly been the case, and I am now suing the Government for damages done by a contingent of 1,500 natives that have recently encamped not many hundred yards from the place, who have done much damage all around.""
Letter from a British citizen to his sister during the Anglo-Zulu War, South Africa, 1879
The inclusion of the author's pending litigation with the British government serves to do which of the following?",high_school_world_history,"[""Emphasize the magnitude of the author's property damages"", 'Convey his disapproval of the ongoing conflict', 'Criticize British officials', 'Assign responsibility to both his own nation and the Zulus']",3
415,"This question refers to the following information.
""The greatest contribution that Africa can make to the peace of the world is to avoid all the dangers inherent in disunity, by creating a political union which will also by its success, stand as an example to a divided world. A Union of African states will project more effectively the African personality. It will command respect from a world that has regard only for size and influence. The scant attention paid to African opposition to the French atomic tests in the Sahara, and the ignominious spectacle of the U.N. in the Congo quibbling about constitutional niceties while the Republic was tottering into anarchy, are evidence of the callous disregard of African Independence by the Great Powers.""
Kwame Nkrumah, Ghanian leader, 1961
The passage is most clearly an example of which of the following?",high_school_world_history,"['Reactions to unsuccessful efforts at unification within Africa', 'An appeal for United Nations intervention in African matters', ""A suggestion to elevate Africa's status in the contemporary world"", 'Strong resistance to the impact of capitalism on Africa']",2
416,"This question refers to the following information.
""The greatest contribution that Africa can make to the peace of the world is to avoid all the dangers inherent in disunity, by creating a political union which will also by its success, stand as an example to a divided world. A Union of African states will project more effectively the African personality. It will command respect from a world that has regard only for size and influence. The scant attention paid to African opposition to the French atomic tests in the Sahara, and the ignominious spectacle of the U.N. in the Congo quibbling about constitutional niceties while the Republic was tottering into anarchy, are evidence of the callous disregard of African Independence by the Great Powers.""
Kwame Nkrumah, Ghanian leader, 1961
Which of the following explains why Nkrumah feels Africa must ""avoid all the dangers inherent in disunity""?",high_school_world_history,"['African countries will not gain independence unless they are united.', 'The lack of unity was the initial cause of chaos in many African countries.', 'The African continent has already gone through numerous civil wars.', 'The global community views power as being determined by both size and influence.']",3
417,"This question refers to the following information.
""When the gods fashioned Gilgamesh*, to him they gave a perfect form. The glorious sun Shamash bestowed upon him glory; Adad the terrible god of storms bestowed upon him courage. The great gods perfected his magnificence beyond all others, terrible like the great wild bull. Two thirds god they made him; one third man they made him.
Of Uruk, its great rampart he built, and the wall of the sacred Eanna temple, the holy sanctuary. Behold the outer walls which gleam with the brilliance of copper; see the inner wall which none might rival. Touch the threshold stoneit is from ancient days. Goest thou into the Eanna temple, yea, the dwelling place of Ishtar, the like of which no subsequent king or living man might equal. Ascend and walk about on the wall of Uruk, inspect the corner-stone, and examine its brick-work, whether its wall is not made of burned brick, and its foundation laid by the Seven Sages. One third for city, one third for garden, one third for field, and a precinct for the temple of Ishtar. These parts and the precinct comprise Uruk.""
The Epic of Gilgamesh, ca. 2100 B.C.E.
*Gilgamesh was a king of Uruk.
Which of the following statements about ancient cities is most supported by the discussion of Uruk in the second paragraph?",high_school_world_history,"['Ancient cities did not have strong defenses to protect against invasions.', 'Ancient cities had designated spaces for the worship of their guardian gods.', 'Temples in ancient cities were often decorated with simplicity.', 'Ancient cities included areas designated for military training.']",1
418,"This question refers to the following information.
""When the Portuguese go from Macao in China to Japan, they carry much white silk, gold, musk, and porcelain: and they bring from Japan nothing but silver. They have a great carrack which goes there every year and she brings from there every year about six hundred coins: and all this silver of Japan, and two hundred thousand coins more in silver which they bring yearly out of India, they employ to their great advantage in China: and they bring from there gold, musk, silk, copper, porcelains, and many other things very costly and gilded.
When the Portuguese come to Canton in China to traffic, they must remain there but certain days: and when they come in at the gate of the city, they must enter their names in a book, and when they go out at night they must put out their names. They may not lie in the town all night, but must lie in their boats outside of the town. And, their time expired, if any man remains there, he is imprisoned.""
Ralph Fitch, an account of his travels to the Far East, 1599 C.E.
The description of the route Portuguese sailors took in the first paragraph most directly supports which of the following historical developments?",high_school_world_history,"['The dominance of East Asian trade by Chinese merchants', 'The rivalry between Dutch and Portuguese traders for access to Japanese markets', 'The involvement of Europeans in the trade dynamics of East Asia', 'The missionary efforts of Jesuits in Japan and China']",2
419,"This question refers to the following information.
""The question as to who, and what, is responsible for African underdevelopment can be answered at two levels. Firstly, the answer is that the operation of the imperialist system bears major responsibility for African economic retardation by draining African wealth and by making it impossible to develop more rapidly the resources of the continent. Secondly, one has to deal with those who manipulate the system and those who are either agents or unwitting accomplices of the said system. The capitalists of Western Europe were the ones who actively extended their exploitation from inside Europe to cover the whole of Africa.""
Walter Rodney, historian, How Europe Underdeveloped Africa, 1974
Which of the following best explains the importance of trading contacts with Europeans for Sub-Saharan Africans in the period 1450 to 1750 C.E.?",high_school_world_history,"['Sub-Saharan Africans relied on European traders to support population growth by continuously importing foodstuffs from the New World.', 'Sub-Saharan Africans formed new states and kingdoms through trading with Europeans for firearms.', 'Sub-Saharan Africans were reliant on European merchants as the exclusive buyers of slaves.', 'Sub-Saharan Africans formed alliances with European powers to remove Muslim and Arab merchant princes who threatened their sovereignty.']",1
420,"This question refers to the following information.
O ye who believe! Strong drink and games of chance and idols are only an infamy of Satan's handiwork. Leave it aside in order that ye may succeed.
the Qur'an, Sura 5: 89
When once you hear the roses are in bloom,
Then is the time, my love, to pour the wine.
the Rubiyt of Omar Khayym
Both verses relate most closely to",high_school_world_history,"['essential economic activities within Islamic culture.', 'the creation and preparation of food and beverages in Islamic culture.', 'the religious governance of individual conduct in Islamic culture.', 'the evolving dynamics between genders in Islamic culture.']",2
421,"This question refers to the following information.
Source 1:
""The Sovereign Congress of Venezuela, to which authority the people of the Republic of the New Granada have voluntarily stood by.
Considering:
1. ""That united in a single Republic, the provinces of Venezuela and the New Granada have all proportions and ways to elevate themselves to a higher grade of power and prosperity.
2. ""That constituted in separate republics, for any more stronger the ties that these have united them, so far from taking advantages of so many advantages, they would hardly consolidate and make respect their sovereignty.
3. ""That these truths, highly penetrated by superior talented men and of an enlightened patriotism, had moved the governments of both republics to convene in a reunion that the vicissitudes of wars decreed and decree the following fundamental Law of the Republic of Colombia:
ARTICLE 1. The Republics of Venezuela and New Granada are from this day on united in a single one under the glorious title of Republic of Colombia.
ARTICLE 4. The Executive Power of the Republic will be vested on the President and in case of his defect a Vice President and his replacement will be appointed interimly by the acting Congress.""
Fundamental Law Establishing Gran Colombia, passed by the Congress of Angostura convened by Simon Bolivar, 1819
Source 2:
""IN THE NAME OF THE HOLY TRINITY.
TITLE 1 - Of the Empire of Brazil, its Territories, Government, dynasty, and Religion.
Art. 1. The EMPIRE of Brazil is the political association for all Brazilian citizens. These will form a free and independent nation, and will not form any other union or federation, which may cause it to lose its own Independence.
Art. 2. Its territory is divided into provinces in the form in which it currently finds itself; these may be subdivided, as is required for the good of the state.
Art. 3. Its government is a Hereditary Monarchy, constitutional, and Representative.
Art. 4. The prevailing dynasty is that of the Lord Dom Pedro I, the sitting Emperor and Perpetual Defender of Brazil.
Art. 5. The Catholic Apostolic Roman Religion will continue to be the religion of the Empire. Followers of all other religions are allowed to worship within their households, or particular houses for that intent, so long as there is nothing indicating this on the exterior of the Temple.""
Constitution of the Empire of Brazil, March 25, 1824
Which of the following is most directly responsible for creating the constitutions above?",high_school_world_history,"['Nationalist groups promoting the idea of pan-American unity', 'Uprisings led by local elites within Latin American countries', 'Indigenous people rallying support from local residents to draft constitutions', 'Colonial rulers setting up their territories for self-governance']",1
422,"This question refers to the following information.
Whether the question be to continue or to discontinue the practice of sati, the decision is equally surrounded by an awful responsibility. To consent to the consignment year after year of hundreds of innocent victims to a cruel and untimely end, when the power exists of preventing it, is a predicament which no conscience can contemplate without horror. But, on the other hand, to put to hazard by a contrary course the very safety of the British Empire in India is an alternative which itself may be considered a still greater evil. When we had powerful neighbours and greater reason to doubt our own security, expediency might recommend a more cautious proceeding, but now that we are supreme my opinion is decidedly in favour of an open and general prohibition.
William Bentinck, Govenor-General of India, ""On the Suppression of Sati,"" 1829
I have made it my study to examine the nature and character of the Indians [who trade with us], and however repugnant it may be to our feelings, I am convinced they must be ruled with a rod of iron, to bring and keep them in a proper state of subordination, and the most certain way to effect this is by letting them feel their dependence on [the foodstuffs and manufactured goods we sell them].
George Simpson, Head of Northern Department, Hudson's Bay Company, 1826
The passages above are best understood in the context of which of the following practices?",high_school_world_history,"['The legal endorsement of slavery in overseas territories', 'The exertion of administrative authority over indigenous populations in colonies', 'Efforts by Western missionaries in territories that have been colonized', 'The deployment of military assets sourced from colonial territories']",1
