Unnamed: 0,question,subject,choices,answer
413,"In the heart of Soviet Russia, Joseph Stalin addressed the nation with a fervor that was palpable, urging his people to rise from the ashes of past humiliations. The air was thick with the resolve to transform the nation's future, to never again be at the mercy of foreign powers. This question refers to the following information. ""To slacken the tempo would mean falling behind. And those who fall behind get beaten. But we do not want to be beaten. No, we refuse to be beaten! One feature of the history of old Russia was the continual beatings she suffered because of her backwardness. She was beaten by the Mongol khans. She was beaten by the Turkish beys. She was beaten by the Swedish feudal lords. She was beaten by the Polish and Lithuanian gentry. She was beaten by the British and French capitalists. She was beaten by the Japanese barons. All beat herâ€“â€“because of her backwardness, because of her military backwardness, cultural backwardness, political backwardness, industrial backwardness, agricultural backwardness. They beat her because it was profitable and could be done with impunity. You remember the words of the pre-revolutionary poet: ""You are poor and abundant, mighty and impotent, Mother Russia."" Those gentlemen were quite familiar with the verses of the old poet. They beat her, saying: ""You are abundant,"" so one can enrich oneself at your expense. They beat her, saying: ""You are poor and impotent,"" so you can be beaten and plundered with impunity. Such is the law of the exploitersâ€“â€“to beat the backward and the weak. It is the jungle law of capitalism. You are backward, you are weakâ€“â€“therefore you are wrong; hence you can be beaten and enslaved. You are mightyâ€“â€“therefore you are right; hence we must be wary of you. That is why we must no longer lag behind."" Joseph Stalin, speech delivered at the first All-Union Conference of Leading Personnel of Socialist Industry, February 4, 1931 Stalin's efforts to advance Russia as justified by his mention of the ""continual beatings"" were vindicated by which of the following historical events?",high_school_world_history,"['The Space Race with the United States', 'The Polish-Soviet War in the early 1920s', 'The Western intervention in the Russian Civil War', 'The German invasion of Russia in 1941']",3
414,"In the midst of the Anglo-Zulu War, South Africa, 1879, tensions were high and property destruction was rampant. A British citizen, feeling the impact of the conflict, took to writing a letter to his sister to describe his dire situation. This question refers to the following information. ""My little homestead in the city, which I recently insured for ï¿¡2,000 would no doubt have shared the common fate, as the insurance companies will not make good that which is destroyed by the Queen's enemies. And although I have a farm of 50 acres close to the town, no doubt the crops and premises would have been destroyed. In fact, this has already partly been the case, and I am now suing the Government for damages done by a contingent of 1,500 natives that have recently encamped not many hundred yards from the place, who have done much damage all around."" Letter from a British citizen to his sister during the Anglo-Zulu War, South Africa, 1879 The inclusion of the author's pending litigation with the British government serves to do which of the following?",high_school_world_history,"[""Highlight the extent of the author's property losses"", 'Express his opposition to the ongoing war', 'Belittle British officials', 'Place blame on both his home country as well as the Zulus']",3
415,"In the early 1960s, the world was witnessing a surge of newly independent nations, particularly in Africa, striving for recognition and influence on the global stage. Amidst these transformative times, leaders grappled with the challenges and opportunities of unity and independence. This question refers to the following information. ""The greatest contribution that Africa can make to the peace of the world is to avoid all the dangers inherent in disunity, by creating a political union which will also by its success, stand as an example to a divided world. A Union of African states will project more effectively the African personality. It will command respect from a world that has regard only for size and influence. The scant attention paid to African opposition to the French atomic tests in the Sahara, and the ignominious spectacle of the U.N. in the Congo quibbling about constitutional niceties while the Republic was tottering into anarchy, are evidence of the callous disregard of African Independence by the Great Powers."" Kwame Nkrumah, Ghanian leader, 1961 The passage is most clearly an example of which of the following?",high_school_world_history,"['Responses to failed unification attempts in Africa', 'A plea for the United Nations to intervene in Africa', 'A proposal to increase the standing of Africa in the modern world', 'Ardent opposition to the influence of capitalism in Africa']",2
416,"In an era marked by global tensions and shifting power dynamics, African leaders were increasingly aware of the continent's potential influence on the world stage. Kwame Nkrumah, a visionary among them, believed that unity could transform Africa into a formidable force. This question refers to the following information. ""The greatest contribution that Africa can make to the peace of the world is to avoid all the dangers inherent in disunity, by creating a political union which will also by its success, stand as an example to a divided world. A Union of African states will project more effectively the African personality. It will command respect from a world that has regard only for size and influence. The scant attention paid to African opposition to the French atomic tests in the Sahara, and the ignominious spectacle of the U.N. in the Congo quibbling about constitutional niceties while the Republic was tottering into anarchy, are evidence of the callous disregard of African Independence by the Great Powers."" Kwame Nkrumah, Ghanian leader, 1961 Which of the following explains why Nkrumah feels Africa must ""avoid all the dangers inherent in disunity""?",high_school_world_history,"['African nations will not achieve independence without unity.', 'Disunity is what originally led many African nations into disarray.', 'The African continent has already experienced its share of civil wars.', 'The world community sees power as a function of size and influence.']",3
417,"In the ancient world, the city of Uruk stood as a testament to divine craftsmanship and human ambition. Within its walls, tales of gods and heroes mingled with the whispers of its citizens, creating a tapestry of myth and history. This question refers to the following information. ""When the gods fashioned Gilgamesh*, to him they gave a perfect form. The glorious sun Shamash bestowed upon him glory; Adad the terrible god of storms bestowed upon him courage. The great gods perfected his magnificence beyond all others, terrible like the great wild bull. Two thirds god they made him; one third man they made him. Of Uruk, its great rampart he built, and the wall of the sacred Eanna temple, the holy sanctuary. Behold the outer walls which gleam with the brilliance of copper; see the inner wall which none might rival. Touch the threshold stoneâ€”it is from ancient days. Goest thou into the Eanna temple, yea, the dwelling place of Ishtar, the like of which no subsequent king or living man might equal. Ascend and walk about on the wall of Uruk, inspect the corner-stone, and examine its brick-work, whether its wall is not made of burned brick, and its foundation laid by the Seven Sages. One third for city, one third for garden, one third for field, and a precinct for the temple of Ishtar. These parts and the precinct comprise Uruk."" The Epic of Gilgamesh, ca. 2100 B.C.E. *Gilgamesh was a king of Uruk. Which of the following statements about ancient cities is most supported by the discussion of Uruk in the second paragraph?",high_school_world_history,"['Ancient cities lacked effective fortifications against attack.', 'Ancient cities featured areas for worshipping their patron deities.', 'Ancient cities commonly decorated their temples in modest ways.', 'Ancient cities featured areas for training their armies.']",1
418,"In the bustling trade routes of the late 16th century, Portuguese sailors were known for their daring voyages across the seas. Their journeys connected distant lands, bringing exotic goods and wealth to their homeland. This question refers to the following information. ""When the Portuguese go from Macao in China to Japan, they carry much white silk, gold, musk, and porcelain: and they bring from Japan nothing but silver. They have a great carrack which goes there every year and she brings from there every year about six hundred coins: and all this silver of Japan, and two hundred thousand coins more in silver which they bring yearly out of India, they employ to their great advantage in China: and they bring from there gold, musk, silk, copper, porcelains, and many other things very costly and gilded. When the Portuguese come to Canton in China to traffic, they must remain there but certain days: and when they come in at the gate of the city, they must enter their names in a book, and when they go out at night they must put out their names. They may not lie in the town all night, but must lie in their boats outside of the town. And, their time expired, if any man remains there, he is imprisoned."" Ralph Fitch, an account of his travels to the Far East, 1599 C.E. The description of the route Portuguese sailors took in the first paragraph most directly supports which of the following historical developments?",high_school_world_history,"[""Chinese merchants' domination of East Asian trade"", 'Competition between Dutch and Portuguese traders for markets in Japan', 'European participation in East Asian trade patterns', 'Jesuit missionary work in Japan and China']",2
419,"In the heart of the 18th century, the echoes of European ships arriving on African shores marked the beginning of a complex entanglement. Sub-Saharan societies found themselves at the crossroads of opportunity and exploitation, where trade with Europeans promised prosperity yet harbored the seeds of dependency. This question refers to the following information. 'The question as to who, and what, is responsible for African underdevelopment can be answered at two levels. Firstly, the answer is that the operation of the imperialist system bears major responsibility for African economic retardation by draining African wealth and by making it impossible to develop more rapidly the resources of the continent. Secondly, one has to deal with those who manipulate the system and those who are either agents or unwitting accomplices of the said system. The capitalists of Western Europe were the ones who actively extended their exploitation from inside Europe to cover the whole of Africa.' Walter Rodney, historian, How Europe Underdeveloped Africa, 1974 Which of the following best explains the importance of trading contacts with Europeans for Sub-Saharan Africans in the period 1450 to 1750 C.E.?",high_school_world_history,"['Sub-Saharan Africans relied on European merchants to sustain population growth through the constant importation of New World foodstuffs.', 'Sub-Saharan Africans consolidated new states and kingdoms by trading with the Europeans for firearms.', 'Sub-Saharan Africans depended on European merchants as the sole purchasers of slaves.', 'Sub-Saharan Africans allied with European powers to evict Muslim and Arab merchant princes from encroaching on their sovereignty.']",1
420,"In a dimly lit library, a scholar sits surrounded by ancient texts, tracing the threads of wisdom through time. Across the table, a student eagerly listens, captivated by the timeless teachings that span across cultures and eras. This question refers to the following information. O ye who believe! Strong drink and games of chance and idolsâ€¦ are only an infamy of Satan's handiwork. Leave it aside in order that ye may succeed. the Qur'an, Sura 5: 89 When once you hear the roses are in bloom, Then is the time, my love, to pour the wine. the RubÃ¡iyÃ¡t of Omar KhayyÃ¡m Both verses relate most closely to",high_school_world_history,"['key economic processes within Islamic society.', 'production of food and drink in Islamic society.', 'religious regulation of personal behavior in Islamic society.', 'changing gender relations in Islamic society.']",2
421,"In a classroom filled with eager students, the teacher introduces a lesson on historical constitutions. She presents two significant documents from the early 19th century, each shaping the future of their respective nations. This question refers to the following information. Source 1: ""The Sovereign Congress of Venezuela, to which authority the people of the Republic of the New Granada have voluntarily stood by. Considering: 1. ""That united in a single Republic, the provinces of Venezuela and the New Granada have all proportions and ways to elevate themselves to a higher grade of power and prosperity. 2. ""That constituted in separate republics, for any more stronger the ties that these have united them, so far from taking advantages of so many advantages, they would hardly consolidate and make respect their sovereignty. 3. ""That these truths, highly penetrated by superior talented men and of an enlightened patriotism, had moved the governments of both republics to convene in a reunion that the vicissitudes of wars decreed and decree the following fundamental Law of the Republic of Colombia: ARTICLE 1. The Republics of Venezuela and New Granada are from this day on united in a single one under the glorious title of Republic of Colombiaâ€¦. ARTICLE 4. The Executive Power of the Republic will be vested on the President and in case of his defect a Vice President and his replacement will be appointed interimly by the acting Congress."" Fundamental Law Establishing Gran Colombia, passed by the Congress of Angostura convened by Simon Bolivar, 1819 Source 2: ""IN THE NAME OF THE HOLY TRINITY. TITLE 1 - Of the Empire of Brazil, its Territories, Government, dynasty, and Religion. Art. 1. The EMPIRE of Brazil is the political association for all Brazilian citizens. These will form a free and independent nation, and will not form any other union or federation, which may cause it to lose its own Independence. Art. 2. Its territory is divided into provinces in the form in which it currently finds itself; these may be subdivided, as is required for the good of the state. Art. 3. Its government is a Hereditary Monarchy, constitutional, and Representative. Art. 4. The prevailing dynasty is that of the Lord Dom Pedro I, the sitting Emperor and Perpetual Defender of Brazil. Art. 5. The Catholic Apostolic Roman Religion will continue to be the religion of the Empire. Followers of all other religions are allowed to worship within their households, or particular houses for that intent, so long as there is nothing indicating this on the exterior of the Temple."" Constitution of the Empire of Brazil, March 25, 1824 Which of the following is most directly responsible for creating the constitutions above?",high_school_world_history,"['Nationalist movements advocating pan-Americanism', 'Revolts organized by provincial elites in Latin American nations', 'Aboriginal natives gathering the support of provincials to create constitutions', 'Colonial powers preparing their colonies for independence']",1
422,"In the early 19th century, the British Empire grappled with complex moral and political dilemmas in its overseas territories. Leaders were tasked with navigating the balance between humanitarian responsibilities and imperial interests. This question refers to the following information. Whether the question be to continue or to discontinue the practice of sati, the decision is equally surrounded by an awful responsibility. To consent to the consignment year after year of hundreds of innocent victims to a cruel and untimely end, when the power exists of preventing it, is a predicament which no conscience can contemplate without horror. But, on the other hand, to put to hazard by a contrary course the very safety of the British Empire in India is an alternative which itself may be considered a still greater evil. When we had powerful neighbours and greater reason to doubt our own security, expediency might recommend a more cautious proceeding, but now that we are supreme my opinion is decidedly in favour of an open and general prohibition. William Bentinck, Governor-General of India, 'On the Suppression of Sati,' 1829 I have made it my study to examine the nature and character of the Indians [who trade with us], and however repugnant it may be to our feelings, I am convinced they must be ruled with a rod of iron, to bring and keep them in a proper state of subordination, and the most certain way to effect this is by letting them feel their dependence on [the foodstuffs and manufactured goods we sell them]. George Simpson, Head of Northern Department, Hudson's Bay Company, 1826 The passages above are best understood in the context of which of the following practices?",high_school_world_history,"['Legalization of slavery in overseas colonies', 'Exercise of colonial administrative power over native peoples', 'Western missionary efforts in colonized territories', 'Mobilization of military resources from colonial possessions']",1
423,"In the midst of a turbulent era, where the call of duty drew men away from their homes, the journey alongside the column revealed stories of endurance and hardship. The soldiers, once youthful and full of hope, now bore the marks of age and relentless conflict. This question refers to the following information. I walk alongside the column, ask what's going on. A soldier says simply: ""They call up more every day. ""Some of us were sent north to the Yellow River at age fifteen, And now at forty we're heading off to the garrisons in the west. On our first tour, the village headman had to tie our bandannas for us. When we came back, our hair was white, but still there's more unrest. The frontier garrisons run with blood, enough to fill an ocean, But the Martial Emperor's territorial ambitions have yet to crest. In the hundred districts east of the mountains, throughout the land of Han, There must be ten thousand villages that brambles now infest. Even if wives are strong enough to handle a hoe and plow, The crops grow every which way, the fields are all a mess. It's hardest for the Shanxi men, with their reputations as fighters: They're rounded up like dogs or chickens, every male impressed. ""But sir, though it's good of you to ask, Complaining isn't part of the soldier's task. We can only shake our heads. Take this winter: The Shanxi troops were never sent home. The District Officers are demanding the land tax, But where will it come from? You can't get blood from a stone! I honestly think it's bad luck to bear a son now, It's better to have a daughter: at least she can marry And live with the neighbors next door. But a son will end up lying on some distant prairie."" Du Fu, ""Ballad of the Army Carts,"" ca. 750 C.E. The poem provides evidence of which of the following as a major cause of later Tang decline?",high_school_world_history,"['Discontent among the peasantry due to oppressive taxation', 'Foreign invasion of the Tang heartlands', 'The spread of Buddhism and Taoism as a reaction to state-sponsored Confucianism', 'An ineffective bureaucracy and poor leadership']",0
424,"In the bustling regions of Northern India, the intricate dance of power and politics played out between local rulers and the dominant Mughal Empire. Amidst the vibrant markets and sprawling landscapes, the question of sovereignty was ever-present, as local zamindars navigated their delicate relationship with the empire. This question refers to the following information. ""In Northern India the existence of separate States at this period is usually little more than a question of words. A zamindar who paid revenue to the Mogul was clearly in a position of dependence, and if he wished to establish a claim to sovereignty, the first step was to refuse, or omit to pay revenue. Such an omission might, however, arise from various other causes, and it is probable that in Rajputana, Central India, and Chota Nagpur there were numerous chiefs and tribes occupying what constitutional lawyers would regard as an anomalous position, sometimes paying the stipulated revenue, sometimes in open rebellion, and sometimes enjoying practical independence because the Mogul authorities found it inconvenient to undertake active measures of coercion."" W.H. Moreland, India at the Death of Akbar, 1920 Moreland's description of revenue collection in the Mughal Empire is best seen as evidence for which of the following generalizations?",high_school_world_history,"['Only people of certain religions were required to pay revenue to the empire.', 'Geographical differences may have influenced which groups pay taxes.', 'Revenue collection was the only source of funds by which the Mughal Empire operated.', 'The case of Rajputana was a typical one in the Mughal Empire.']",1
425,"In the late 19th and early 20th centuries, nations grappled with waves of immigration, debating how to manage the influx of newcomers. Governments often responded with policies that shaped the social and economic landscapes of their countries. This question refers to the following information. An Act to place certain restrictions on Immigration and to provide for the removal from the Commonwealth of Prohibited Immigrants. â€¦ 3. The immigration into the Commonwealth of the persons described in any of the following paragraphs in this section (hereinafter called ""prohibited immigrants"") is prohibited, namely (a) Any person who when asked to do so by an officer fails to write out at dictation and sign in the presence of the officer a passage of fifty words in length in a European language directed by the officer; (b) Any person in the opinion of the Minister or of an officer to become a charge upon the public or upon any public or charitable organisation; â€¦ (g) Any persons under a contract or agreement to perform manual labour within the Commonwealth: Provided that this paragraph shall not apply to workmen exempted by the Minister for special skill required by Australiaâ€¦ Immigration Restriction Act of 1901 (Australia) Whereas in the opinion of the Government of the United States the coming of Chinese laborers to this country endangers the good order of certain localities within the territory thereof; Therefore, Be it enacted by the Senate and House of Representatives of the United States of America in Congress assembled, That from and after the expiration of ninety days next after the passage of this act, the coming of Chinese laborers to the United States be suspended; and during such suspension it shall not be lawful for any Chinese laborer to come, or having so come after the expiration of said ninety days to remain within the United States. SEC. 2. That the master of every vessel who shall knowingly bring within the United States on such vessel, and land or permit to be landed, any Chinese laborer, from any foreign port or place, shall be deemed guilty of a misdemeanor, and on conviction thereof shall be punished by a fine of not more than five hundred dollars for each and every such Chinese laborer so brought, and may be also imprisoned for a term not exceeding one yearâ€¦. Chinese Exclusion Act of 1882 (United States) The passages are best seen as examples of which prominent social or economic trend from the 1800s?",high_school_world_history,"['The rise of anti-Semitic ideologies', 'Trade protectionism', 'A growing desire to attract skilled labor from abroad', 'Hardening of anti-immigrant sentiment']",3
426,"In the bustling courts of medieval Europe, rulers were constantly on the lookout for innovations that could give them an edge in the endless sieges and battles that defined their reigns. Meanwhile, across the vast landscapes of China, the threat of swift and elusive steppe nomads demanded a different strategic focus. This question refers to the following information. Gunpowder Weaponry: Europe vs. China In Western Europe during the 1200s through the 1400s, early cannons, as heavy and as slow to fire as they were, proved useful enough in the protracted sieges that dominated warfare during this period that governments found it sufficiently worthwhile to pay for them and for the experimentation that eventually produced gunpowder weapons that were both more powerful and easier to move. By contrast, China, especially after the mid-1300s, was threatened mainly by highly mobile steppe nomads, against whom early gunpowder weapons, with their unwieldiness, proved of little utility. It therefore devoted its efforts to the improvement of horse archer units who could effectively combat the country's deadliest foe. What traditional view of world history does this passage seem to challenge?",high_school_world_history,"['That China has always been less technologically adept than most Afro-Eurasian societies', ""That China's rigid form of dictatorial rule suppressed any spirit of military or technological innovation"", 'That China was hindered by religious fundamentalism when it came to modernizing efforts', 'That China was surpassed by Europe in global power because it turned a blind eye to the obvious benefits of technological change']",3
