Unnamed: 0,question,subject,choices,answer
551,以下哪项可能导致碘缺乏？,nutrition,"['水果和蔬菜摄入量低', '仅在中非食用本地种植的食物', '热量摄入不足', '阳光照射不足']",1
552,摄入过多以下哪些饮食成分会导致认知能力加速下降？,nutrition,"['高升糖指数碳水化合物', '高n-6:n-3脂肪比例', '长链饱和脂肪', '以上所有']",3
553,使用BMI（身体质量指数）作为身体脂肪测量方法的主要限制是什么？,nutrition,"['它对普通人不是一个准确的测量', '它比身高体重表更准确', '它不能区分脂肪和无脂肪质量', '以上全部']",2
554,超重的定义是什么？,nutrition,"['BMI > 25 kg/m2', 'BMI = 25 kg/m2', 'BMI 25-29.9 kg/m2', 'BMI 25-30 kg/m2']",2
555,身体中最大的内源性底物来源是什么？,nutrition,"['肝糖原', '肌糖原', '肌内脂肪', '脂肪组织']",3
556,麸质,nutrition,"['可能增加碳水化合物的吸收不良', '是燕麦蛋白的成分', '是玉米中的主要蛋白质', '可能在溃疡性结肠炎中禁用']",0
557,偶尔有婴儿出生时免疫系统不正常。哪些症状最能提示严重的联合免疫缺陷？,nutrition,"['反复严重感染', '婴儿期不明原因死亡的家族史', '结核菌株BCG疫苗接种后全身扩散', '给出的所有选项都是正确的']",3
558,急性酗酒与什么有关？,nutrition,"['快乐心脏综合征', '家庭心脏综合征', '海滩心脏综合征', '假日心脏综合征']",3
559,为了达到最佳的营养状态，建议老年人摄入：,nutrition,"['高能量含量的饮食。', '高营养密度的饮食。', '低能量含量的饮食。', '每日抗氧化补充剂。']",1
560,关于糖摄入量与龋齿风险之间关联的最佳可用证据来自哪种类型的研究设计？,nutrition,"['随机对照', '非随机对照', '横断面观察', '队列']",3
561,关于暴食症，以下哪项是不正确的：,nutrition,"['暴食症患者的暴食发作通常比神经性贪食症患者的热量更高，导致患者肥胖', '暴食症患者更有可能发展为肥胖', '减肥手术可以被视为轻度病例的治疗选择', '自发缓解是一种可能的结果']",0
562,以下哪个会在缺乏维生素D时增加？,nutrition,"['凝血酶原的血浆浓度', '前凝血酶原的血浆浓度', '碱性磷酸酶的血浆活性', '酸性磷酸酶的血浆活性']",2
563,肠道乳糖酶缺乏会导致乳糖消化不良，进而可能导致乳糖不耐症，即引起临床症状。婴儿和儿童通常表现出足够的乳糖酶水平，以免出现临床症状。总体来说，成年人可以分为乳糖酶持续者或乳糖酶非持续者。全球乳糖酶非持续者的大致百分比是多少？,nutrition,"['45%-50%', '70%-75%', '10%-15%', '30%-35%']",1
564,以下哪一项不是维生素A的功能,nutrition,"['合成血液凝结蛋白', '激活维生素D受体', '激活甲状腺激素受体', '调节基因表达和细胞分化']",0
565,以下哪种维生素为胶原蛋白合成中的羟化反应提供辅因子？,nutrition,"['生物素', '烟酸', '核黄素', '维生素C']",3
566,用于检查过去8-10周平均血浆葡萄糖浓度的测试是：,nutrition,"['糖化血红蛋白A1c', '口服葡萄糖耐量试验 (OGTT)', '果糖胺测试', '空腹血浆葡萄糖浓度']",0
567,以下哪种说法是正确的？,nutrition,"['二氧化硫不用于含有硫胺素的食品，因为它会破坏这种维生素', '二氧化硫不用于含有烟酸的食品，因为它会破坏这种维生素', '二氧化硫不用于含有维生素E的食品，因为它会破坏这种维生素', '二氧化硫不用于含有维生素C的食品，因为它会破坏这种维生素']",0
568,哪种维生素是昏暗光线下视力所需的？,nutrition,"['维生素A', '维生素D', '维生素E', '维生素K']",0
569,以下关于糖原代谢的说法哪项是正确的？,nutrition,"['糖原合成的一个关键步骤是UDP-葡萄糖的形成', '在肌肉的禁食状态下，糖原被分解成葡萄糖6-磷酸，然后是游离葡萄糖。', '糖原主要储存在肝脏和大脑中。', '胰高血糖素增加糖原的合成']",0
570,出生于素食母亲的婴儿可能面临缺乏哪种营养素的风险？,nutrition,"['维生素C', '叶酸', '维生素B12', '钙']",2
571,以下哪个最接近由ß-胡萝卜素形成的视黄醇的量？,nutrition,"['2摩尔视黄醇/摩尔ß-胡萝卜素', '1摩尔视黄醇/摩尔ß-胡萝卜素', '0.15摩尔视黄醇/摩尔ß-胡萝卜素', '0.1摩尔视黄醇/摩尔ß-胡萝卜素']",2
572,以下关于植物来源氨基酸在人类营养中的说法哪一个是正确的？,nutrition,"['所有植物蛋白来源都缺乏必需氨基酸', '所有植物蛋白来源都含有所有必需氨基酸，尽管某些可能在特定氨基酸的量上有所限制', '所有植物蛋白来源都缺乏赖氨酸', '所有植物蛋白来源都缺乏含硫氨基酸']",1
573,额外的膳食蛋白质可能：,nutrition,"['增加髋部骨折的风险', '减少尿液中的钙排泄', '刺激类胰岛素生长激素的产生', '减少肌肉质量和力量']",2
574,胃肠道功能可以通过多种方式进行分类。以下哪种功能在饭后立即生存中最重要？,nutrition,"['吸收和保持水分和电解质', '排除毒素', '保持屏障功能', '从营养中提取最大价值']",0
575,计划怀孕的女性被建议在怀孕前及怀孕的前三个月每天补充400微克叶酸。这样的补充对所生孩子的印记基因IGF2的甲基化有何影响？,nutrition,"['没有影响。', 'IGF2的甲基化增加。', 'IGF2的甲基化减少。', '效果取决于孩子是男性还是女性。']",1
576,哪些食物在威尔士和苏格兰的消费量往往较低（截至2020年）？,nutrition,"['肉类', '糖果', '水果和蔬菜', '土豆']",2
577,以下哪种身体成分的变化与老年人衰老有关？,nutrition,"['增加的骨量', '增加的肌肉量', '增加的体脂', '以上全部']",2
578,补充哪种脂溶性维生素已被证明可以减少心血管疾病？,nutrition,"['维生素A和D', '维生素A和K', '维生素D和E', '以上都不是']",3
579,在预防与年龄相关的认知衰退方面，哪种营养素有最好的证据支持？,nutrition,"['N-3脂肪酸', '植物化学物', 'N-6脂肪酸', '长链饱和脂肪']",0
580,以下哪项关于评估人类营养中蛋白质质量的方法的陈述是正确的？,nutrition,"['大鼠蛋白质效率比率实验（PER）是评估人类营养中蛋白质质量的好方法。', '大鼠净蛋白质利用率实验（NPU）是评估人类营养中蛋白质质量的最佳方法。', '动物生长实验低估了人类营养膳食蛋白质的质量。', '生长中的大鼠是评估人类营养中蛋白质质量的良好模型。']",2
581,全球化对粮食安全的影响是什么？,nutrition,"['富裕国家的补贴和贸易壁垒使发展中国家难以利用全球化的潜力来促进粮食安全。', '世界贸易组织的规则不涵盖农业，因此全球化实际上对粮食安全没有影响。', '到目前为止，超市是食品和农业经历全球化的唯一途径。', '发展中国家需要建立公共持有的粮食储备，以实现潜在的利益。']",0
582,肠道微生物将L-肉碱代谢成哪种代谢产物已被证明会增加心血管疾病？,nutrition,"['胆碱', '甜菜碱', '三甲胺', '以上皆是']",2
583,以下哪项将为短期剧烈活动（如冲刺）期间的肌肉收缩提供主要燃料？,nutrition,"['肌肉三酰基甘油', '血浆游离脂肪酸', '极低密度脂蛋白中的血浆三酰基甘油', '肌糖原']",3
584,在过去的二十年里，随着流行病学研究发现早期经历与后来的健康之间的联系，人们对孕产妇营养的兴趣不断增加。以下哪种说法是正确的：,nutrition,"['尽管早期生活似乎很重要，但观察到的与心血管疾病和2型糖尿病风险的联系在很大程度上可以通过成年期的生活方式来解释', '观察到的早期经历与后来的健康之间的联系仅在英国的研究中被发现', '流行病学证据表明生理上的编程差异仅与出生前事件相关', '流行病学证据表明生理上的编程差异与出生前和早期出生后的事件相关']",3
585,以下关于蛋白质需求的说法哪一个是正确的？,nutrition,"['蛋白质需求等于需求乘以利用效率。', '蛋白质需求等于需求除以利用效率。', '蛋白质需求可以小于需求。', '蛋白质需求总是与需求相同。']",1
586,是什么导致了2007-2008年的食品价格飙升？,nutrition,"['对农业和农村发展的长期忽视导致了价格飙升。', '使用粮食作物生产生物燃料导致食品价格上涨。', '这是由商品价格投机引起的。', '以上所有原因都是其中的原因。']",3
587,支持人类膳食胆固醇与血浆LDL胆固醇水平关系的证据为何不确定的可能原因是什么？,nutrition,"['调节胆固醇吸收及其在脂蛋白中输出的机制的复杂性。', '控制肝脏清除肠道来源脂蛋白的机制的复杂性。', '细胞胆固醇增加时的多种肝内反应。', '以上皆是。']",3
588,以下类型的研究结果为饮食与骨骼健康之间的关联提供了强有力的证据：,nutrition,"['以骨折为终点，具有大样本量的长期干预研究', '通过生化标志物测量骨重建的实验研究', '一次性测量骨矿物质密度和骨矿物质含量的实验研究', '个别患者的病例报告']",0
589,女性在粮食安全中扮演什么角色？,nutrition,"['她们的主要角色是准备餐食。', '她们作为食品生产者、自然资源管理者、收入获得者和家庭营养照顾者，发挥着核心作用。', '她们负责除草，但从不犁地或种植，因为只有男性才有足够的力量进行这些活动。', '她们的努力主要集中在蔬菜园和养鸡上；而男性则参与谷物作物和大型牲畜的管理。']",1
590,肥胖流行的主要原因是什么？,nutrition,"['能量摄入量/密度增加和更加久坐的生活方式', '休闲时间活动减少', '遗传基因变化', '没有一个选项是正确的']",0
591,食品补充剂，包括微量矿物质和维生素，常常以具有健康益处的承诺进行宣传。以下哪种物质可能会被过量摄入，即远超过每日推荐需求？,nutrition,"['维生素C', '维生素D', '锌', '维生素A']",0
592,动物研究中的毒性和剂量反应数据与以下哪种类型的数据一起用于评估食品物质的安全性？,nutrition,"['添加该物质的食品消费率', '食品中该物质的浓度', '食用该食品的人类每日摄入该物质的量', '一个人一生中将消费的该物质的总量']",2
593,减重手术用于肥胖治疗，但手术后肥胖个体的2型糖尿病发生率减少了多少？,nutrition,"['80-90%', '发生率没有减少', '大约50%', '没有一个选项是正确的']",0
594,在常规实践中评估生长应该是：,nutrition,"['仅身高', '仅体重', '体重和身高', '头围']",2
595,以下哪项陈述是正确的？,nutrition,"['黄酮类包括黄酮和异黄酮。', '大豆食品中异黄酮的消化率和生物利用度不受加工影响。', 'β-胡萝卜素和番茄红素都可以作为维生素A的前体。', '类胡萝卜素和黄酮类都属于多酚类。']",0
596,以下哪项是葡萄糖完全氧化为二氧化碳和水的ATP产量？,nutrition,"['10', '25', '30', '32']",3
597,基础代谢率（BMR）：,nutrition,"['在舒适的坐姿下测量', '在甲状腺功能减退和甲状腺功能亢进时不变', '体重增加后会更高，因为部分多余的体重是无脂肪组织。', '体重减轻后不变。']",2
598,铁缺乏的诊断可能因并发感染而变得复杂，因为许多铁状态标志物会因感染而改变。在同时患有铁缺乏症和严重感染的人中，以下哪种铁状态标志物组合最有可能出现？,nutrition,"['低血红蛋白，高铁蛋白，高血清转铁蛋白受体，高铁调素', '低血红蛋白，低铁蛋白，高血清转铁蛋白受体，低铁调素', '低血红蛋白，低铁蛋白，正常血清转铁蛋白受体，高铁调素', '低血红蛋白，低铁蛋白，低血清转铁蛋白受体，高铁调素']",0
599,以下哪些因素可以降低结直肠癌的风险？,nutrition,"['维生素C', '膳食纤维', '酒精', '雌激素']",1
600,以下哪一项现代人类的特征最为古老，早于晚期石器时代、旧石器时代晚期，甚至早于解剖学上的现代人类？,prehistory,"['精致的葬礼', '拥有更大人口的较大遗址', '改进的石器技术', '通过艺术创作进行象征性表达']",2
601,印加人何时开始在南美洲进行军事扩张？,prehistory,"['200 A.D.', '900 A.D.', '1450 A.D.', '1650 A.D.']",2
602,中国仰韶文化遗址的发掘表明哪种驯化作物？,prehistory,"['豆类、小米和玉米。', '小麦、水稻和豌豆。', '高粱、二粒小麦和豆类。', '小米、白菜和水稻。']",3
603,在作者的两小时电影中代表宇宙历史，人类家族的最早成员何时出现？,prehistory,"['在电影的开头', '在电影的中途', '在电影的90分钟时', '在电影最后3秒钟']",3
604,在兰德尔·怀特的观点中，个人装饰物在旧石器时代晚期意味着什么？,prehistory,"['愿意长途旅行', '在篝火旁进行的夜间爱好', '对个人身份的日益关注和重视', '更高的智力和合作意愿']",2
605,查科峡谷的祖先普韦布洛文化包括：,prehistory,"['大约75个大型定居点和超过300个小型社区。', '超过500个拥有纪念性建筑的城镇和村庄。', '30到40个农庄和三个大型普韦布洛。', '一个大型城邦，拥有超过300个外围农庄。']",0
606,以下哪一项表示主要背景？,prehistory,"['一个整个社区的垃圾堆放在一起的垃圾填埋场', '由侵蚀暴露在地表的文物、生态物和骨骼', '发现了一处原地遗留的文物藏品或收藏品的存在', '以上全部']",2
607,1797年，约翰·弗里尔发现了他描述为：,prehistory,"['地面上散落的动物遗骸。', '最早的书面文件。', '在很深的地方挖掘出的原始石器。', '具有类猿特征的人类头骨。']",2
608,奥瑞纳文化技术与莫斯特文化技术有何不同？,prehistory,"['莫斯特文化技术生产了更多的投掷器尖头。', '莫斯特文化技术生产了更多可用的刀片表面。', '奥瑞纳文化技术生产了更多可用的刀片表面。', '奥瑞纳文化技术专注于手斧的生产。']",2
609,在鼎盛时期，仅约有 _______ 的印加帝国是由印加族组成的。,prehistory,"['1 percent', '10 percent', '30 percent', '50 percent']",0
610,与大多数其他早期文明不同，米诺斯文化几乎没有以下方面的证据：,prehistory,"['贸易。', '战争。', '共同宗教的发展。', '精英的炫耀性消费。']",3
611,米诺斯经济可能因严重依赖以下哪项而对自然灾害特别脆弱？,prehistory,"['农业', '海上贸易', '金属加工', '奴隶劳动']",1
612,墨西哥谷地的人口是通过以下方式支持的：,prehistory,"['长途贸易、盐矿开采和石工。', '狩猎和采集、捕鱼和根作物的种植。', '先进的医疗、手工艺和冶金技术。', '农业灌溉、梯田和称为浮园的人工高地。']",3
613,对两种主要类型大米的遗传学研究，粳米（短粒）和籼米（长粒），表明：,prehistory,"['它们彼此之间的关系比与当地野生祖先的关系更密切，表明这些现代大米品种最近在东亚发展起来。', '它们与当地野生祖先的关系比彼此之间的关系更密切，表明这些现代大米品种分别在东亚和南亚驯化。', '它们彼此无关，表明这些现代大米品种在东亚和西欧独立驯化。', '它们与当地野生祖先关系密切，表明驯化一定是最近发生的，不早于2000年前。']",1
614,考古学与伪科学幻想和关于古代外星人的幻想不同，因为：,prehistory,"['考古学不局限于证据或科学方法。', '考古学家对科幻小说不感兴趣，实际上对古代历史了解不多。', '考古学家实际上解决了所有关于过去的谜团和争议。', '考古学家遵循科学方法，并受证据或缺乏证据的约束。']",3
615,特奥蒂瓦坎这个名字是由谁给这座城市命名的：,prehistory,"['阿兹特克人，他们在城市崩溃后很久仍继续朝圣。', '西班牙入侵者，他们大部分摧毁了它。', '城市的第一位国王，他以自己最喜爱的神命名。', '奥尔梅克商人，他们对城市的宏伟印象深刻。']",0
616,欧洲新石器时代几乎所有重要的农作物：,prehistory,"['在公社农场同时被驯化。', '在群体定居之前就被驯化。', '在欧洲独立驯化', '从其他地区进口。']",3
617,以下哪些是文明的四个特征？,prehistory,"['粮食剩余、专业化、城市聚落和记录保存系统', '粮食剩余、常备军、艺术品和管道系统', '粮食剩余、纪念性建筑、宗教建筑和博物馆', '博物馆、图书馆、纪念性建筑和艺术品']",0
618,北美西北海岸的土著人是：,prehistory,"['玉米农业者。', '简单的觅食者。', '富裕的觅食者。', '被阿兹特克征服。']",2
619,更新世后欧洲食物资源基础的最显著特点是什么：,prehistory,"['依赖巨型动物。', '狩猎和采集。', '依赖毛皮动物。', '多样性。']",3
620,在密西西比文化中心卡霍基亚的僧侣土丘的作用是：,prehistory,"['一个了望塔或火塔。', '平等部落的聚会场所。', '一个墓葬纪念碑。', '一个或多个重要建筑的基础。']",3
621,根据对古代湖泊沉积物中发现的腹足类动物壳中氧同位素比率的分析，印度河流域的文明发生了什么？,prehistory,"['由于降雨量增加和生长期延长，它变得越来越复杂。', '由于气候变化和干旱，它最终崩溃了。', '由于季风增加和一系列灾难性洪水，它崩溃了。', '它演变成沿河流和湖岸的一系列城邦。']",1
622,在晚中新世期间，碳同位素分析表明环境变化会影响现代人类的古猿祖先。这些变化最好被描述为：,prehistory,"['全球温度突然下降导致回到冰河时代的条件。', '全球温度突然上升导致海平面上升。', '草原扩张和林地减少，导致区域性马赛克环境。', '大型哺乳动物种群减少，而其他脊椎动物类群相对增多。']",2
623,许多古代精英对资源消耗的态度似乎是：,prehistory,"['“省一分钱就是赚一分钱。""', '""如果你有，就炫耀它。""', '""三思而后行。""', '""最后的将成为最前，最前的将成为最后。""']",1
624,考古学家如何描述奥尔梅克人建造的纪念碑？,prehistory,"['哈拉菲安仪式纪念碑', '巨石首领制', '剩余食物储存中心', '王权仪式中心']",3
625,商朝为中国文明的持续发展奠定了基础，这一发展一直持续到：,prehistory,"['10世纪。', '13世纪。', '17世纪。', '20世纪。']",3
626,阿兹特克帝国是基于系统扩张的：,prehistory,"['以黄金、玉石、羽毛、布料和珠宝形式的贡品。', '基于军事征服的压迫性社会和宗教控制。', '陶器生产、独特的建筑风格和艺术表现。', '需要广泛和不断升级的人祭的宗教信仰。']",0
627,是什么使得从德国Schöningen一个30万年前的遗址中回收几乎完好无损、做工精美的木矛成为可能？,prehistory,"['土壤高度酸性并且是好氧的，这为有机文物提供了极好的保存条件。', '土壤被水淹没，提供了可以保存有机材料的条件。', '木矛被放置在一个显而易见的文物储藏地，考古学家最终会在那里找到它们。', '木矛上覆盖着干血混合着木炭和泥土，这有助于保存木材。']",1
628,最近关于石器复制和大脑成像的研究提出了以下假设：,prehistory,"['工具制作中的联结为大脑准备了生产和使用语言的能力。', '工具制作需要合作，而这种合作只能通过语言来实现。', '工具制作起源于语言进化后的数百万年。', '大脑与双足行走之间的联结为手的工具制作做好了准备。']",0
629,以下哪一项不是约瑟夫·泰特纳提出的古代文明崩溃的原因之一？,prehistory,"['资源枯竭', '经济衰退', '精英管理不善', '流行病']",3
630,古基因和古生态学证据表明澳大利亚的居住日期可以追溯到：,prehistory,"['80,000 B.P.', '70,000 B.P.', '60,000 B.P.', '40,000 B.P.']",2
631,莫切人在其城市中心建造了什么？,prehistory,"['一个庞大的寺庙和工匠作坊综合体', '一个巨大的精英住宅围墙区', '太阳金字塔', '羽蛇神庙']",2
632,南美洲对欧洲最重要的农业贡献是哪种作物？,prehistory,"['稻米', '土豆', '南瓜', '豆类']",1
633,人类能够在不同环境中生存，从北极苔原到热带森林，这得益于：,prehistory,"['对每个新栖息地的特定生物适应。', '新颖的身体特征的快速进化，这允许进入新的地理范围。', '智力和文化适应。', '基因变化和种族差异。']",2
634,马丘比丘建在山上是为了：,prehistory,"['防御堡垒。', '印加雨神的神殿。', '精英们的休闲度假地。', '天文观测站。']",2
635,现代人类基因组的证据表明从尼安德特人遗传的基因：,prehistory,"['对现代人类普遍有益。', '控制现代欧洲人的脂肪代谢。', '与狼疮等人类疾病有关。', 'b和c都正确。']",3
636,有趣的是，古代南美洲的文明似乎都没有发展出：,prehistory,"['纪念性工程。', '灌溉技术。', '书面语言。', '重要的军队。']",2
637,美索不达米亚的哈苏南和萨马兰遗址有什么共同点？,prehistory,"['两者都严重依赖农业。', '两者都有大量稀有奢侈品。', '两者都有高地位的墓葬。', '两者都有复杂的纪念性建筑。']",0
638,下颌向前突出的情况称为,prehistory,"['树栖的。', '前突的。', '齿隙。', '下颌骨。']",1
639,更新世晚期到全新世早期的气候变化对人类群体产生了什么影响？,prehistory,"['它迫使人群迁移到赤道附近。', '它考验了人类适应的能力。', '它迫使人类穿上衣服。', '它完全没有影响。']",1
640,帕伦克统治者帕卡尔大帝的石棺盖上描绘了什么?,prehistory,"['被杀的国王敌人，以及代表世界上所有伟大城市和文明的一系列象形文字', '死去的国王悬在玛雅地怪和象征玛雅天堂的羽蛇鸟之间', '阿兹特克国王乘坐金子制成的战车升天', '一个古代外星人通过望远镜观察并驾驶宇宙飞船']",1
641,查尔斯·达尔文发现植物和动物是通过一种被称为__________的过程进化的。早期考古学家发现______________________。,prehistory,"['科学创造论; 人类文化的进化方式不同于植物和动物', '单线进化; 文明进化比植物更快', '自然选择; 人类文化没有随着时间的推移而进化或改变太多', '自然选择; 人类文化在漫长的时间内进化']",3
642,对在南非Kathu Pan遗址发现的那些文物进行复制的石矛尖进行实验表明，直立人：,prehistory,"['在50万年前制造和使用带有石制抛射点的矛进行狩猎。', '在超过300万年前制造和使用带有石制抛射点的矛进行狩猎。', '没有使用带有石制抛射点的矛，但可能用木制和骨制工具进行捕鱼和捕猎。', '制造石矛尖作为武器使用，但不是用于狩猎。']",0
643,霍伦施泰因-施塔德尔洞穴的“狮子人”是以下哪种艺术的例子：,prehistory,"['移动艺术。', '异域原材料的长途贸易。', '壁画艺术。', '维纳斯雕像。']",0
644,当解剖学上的现代人类首次到达中东时，他们遇到了谁？,prehistory,"['尼安德特人，欧洲和亚洲前现代人居民的进化后裔', '直立人，欧洲和亚洲前现代人居民的进化后裔', '智人，他们在亚洲独立进化，并在大约20万年前到达那里', '以上所有']",0
645,露西属于哪个物种？,prehistory,"['Homo habilis', 'Australopithecus afarensis', 'Homo sapiens', 'Australopithecus robustus']",1
646,根据对附近村庄动物牙齿的分析，我们对建造巨石阵的人有什么了解？,prehistory,"['他们在现场饲养牲畜，包括牛、羊和山羊。', '他们从该地区以外的地方将动物带到现场。', '他们没有驯养动物，而是捕猎野生动物作为肉食。', '他们捕猎羚羊、瞪羚和熊。']",1
647,以下哪一项被描述为“现有原因的缓慢作用”？,prehistory,"['自然选择', '灾变论', '均变论', '单线演化']",2
648,当比较大脑大小与身体大小的比例时，哪个物种的大脑比例更大？,prehistory,"['直立人', '早期智人', '尼安德特人', '现代智人']",3
649,中旧石器时代和上旧石器时代之间的一个重要区别是什么？,prehistory,"['减少使用进口原材料，增加使用当地可获得的材料', '较小的遗址，表明从大型游牧狩猎群体向最早的家庭和家户转变', '石器工具传统的激增，表明从时间和地理上的同质性转变为更大的多样性和变异性', '石制手斧和工具的使用逐渐减少，表明向使用更灵活和可加工的材料如木材和骨头的转变']",2
650,在哪个国家可以找到最多的巴斯克语使用者？,high_school_geography,"['丹麦', '芬兰', '卢森堡', '西班牙']",3
651,哪个群体在美国东部进行了第一次有效的定居？,high_school_geography,"['法国人', '英国人（英格兰人，苏格兰-爱尔兰人，威尔士人，苏格兰人）', '俄罗斯人', '中国人']",1
