Unnamed: 0,question,subject,choices,answer
0,一位乘客在42街车站进入地铁车厢。由于所有座位都被占满，乘客站在车厢里并抓住一根扶杆以保持平衡。当地铁车厢向市区行驶时，乘客瞥了一眼站在他旁边的一个女孩。突然，地铁车厢意外停车。乘客一时失去平衡，抓住了女孩的腰（以免摔倒）。一旦乘客恢复平衡，他便将手从女孩的腰上移开，重新抓住扶杆。如果女孩对乘客提起民事诉讼，他最有可能被裁定,professional_law,"['对人身伤害负责。', '负责，因为乘客认为在这种情况下女孩同意了接触。', '不负责，因为乘客的行为在这种情况下是社会可接受的。', '不负责，因为女孩没有因接触而受到伤害。']",2
1,一位母亲带着她五岁的孩子去医院急诊室接受治疗。医院的一名医生在治疗过程中猥亵了孩子。当时，治疗室内除了医生和孩子外没有其他人；母亲离开房间去买咖啡。两周后，当孩子告诉她母亲在治疗室发生的事情时，母亲遭受了严重的情绪痛苦，导致身体不适。在母亲代表自己对医生提起的因故意施加情绪痛苦的诉讼中，母亲有可能胜诉吗？,professional_law,"['不，因为母亲在治疗过程中将孩子单独留给医生是有过失的。', '不，因为母亲既不是医生行为的直接受害者，也不是同时见证者。', '是，因为医生的行为是令人发指的。', '是，因为母亲的痛苦是医生行为的自然和可预见的后果。']",1
2,一位婚礼策划师在湖上拥有一个夏季小屋。为了方便进入位于湖上方小山丘上的小屋，婚礼策划师与邻居（一个毗邻土地的所有者）签订了一项协议，其中邻居以书面形式授予婚礼策划师一条30英尺宽和四分之一英里长的通行权，沿着邻居物业的东侧边界。在未通知邻居的情况下，婚礼策划师按照他的计划进行改善路基，将道路铺上沥青以便更适合机动车通行。几年后，邻居开办了一家沙子生意，这需要他进行重型运输，随后摧毁了路上的沥青面层。邻居开办沙子生意十年后，婚礼策划师将他的湖滨物业卖给了一位艺术家。在艺术家接管小屋和物业不久后，邻居在道路上竖起了木制障碍物，从而阻挡了通往艺术家物业的通道。婚礼策划师在通道道路上获得的权益可最好描述为,professional_law,"['地役权.', '通过先前使用隐含的地役权.', '必要地役权.', '明确地役权.']",3
3,一个原告在双方居住的州的法院起诉了一名被告。原告仅声称根据联邦法规提起诉讼，尽管州法律提供了类似的诉因。该联邦法规规定，根据该法规的索赔可以在任何有管辖权的法院提出。该法规尚未被任何联邦法院解释。州法院应该审理此案吗？,professional_law,"['不，因为根据联邦法律的案件必须在联邦法院裁决。', '不，因为州法院必须在联邦法院决定联邦问题之前回避联邦法律的案件。', '是，因为州法院不得歧视根据联邦法律提出的案件。', '是，因为由于没有公民身份的多样性，双方无法在联邦法院进行诉讼。']",2
4,一位经理的竞争对手寄了一封诽谤信给经理，指责他在专业上无能，并称他是镇上最差的商人之一。信是寄给经理的。他读了信，把它放在一个私人抽屉里，再也没有读过。后来，他试图因为这封信而起诉竞争对手诽谤。法院是否可能会批准被告的驳回动议，并基于什么理由？请根据普通法对诽谤的定义作答。,professional_law,"['是的，法院将驳回，因为出版物仅仅是给经理一个人。', '是的，法院将驳回，因为语言对经理的声誉没有损害。', '不，法院不会驳回，因为情况表明所有的诽谤要素都存在。', '不，法院不会驳回，因为在诽谤诉讼中，原告有绝对的权利来要求陪审团审判，以证明诽谤。']",0
5,卖方与买方签订合同，以30万美元出售土地。合同规定，成交将在合同签署后60天进行，卖方将在成交时通过一份放弃所有权契约将“可出售的产权”转让给买方。合同中没有其他关于交付给买方的产权的条款。产权调查显示，土地上有一笔未偿还的5万美元抵押贷款和一部分土地的通行权地役权。买方现在声称产权不可出售，并拒绝成交。买方的说法正确吗？,professional_law,"['不，因为根据这些事实，没有什么使产权不可出售。', '不，因为买方同意接受放弃所有权契约。', '是的，因为通行权地役权使得产权不可出售。', '是的，因为未偿还的抵押贷款使得产权不可出售。']",2
6,一名原告起诉被告，因为原告在被告的车撞到他时受伤。在审判中，原告作证说，他在被告的车撞到他时正走在人行横道内过马路。此案发生在一个有法律规定要求所有驾驶者在指定的人行横道停车并允许行人过马路的司法辖区。被告辩称原告是从人行横道外跑到街道上的。此外，被告作证说，他在看到原告冲到街道上时立即踩刹车，但没能及时停车以避免撞到他。为了支持被告的证词，被告请一位邻居作证，她说在她住在那条街的这些年里，她经常观察到原告“总是在人行横道外过马路。”邻居的证词可能会是,professional_law,"['被采纳，因为这表明原告粗心。', '被采纳，因为这证明了原告在横穿马路时习惯在人行横道外。', '被排除，因为邻居不是事故的目击者。', '被排除，因为她的证词是不可接受的品格证据，用于证明被告在特定场合的行为。']",1
7,几个人一起从艺术博物馆偷了一幅画。其中一个是司机，他在犯下另一项罪行时被抓。他告诉警方：“我甚至没有从艺术博物馆得到任何钱。全都给了第一个人和第二个人。”当第一个人和第二个人因艺术画作盗窃案受审时，司机的陈述在法庭上是否可以作为证据？,professional_law,"['是的，作为一方当事人承认的陈述。', '是的，作为对其他被告不利的陈述。', '不，因为这是在拘留期间做出的，因此不可靠。', '不，因为该陈述不是在阴谋进行或推进过程中做出的，因此是传闻。']",3
8,一位狂热的棒球迷想购买即将在当地体育场举行的棒球比赛的门票。他联系了体育场的售票处，售票处告知他，所有门票将在第二天上午9点在体育场出售。这位从事砖瓦工工作的球迷意识到他无法请假去购买门票。因此，他打电话给隔壁的邻居，询问他是否愿意去体育场为他购买棒球门票。邻居告诉球迷，他很乐意为他购买门票，并且他（邻居）自己也想买票。不过，邻居说他的车坏了，没有交通工具可以去体育场。球迷建议他可以把车借给邻居。邻居同意了，第二天早上两人在球迷的家门前见面。球迷把车钥匙交给了邻居，并给了他买票的钱。随后，邻居开着球迷的车去了体育场，在那里为球迷买了票（用自己的钱）也为自己买了一套票。球迷指示邻居在从体育场回来后把车还到他的家。然而，邻居离开体育场后，决定去一个距离他家120英里的小镇拜访朋友。当邻居驾车前往小镇时，一辆汽车撞上了他，造成了球迷的车严重损坏。修理球迷的车的费用被确定为超过了汽车的零售价值。在球迷起诉邻居以索赔事故损害的诉讼中，球迷最有可能,professional_law,"['得不到任何赔偿，因为事故发生时邻居正在进行一项共同冒险。', '获得修车费用的赔偿。', '获得汽车的零售价值的赔偿。', '获得赔偿，因为事故发生时邻居在疏忽驾驶。']",2
9,一名被告是无力负担律师费用的穷人，他因持有少于一盎司的大麻而被捕并被指控。根据相关州法律，持有少于一盎司的大麻是轻罪，最高可判处一年监禁和/或500美元罚款。在审判中，被告不认罪并要求任命一名律师为其辩护。审判法官拒绝了被告的律师请求。如果被告随后被判有罪，以下哪一项是可以合法施加的最严厉的刑罚？,professional_law,"['500美元罚款。', '六个月监禁。', '一年监禁。', '没有刑罚，因为被告被剥夺了获得律师的权利。']",0
10,一名在事故中受伤的司机起诉了过失的另一名司机以索赔。他们的辩护医学专家进行了独立的医学检查并审查了所有医学记录。专家作证称，事故并未导致受伤，因为医学记录证明了之前的长期治疗相同症状的历史。陪审团裁定原告胜诉，但仅判给10美元的赔偿。在审后动议中，原告辩称专家的证词为不当的传闻证据，因为他是基于之前治疗医生的记录，而这些医生无法接受交叉质询。根据联邦证据规则，正确的裁决是什么？,professional_law,"['关于原告在事故前状况的证词无关紧要，该证词不可采信。', '联邦证据规则允许为医疗诊断或治疗目的所作的传闻陈述的采纳。', '与问题相关的医学证词永远不能从被告的案子中排除，因为它总是可靠的。', '该证词是不可采信的传闻，因为在这些事实下有宪法权利去交叉质询那些写了之前记录的医生。']",1
11,卖方称发生了一种情况，使履行销售合同变得不切实际。关于不可行性的免责，下列哪项是不正确的？,professional_law,"['问题不应该是由寻求援引该辩护的当事方的过错造成的。', '价格上涨足以解除合同。', '未能免除履行将导致严重的不公正。', '不可行性必须涉及合同订立时的基本假设。']",1
12,周五晚上，一名司机在他的车辆被一名身份不明的司机擦撞后，在一场汽车事故中受伤。事故发生后，司机被送往医院接受治疗。在医院期间，司机被诊断出背部骨折。他被打上全身石膏，然后被放置在牵引状态。司机的医生组装了牵引装置，并将司机的左腿以40度角放置在头顶上的马镫中。司机被指示仰卧在床上。周六早晨早餐后，司机向护士请求使用便盆。当她将便盆放在司机的身体下方时，支撑他腿的马镫断了。这导致司机的腿撞在床边的金属框架上，导致胫骨骨折。牵引装置存在缺陷，因为制造商没有在马镫装置上包括一个安全锁，以防止其在没有牢固固定时掉落。如果司机对制造商提出索赔，他很可能,professional_law,"['胜诉，因为马镫在牵引装置正常使用时断裂了。', '胜诉，因为制造商未包括安全锁使牵引装置存在缺陷。', '败诉，因为牵引装置已不受制造商控制。', '败诉，如果医生在组装牵引装置时未正确安装马镫。']",1
13,一位房主对一个屋顶工说：“我的屋顶漏水了。我认为旧瓦片裂了。如果你能用全新的瓦片替换它们，我会支付你5000美元。”屋顶工回答说：“当然可以，如果我能排开繁忙的日程。”房主接着说：“那好吧，但请尽快通知我。”三天后，屋顶工开着他的皮卡车来到房主家，并卸下了进行屋顶工作所需的材料和设备。当房主从窗户向外看见正在发生的一切时，他立刻跑出去喊道：“停！交易取消。我决定自己修理屋顶。”在屋顶工因违约而对房主提起的诉讼中，以下哪一项能为屋顶工提供最佳的追偿理论？,professional_law,"['当屋顶工购买做这项工作所需的材料和设备时，成立了一份双边合同。', '当屋顶工说“当然可以，如果我能排开繁忙的日程”时，成立了一份双边合同。', '房主提出了一个单边合同的要约，并且当屋顶工购买了完成该工作所需的材料和设备时，该要约变得不可撤销。', '房主提出了一个单边合同的要约，并且当屋顶工在房主家卸下材料和设备时，他表现出接受要约的意图。']",3
14,一个鳏夫拥有一个10英亩采石场的所有权。8月1日，鳏夫把一份将采石场转让给他侄女的契约交给他的朋友，并对朋友说：“把这个交给我侄女。”鳏夫不知道的是，侄女在非洲。下周，朋友在记录办公室正确地记录了这份契约。一个月后，鳏夫去世，在他的遗嘱中，他将采石场遗赠给了他的女儿。此后，侄女从非洲回来，侄女与女儿之间就采石场的所有权发生了争议。在一项关于采石场所有权的诉讼中，法院裁定侄女胜诉。裁决很可能基于以下哪项？,professional_law,"['存在有效的“临终赠与”。', '当鳏夫将契约交给朋友时，交付是有效的。', '当朋友记录契约时，交付是有效的。', '契约在遗赠生效前已被记录。']",1
15,一名罪犯实施了教唆犯罪。以下哪一项不适用于教唆？,professional_law,"['这是两人或多人之间达成的犯罪协议。', '这是教唆他人实施重罪。', '除教唆外不需要其他行为。', '撤回通常不是一种辩护。']",0
16,被告人告诉两名男子，一家医疗器械公司现在正在利用河边的旧仓库储存其除颤器的供应。深夜，两名男子闯入仓库，并开始将大型除颤器箱子装上他们的卡车。在他们离开时，其中一名男子不慎将他的烟头扔进了一堆旧纸箱和纸张的垃圾堆。不久之后，垃圾堆就燃起了小火。虽然两名男子有时间在不对自身造成任何危险的情况下扑灭火焰，但他们没有这样做，而是逃走了。与此同时，火势迅速蔓延，将整个仓库吞噬。如果被告人后来被控为共谋者，他很可能会被认为,professional_law,"['事前从犯。', '第二级主犯。', '帮凶。', '不负责任。']",3
17,一名男子因刊登付费报纸广告，提供如何在另一个州进行堕胎以及如何找到转介服务的信息而被逮捕并定罪。一项刑事法规规定传播此类信息是犯罪。法院会维持该定罪吗？,professional_law,"['不，该法规侵犯了第六修正案的隐私权。', '不，该法规侵犯了第一修正案保护的商业言论的发表权。', '是的，堕胎权不包括宣传在哪里可以堕胎的权利。', '是的，没有权利发表或传播商业性质的言论。']",1
18,一位著名的环保主义者拥有一大片原始森林。环保主义者将这片土地“以完全所有权转让给州人民；但是，如果该土地的任何部分被用于或开发用于任何商业目的或以其他方式从其自然状态转换（娱乐、科学或教育目的除外），则赠与人或其继承者可以重新进入赠与人之前的产权。”该州在这片土地上的权益最好描述为,professional_law,"['可终止的完全所有权。', '附解除条件的完全所有权。', '附属地役权。', '附有执行利益的可终止所有权。']",1
19,一位承包商与房主就新房的建造价格进行谈判。承包商向房主提出了多个建造报价，其中包括一个10万美元的报价。以下哪种沟通不会终止该报价，以便后续的接受可以生效？,professional_law,"['房主询问承包商是否愿意以95,000美元的价格建造房屋。', '承包商联系房主并表示撤回报价。', '承包商在房主接受之前去世，但承包商的儿子打算继续经营该业务。', '房主表示“我接受你的报价，但价格应为97,000美元。”']",0
20,一名被告被怀疑入室盗窃了邻居的公寓。邻居报告说他的公寓被洗劫一空，几件衣物被盗。在调查过程中，两名警探去被告的工作场所采访他。在被告知米兰达权利后，被告要求打电话给他的律师。虽然他的律师不在，律师的接待员劝告他不要说任何话。被告告诉侦探，除非有他的律师在场，否则他将不再说任何话。然后侦探问他是否愿意跟他们去警察局回答一些与此无关的抢劫案的问题。被告同意了。在他们开车去警察局的途中，被告被问到他穿的靴子是在哪里买的。他拒绝回答。当他们到达警察局时，侦探要求他签署放弃律师权利的声明。被告回答说，在没有律师在场的情况下，他不会签署任何东西。随后他被安置在一个审讯室。很快，被告被告知如果他愿意说出靴子是在哪里买的就可以离开。被告承认他是从一个朋友那里买的靴子和一些衬衫。根据这些信息，侦探获得了一份搜查令并去了被告的家，在那里他们找到了被盗的衣物。被告被指控入室盗窃公寓。在审判中，法庭应该,professional_law,"['承认供词，因为它是自愿的，并且衣物是通过有效的搜查令获得的。', '压制供词，因为它是在违反他第六修正案的律师权利的情况下获得的，但承认衣物，因为是通过有效的搜查令获得的。', '压制供词，因为被告未能签署放弃声明，但承认衣物，因为是通过有效的搜查令获得的。', '压制供词，因为它是在违反他第五修正案的律师权利的情况下获得的，并且衣物因为搜查令是由于供词而获得的。']",3
21,一名女子受雇于一家百货公司的销售员。她在女性内衣部工作。一天晚上接近关门时间，该女子从百货公司的珠宝部的一个橱柜中拿出一条钻石项链，并用纸巾包裹起来。然后，该女子偷偷地将项链塞进购物袋，打算离开商店时将其带走。过了一会儿，店主走近该女子，并告诉她需要留下来做库存。当该女子完成库存时，店主发现了项链并报警。该女子最有可能被判有罪的罪行是,professional_law,"['未遂盗窃。', '盗窃。', '虚假陈述。', '挪用。']",1
22,一名女子在商场的公共洗手间里。当她在水槽旁时，一名男子进入了洗手间并告诉她不要出声。受到惊吓的女子跑向浴室的一扇开着的窗户，并跳到了消防梯上。当她沿着消防梯下去时，不小心跌倒，腿部擦伤。以下哪一项罪行，该男子最有可能被定罪？,professional_law,"['攻击罪。', '殴打罪。', '意图强奸的攻击罪。', '无罪。']",3
23,一位买家从市场购买了一加仑的脱脂牛奶。牛奶装在一个塑料容器中，由一家乳品公司加工和包装。那天晚上，买家在准备晚餐时，从市场购买的容器中倒了一杯牛奶。他坐下来吃饭，并喝了一口牛奶。当他这么做的时候，买家感到有东西毛茸茸地卡在了他的嘴里。他立即吐出了那个毛茸茸的东西，发现那是一只死老鼠。买家遭受了严重的情感痛苦，但没有身体疾病或伤害。如果买家基于制造过失对乳品公司提出索赔，他最有可能,professional_law,"['获得赔偿，因为他遭受了严重的情感痛苦。', '获得赔偿，基于事物本身就说明的原则。', '不会获得赔偿，因为乳品公司的过失仅造成了精神困扰。', '不会获得赔偿，因为买家的正确诉讼理由是故意造成精神痛苦。']",2
24,在酒吧喝了几杯酒后，一个男人和他的朋友开车经过一座灯光熄灭的大房子。男人坐在乘客座位上，朋友把车停在路边。他们因为喝酒而感到醉意和攻击性。经过商讨，他们决定进入房子看看能拿些什么是个安全的赌注。他们闯入并拿走了几个装满珠宝的包。在开车离开时，他们被拦下并因入室盗窃被捕。乘客以自己醉得无法产生进入房子实施重罪的特定意图为辩护。这里描述的事实是否表明该辩护在审判中可能胜诉？,professional_law,"['是的，因为他实际上醉得无法形成证明入室盗窃所需的意图。', '不，因为醉酒从来不是实施重罪的辩护理由。', '不，因为事实表明他并没有醉到无法形成入室盗窃所需的意图。', '是的，因为醉酒和攻击性的感觉不是他的自然精神状态，因此意图（mens rea）被否定了。']",2
25,一名铁路工人的遗孀在联邦法院对铁路公司提起了一起过失致死诉讼，声称铁路公司的过失导致了她丈夫的死亡。在审判中，遗孀提供了丈夫一名同事的证词。该同事作证说，他看到丈夫所乘坐的铁路车厢减速，而后面的车厢加速。同事还表示，他后来听到一声巨响，但没有转过身去看，因为在场内听到响声是很常见的。另有三名铁路员工作证称没有发生碰撞。在证据结束时，铁路公司申请依法判决，但被拒绝，案件交由陪审团审理。陪审团裁定遗孀胜诉。铁路公司提出了申请依法判决的重新动议。法院应适用什么标准来决定如何裁决该动议？,professional_law,"['证据是否揭示了支持遗孀主张的实质性事实争议。', '判决是否违背证据的权重。', '遗孀是否提供了支持判决的微量证据。', '记录中是否有实质性证据支持判决，所有争议问题都以遗孀的利益为准。']",3
26,2月1日，一名男子给一位机械师寄出以下信件：“最近我的车运行得不太好。如果你在2月10日前更换机油、更换机油滤清器并调整化油器，我将支付你275美元。”机械师于2月3日收到该男子的信件。当日，他打电话给一家汽车供应公司并订购了进行维修所需的材料。两天后，机械师在一个聚会上遇到了那名男子，并进行了如下对话：男子：“忽略我上周寄给你的信。”机械师：“不行，我已经向汽车供应公司订购了材料。”男子：“抱歉，我昨天卖掉了我的车，所以不用修了。”如果机械师因违约提起诉讼，以下哪个是该男子最有力的论点，证明双方之间没有形成可强制执行的合同？,professional_law,"['在男子撤销他的要约之前，机械师尚未完成履行。', '男子的要约只能通过返回承诺接受。', '因为男子是通过信件提出要约的，机械师只能以同样的方式接受。', '虽然机械师正在准备进行维修，但在男子撤销要约时，他尚未开始请求的接受行为。']",3
27,一名原告因在被告家门口的人行道上摔倒而受伤，起诉了被告。原告的投诉称人行道上覆盖着一层厚厚的冰，是被告疏忽留下的，已经存在了好几天。在回答中，被告指出冰是在一夜之间形成的，并且原告在被告尚未有机会清除之前就已经摔倒。在审判中，一名医生，他的办公室就在被告家隔壁，作证称他看到原告摔倒，并且那块冰已经存在了好几天，至少有两英寸厚。在交叉询问中，被告的律师问医生以下问题：“在你当天对原告的治疗中，他是否告诉你他的摔倒是由于在晕眩后失去平衡造成的？” 原告律师提出反对意见，医生的证词将被裁定,professional_law,"['可采纳，因为这对诊断或治疗具有合理的相关性。', '可采纳，因为医生对原告的伤害有个人了解。', '不可采纳，因为被告的律师未能奠定适当的基础。', '不可采纳，因为医生的证词与证明原告所称的伤害是虚假或夸大的无关。']",0
28,在感恩节那天，一位父亲正在为家人切火鸡时严重割伤了他的手。刀子切断了一条动脉，导致父亲失去了大量血液。母亲打电话给他们的家庭医生，医生指示她开车送父亲去当地医院。医生表示他会在那里与他们会合。不久之后，在医院，医生为父亲进行了治疗并包扎了他的手。然而，由于父亲失去了相当多的血液，医生下令立即进行输血。在确定父亲的血型为A阳性后，医生口头指示医院雇用的护士去获取输血所需的血液。护士遵循了医生的指示，打电话给医院的血库部门，订购了一单位A阳性血液。接到护士电话的血库人员正确地记录了A阳性血液的订单。然而，血库的一名工作人员，其身份无法确定，在处理订单和为父亲标记血液单位时犯了错误。结果，血库发送了一单位错误标记为A阳性的B阳性血液。在输错血后，父亲去世了。医院有一条书面的规定，要求所有输血订单必须由负责患者治疗的医生书面下达。虽然医生知道医院的规定，但他和医院的许多其他医生一样，常常通过口头指示下达输血订单。如果母亲对医生提起错误死亡诉讼，她最有可能,professional_law,"['胜诉，因为医生将对血库在输错血方面的错误负责。', '胜诉，因为医生没有遵循医院关于输血订单的规定。', '败诉，因为医生的行为方式与医院的许多其他医生相同。', '败诉，因为负责发送错误血型的血库中身份不明的人不是医生的雇员。']",3
