Unnamed: 0,question,subject,choices,answer
344,Prime Corp.是一家按权责发生制计账的日历年C公司。其当年报告的联邦所得税前账面收入为300000美元，其中包括17000美元的公司债券利息收入。发生了20000美元的公司高管定期寿险保费费用。Prime是保单的拥有者和受益人。Prime当年的应税收入在Prime的Schedule M-1《按书本收入（损失）与1120美国公司所得税申报表的收入（返回）调节》上如何协调？,professional_accounting,"['$320,000', '$300,000', '$283,000', '280000']",0
345,"星星公司是一家专门经营现代家具的零售店。以下信息取自星星公司6月份的预算：销售额540,000美元，销售成本300,000美元，6月1日的商品库存150,000美元，6月30日的商品库存180,000美元，6月1日的采购应付账款85,000美元，6月30日的采购应付账款75,000美元。星星公司应为6月采购预算多少现金支付额？",professional_accounting,"['$260,000', '$280,000', '$320,000', '340000']",3
346,应收账款的确认最初被审计师归类为“例外”的原因最有可能是,professional_accounting,"['客户与被审计单位之间存在信用或零余额。', '回复是通过邮寄而不是传真给审计师的。', '应收账款被分类为无法收回。', '寄给被审计单位但尚未记录的付款。']",3
347,一家公司的新的打卡系统要求小时工选择一个识别号码，然后选择签到或签退按钮。摄像机会拍摄使用该系统的员工的图像。以下哪种风险可以预期新系统改变最小？,professional_accounting,"['员工自己工时的欺诈性报告。', '员工加班计算的错误。', '员工工时的不准确核算。', '记录其他员工的工时。']",1
348,以下哪种情况不会影响对审计客户的客观性、诚信或独立性？,professional_accounting,"['审计师带客户的审计委员会去拉斯维加斯过周末。', '外地客户请审计团队在一家著名的当地餐厅吃晚餐。', '审计师为客户管理层提供一个赛季的大联盟棒球俱乐部包厢座位。', '客户在审计团队连续两个周末工作后，带他们去滑雪两天。']",1
349,假设X公司的市场价格是每股45美元，Y公司的市场价格是每股30美元。如果X公司为每股Y公司股票提供四分之三股普通股，那么市场价格的交换比率将是：,professional_accounting,"['0.667', '1', '1.125', '1.5']",2
350,费因伯格声称，大多数对心理利己主义的论证：,philosophy,"['参考神经科学。', '基于控制研究。', '基于访谈和调查。', '具有非经验性质。']",3
351,以下哪种观点与情境伦理立场无关？,philosophy,"['为所欲为', '原则性相对主义', '目的证明手段', '没有选择']",0
352,布兰特所捍卫的功利主义版本使正当性成为以下因素的函数：,philosophy,"['特定行为的后果。', '社会实际和公认的规则。', '理想规则。', '一个人的原则是否可以普遍化。']",2
353,在西塞罗看来，每个人都被自然赋予了两种性格：,philosophy,"['普遍的和个人的。', '有德的和邪恶的。', '善与恶。', '神性和野性。']",0
354,康德声称理性的自然目的是什么：,philosophy,"['产生幸福。', '产生快乐。', '产生知识。', '产生善意。']",3
355,安斯康认为，根据西奇威克的观点，一个行为的恶劣程度必须根据以下因素来估计：,philosophy,"['它的实际后果。', '它的预期后果。', '它是否违反了任何职责。', '它是否违反了神圣法律。']",1
356,美学处理的对象是_____。,philosophy,"['对我们的存在至关重要', '对大多数人来说不重要', '对我们的存在不重要', '很少被看到']",2
357,根据休谟的观点，道德最终基于：,philosophy,"['理性。', '上帝的命令。', '社会协议。', '同情心。']",3
358,亚里士多德说，使事物成为其本质的东西并不存在于世界上存在的个体之外。因此，如果一个物种的所有成员都被毁灭，那么它们的本质或形式：,philosophy,"['同样会被毁灭。', '只有在没有人记得这个物种的情况下才会被毁灭。', '会继续存在（像柏拉图的形式一样）在某个其他存在领域。', '不会被毁灭，因为起初没有本质或形式可以被毁灭；只有个体，而不是事物的普遍本质或性质。']",0
359,伊壁鸠鲁声称所有其他美德都源于：,philosophy,"['谨慎。', '节制。', '公正。', '勇气。']",0
360,亚里士多德声称：,philosophy,"['美德在我们的掌控之中，恶德也是。', '美德在我们的掌控之中，但恶德不是。', '恶德在我们的掌控之中，但美德不是。', '美德和恶德都不在我们的掌控之中。']",0
361,根据斯蒂文森，经验方法：,philosophy,"['从未在解决伦理分歧时有用。', '有时在解决伦理分歧时有用，但并不总是足够的。', '原则上总是足以解决伦理分歧。', '提供从事道德哲学的唯一负责任的方法。']",1
362,根据阿奎那的观点，人类最终的幸福在于：,philosophy,"['快乐', '道德美德的行为。', '爱上帝。', '沉思上帝。']",3
363,亚里士多德在《伦理学》的结尾处转向讨论：,philosophy,"['美学。', '神学。', '政治。', '自然科学。']",2
364,像大多数理性主义者一样，柏拉图将知识定义为有理由的真实信念。根据这一定义，我们可能声称知道某些事情是真实的，但实际上可能是错误的，但我们不可能真正知道某些事情是错误的。为什么？,philosophy,"['因为知道某些错误的东西就是知道没有真实的东西，什么都不知道（即根本不知道）。', '因为我们所知道的真实事物最终是基于我们声称知道的真实事物。', '因为我们无法为相信某些错误的东西提供理由或依据。', '因为与我们对不变形式的知识相反，对特定对象的信念可能会改变。']",0
365,Feinberg声称，当人们感到饥饿时，他们通常渴望：,philosophy,"['吃东西。', '愉快的味觉感受。', 'a和b都渴望。', '既不渴望a也不渴望b。']",0
366,Stevenson声称伦理判断的主要用途是：,philosophy,"['陈述事实。', '影响他人的利益。', '描述自己对事物的认可。', '以上都不是。']",1
367,克雷格说一个实际上无限多的事物_____。,philosophy,"['是可能的', '是无意义的', '存在于某处', '不能存在']",3
368,Stevenson在这篇论文中的主要目的是：,philosophy,"['提供一个关于正当行为为何正当的解释。', '确定哪些事物本身是好的。', '发展一个良好道德品格的理论。', '使伦理问题清晰。']",3
369,达芬奇的《蒙娜丽莎》是_____。,philosophy,"['具象的', '抽象的', '模糊的', '非具象的']",0
370,Taurek声称，如果面临选择是拯救X的生命还是Y的手臂：,philosophy,"['Y有义务选择拯救X的生命。', '我们有义务选择拯救X的生命。', 'a和b都对。', 'a和b都不对。']",3
371,霍布斯声称所有自然法则都可以总结为以下原则：,philosophy,"['最大化幸福。', '绝不将他人视为达到自己目的的手段。', '己所不欲，勿施于人。', '在一切所做的事情中实践美德。']",2
372,霍布斯将不公定义为：,philosophy,"['拿多于自己份额的东西。', '未能履行自己的契约。', '将他人仅仅当作手段。', '违反自然法则。']",1
373,根据萨特的观点，至少有一个存在先于本质的存在，这个存在是____。,philosophy,"['上帝', '人', '原始人', '未来人']",1
374,Nagel声称道德运气的问题与以下哪个问题密切相关：,philosophy,"['上帝的存在。', '意志自由。', '心理利己主义。', '普遍性。']",1
375,根据罗尔斯的观点，我们可以进入原始状态：,philosophy,"['只有通过离开社会并从头重建社会制度。', '在任何时候，只需遵循某个程序。', '只有在某种程度上忘记我们是谁的情况下，这种情况非常罕见。', '以上都不是。']",1
376,赫尔声称所有的道德论点都是：,philosophy,"['无用的。', '有效的。', '人身攻击的。', '有根据的。']",2
377,Nussbaum声称，在跨文化交流中，不同概念体系的居民往往倾向于将他们的互动视为：,philosophy,"['相对主义的方式。', '绝对主义的方式。', '康德主义的方式。', '亚里士多德主义的方式。']",3
378,Diener和Crandell提到的伦理原则有多少类别？,philosophy,"['三类: 对学生的伤害; 缺乏知情同意; 社交媒体上的隐私侵犯。', '四类: 对参与者的伤害; 缺乏知情同意; 隐私侵犯; 涉及欺骗', '两类: 伦理和不伦理', '两类: 对与错']",1
379,针对饥荒救济适得其反，因为它导致人口过剩的论点，辛格声称：,philosophy,"['这在经验上已被证明是错误的。', '这是真的，但不应该成为我们的道德关切。', '这是一个向人口控制努力捐款的理由。', '不存在“人口过剩”这样的事情。']",2
380,奥古斯丁认为我们永远不会犯错：,philosophy,"['在任何情况下都不犯错。', '除了通过无知。', '除了通过邪恶。', '除了通过诱惑。']",1
381,菲洛说克莱安特用来论证的类比是_____。,philosophy,"['过于复杂', '弱', '强', '不基于合法的推理方法']",1
382,在债务人案例中，反对监禁A的道德论点依赖于：,philosophy,"['恐惧。', '普遍化。', '对这样做的后果的考虑。', '以上全部。']",1
383,为了说明表面责任的概念，罗斯作了如下类比：,philosophy,"['自然法则。', '一个国家的法律。', '独裁者的命令。', '我们的情感。']",0
384,Nagel声称在反思之前，人们不能因以下原因受到道德评判是合理的：,philosophy,"['仅影响他们自己的行为。', '他们的性格。', '由于超出他们控制的因素。', '不侵犯任何人权利的行为。']",2
385,笛卡尔说，就他所知，他可能是_____。,philosophy,"['做梦', '一个神', '无误的', '完美的']",0
386,艺术的一个重要形式特征是_____。,philosophy,"['社会意义', '忠实的再现', '其激发强烈情感的力量', '一致性']",3
387,根据苏格拉底的观点，一个人的生活价值或质量取决于对人类生存原则或基本理由的理解。没有这样的知识（他认为）生活就缺乏美德，因为：,philosophy,"['“有道德地行动意味着对自己正在做什么以及为什么这样做有了解。”', '“不从哲学上理解存在的人永远无法做对任何事情。”', '“要有做任何事情的能力或能力，要求我们知道自己在做什么。”', '“不仅美德是知识，而且未经审视的生活不值得过。”']",0
388,Baier声称，一个规则要属于一个群体的道德，必须是：,philosophy,"['属于该群体的风俗习惯的一部分。', '普遍可教的。', '不仅仅是一个禁忌。', '以上全部。']",3
389,Feinberg声称追求幸福的最佳方式是：,philosophy,"['追求快乐。', '追求幸福。', '忘掉幸福。', '以上皆非。']",2
390,对于柏拉图来说，普通的感官对象存在并且可以作为理念或“形式”的例子或实例被认知，而这些理念或“形式”并不存在于我们普通的感官世界中。形式不存在于感官世界的原因是：,philosophy,"['在感官世界中，只有数学对象（例如三角形）可以通过假设来认知，这些假设是在我们被问及合适的问题时回忆起来的。', '与感官世界中的一切不同，形式不是个体事物，而是个体事物成为其所是并被认知的普遍本质或性质。', '在感官、经历的世界中，除非存在“感官世界”形式（如美或正义的形式），否则没有任何东西可以存在或被识别为某个特定事物。', '感官世界由变化的形式组成，这些形式的存在和认知依赖于其他变化的形式，而这些又依赖于其他形式，形成无尽的回归。']",1
391,认为艺术由其形式定义的观点被称为_____。,philosophy,"['非形式主义', '表现主义', '形式主义', '结构主义']",2
392,根据休谟，理性：,philosophy,"['应该服务于我们的激情。', '应该完全独立于我们的激情运作。', '应该用来引导我们的激情。', '应该用来熄灭我们的激情。']",0
393,根据安斯康姆，“道德义务”目前表示：,philosophy,"['一个社会的规范。', '一个人的感受。', '上帝的命令。', '根本没有真实的概念。']",3
394,Ross声称我们了解到我们的表面义务：,philosophy,"['通过看到特定行为的表面正当性，然后领悟一般原则。', '通过领悟一般原则，然后推断特定行为的表面正当性。', '通过哲学证明。', '从我们孩提时代接受的明确道德教育中获得。']",0
395,根据伊壁鸠鲁，法律在什么时候是不公正的：,philosophy,"['它不符合自然法。', '它不符合社会的传统。', '它冒犯了神明。', '它对受影响的人没有好处。']",3
396,哲学的四个主要分支是形而上学、认识论、价值论和_____。,philosophy,"['生物伦理学', '逻辑学', '美学', '范畴逻辑']",1
397,密尔声称，对功利主义最强烈的反对意见之一来自于以下观念：,philosophy,"['责任。', '正义。', '美德。', '超额行为。']",1
398,一个普遍的观点是，如果一个物体具有审美价值，那么它_____。,philosophy,"['无法定义', '没有实用性', '具有某种重要功能', '没有意义']",2
399,柏拉图的观点是，真正的美是_____。,philosophy,"['在日常物品中找到的', '不存在的', '在自然界中无处不在', '不属于这个世界的']",3
400,这个问题涉及以下信息。 俄语人口在末代帝俄和苏联时期的识字率，1897–1955年 识字率 1897年 24% 1917年 45% 1926年 56% 1937年 75% 1939年 81.10% 1955年 99.90% 来源：人口普查数据和苏联教育部 一位同情苏联共产主义的历史学家最可能将这张图表用作证据来支持以下哪一项命题？,high_school_world_history,"['俄国革命的理想被列宁和斯大林政权背叛了。', '列宁和斯大林极大地提高了俄罗斯的军事准备。', '共产主义在俄罗斯比在中国运作得更有效。', '尽管列宁和斯大林存在滥用职权的行为，苏联政权仍然取得了显著的成就。']",3
401,以上段落的作者在讨论“第二堵墙”时，他指的是什么？,high_school_world_history,"['天主教徒和改革者对“圣灵”适当定义的不同看法', '天主教徒和改革者对圣经文本适当使用和解释的不同看法', '天主教徒和改革者对耶稣神性适当神学信仰的不同看法', '天主教徒和改革者对适当洗礼方式的不同看法']",1
402,以下哪项技术最直接导致了上述条约的签署？,high_school_world_history,"['火药武器', '指南针', '钢铁', '病原体理论']",1
403,这个问题涉及以下信息。 “关于谁和什么导致非洲欠发达的问题可以从两个层面来回答。首先，答案是帝国主义体系的运作对非洲经济滞后负有主要责任，因为它通过抽走非洲的财富并使大陆资源更快速的发展变得不可能。其次，必须处理那些操纵该系统的人以及那些是该系统的代理人或不知情的帮凶的人。西欧的资本家是从欧洲内部积极扩展其剥削以覆盖整个非洲的人。” 沃尔特·罗德尼，历史学家，《欧洲是如何使非洲欠发达的》，1974年 根据您对世界历史的了解，以下哪一项对欧洲在1750年至1900年期间渗透非洲的能力贡献最小？,high_school_world_history,"['机枪的发明', '热带疾病疫苗的发明', '股份公司的发展', '蒸汽动力船的发明']",2
404,这个问题涉及以下信息。 没有任务比维护和平更紧迫。没有和平，我们的独立就没有意义。我们国家的重建和建设将没有意义。我们的革命将不被允许顺利进行。我们能做什么？我们能做很多！我们可以将理智的声音注入世界事务。我们可以动员亚洲和非洲的所有精神力量、所有道德力量、所有政治力量来支持和平。是的，我们！我们，14亿亚洲和非洲的人民。 印尼领导人苏加诺，1955年在万隆会议上的主旨演讲 就像非洲、亚洲和中东的许多其他领导人一样，苏加诺试图保持中立，但未能完全成功，期间,high_school_world_history,"['阿拉伯-以色列冲突。', '朝鲜战争。', '冷战。', '越南冲突。']",2
405,以上段落的作者声称：“繁荣促进了衰败的原则；随着征服的范围扩大，毁灭的原因也随之增多。” 他这句话是什么意思？,high_school_world_history,"['统治者变得过于富有，因此被推翻。', '帝国变得过于庞大而难以有效控制。', '衰败在事物开始成长的那一刻就开始了。', '征服和繁荣是互不兼容的。']",1
406,以上演讲最能在以下哪种背景下得到理解？,high_school_world_history,"['中东的蒙古入侵', '新教改革', '大航海时代', '十字军东征']",3
407,"这个问题涉及以下信息。
“当葡萄牙人从中国的澳门到日本时，他们携带大量的白丝绸、金子、麝香和瓷器；而他们从日本带回的只有银子。他们有一艘大帆船每年都去那里，并且每年从那里带回大约六百枚银币：而所有这些日本的银子，加上每年从印度带来的二十万枚银币，他们都在中国充分利用；他们从那里带回金子、麝香、丝绸、铜器、瓷器和许多其它非常昂贵和镀金的东西。
当葡萄牙人到中国广州做生意时，他们只能在那里待几天：而当他们进入城市的大门时，必须在一本书上登记他们的名字，当他们晚上出去时必须注销名字。他们不能在城里过夜，必须在城外的船上过夜。而且，时间一到，如果有人还留在那里，就会被监禁。”
拉尔夫·菲奇，1599年对其远东旅行的叙述
除了第一段提到的银子来源之外，最大量的额外银子来自以下哪个地区？",high_school_world_history,"['中亚', '欧洲', '中东', '新大陆']",3
408,第一段可以被认为削弱了关于西方帝国主义的哪种普遍假设？,high_school_world_history,"['欧洲殖民者有时干涉当地的宗教习俗', '欧洲殖民者非常关心如何赚取利润', '欧洲殖民者一致热衷于向当地人口强加他们的文化规范', '欧洲殖民者经常诉诸武力来将他们的意志强加于帝国臣民']",2
409,"这个问题涉及以下信息。""至少有一个[世界的]社会必须以某种方式极大地提高其生产力[以实现全球霸权]。这种量子飞跃必须在各种科学、技术、农业和工业革命之前完成，我们的后量子飞跃世界正是建立在这些革命之上的。这只能通过利用整个大陆的生态系统、矿产资源和人力资源来实现，而这些大陆位于进行飞跃的社会之外。西欧正是通过其残酷和枪支，更重要的是，通过地理和生态的运气做到了这一点。""",high_school_world_history,"['美洲与欧洲之间的食物来源交换', '火药技术的精炼', '蒸汽动力技术的发展和应用', '合股公司的实施']",2
410,以下哪个后来的发展最有可能削弱毛泽东在段落倒数第二行中表达的希望？,high_school_world_history,"['中国沿海的经济特区发展为中国带来了经济增长。', '与苏联的政治摩擦在冷战期间将中国推向美国的轨道。', '农田上的农民合作社和强调农村钢铁生产给中国农民带来了饥荒和贫困。', '由邓小平等人领导的共产党内部反对声音在文化大革命期间被根除和压制。']",2
411,"这个问题涉及以下信息。
在权力的巅峰时期，蒙古可汗或统治者的领地组成了一个辽阔的帝国，以前敌对的民族在其中和平共处，几乎所有宗教都被容忍。……由成吉思汗首次颁布的法典规范了人际互动。其结果是国际接触的重要新阶段。从东欧到中国南部，商人和旅行者可以在治安良好的蒙古领土上自由穿行，无需担心生命或财产安全。覆盖或连接欧洲、亚洲和中东大部分地区的蒙古领土大片区域成为东半球文明之间的桥梁。穿越蒙古土地的商队和使团将新的食物、发明和思想从一个文明中心带到其他中心，并从文明中心传递给作为中介的游牧民族。安全的贸易路线造就了富裕的商人和繁华、国际化的城市。它们还促进了食物和发明的传播……成为经济和社会发展的主要动力以及文明生活的提升。
——罗伯特·吉塞皮，1992年
以下哪一项是13世纪蒙古征服俄罗斯的长期后果？",high_school_world_history,"['俄罗斯被排除在西欧的发展（如文艺复兴）之外。', '俄罗斯因成为蒙古政治活动的行政中心而受益。', '伊斯兰教成为俄罗斯的主导宗教。', '俄罗斯发展出一个集中的官僚体系。']",0
412,以下哪个事件是上述演讲最直接的结果？,high_school_world_history,"['任何基督教运动都未能重新夺回黎凡特', '地中海贸易路线的衰落', '拉丁基督徒征服君士坦丁堡', '拜占庭军队决定性地击败塞尔柱突厥人']",2
413,斯大林通过提到“持续的殴打”来证明他推进俄罗斯的努力是正当的，这在以下哪个历史事件中得到了验证？,high_school_world_history,"['与美国的太空竞赛', '20世纪20年代初的波苏战争', '俄罗斯内战中的西方干预', '1941年德国入侵俄罗斯']",3
414,"这道题参考了以下信息。""我在城市的小房子，最近投保了2,000英镑，毫无疑问会有相同的命运，因为保险公司不会赔偿被女王的敌人摧毁的东西。虽然我有一个离城不远的50英亩的农场，毫无疑问庄稼和房屋会被毁。事实上，这已经部分发生了，我现在正在控告政府，因为最近有1,500名当地人在距离不远的地方扎营，他们在周围造成了很多损害。"" 一封英国公民在1879年英祖鲁战争期间写给他妹妹的信。 作者与英国政府待决的诉讼的提到意在做以下哪一项？",high_school_world_history,"['强调作者财产损失的程度', '表达对正在进行的战争的反对', '贬低英国官员', '将责任归咎于他的祖国和祖鲁人']",3
415,"这个问题涉及以下信息。 ""非洲对世界和平的最大贡献是通过创建一个政治联盟来避免分裂固有的所有危险，这个政治联盟的成功也将成为一个分裂的世界的榜样。非洲国家联盟将更有效地展示非洲的个性。它将赢得一个只关注规模和影响力的世界的尊重。对法国在撒哈拉进行原子测试的非洲反对意见所给予的微不足道的关注，以及联合国在刚果争论宪法细节而使共和国濒临无政府状态的可耻景象，都是大国对非洲独立的冷漠无视的证据。"" 加纳领导人克瓦米·恩克鲁玛，1961年 这段话最清楚地是以下哪个的例子？",high_school_world_history,"['对非洲统一尝试失败的回应', '呼吁联合国介入非洲', '提出提高非洲在现代世界地位的建议', '对资本主义在非洲影响的热烈反对']",2
416,"这个问题是指以下信息：
“非洲对世界和平的最大贡献是通过创建一个政治联盟来避免分裂固有的所有危险，这个联盟的成功也将成为一个分裂世界的榜样。非洲国家联盟将更有效地展现非洲个性。它将赢得一个只看重规模和影响力的世界的尊重。对撒哈拉法国原子试验的非洲反对意见所受到的微不足道的关注，以及联合国在刚果就宪法细节争吵时，刚果共和国正摇摇欲坠地走向无政府状态的屈辱景象，都是大国对非洲独立冷漠无视的证据。”
加纳领袖克瓦梅·恩克鲁玛，1961年
以下哪一项解释了为什么恩克鲁玛认为非洲必须“避免分裂固有的所有危险”？",high_school_world_history,"['非洲国家如果不团结就无法实现独立。', '分裂是许多非洲国家最初陷入混乱的原因。', '非洲大陆已经经历了相当多的内战。', '国际社会将权力视为规模和影响力的函数。']",3
417,下列关于古代城市的说法中，哪一项最能得到第二段关于乌鲁克的讨论的支持？,high_school_world_history,"['古代城市缺乏有效的防御工事来抵御攻击。', '古代城市设有用于拜祭守护神的区域。', '古代城市通常以朴素的方式装饰他们的庙宇。', '古代城市设有用于训练军队的区域。']",1
