Unnamed: 0,question,subject,choices,answer
151,To what extent have biological agents been weponized?,security_studies,"['Military professionals believe that the majority of biological agents can be sufficiently stable in their effects to be used as a weapon. Resource requirements would be minimal as fermenters used to make vaccines could be converted for military production and relatively small quantities of the agent are required to produce highly lethal effects, making them an efficient and effective weapon.', 'Construction of the means to transmit biological weapons in warfare has focused on the use of vectors, for example lice, fleas, or mosquitoes, as a mode of transmission as a military weapon. These are favoured because the target would find it difficult to contain the source of the outbreak, placing the infrastructure of the target country under strain.', ""Biological agents comprise bacteria, viral, and toxin agents. However, not every disease provides the basis for an effective biological weapon. An agent's storage, delivery, mode of transmission and its very resilience can shape its effects on a target population."", 'Inoculation programs against naturally occurring disease have eradicated the potential for viral agents to cause a global pandemic. Vaccination capabilities have undermined calls for the weaponization of viral agents made by some military strategists as most public health authorities have in place programs to deal with a possible outbreak.']",2
152,In what ways can a distinciton be made between limtied force and full-scale force?,security_studies,"['The distinction between limited force and full-scale force is the second process of coercive diplomacy. Coercive diplomacy only fails if the coercer fails to achieve its defined goals and fails to defeat its adversary in the second stage.', 'Generally the distinction between brute and limited force is negligible. Resort to air or sea power constitutes an equal coercive capacity to a conventional ground offensive. Military action always results from a failure of negotiations and from a shift from the diplomatic to the military sphere.', ""The distinction between limited force and brute force is important because the amount of force that is used to attain the coercer's interests defines the type of outcome that is achieved. If a positive policy outcome is achieved, then we can say that limited force has been employed."", 'The distinction between limited force and full-scale war is crucial because resort to brute force means that diplomacy has failed. The distinction is not based on the amount of force or the type, but on the purpose that the use of force seeks to accomplish and the element of choice left to the adversary. In essence, limited force is a bargaining tool.']",3
153,Whcih of the folowing was not stated as an objective of the Comission on Human Security when it was launched?,security_studies,"['To promote public understanding, engagement and support of human security and its underlying imperatives.', 'To develop the concept of human security as an operational tool for policy formulation and implementation.', 'To propose a concrete program of action to address critical and pervasive threats to human security.', 'To develop a new international justice system to enhance human security.']",3
154,In what ways is a fusoin nuclear device diffeerent from a fission deivce?,security_studies,"['A fusion weapon is a three-stage-bomb that uses an implosion device to create a fission reaction, which then detonates a fusion reaction. It is often referred to as a thermo-nuclear or hydrogen device and has unlimited destructive potential.', 'A fusion reaction is created when the nuclei of two light elements are combined, the reaction resulting in heavier elements fragmenting into smaller parts. This fragmentation releases energy of limited destructive capacity, the extent of energy released dependent on the mass of material used.', 'A fusion device is a two-stage process where a gun-type device is used to trigger a series of fission reactions with the cumulative result being the production of a high energy flash explosion with unlimited thermal energy.', 'Fusion weapons have a highly specific destructive effect. The heavier element produced from a fissions reaction, and the difference in mass from the two lighter nuclei (which is translated into an energy explosion) can be precision calculated. Bombs even within the multi-megaton range have unlimited military utility, their destructive capability can be manufactured according to the target.']",0
155,In what ways wil the changing global security enviroment shape the natue of develping conflicts in the twenty-first century?,security_studies,"['Human migration will arise as a result of global inequalities in the distribution of power, wealth, and resources. Disempowerment of populations will lead to competition and violence, manifested in transnational movements; and environmental threats and resources scarcity will lead to conflict.', 'Economic interdependency between states will strengthen global security and lead to a reduction in international conflict. Human migration will lead to overcrowding and resource scarcity but this will be addressed by the technological advancements of developing states to which most migration will take place.', 'The primary cause of conflict, both at international and sub-national level will be based in ideological differences between populations as resources scarcity, population growth and human migration forces diverse identity groups into increasingly close contact.', 'Environmental concerns will be overshadowed by immediate threats to international security, posed by global economic crisis and the subsequent rise of fundamentalist ideologies and violence. Human migration will be managed within the current global economic system as poverty restricts movement although there is a limited risk of transnational revolt as a result of disempowerment and resource scarcity.']",0
156,Which of the folowing is a commmon criticism of the human securty concept?,security_studies,"['Human security is neo-colonial.', 'Human security promotes global capitalism.', 'Human security is too broad.', 'All of these options.']",3
157,How does Buzan's concept of 'societal secuirty' mark a depature from traditonal understandings of security?,security_studies,"['Securing the sustainable development of the state was dependent on societal security as an independent interest that was not secondary or dependent on the other sectors, including the military.', 'The end of the Cold War allowed security studies to move beyond the confines of the dominant realist and neorealist perspectives, with an emerging interest in other, non-military, conceptions of security. Those who wished to broaden the scope of security studies advocated the inclusion of resource, environment, and other referent points for analysis.', 'Societal security referred to the sustainable development of traditional patterns of military capabilities. Military threats could be subdivided to include the infrastructural strength, the technology, personnel, the economic base and the political base of the military security sector.', 'Contemporary processes of globalization and societal conflict required the development of new conceptual tools beyond the state as the referent object. Security was dependent on factors beyond geographically conceived survival: survival of the state was superseded by survival of the nation (ethnic) state.']",1
158,"In whaat ways did the Human Developmnt Report, published by the United Nations Developmnt Program in 1994, challenge the tradtional security paradigm?",security_studies,"['The report outlined seven areas or components of human security that policymakers should henceforth devote greater political attention and capital to: economic security, food security, health security, environmental security, personal security, community security, and political security.', 'The report highlighted the considerable burden that infectious diseases continue to pose in the developing world-including HIV/AIDS, tuberculosis, and malaria.', 'The report advocates a framework of human security analysis that aims to redress the perceived imbalance in security thinking that has been predominant in traditional security studies.', 'All of these options.']",3
159,How might glbal inequality present a threat to glbal security?,security_studies,"['Human security is threatened by global inequality, because 3s of the world population do not share the benefits of globalisation. However, this inequality does not translate into political instability or involve military action.', 'Global inequality creates disenfranchised populations who, although discontent with their situation, lack the agency to rebel or protest.', 'Revolutionary uprisings are likely to occur; people of the world who have been left behind by neoliberal globalisation can become radicalised and rebel against those who have benefitted from the economic policies that have failed them.', 'Global inequality does not present a significant threat to global security.']",2
160,Which of the follwoing is an importnat outcome of the 'energy security nexus'?,security_studies,"['Attempts to exert control over energy reserves in the South have consequences for the sustainability of cooperation between core powers; the emergence of geopolitical rivalries over this form of control has implications for international security.', 'All of these options.', 'United by common insecurities concerning the production and supply of energy resources, international actors are forced into negotiation and cooperation between states increases.', ""By virtue of their energy resources to which the global 'North' desires access, states in the 'South' gain power in the international arena and have redressed the global North-South divide and associated inequalities.""]",0
161,What factors enabled the expansion of transnationl crime (TNC) in the 1990s?,security_studies,"['Transnational crime developed as a result of the declining expenditure on defence and the standing down of armies, which reduced the risk of activities.', 'TNC as a concept emerged in the academic sphere as linked to human security concerns and developmental opportunities in weak states as a means of conflict resolution and peace building in Europe.', 'Transnational criminal activities have always been a feature of the international system. In the policy community, the growth of interest in TNC is due to the increasing sophistication of intelligence and communications technology, which has enabled the true representation of the scale and the scope of the problem to be known.', 'International trends such as globalization may have had the unintentional consequence of opening up new spaces for the development of transnational crime.']",3
162,What are the specific elements of a comprehensive natinoal defence trade control sytem?,security_studies,"['Governments should include in their arms trade rules, laws, penalties for their violation.', 'Governments should ensure that weapons producers mark their defence items with a unique marking.', 'Government police and military forces should establish appropriate weapons stockpile security measures and national authorities should collect and destroy old, outdated, and excess weaponry.', 'All of these options.']",3
163,What internal secuirty policy options are avalailable to elites?,security_studies,"['Elites create negative inducements for non support of the regime. Redistribution as a means of denial to the power structure in the form of ""elite disenfranchisement"" which may include diversion of resources, disarmament and denial of access to commercial activity routes.', 'Lacking infrastructural capacity and wider social legitimacy, weak state elites are often forced to rely on coercive power. However, a key dilemma is that the instruments of violence can be a threat to the regime requiring the deliberate undermining of armed forces.', 'Elites attempt to foster a new politics of identity in which ethnic consciousness is superseded by ideologies orientated around the myth of the regime.', 'Weak states have cultivated international sponsorship and have initiated processes of democratic reform so as to gain popular legitimacy internally whilst bolstering its international legitimacy externally.']",1
164,What is the vlaue of a post-structuralist critiqe in security stuudies?,security_studies,"['To enable us to understand the workings of political subjecthoods left out of traditional discourses on security.', 'To examine the base of power and its construction, in greater depth than traditional analysis.', 'To challenge the idea that smart weapons and technology are the active subjects determining security today.', 'All of these.']",3
165,What is the refeerent objct in contemporray cyber-security?,security_studies,"['Digitalised sensitive information', 'Critical Information Infrastructures', 'Government IT systems', 'Telecommunication networks']",1
166,What was the importnace of peace reseach during the 1980s?,security_studies,"['Peace research was inter-disciplinary and politically orientated with immediate policy responsibility accountable to the major powers of the political system.', 'Peace research, in contrast to university IR, was under a great deal of pressure to deal with relevant issues with a high expectation of immediate delivery of policy answers.', 'There was a distance from policy responsibility but European security studies gained political relevance due to the politicization of security issues during the period defined by the peace movement.', 'The setting was simultaneously informed by political theory as the dominant discipline and isolated from developments in theory in the different disciplines.']",2
167,Which statemnt best describes the liberalist attiude towards internatinal organisations?,security_studies,"['Liberalism holds that international organisations can enhance national and international security. It advocates the inclusion of non-governmental organisations and other actors to encourage cooperation and build communities.', 'The liberalist advocacy of cooperation as enhancing security is undermined by the failure of international organisations such as the league of nations in preventing global conflicts.', ""Under liberalism's different schools of thought, there is a general consensus that the involvement of international organisations in the political system ultimately undermines security by disempowering the state as a unitary actor."", 'All of these options.']",0
168,Wihch of the following reasons might influecne a state's decision to join an alliance such as NATO?,security_studies,"['More powerful states may also create alliances in order to extend their protective umbrella over weaker friendly states.', 'States may seek to join an alliance if they believe that their own resources are inadequate to maintain their sovereignty and security.', 'An alliance can become attractive to states when a potential hegemonic power threatens the other states in that system.', 'All of these options.']",3
169,"In the contmporary context, how can peace stuides best be defined?",security_studies,"['Following the expansion of peace studies in the decline of the Cold War, the field has emerged as an independent and autonomous area of study that addresses issues surrounding conflict resolution, economic security and the cessation of violence at both an international and sub-national level. As a field of research, peace studies are best defined by their distinction from development studies and international relations.', ""Peace studies are best defined by its research agenda that focuses on the search for non-violent measures by which to end conflict. Peace researchers adopt a 'top-down' approach to conflict resolution that prioritises the issues surrounding violence and the use of force, focusing on instigating agents in an attempt to secure that actor as the referent object to security."", 'Peace studies cannot be defined as a specific academic approach due to the shifting nature of its research agenda and the diversity of interests addressed by peace researchers. However, following the Cold War the success of the field has been such that it boasts a number of research institutes and attracts global and interdisciplinary attention.', 'Peace studies is defined by a concern with the underlying causes of phenomena in IR, a global outlook, an interdisciplinary approach, the search for non-violent transformations, an analytical and normative approach, and the adoption of multi-level analysis that links theory and practice within research.']",3
170,How does the preoccuaption with human rights affect the human rigths orientated school of liberalism?,security_studies,"['Modern human rights oriented liberalism is concerned with self-determination.', 'Human rights orientated liberalism will advocate separatism where conflict and bloodshed seem inevitable without it.', 'Human rights orientated liberalism is particularly focused on persons subject to economic, sexual, gender, religious, and political persecution, discrimination, or deprivation.', 'All of these options.']",3
171,Waht is the 'securtiy dilemma' taht faces weak states?,security_studies,"['The inability of the state to provide stability creates a situation wherein each component of society competes to preserve its well-being thereby engendering insecurity. The condition is self-perpetuating - a semi-permanent situation of emergent anarchy because measures to secure the regime will provoke greater resistance.', 'The weak state insecurity dilemma is primarily an external condition creating a situation for the weak state similar to structural anarchy, wherein a weak state creates insecurity in the region when taking measures to improve its own regional standing.', ""The weak state insecurity dilemma emerges out of competition between each component of society to preserve and protect the longevity of their well-being and interests. However, the ruling elite remain separate from the social sphere of contestation producing a policy dilemma; use of the monopoly of instruments of violence to restore order will reduce the regime's infrastructural core."", ""Weak state insecurity dilemmas are born out of a lack of political and institutional centring with a monopoly of force. However, the engagement of armed forces to strengthen institutions may stop this process. Inability to foster 'stateness' is reversed by the use of violence. Social disquiet is a semi-permanent situation of emergent but not developed anarchy.""]",0
172,Whch of the following ideas have become mainsreamed within human secuity since the Human Development Report?,security_studies,"['Limiting security analysis to military engagement is too restrictive.', 'Security is a contestable concept.', 'Focusing security only on violent conflicts is too restrictive.', 'All of these options.']",3
173,Which of the folowing security secotrs are intrinsically linked with energy securty?,security_studies,"['Economic and development security.', 'Regime and international security.', 'Environmental and human security.', 'All of these options.']",3
174,In what ways may weak states be chalenged externaly?,security_studies,"[""Powerful states may employ diplomatic pressures to ensure that weak states comply with international norms. This may involve economic sanctions and withholding weaponry deals, which undermines the state's ability to pay or supply the army which increases the risk of army disaffection and possible coups."", 'Weak states are threatened by the proliferation of small arms which can be used in a challenge to the authority of the state. Small and light weapons are purchasable through legal and illegal channels and are prevalent in regions with warlords, criminals and private militias.', 'Weak states cannot remain isolated from processes of globalization. Increasingly porous borders lead to migration and immigration. In order to compete in a globalized market weak states look to secure financial-credit assistance or aid from international institutions. However, these processes undermine the hegemonic idea of the state and societal identity is blurred which makes it difficult for the state to sustain its ideological appeal.', 'All of these options.']",3
175,Which of the follwing are true of the Great Law of Peaace of the Haudenosaunee Confederacy?,security_studies,"['The Great Law alerts scholars to the problem of failing to sustain critique.', 'The case of the Great Law illustrates the importance of being critical of practices of research and knowledge production.', 'The Great Law is a challenge for traditional security studies, as it represents a proven non-state approach.', 'All of these.']",3
176,In what ways can the diffrent relationship between US and Europen security studies be explaiend?,security_studies,"[""The different relationship to the concept of security: in Europe the debate has stayed as part of politico-self-reflection of the scholar who 'does security;' whereas in the US, the question of the concept of security is seen at the most a necessary 'define your' terms' operation."", 'The different relationship to the exact form of knowledge that is valued. The US is more rationalist, Europe the more reflectivist. In the US security studies debate hypothesis is typically examined as cause-effect relationships, tied into general debates and with measurement of ideational variables.', ""In the US major competing explanations emphasized, on the one hand, the US's liberal hegemony, and, on the other hand, the purely power based stability of presumed unipolarity in which balancing becomes impossible."", 'All of these options.']",3
177,Which of the folowing does not constittute a fundamntal ontological prinicple of social constructivism?,security_studies,"['Normative or ideational structures are important and matter as much as, if not more than, material structures.', 'Identities are important.', 'Anarchy is an inescapable feature of the international system.', 'Agents and structures are mutually constituted.']",2
178,Wich of the folloiwing events can be regarded as contributng to the emergence of environmental security during the 1960s and 1970s?,security_studies,"['From the 1970s a number of scholars attempted to critique orthodox security discourse and practices, highlighting their inability to manage environmental risks to national and international security.', 'There became a growing recognition that environmental changes do not merely pose risks to ecosystems - they also pose risks to human well-being.', 'A shared environmental consciousness emerged in developing countries.', 'All of these options.']",3
179,Wich of the folowing is not a purported limtation of the liberalist approach?,security_studies,"['Liberalism poses great difficulty in defining when the use of force would be justified or necessary.', 'Liberalism is often internally inconsistent, limiting its applicability for use as a guide.', 'A failure to address the importance of a wide range of actors in the decision-making processes of the international system.', 'Liberalist influence merely reflects Western dominance, potentially undermining its relevance in the future.']",2
180,To what extennt and to what efefct has the environment been securitized?,security_studies,"['The securitization of environmental security concerns has raised the profile of environmental security issues among both foreign and domestic security policymakers and agencies. It is now uniformly recognized that environmental change can be considered as an issue of high security politics.', ""Environmental security has led to a 'trading off' of military security for environmental security with the allocation of resources committed to solving environmental problems. A particular emphasis has been placed on environmental change as the cause of violent conflict and addressing environmental threats from other factors than domestic causes."", ""The environment has been 'securitized' in the sense that environmental security has been used to make them matters of 'high politics'. This has to some degree raised the profile of critical issues among policymakers and agencies so that the environment can be considered an issue of security. But whilst the issue has been broadened there has been little change in policy and action in terms of the referent object of environmental security."", ""The national security perspective on environmental issues has undermined the utility of the concept of environmental security. The militarization of environmental problems has decreased the ability of policymakers to 'capture' the critical nature of environmental problems and the environmental dimensions to social vulnerability. The reconciliation of environmental security with national security, and global levels of international change cannot be made without trading in the security interests of the state.""]",2
181,Wich of the follwoing defines a Revoluton in Military Affairs?,security_studies,"['A coup in which established leaders are ousted by an internal military force.', 'A wholesale shift in the way warfare is conducted and understood.', 'A watershed in technological advancement, such as the creation of nuclear weaponry.', 'A watershed in technological advancement which alters the fundamental characteristics of war.']",3
182,Which of the folowing phrases is not likey to indicate legitimacy in the new terminology of RMA?,security_studies,"['Surgical strike.', 'Indiscriminate attack.', 'Smart bomb.', 'Precision target.']",1
183,Wich of the folowing concepts does NOT form part of the tehnical discourse on cyber-security?,security_studies,"['Business networks', 'Computer experts', 'Anti-virus industry', 'Computer networks']",0
