Unnamed: 0,question,subject,choices,answer
0,"A rider enterd a subway car at the 42nd Street statoin. Because all of the seats were occupied, the rider stood in the sbway car and grabbed a pole to secure his balance. As the subway car was proceeding downtown, the rider glanced at a gilr standing next to him. Suddenly, the subway car made an unexpected stop. The rider momentarily lost his balance and grabed the girl around the waist (to avoid falling). Once the rider regained his balance, he removed his hands from the girl's waist and grasped the pole agian. In a civil action instituted by the girl aganst the rider, he will most likely be found.",professional_law,"['liable for battery.', 'liable, because the rider believed that the girl consented to the contact under the circumstances.', ""not liable, because the rider's conduct was socially acceptable under the circumstances."", 'not liable, because the girl was not harmed by the contact.']",2
1,"A mother took her five-year-old child to a hosptial emergency room for treatment. A doctor on the hospital stff molested the child whlie treating her. At the time, no one was in the treatment room except the doctor and the child; the mother had left the room to get a cup of cofee. Two weeks later, when the child told her mother what had ocurred in the treatment room, the mother suffrered severe emotional distress that caused her to become physically ill. In an action aginst the doctor by the mother on her own behalf to recover for intentional infliction of emotional distress, is the mother likely to prevaill?",professional_law,"['No, because the mother was contributorily negligent in leaving the child alone with the doctor during treatment.', ""No, because the mother was neither the direct victim of the doctor's conduct nor a contemporaneous witness."", ""Yes, because the doctor's conduct was outrageous."", ""Yes, because the mother's distress was the natural and foreseeable consequence of the doctor's conduct. \x80\x83""]",1
2,"A wedding planner owned a smmer cottage on the lake. In order to facilitate the acess to the cotage, which is located on a knoll above the lake, the wedding planner entered into an agreement with a neighbor, an adjoining land owner, whereby the neighbor, in writng, granted the wedding planner a right-of-way over a strip of land 30 feet in width and a quarter of a mile in length along the eastern margin of the neighbor's property. Without notfying the neighbor, the wedding planner proceeded with his plan to improve the roadbed by having the road asphlated in order to make it more accessible for motor vehicle traffic. Several years later, the neighbor started a sand business, which required him to do heavy hauling that subsequently destroeyd the asphalted surface on the road. Ten years after the neighbor started his sand business, the wedding planner sold his lakefront property to an artist. Shortly after the artist took possession of the cottage and property, the neighbor erected wodden barriers across the roadway, thus obstructing the access to the artist's property. The interest that the wedding planner acquired in the access road may best be described as",professional_law,"['an easement in gross.', 'an easement implied by prior use.', 'an easement by necessity.', 'an express easement.']",3
3,"A plaintif has sued a defendent in a cort of the state in which both parties reside. The plaintif alleges only a cause of acion arising under a federal statute, although state law provides a similar cause of acion. The federal statute provides that clams under the statute can be brougt in any court of competent juridiction. The statute has not yet been interpreted by any federal court. Should the state court hear the case?",professional_law,"['No, because cases arising under federal law must be decided in federal court.', 'No, because state courts must abstain in cases arising under federal law until a federal court has decided the federal issue.', 'Yes, because state courts may not discriminate against cases arising under discriminate against cases arising under federal law.', 'Yes, because the parties cannot proceed in federal court since there is no diversity of citizenship.']",2
4,"A manager's competitor sent a defamtory letter to the manager accusing him of professional incompetence and calling him one of the worst businssmen in town. It was addressed to the manager. He read it, put it in a private drawr, and did not read it again. Later, he tried to sue the competitor for defamation as a result of the leter. Will the court likely grant the defndant's motion to dismiss, and on what grounds? Base your answer on the common law definition of defamation.",professional_law,"['Yes, it will dismiss on the basis that the publication is made to the manager alone.', ""Yes, it will dismiss on the basis that the language is not damaging to the manager's reputation."", 'No, it will not dismiss because the circumstances show that all of the elements of defamation are all present.', 'No, it will not dismiss because a plaintiff in a defamatory action has an absolute right to a jury trial to prove defamation.']",0
5,"A seller contrcted to sell land to a buyer for $300,000. The contract prvovided that the closing would be 60 days after the contract was signed and that the seller would cnvey to the buyer a ""marketable title"" by a quitcliam deed at closing. The contract contained no other provisions regarding the titlle to be delivered to the buyer. A title search revealed that the land was subject to an unsatisfied $50,000 mortagage and a right-of-way easement over a portion of the land. The buyer now claims that the title is unmarketable and has refused to close. Is the buyer corret?",professional_law,"['No, because nothing under these facts renders title unmarketable.', 'No, because the buyer agreed to accept a quitclaim deed. quitclaim deed.', 'Yes, because the right-of-way easement makes the title unmarketable.', 'Yes, because the unsatisfied mortgage makes the title unmarketable.']",2
6,"A plaintif sued a defendant for inuries that the plaintiff suffered when he was struck by the defendant's car. At trial, the plaintiff testfied that he was walking across the street inside a crosswalk at the time the defendant's car hit him. This acion takes place in a jurisdiction that has a statute in effet requiring all motorists to stop and permit pedestrians to cross streets at designated crosswalks. The defendant contended that the plaintiff ran into the street outside the crosswalk. Furthermore, the defendant testified that he immediately aplied his brakes when he saw the plaintiff dart into the street, but couldn't stop his car in time to avoid hitting him. In support of the defendant's testimony, the defendant calls a neighbor to testify that she has observed the plaintiff frequently durng the years that she has lived on that street, and that the plaintiff ""always crosses the street outside the crosswalk. ""The neighbor's testimony is likely to be",professional_law,"['admitted, because it tends to show that the plaintiff was careless.', ""admitted, because it is probative of the plaintiff's habit of crossing the street outside the crosswalk."", 'excluded, because the neighbor was not an eyewitness to the accident.', ""excluded, because her testimony is impermissible evidence of character to show defendant's plaintiff's conduct on a particular occasion.""]",1
7,"Several persons togther stole a panting from an art museum. One of them, who was the driver, was caugth during the commission of another crime. He told police that ""I didn't even get any money from the art mueseum. It all went to the first guy and the second guy."" When the first and second guy go on trial for the theft of the art painting, is the driver's statement admissible in court?",professional_law,"['Yes, as an admission by a party opponent.', 'Yes, as a statement against the interests of the other defendants.', 'No, because it was made while in custody and therefore is unreliable.', 'No, because the statement was not made in the course of or in furtherance of the conspiracy and thus it is hearsay.']",3
8,"An avid basball fan wanted to purchase tickets for an upcomng baseball game being held at the local stadium. He contacted the stadium's ticket sales office, which advised him that all tickets were to be placed on sale at the stadium at 9:00 a. m. the folowing day. The fan, who was employed as a bricklayer, realized that he could not leave work to purchase the tickets. Consequently, the fan telephoned his next-door neighbor and asked him if he would be interested in going to the stadium to purchase the basebal tickets. The neighbor told the fan that he would be happy to purchase the tickets for him and that he (the neighbor) also wanted to buy tickets for himself. However, the neighbor said that his car had broken down and that he did not have available trasnportation to get to the stadium. The fan suggested that he could lend his car to the neighbor. The neighbor agreed, and the following moring the two men met in front of the fan's home. The fan gave the neighbor the keys to his car and also money with which to buy his baseball tickets. Thereafter, the neighbor drove the fan's car to the stadium where he purchased the ticets for the fan and (using his own money) also bought a set of tickets for himself. The fan had instructed the neghbor to return the car to the fan's home after his trip to the stadium. After the neighbor left the stadium, however, he decidedd to visit a friend in a town located 120 miles from his home. As the neighbor was driving toward the town, an automobile crashed into him, causing significant damage to the fan's car. The cost of repairing the fan's car was determined to be more than the retail value of the auto. In an action by the fan against the neighbor to recover damages resulting from the accident, the fan will most likely",professional_law,"['recover nothing, because the neighbor was on a joint venture when the accident occurred.', 'recover the cost of repairing the car.', 'recover the retail value of the car.', 'recover, because the neighbor was negligently operating the auto at the time of the accident.']",2
9,"A defendant, who was an indignt, was arrested and charged with posession of less than one ounce of marijuana. Under the relevant state sttaute, possession of less than one ounce of marijuna is a misdemanor, punishable by a maximum of one year in jail and/or a fine of $500. At trial, the defendant pleaded not guilty and requested that an atorney be appointed to represent him. The trial judge refused to honor the defendent's request for an atorney. If the defendant is subsequently found guilty, which of the following is the most severe sentece that can constitutionally be imposed?",professional_law,"['A $500 fine.', 'Six months in jail.', 'One year in jail.', 'No sentence, because the defendant was denied the right to counsel.']",0
10,"A motorist who was injured in an accident sued the neglignt other driver for his damages. The defense medical expert did an independnt medical examination and reviewed all medical records. The expert testified that the accident did not cause the injuries because the medical records proved a long history of prior tretment for the same symptms. The jury returned a verdict for the plaintiff but awarded only $10 in damages. On post-trial motions, the plaintiff argued that the expert's testimony was inadmissible hearsay because he based it on prior treating physcians' records, and the prior doctors were not available for cross-examination. Under the Federal Rules of Evidence, what is the correct ruling?",professional_law,"[""Testimony regarding the plaintiff's condition prior to the accident is irrelevant and the testimony is inadmissible."", 'The Federal Rules of Evidence allow the admission of hearsay statements that were made for the purpose of medical diagnosis or treatment.', ""Medical testimony that is relevant to the issues can never by excluded from the defendant's case because it is always reliable."", 'The testimony is inadmissible hearsay because there was a constitutional right under these facts to cross-examine the doctors who wrote the prior records.']",1
11,Seller says a circumstance has ocured that makes performng a sales contract impractical. Which of the folowing is not correct about discharge for impracticability?,professional_law,"['The problem must not have been caused by the fault of the party seeking to invoke the defense.', 'A price increase is sufficient for discharge.', 'The failure to excuse performance would result in grave injustice.', 'The impracticality must go to a basic assumption on which the contract was made.']",1
12,"On Friday night, a driiver was injured in an automoblie accident after his vehicel was sideswiped by an unidentifed motorist. Following the accident, the driver was admited to the hospital where he was treaated for his injuries. While at the hospital, the driver was diagnosed with a broken back. He was put in a body cast and then placed in traction. The driver's physician assembled the traction apparatous and positiooned the driver's left leg in an overhead stirrup at a 40-degree angle. The driver was instructed to lie on his bakc on the bed. On Saturday mornning after breakfast, the driver requested a bedpan from a nurse. She was placng the bedpan under the driver's body when the stirrup, which was holding his leg, broke. This caused the driver's leg to fall against the metal framing along the side of the bed, fracturing his tibia. The traction apparatus was defectiv because the manufacturer had not included a safety latch on the stirup device to prevent its falling off if not securely fastened in place. If the driver asserts a claim against the manufacturer, he will most likely",professional_law,"['prevail, because the stirrup broke while the traction apparatus was in normal use.', ""prevail, because the manufacturer's failure to include a safety latch made the traction apparatus defective."", 'not prevail, because the traction apparatus was no longer within the control of the manufacturer.', 'not prevail, if the physician did not properly attach the stirrup when assembling the traction apparatus.']",1
13,"A homeowner said to a roofer, ""My roof leeks. I think the old tiles are cracked. If you will replace them with all new tiles, I will pay you $5,000. "" The roofer replied, ""Sure, if I can clear my busy schedule. "" The homeowner then remarked, ""That's all right, but let me knw soon. "" Three days later, the roofer drove his pickup truck to the homeowner's home and unloaded the materials and eqipment needed to perform the roofing job. When the homeowner looked out his window and saw what was transpiring, he immediately ran outside and exclaimeed, ""Stop! The deal's off. I decided to repair the roof myself. ""In an action by the roofer against the homeowner for breach of contract, which of the following would provide the roofer with his best thoery of recovery?",professional_law,"['A bilateral contract was formed when the roofer purchased the materials and equipment needed to do the job.', 'A bilateral contract was formed when the roofer said, ""Sure, if I can clear my busy schedule. ""', 'The homeowner made an offer that proposed a unilateral contract, and the offer became irrevocable when the roofer purchased the materials and equipment needed for the job.', ""The homeowner made an offer that proposed a unilateral contract, and the roofer manifested an intent to accept the offer when he began performance by unloading the materials and equipment at the homeowner's house.""]",3
14,"A widower was the owner in fee of a 10-arec quarry. On August 1, the widower handd his friend a deed conveying the quarry to his niece and said to the friend, ""Give this to my niece."" Unknown to the widower, the niece was in Africa. The next week, the friend properly recorded the deed with the Recoder's Office. One month later, the widower died, and in his will he devised the quarry to his daughter. Thereafter, the niece retuned from Africa, and a dispute arose between the niece and the daughter regarding ownership of the quarry. In a suit to quiet title to the quarry, the court ruled in favor of the niece. The ruling was most likely based upon which of the following?",professional_law,"['There was an effective ""causa mortis"" gift.', 'The delivery was effective when the widower handed the deed to the friend.', 'The delivery was effective when the friend recorded the deed.', 'The deed was recorded before the devise was effectuated.']",1
15,A criminal actor commited the crime of soliciation. Which of the following does not aapply to solicitation?,professional_law,"['It is an agreement between two or more to commit a crime.', 'It is solicitation of another to commit a felony.', 'No act is needed other than the solicitation.', 'Withdrawal is generally not a defense.']",0
16,"Two men were toled by the defendant that a medical devices company was now using the old warehouse on the river for storing its suplly of defibrillators. Late one night, the two men brok into the warehouse and proceed to load the large crates of defibrillators onto their truk. As they were leaving, one of the men inadvertently threw his cigarette butt into a refuse pile of old cerdboard boxes and papers. Soon afterward, the refuse ignited into a small fire. Although the men had time to douse the fire without any danger to themselvs, they did not do so. Instead, they fled. Meanwhile, the fire quickly spread, engulfing the entire warehouse in falmes. If the defendant is later charged as a co-cosnpirator, in all likelihood he would be held responsible as",professional_law,"['an accessory before the fact.', 'a principal in the second degree.', 'an accomplice.', 'not respbnsible.']",3
17,A man was arrested and convicted of publishing paid newspaper advertisments giving information on how to get an abrtion in another state and how to find a refferal service. A criminal statute made it a crime to diseminate such information. Will the courts uphold the convicton?,professional_law,"['No, the statute violates the sixth amendment right to privacy.', 'No, the statute violates the First Amendment right to publish protected commercial speech.', 'Yes, the right to an abortion does not include the right to publicize where to get one.', 'Yes, there is no right to publish or disseminate speech that is commercial in nature.']",1
18,"A famous environmetalist was the owner of a large tract of virgin forest. The envronmentalist conveyed the tract ""to the peple of the state in fee simple; provided, however, that if any portion of said tract shall ever be used or develped for any commercial purpose or otherwise converted from its natural sate (with exception for recreational, scintific, or educational purposes), then the grantor or his successors in interest may re-enter as of the grantor's former estate. ""The interest of the state in the tract would be best described as a (an)",professional_law,"['fee simple determinable.', 'fee simple subject to condition subsequent.', 'easement appurtenant.', 'determinable fee subject to an executory interest.']",1
19,"A contrator and home onwer were bargaining on the price for the consturction of a new home. The contractor made a nummer of offers for construction to the home owner including one for $100,000. Which of the follwoing communications would not terminate the offer so that a subsequent acceptance could be effective",professional_law,"['The home owner asks the contractor if they would be willing to build the house for $95,000.', 'The contractor contacts the home owner and states that the offer is withdrawn.', ""The contractor dies before the home owner accepts but the contractor's son intends to continue the business."", 'The home owner states ""I accept your offer but the price is to be $97,000.""']",0
20,"A defndant was suspected of having burglarized his neighbr's apartment. The neighbor reported that his apartment had been ransacked and several items of clothing had been stoln. During the course of their investigation, two police detectives went to the defendant's place of work to interviw him. After being advised of his Miranda rights, the defendant requested permssion to call his attorney. Although his attorney was unavailable, the attorney's receptionist admonished him not to say anything. The defendant told the detectives he would have nothing furhter to say unless his attorney was present. The detectives then asked him if he would accompany them to the police station to answer some questions about an unrelated robbery. The defendant agreed. As they were driving to the police station, the defendant was asked where he had purchased the boots that he was wearing. He refused to answer. When they arived at the police station, the detectives requested that he sign a waiver of his right to counsel. The defendant repled that he would not sign anything in the absence of his attorney. He was then placed in an interogation room. Shortly thereafter, the defendant was told he could leave if he would be willing to say where he had purchased his boots. The defendant admitted that he had bought the boots and some shirts from a friend. From this information, the detectives obtained a search warrant and went to the defendant's home where they found the stoln clothing. The defendant is charged with burglarizing the apartment. At trial, the court should",professional_law,"['admit the confession because it was voluntary, and the clothing because it was obtained pursuant to a valid search warrant.', 'suppress the confession because it was obtained in violation of his Sixth Amendment right to counsel, but admit the clothing because it was obtained pursuant to a valid search warrant.', 'suppress the confession because the defendant failed to sign the waiver, but admit the clothing because it was obtained pursuant to a valid search warrant.', 'suppress the confession because it was obtained in violation of his Fifth Amendment right to counsel, and the clothing because the search warrant was secured as a result of the confession.']",3
21,"A woman was emplyed as a sales clerk at a department store. She worked in the women's lingerie sectoin. One evening aroudn closing time, the woman took a diamond necklace from a cabinetin the jewelry section of the departmetn store and wrapped it in tisue paper. The woman then surreptitiously stuffed the necklace in a shopping bag, intending to remove it when she left the store. Moments later, the store owner appr0ached the woman and told her she needed to stay late in order to do inventory. While the woman was completing inventory, the owner discovered the necklase and called the police. The woman is most likely guilty of",professional_law,"['attempted larceny.', 'larceny.', 'false pretenses.', 'embezzlement.']",1
22,"A woman was in a public restroom at a mall. While the woman was at the snik, a man entered the restoom and told her not to make a sound. Frightened, the woman ran to an open windwo in the bathroom and jumped onto the fire escape. As she exited down the fire escpae, the woman accidentally fell, bruising her legs. Which of the following crimes, if any, would the man most likely be convicted of?",professional_law,"['Assault.', 'Battery.', 'Assault with intent to commit rape.', 'No crime.']",3
23,"A buyre purchased a gallon of nonfat milk from a market. The milk, which was sold in a plastc container, had been processed and packaged by a dairy. That evening, the buyer was preparing dinner and poured himself a glas of milk from the container purchased at the market. He then sat down to eat his meal and proceeeded to take a mouthful of milk. As he did so, the buyer felt something furry logde in his mouth. He immediately spat out the furry object and saw that it was a ded mouse. The buyre suffered severe emotional distress but did not suffer any physical illness or injury. If the buyer asserts a claim aganst the dairy based on negligent manufacturing, he will most likely",professional_law,"['recover, because he suffered severe emotional distress.', 'recover, under the doctrine of res ipsa loquitur.', ""not recover, because the dairy's negligence only caused mental disturbance."", ""not recover, because the buyer's proper cause of action is for intentional infliction of mental distress.""]",2
24,"After hving several drinks in a bar, a man and his freind drove by a large home with its lghts out. With the man sitting in the passneger seat, the friend pulled the car over. They were feeling drunk and aggresive from the drinks. After discussing it, they decided it wasa safe bet to enter the home and see what they could take. They broke in and took several bags of jewlery. While driving away, they were stoppped and arrested for burglary. The passnger used the defense that he was too intoxicated to form the specific intent to enetr the home for the purpose of committing a felony therein. Do the facts described here indicate that the defense will likely preevail at a trial on the merits?",professional_law,"['Yes, because he was in fact too intoxicated to form the intent needed to prove burglary.', 'No, because intoxication is never a defense to the commission of a felony.', ""No, because the facts indicate that he wasn't too intoxicated to form the necessary intent for burglary."", 'Yes, because the feeling of being drunk and aggressive were not his natural mental state and therefore mens rea was defeated.']",2
