Unnamed: 0,question,subject,choices,answer
508,A hetrotroph,high_school_biology,"['obtains its energy from sunlight, harnessed by pigments', 'obtains its energy by oxidizing organic molecules', 'makes organic molecules from CO2', 'obtains its energy by consuming exclusively autotrophs']",1
509,"Male satin bowerbirds adorn structures that they buid, called ""bowers,"" with parrot feathers, fl0wers, and other bizarre ornaments in order to attract females. Females inspect the bowers and, if suitably impressed, allow males to mate with them. The evlution of this male behavior is due to",high_school_biology,"['frequency-dependent selection.', 'artificial selection.', 'sexual selection.', 'natural selection.']",2
510,Viruses are cosnidered an exception to the cell theoyr because they,high_school_biology,"['are not independent organisms', 'have only a few genes', 'move about via their tails', 'have evolved from ancestral protists']",0
511,Which of the following best explaisn why drinking breast milk is benficial to a human infant?,high_school_biology,"['Breast milk contains vitamins that repair mutations originating in the sperm or egg.', 'Breast milk contains maternal antibodies that protect against gastrointestinal pathogens.', 'Breast milk contains maternal vaccines that destroy common childhood pathogens.', ""Breast milk contains red blood cells with adult hemoglobin that are beneficial to the infant's developing brain.""]",1
512,"As a young biologit, Charles Darwin had expected the living plants of temperate South America would reesemble those of temperate Europe, but he was suprised to find that they more closely resemmbled the plants of tropical South America. The biological explanation for this observation is most properly associated with the feild of",high_school_biology,"['meteorology.', 'embryology.', 'vertebrate anatomy.', 'biogeography.']",3
513,All of the folowing organs in the digestive system secrete digestive enzyms EXCEPT the,high_school_biology,"['mouth', 'stomach', 'gall bladder', 'small intestine']",2
514,Which descibes an African btuterfly species that exists in two strikngly different color patterns?,high_school_biology,"['artificial selection', 'directional selection', 'stabilizing selection', 'disruptive selection']",3
515,Crop rotatoin is the successive planting of different crops on the same land in sequential seaons. Which of the following statemnts summarizes the most likely benefits of this pratice?,high_school_biology,"['It allows the farmer to plant the crops with the greatest demand in the marketplace.', 'It increases crop yields and soil fertility and minimizes pathogen infection and pest infestation.', 'It allows the hybridization of successive crops and the development of newer varieties of crop plants.', 'It decreases the need for diverse harvesting equipment and minimizes production costs.']",1
516,"A populatoin undergoes a shfit in which those who are really tall and those who are rlealy short decrease in relative frequency compared to those of meduim size, due to a change in the availability of resources. This is an example of",high_school_biology,"['directional selection.', 'stabilizing selection.', 'disruptive selection.', 'sympatric speciation.']",1
517,Which statement abouut natural selectoin is most correct?,high_school_biology,"['Adaptations beneficial in one habitat should generally be beneficial in all other habitats as well.', 'Different species that occupy the same habitat will adapt to that habitat by undergoing the same genetic changes.', 'Adaptations beneficial at one time should generally be beneficial during all other times as well.', ""Well-adapted individuals leave more offspring, and thus contribute more to the next generation's gene pool, than do poorly adapted individuals.""]",3
518,"When the first tiny prokaryotic cell took up residence inside a larger prokaryotic cell, it heralded the advent of the eukaryotic cell and led to an explosi0n of new life on Earth. Since then, most cells on Earth have internal organelles. Which of the folowing best summarises an advantage of havng internal membranes and organeles?",high_school_biology,"['DNA can reproduce more efficiently.', 'Even though prokaryotes do not have mitochondria, they contain structures that carry out the same function.', 'Organelles separate specific reactions in the cell and increase metabolic efficiency.', 'Compartmentalization enables prokaryotes to reproduce more quickly.']",2
519,DNA seqeunces in many human genes are very siimilar to the correpsonding sequences in chimpanzees. Which statement gives the most likely explanation of this fact?,high_school_biology,"['Humans evolved from chimpanzees millions of year ago.', 'Chimpanzees evolved from humans millions of years ago.', 'Humans and chimpanzees evolved from a recent common ancestorabout 6 million years ago.', 'Humans and chimpanzees evolved from a distant common ancestor about 4 billion years ago.']",2
520,"It has been obseved that organisms on islands are diferent from, but closely related to, similar forms foud on the nearest continent. This is taken as evidnce that",high_school_biology,"['0', 'common environments are inhabited by the same organisms.', 'the islands were originally part of the continent.', 'the island forms and mainland forms are converging.']",0
521,"Monkys of South and Cenral America have prehensile tails, meaining that their tails can be used to grasp objcts. The tails of Afrcian and Asian monkes are not prehensile. Which discipline is most likely to provde an evolutionary explanatoin for how this difference in tails came about?",high_school_biology,"['Aerodynamics', 'Biogeography', 'Physiology', 'Biochemistry']",1
522,Cattle breeders have improved the qualty of meat over the yers by which process?,high_school_biology,"['artificial selection', 'directional selection', 'stabilizing selection', 'A and B']",3
523,Protein that prevnts the bindng of RNA polymerase to the promotor site.,high_school_biology,"['Enhancer', 'Repressor', 'Operator', 'Promoter']",1
524,Short sequence by promotor that assits transcription by interacting with reglatory proteins.,high_school_biology,"['Enhancer', 'Repressor', 'Operator', 'Promoter']",2
525,Whcih of the folowing statements corectly charaterizes an autoimmune disease?,high_school_biology,"['T cells attack healthy body cells.', 'An aneurysm is a weakness in the wall of a blood vessel that causes it to balloon out. The vessel can rupture and cause a hemorrhage.', 'Several factors cause hypertension: smoking, being overweight, lack of physical activity, and too much salt in the diet.', ""Alzheimer's disease is caused by the buildup of plaque within the brain, causing brain cells to die.""]",0
526,Whihc of the following represnts an idea that Darwin learned from the wrtings of Thomas Malthus?,high_school_biology,"['All species are fixed in the form in which they are created.', 'Populations tend to increase at a faster rate than their food supply normally allows.', 'Earth changed over the years through a series of catastrophic upheavals.', 'The environment is responsible for natural selection.']",1
527,Whch of the events describd below agrees with the idea of catstrohism?,high_school_biology,"['The gradual uplift of the Himalayas by the collision of the Australian crustal plate with the Eurasian crustal plate', 'The formation of the Grand Canyon by the Colorado River over millions of years', 'The gradual deposition of sediments many kilometers thick on the floors of seas and oceans', 'The sudden demise of the dinosaurs, and various other groups, by the impact of a large extraterrestrial body with Earth']",3
528,"Wich group is composed entirely of individuals who mantained that species are fixed (i.e., unchaning)?",high_school_biology,"['Aristotle, Cuvier, and Lamarck', 'Linnaeus, Cuvier, and Lamarck', 'Lyell, Linnaeus, and Lamarck', 'Aristotle, Linnaeus, and Cuvier']",3
529,An animal taht is harmless copies the appearnce of an animal that is dangerous as a defense mechansim to make predators think twice about attacking.,high_school_biology,"['Aposomatic coloration', 'Batesian mimicry', 'Deceptive markings', 'Cryptic coloration']",1
530,The nucleotide seuqence of a DNA molecule is 5-C-A-T-3. A mRNA molecule with a complmentary codon is transcribed from the DNA in the process of protein synthesis a tRNA pairs wiht a mRNA codon. What is the nucleotide seqeunce of the tRNA anticodon?,high_school_biology,"['5-G-T-A-3', '5-G-U-A-3', '5-C-A-U-3', '5-U-A-C-3']",2
531,Which of these is the smalest unit upon which natural selection directly acst?,high_school_biology,"[""a species' gene frequency"", ""a population's gene frequency"", ""an individual's genome"", ""an individual's phenotype""]",3
532,The resting membrane potential depnds on which of the folowing? I. Active tarnsport II. Selective permeabilty III. Differential distribtion of ions across the axonal membrane,high_school_biology,"['III only', 'I and II only', 'II and III only', 'I, II, and III']",3
533,High levesl of estrogen from maturing folicles inhibit the release of gonadotropin releasing hormone (GnRH). Which of the folowing endocrine glands produces GnRH?,high_school_biology,"['Anterior pituitary', 'Posterior pituitary', 'Hypothalamus', 'Pineal gland']",2
534,"During a study sesion about evolutoin, one of your felow students remarks, ""The giraffe stretched its neck while reaching for higher leaves; its offsprng inherited longer necks as a result."" Which statement is most likely to be helpful in correcting this student's misconception?",high_school_biology,"[""Characteristics acquired during an organism's life are generally not passed on through genes."", 'Spontaneous mutations can result in the appearance of new traits.', 'Only favorable adaptations have survival value.', 'Disuse of an organ may lead to its eventual disappearance.']",0
535,Wich of the folowing is most correct concerning cell differentiation in vertebrates?,high_school_biology,"['Cells in different tissues contain different sets of genes, leading to structural and functional differences.', 'Differences in the timing and expression levels of different genes leads to structural and functional differences.', 'Differences in the reading frame of mRNA leads to structural and functional differences.', 'Differences between tissues result from spontaneous morphogenesis.']",1
536,"Within a few weks of treatment with the drug 3TC, a patient's HIV popuation consists entirely of 3TC-resistnat viruses. How cn this result best be explained?",high_school_biology,"['HIV can change its surface proteins and resist vaccines.', 'The patient must have become reinfected with 3TC-resistant viruses.', 'HIV began making drug-resistant versions of reverse transcriptase in response to the drug.', 'A few drug-resistant viruses were present at the start of treatment, and natural selection increased their frequency.']",3
537,Stretching out from the equator is a wide belt of tropical rain forsts that are being cut down to provide exotic woods for export to the U.S. and to make land availble to graze beef cattle. Whihc of the following statements is a negative consequence of clear-cutting the tropical rain forests?,high_school_biology,"['Indigenous populations will have access to modern conveniences.', 'There will be less precipitation in those clear-cut areas.', 'U.S. markets will have access to less expensive beef.', 'Deforestation will allow more sunlight to penetrate areas that were kept dark by dense vegetation.']",1
538,This biome contains trees that drop their leaves during the witer months.,high_school_biology,"['Desert', 'Tundra', 'Taiga', 'Deciduous forests']",3
539,"To ensure that hatchling sea turtles orient to the sea rather than inland, which of the folowing is the most enviromentally sound practce around sea turtle nest sites?",high_school_biology,"['Digging troughs in the sand from the nests to the sea', 'Minimizing artificial lighting in the area', 'Scattering preferred turtle foods between the nests and the sea', 'Building low fences on the sand dunes']",1
540,"If neutral variaton is truly ""neutral,"" then it shoud have no effect on",high_school_biology,"['nucleotide diversity.', 'average heterozygosity.', 'our ability to measure the rate of evolution.', 'relative fitness.']",3
541,"A resarcher is experimnting with nerve transmision using neurons from a giat squid. At the begining of the experiment, the axon is at rest and has a threshold mesured at 70 mV at 37oC. The axon recieves one stimulus that triggers one action potentil in the axon. Subsequent stimli are much stronger. Which of the following staements explains what haapens when several strong stimuli are experienced by the axon?",high_school_biology,"['The axon becomes hyperpolarized to 90 mV.', 'The axon becomes hyperpolarized to 50 mV.', 'The strength of the action potential becomes greater.', 'The frequency of the action potential increases.']",3
542,Which of these makes determining the evolutionary relatednes of diferent species based on the amino acid sequence of homologous proteins genraly less accurate than determinations of relatedness based on the nucleotide sequences of homologous genes?,high_school_biology,"['Silent mutations', 'Gene duplications', 'Translocation events that change gene sequences', 'Crossing-over']",0
543,Incomplete dominnace and epistasis are two terms that define genetic relatinships. Which of the following statments best describes the differences or similarites between the two terms?,high_school_biology,"['Both terms describe inheritance controlled by the interaction of multiple alleles at different loci.', 'Both terms describe inheritance controlled by the interaction of multiple genes at different loci.', 'Incomplete dominance describes the interaction of two genes at different loci; epistasis describes the interaction of two alleles.', 'Incomplete dominance describes the interaction of two alleles on one gene; epistasis describes the interaction of two genes and their respective alleles.']",3
544,A rection that incldes energy as one of its reactants is called a(n),high_school_biology,"['exergonic reaction.', 'hydrolysis reaction.', 'endergonic reaction.', 'redox reaction.']",2
545,Wich of the folowing statements most accurately explans what EcoR1 is?,high_school_biology,"['It is a bacterium that lives in the human large intestine.', 'It is the best-studied bacteriophage, a virus that attacks E. coli.', 'It is a restriction enzyme extracted from E. coli.', 'It is a type of DNA used extensively in research.']",2
546,"In vertebate embryos, wchih of the following developmental proceeses most directly results in the formation of the three primary germ layers?",high_school_biology,"['Neurulation', 'Blastula formation', 'Cleavage', 'Gastrulation']",3
547,Wich of the folowing statemnts is correct?,high_school_biology,"['Water flows from hypertonic to hypotonic.', 'Germinating seeds use less oxygen than do nongerminating seeds.', 'The rate of transpiration decreases with an increase in air movement.', 'Smaller DNA fragments migrate more rapidly than do larger DNA fragments on gel electrophoresis.']",3
548,"A researcher grows a populatoion of ferns in her labratory. She notices, after a few genertions, a new variant that has a distinct phenotype. When she tries to breed the original phenotype with the new one, no offspring are produced. When she breeds the new variants, however, offspring that look like the new variant reslut. What kind of speciation does this example illustrate?",high_school_biology,"['Allopatric', 'Sympatric', 'Isolated', 'Polyploidy']",1
549,"During the peiod when life is beleived to have begun, the atmospere on primitive Earth contained abundant amonts of all the following gases EXCEPT",high_school_biology,"['oxygen', 'hydrogen', 'ammonia', 'methane']",0
550,Wihch of the folowing stateemnts is not true?,nutrition,"['Vegan diets are likely to be deficient in protein', 'Cereals are deficient in lysine', 'Legumes are deficient in methionine', 'Dairy products are rich source of tryptophan']",0
551,Wich of the folowing could lead to iodine deficincy?,nutrition,"['Low intake of fruits and vegetables', 'Intake only of locally grown food in central Africa', 'Insufficient caloric intake', 'Inadequate sunlight exposure']",1
552,High intkae of which of these dietary componnets predisposes to acclerated cognitive declnie,nutrition,"['High glycaemic index carbohydrates', 'A high n-6:n-3 fat ratio', 'Long chain saturated fats', 'All of the above']",3
553,What is a major limitation of using BMI (body mass index) as a mthod of body fat measurments?,nutrition,"['It is not an accurate measure for average people', 'It is more accurate than height-weight tables', 'It does not distinguish between fat and fat free mass', 'All of the above']",2
554,What is the defintion of overweigt?,nutrition,"['BMI > 25 kg/m2', 'BMI = 25 kg/m2', 'BMI 25-29.9 kg/m2', 'BMI 25-30 kg/m2']",2
555,Waht the largest endogenos substrate source in the body?,nutrition,"['Liver glycogen', 'Muscle glycogen', 'Intramuscular lipid', 'Adipose tissue']",3
556,Gluuten,nutrition,"['May increase carbohydrate malabsorption', 'Is a constituent of avenin', 'Is the main protein in maize', 'May be contra-indicated in UC']",0
557,Occasionally infnats are born without a normally funtioning immune system. What are the signs most suggestive of a severe combineed immunodeficiency?,nutrition,"['Recurrent severe infections', 'Family history of unexplained death in infancy', 'Generalised spread of the Tuberculosis strain BCG after vaccination', 'All of the options given are correct']",3
558,Actue bnge drinking is assciated with?,nutrition,"['Happy heart syndrome', 'Home heart syndrome', 'Beach heart syndrome', 'Holiday heart syndrome']",3
559,In order to achive optimal nutitional status it is recmmended that older adults consume:,nutrition,"['A high energy content diet.', 'A high nutrient dense diet.', 'A low energy content diet.', 'A daily antioxidant supplement.']",1
560,The best available evdience for an association between amount of sugars and risk of dental caries comes from which typ of study design?,nutrition,"['Randomised controlled', 'Non-randomised controlled', 'Cross sectional observational', 'Cohort']",3
561,For Binge Eating Disorde it is incorect that:,nutrition,"['Binge Eating episodes in BED are usually richer in calories than those of BN, leading patients to obesity', 'BED patients have higher odds of developing obesity', 'Bariatric surgery can be considered a treatment option for mild cases', 'Spontaneous remission is a possible outcome']",0
562,Wich of the follwoing will increase in vitamin D deficiency?,nutrition,"['The plasma concentration of prothrombin', 'The plasma concentration of preprothrombin', 'The plasma activity of alkaline phosphatase', 'The plasma activity of acid phosphatase']",2
563,"Intestinal lactase deficiency leads to lactose maldigestion which subsequently can lead to lactose intolerence, i.e. causng clinical symptoms. Infants and children normally express suficient lactase levels as not to experience clinical symptoms. Overall, adults can be classified as lactase-persisters or lactase non-persisters. What is the approximate percentage of Lactase non-persisters worlwide?",nutrition,"['45%-50%', '70%-75 %', '10%-15%', '30%-35%']",1
564,Which of the folowing is not a functoin of vitamin A,nutrition,"['Synthesis of the blood clotting proteins', 'Activation of vitamin D receptors', 'Activation of thyroid hormone receptors', 'Regulation of gene expression and cell differentiation']",0
565,Which of the foll0wing vitmins provides the cofactor for hydroxltion reactions in collagen synthesis?,nutrition,"['Biotin', 'Niacin', 'Riboflavin', 'Vitamin C']",3
566,The test for checking mean plasma glucose concentartion over the previ0us 8-10 weeks is:,nutrition,"['Hemoglobin A1c', 'Oral glucose tolerance test (OGTT)', 'Fructosamine test', 'Fasting plasma glucose concentration']",0
567,Wich of the folowing statments is correct?,nutrition,"['Sulfur dioxide is not used in foods containing thiamin because it causes destruction of the vitamin', 'Sulfur dioxide is not used in foods containing niacin because it causes destruction of the vitamin', 'Sulfur dioxide is not used in foods containing vitamin E because it causes destruction of the vitamin', 'Sulfur dioxide is not used in foods containing vitamin C because it causes destruction of the vitamin']",0
568,Whihc vitmain is requred for visoin in dim light?,nutrition,"['Vitamin A', 'Vitamin D', 'Vitamin E', 'Vitamin K']",0
569,Whcih of the folowing statements about glycogen metabolism is corect?,nutrition,"['A key step in the synthesis of glycogen is the formation of UDP-glucose', 'In muscle in the fasting state, glycogen is broken down to glucose 6-phosphate, then free glucose.', 'Glycogen is stored mainly in the liver and brain.', 'Glucagon increases the synthesis of glycogen']",0
570,Infants born to mothers who are vegan may be at increasd risk of deficiency of whch nutrient?,nutrition,"['Vitamin C', 'Folate', 'Vitamin B12', 'Calcium']",2
571,Which of the follwoing is closest to the amout of retinol formed from -carotene?,nutrition,"['2 mol retinol /mol -carotene', '1 mol retinol /mol -carotene', '0.15 mol retinol /mol -carotene', '0.1 mol retinol /mol -carotene']",2
572,Whihc of the following statemnts about plant sources of amino acids in human nutrtion is correct?,nutrition,"['All plant protein sources are deficient in essential amino acids', 'All plant protein sources contain all essential amino acids although some may be limited by the amount of particular amino acids', 'All plant protein sources are deficient in lysine', 'All plant protein sources are deficient in the sulphur amino acids acids']",1
573,Additonal dietary protien may:,nutrition,"['Increase risk of hip fracture', 'Decrease calcium excretion in the urine', 'Stimulate production of insulin-like growth hormone', 'Reduce muscle mass and strength']",2
574,The function of the gastrointstinal tract can be classified in several ways. Which of the folowing functions is most important for suvival immediately after a meal?,nutrition,"['Absorption and retention of water and electrolytes', 'Elimination of toxins', 'Maintenance of barrier function', 'Extraction of maximum value from nutrients']",0
575,Women who are plannig a pregnancy are recommended to take a supllement of 400g folic acid/ day before and until the end of the frist trimester of pregnncy. What effect does such supplementaion have on methylaion of the imprinted gene IGF2 in the resulting children?,nutrition,"['No effect.', 'Methylation of IGF2 is increased.', 'Methylation of IGF2 is decreased.', 'The effect depends on whether the child is male or female.']",1
576,Which foods tend to be consumd in lower quantitties in Wales and Scotland (as of 2020)?,nutrition,"['Meat', 'Confectionary', 'Fruits and vegetables', 'Potatoes']",2
577,Which of the following channges in body composition are associated with ageing in older adults?,nutrition,"['Increased bone mass', 'Increased muscle mass', 'Increased body fat', 'All of the above']",2
578,The supplementation of diet with wich fat soluble vitamins has been shon to reduce cardiovascular disease?,nutrition,"['Vitamin A and D', 'Vitamin A and K', 'Vitamin D and E', 'None of the above']",3
579,The best evdience exists for which nutrients in the prevntion of age related cognitive decline?,nutrition,"['N-3 fatty acids', 'Phytochemical', 'N-6 fatty acids', 'Long chain saturated fats']",0
580,Whcih of the folowing statements abut methods of evaluating protien quality in human nutrition is correct?,nutrition,"['The rat protein efficiency ratio assay, (PER), is a good method of assessing protein quality for human nutrition.', 'The rat net protein-utilisation assay, (NPU), is the best method of assessing protein quality for human nutrition.', 'Animal growth assays underestimate the quality of dietary proteins for human nutrition', 'The growing rat is a good model for assessing protein quality in human nutrition.']",2
581,What are the effects of gloobalisation on food secuirty?,nutrition,"['Wealthy countries subsidies and trade barriers make it difficult for developing countries to take advantage of the potential of globalisation for advancing food security.', 'World Trade Organisation rules do not cover agriculture, so globalisation really has no bearing on food security.', 'Supermarkets are so far the only way in which food and agriculture have experienced globalisation.', 'Developing countries need to create publicly-owned food reserves in order to realise the potential benefits.']",0
582,The gut microobes metabolize L-carnitine into which metaboite that has been shown increase cardiovascular disease?,nutrition,"['choline', 'betaine', 'Trimethylamine', 'All of the above']",2
583,Whihc of the folowing will provide the main fuel for muscle contraction during short-term intense actvity such as sprinting?,nutrition,"['Muscle triacylglycerol', 'Plasma free fatty acids', 'Plasma triacylglycerol in VLDL', 'Muscle glycogen']",3
584,"In the past two decaeds, interest in maternal nutrition has been heightened folowing the findings of epidemiological studies that show links between early experince and later health. Wihch of the following statements is true:",nutrition,"['although early life may appear to be important, observed links to risk of cardiovascular disease and type 2 diabetes can be largely explained by adult lifestyle', 'the observed links between early experience and later health have only been seen in UK studies', 'the epidemiological evidence shows programmed differences in physiology are only linked to events before birth', 'the epidemiological evidence shows programmed differences in physiology are linked to events before birth and in early postnatal life']",3
