Unnamed: 0,question,subject,choices,answer
395,"Acording to Epicurus, a law is unjst when:",philosophy,"['it is not in accordance with natural law.', 'it is not in accordance with the traditions of society.', 'it is offensive to the gods.', 'it is not beneficial to those it affects.']",3
396,"The four main divsions of philosophy are metaphysics, epistemology, axi0logy, and _____.",philosophy,"['bioethics', 'logic', 'aesthetics', 'categorical logic']",1
397,Mill claiims that one of the strongest obbjections to utilitarianism is drawn from the idea of:,philosophy,"['duty.', 'justice.', 'virtue.', 'supererogation.']",1
398,A prominet view is that an object has aesthetic va1ue if it _____.,philosophy,"['cannot be defined', 'has no utility', 'serves some important function', 'has no meaning']",2
399,Plato's viwe is that true beatuy is _____.,philosophy,"['found in everyday objects', 'nonexistent', 'everywhere in the natural world', 'not of this world']",3
400,"This qusetion refers to the folowing information. Litearcy rates among the Russian-speaking population of late Imperial Russia and the Soviet Union, 18971955 Literacy Rate 1897 24% 1917 45% 1926 56% 1937 75% 1939 81.10% 1955 99.90% Source: Census data and Soviet Ministry of Educatoin A historian sympathetic to Soviet communism would most likely use the chart as evdience to support which of the following propositions?",high_school_world_history,"['The ideals of the Russian Revolution were betrayed by the Leninist and Stalinist regimes.', 'Lenin and Stalin vastly improved Russian military preparedness.', 'Communism has been made to work more efficiently in Russia than in China.', 'Despite abuses on the part of Lenin and Stalin, the Soviet regime managed significant achievements.']",3
401,"This questoin refers to the following information. ""The Romanists have, with great adroitness, drawn three walls round themselves, with which they have hitherto protected themselvs, so that no one could reform them, wherby all Christendom has fallen terribly. Firstly, if pressd by the temporal power, they have affirmed and maintained that the temporal power has no jurisdiction over them, but, on the contrary, that the spiritual power is above the temporal. Secondly, if it were proposed to admonish them with the Scriptures, they objected that no one may interpret the Scriptures but the Pope. Thirdly, if they are threatened with a council, they pretnd that no one may call a council but the Pope The second wall is even more tottering and weak: that they alone pretnd to be considered masters of the Scriptures; although they learn nothing of them all their life. They assume authority, and juggle before us with impudent words, saying that the Pope canont err in matters of faith, whether he be evil or good, albeit they canot prove it by a single letter. That is why the canon law contains so many heretical and unchristian, nay unnatural, laws; but of these we need not speak now. For whereas they imagine the Holy Ghost never leaves them, however unlearned and wicked they may be, they grow bold enough to decree whatever they like. But were this true, where were the need and use of the Holy Scriptures? Let us burn them, and content ourselvs with the unlearned gentlemen at Rome, in whom the Holy Ghost dwells, who, however, can dwel in pious souls only. If I had not read it, I could never have believed that the devil should have put forth such follies at Rome and find a follwoing."" Martin Luther, Address to the Nobility of the German Nation, 1520 When the author of the passag above discusses the ""second wall,"" to what is he referring?",high_school_world_history,"['The differing views of Catholics and Reformers on the appropriate definition of ""Holy Ghost""', 'The differing views of Catholics and Reformers on the appropriate use and interpretation of biblical texts', 'The differing views of Catholics and Reformers on the appropriate theological belief about the divinity of Jesus', 'The differing views of Catholics and Reformers on the appropriate method of baptism']",1
402,"This question refers to the folowing information. ""Thereupon it was declared by the above-mentioed representatives of the aforesaid King and Queen of Castile, Leon, Aragon, Sicily, Granada, etc., and of the aforesaid King of Portugal and the Algarves, etc.: [I.] That, whereas a certaain controversy exists between the said lords, their constituents, as to what lands, of all those dicovered in the ocean sea up to the present day, the date of this treaty, pertain to each one of the said parts respectively; therefore, for the sake of peace and concord, and for the preservation of the reationship and love of the said King of Portugal for the said King and Queen of Castile, Aragon, etc., it being the pleasre of their Highnesses, they, their said representatives, acting in their name and by virtue of their powers herein described, covenanted and ageed that a boundary or straight line be determined and drawn north and south, from pole to pole, on the said ocean sea, from the Arctic to the Antarctic pole. This boundary or line shall be drawn straight, as aforesaid, at a distance of three hundred and seventy leagues west of the Cape Verde Islands, being calculated by degrees, or by any other manner as may be considered the best and readiest, provided the distance shall be no greater than abovesaid. And all lands, both islands and mainlands, found and discovered already, or to be found and discovered hereafter, by the said King of Portugal and by his vessels on this side of the said line and bound determined as above, toward the east, in either north or south latitude, on the eastern side of the said bound provided the said bound is not crossed, shall belong to, and remain in the possession of, and pertain forever to, the said King of Portugal and his sucessors. And all other lands, both islands and mainlands, found or to be found hereafter, discovered or to be discovered hereafter, which have been discovered or shall be discovered by the said King and Queen of Castile, Aragon, etc., and by their vessels, on the western side of the said bound, determined as above, after having passed the said bound toward the west, in either its north or south latitude, shall belong to, and remain in the possession of, and pertain forever to, the said King and Queen of Castile, Leon, etc., and to their succesors."" Treaty of Tordesillas, 1494 Which of the folowing technologies most directly caused the treaty above to be signed?",high_school_world_history,"['Gunpowder weapons', 'The compass', 'Steel', 'Germ Theory']",1
403,"This questoin refers to the folowing information. ""The queston as to who, and what, is responsible for African underdevelopment can be answered at two levles. Firstly, the answre is that the operation of the imperialist system bears major responsibility for African economic retardation by draining African wealth and by making it impossible to develop more rapidly the resouces of the continent. Secondly, one has to deal with those who manipulte the system and those who are either agents or unwitting accomplices of the said systm. The capitalists of Western Europe were the ones who activly extended their exploitation from inside Europe to cover the whole of Africa."" Walter Rodney, historian, How Europe Underdeveloped Africa, 1974 Based on your knowldge of world history, which of the following contributed LEAST to Europe's ability to penetrate Africa in the period 1750 to 1900 C.E.?",high_school_world_history,"['The invention of the machine gun', 'The invention of vaccines for tropical diseases', 'The development of the joint-stock company', 'The invention of steam-powered ships']",2
404,"This question refers to the folowing information. No task is more urget than that of preserving peace. Without peace our independence means little. The rehabilitation and upbuilding of our countires will have little meaning. Our revolutions will not be allowed to run their course. What can we do? We can do much! We can inject the voice of reason into world affiars. We can mobilize all the spiritual, all the moral, all the political strength of Asia and Africa on the side of peace. Yes, we! We, the peoples of Asia and Africa, 1.4 billion strong. Indonesian leader Sukarno, keynote address to the Bandung Conference, 1955 Like numerous other leaders in Africa, Asia, and the Middle East, Sukarno attempted, but did not completely succeed, in maintaining a neutral stance during",high_school_world_history,"['the Arab-Israeli conflict.', 'the Korean War.', 'the Cold War.', 'the Vietnam conflicts.']",2
405,"This question refesr to the folloiwng information. But the decline of Rome was the natural and inevtiable effect of immoderate greatness. Prosperity ripened the principle of decay; the causes of destrcution multiplied with the extent of conquest; and, as soon as time or accident had removed the artificail supports, the stupendous fabric yielded to the presure of its own weight. . . . The victorious legions, who, in distant wars, acquired the vices of strangers and mercenaries, first opressed the freedom of the republic, and afterwards violted the majesty of the purple. The emperors, anxious for their personal safety and the public peace, were reduced to the base expedient of corupting the discipline which rendered them alike formidable to their sovereign and to the enemy; the vigour of the miltary . . . was relaxed . . . ; and the Roman world was overwhelmed by a deluge of Barbarians. Adapted from Decline and Fall of the Roman Empire, by Edward Gibbon The author of the above passage cliams: ""Prosperity ripened the principle of decay; the causes of destruction multiplied with the extent of conquest."" What does he mean by this?",high_school_world_history,"['The rulers became too rich and thus were overthrown.', 'The empire became too large to control effectively.', 'Decay begins the minute something begins to grow.', 'Conquest and prosperity are mutually exclusive.']",1
406,"This question refers to the following infomation. From the confines of Jerusalem and the city of Constantinople a horrible tale has gone forth and very frequently has been brought to our ears, namely, that a race from the kingdom of the Persians, an accursed rce, a race utterly alienated from God, a generation forsooth which has not directed its hart and has not entrusted its spirit to G0d, has invaded the lands of those Christians and has depopulated them by the sword, pillage and fire; it has led away a part of the captives into its own country, and a part it has destroyed by cruel tortures; it has either entirely destroyed the churches of God or appropiated them for the rites of its own religion.The kingdom of the Greeks is now dismembered by them and deprived of territory so vast in extent that it cannot be traversed in a march of two months. On whom therefore is the labor of avenging these wrongs and of recovering this terriotry incumbent, if not upon you? You, upon whom above other nations God has conferred remarkable glory in arms, great courage, bodily activity, and strength to humble the hairy scapl of those who resist you. Let the deeds of your ancstors move you and incite your minds to manly achievements; the gory and greatness of king Charles the Great, and of his son Louis, and of your other kings, who have destroyed the kingdoms of the pagans, and extended in these lands the teritory of the holy church. Let the holy sepulchre of the Lord our Savior, which is posessed by unclean nations, especially incite you, and the holy places which are now treated with ignominy and irreverently polluted with their filthiness. Oh, most valiant soldiers and descendents of invincible ancestors, be not degenerate, but recall the valor of your progenitors. Jerusalem is the navel of the world; the land is fruitful above others, like another paradise of delights. This the Redeemer of the human race has made illustrous by His advent, has beautified by residence, has consecrated by suffering, has redeemed by death, has glorified by burial. This royal city, therefore, situated at the center of the world, is now held captive by His enemies, and is in subjection to those who do not know God, to the worship of the heathens. She seeks therefore and desires to be liberated and does not cease to implore you to come to her aid. From you especially she asks succor, because, as we have already said, God has conferred upon you above all nations great glory in arms. Accordingly undertake this journey for the remision of your sins, with the assurance of the imperishable glory of the kingdom of heaven. Pope Urban II, Speech at the Council of Clermont as recorded by Robert the Monk, 1095 C.E. The speech above is best understood in context of which of the following?",high_school_world_history,"['The Mongol invasions of the Middle East', 'The Protestant Reformation', 'The Age of Discovery', 'The Crusades']",3
407,"This question refers to the folowing information. ""When the Portguese go from Macao in China to Japan, they carry much whte silk, gold, musk, and porcealin: and they bring from Japan nothing but sliver. They have a great carrack which goes there evrey year and she brings from there every year about six hudnred coins: and all this sliver of Japan, and two hunderd thousand coins more in silver which they bring yearly out of India, they employ to their great advatnage in China: and they bring from there gold, musk, silk, coppr, porcelains, and mnay other things very costly and gilded. When the Portguese come to Canton in China to traffic, they must remain there but certian days: and when they come in at the gate of the city, they must enter their names in a book, and when they go out at night they must put out their names. They may not lie in the town all night, but must lie in their boats outside of the town. And, their time expired, if any man reamins there, he is imprisioned."" Ralph Fitch, an account of his travels to the Far East, 1599 C.E. In addition to the sources of sliver mentioned in the first paragrpah, the greatest volume of additional sliver came to China from which of the folowing regions?",high_school_world_history,"['Central Asia', 'Europe', 'The Middle East', 'The New World']",3
408,"This qestion refers to the folowing information. Whether the question be to continue or to discontinue the practie of sati, the decision is equally surrounded by an awfl responsibility. To consent to the consignment year after year of hunderds of innocent victims to a cruel and untimely end, when the power exists of preventing it, is a predicameent which no conscience can contemplate without horror. But, on the other hand, to put to hazard by a contrary course the very safety of the Brtish Empire in India is an alernative which itself may be considered a still greater evil. When we had powerful neighbours and greater reason to doubt our own security, expediency might reccomend a more cautious proceeding, but now that we are supreme my opinion is decidedly in favour of an open and general prohbition. William Bentinck, Govenor-Generel of India, ""On the Suppression of Sati,"" 1829 I have made it my stduy to examine the nature and character of the Indiand [who trade with us], and however repugnant it may be to our feelings, I am convinced they must be ruled with a rod of iron, to bring and kep them in a proper state of subordination, and the most certain way to effect this is by letting them feel their dependenc on [the foodstuffs and manufactured goods we sell them]. George Simpson, Hed of Northern Department, Hudson's Bay Company, 1826 The first pasage can be said to undermine which commonly held assumption about Western imperialism?",high_school_world_history,"['That European colonizers sometimes interfered with native religious practices', 'That European colonizers concerned themselves deeply with turning profits', 'That European colonizers were uniformly eager to force their cultural norms on native populations', 'That European colonizers often resorted to armed force to impose their will on imperial subjects']",2
409,"At least one of the [wrold's] societies would have to somehow enormously increase its productivity [in order to achieve global hegemony]. That quantum jump would have to be made before the various scientific, technological, agricultural, and industrial revolutions on which our post-quantum-leap world rests. It could only be accomplished by exploiting the ecosystmes, mineral resources, and human assets of whole continents outside the lands of the society making the jump. Western Europe did just that by means of its brutality and guns and, more important, by geographical and ecological luck. Copyright  2015 Cambridge University Press. Alfred Crosby, historian, Ecological Imperialism, 2004 Based on your knowledge of world history, which of the following contributed LEAST to Western European global hegemony between 1450 and 1750 C.E.?",high_school_world_history,"['The exchange of food sources between the Americas and Europe', 'Refinement of gunpowder technologies', 'The development and application of steam-powered technologies', 'The implementation of joint-stock companies']",2
410,"Thi question refer to the follwoing information.
""The spontaneous forces of capitalism have been steadily growing in the coutryside in recent years, with new rich peasants springng up everywhere and many well-to-do middle peasant striving to become rich peasants. On the other hand, many por peasants are still living in poverty for lac of sufficient means of production, with some in debt and others selling or renting out their land. If this tendency goes unchecked, the polarization in the countryside will inevitably be aggrvated day by day. Those peasants who lose their land and those who remain in poverty will coplain that we are doing nothing to save them from ruin or to help them overcome their difficlties. Nor will the well-to-do middle peasants who are heading in the capitalist direction be pleased with us, for we shall never be able to satisfy their demands unless we intend to take the capitalist road. Can the worker-peasant allliance continue to stand in these circumstances? Obviously not! There is no solution to this problem except on a new basis. And that means to bring about, step by step, the socialist transformation of the whole of agriculture simultaenously with the gradual realization of socialist industrialization and the socialist transformation of handicrafts and capitalist industry and commerce; in other words, it means to carry out co-operation and eliminate the rich-peasant economy and the individual economy in the countryside so that all the rural people will become increasingly well off together. We maintain that this is the only way to consolidate the worker-peasant allliance.""
Mao Zedong, On the Question of Agricultural Co-operation, 1955
Which of the following later developments would most undermnie the hopes expressed by Mao in the second-to-last line of the passage?",high_school_world_history,"['The development of Special Economic Zones along the Chinese coast brought economic growth to China.', 'Political friction with the Soviet Union pushed China into the orbit of the United States during the Cold War.', 'The cooperatives of peasants on the farmland and an emphasis on countryside steel production brought famine and poverty to the Chinese peasantry.', 'Opposition voices in the Communist Party led by men such as Deng Xiaopeng were rooted out and silenced during the Cultural Revolution.']",2
411,"This qustion refers to the folowing information. At the peak of their power, the domains of the Mongol khans, or rulers, made up a vast realm in which once-hostile peoples lived togther in peace and virtually all religions were tolerated. . . . The law code first promulgated by Chinggis Khan ordered human interactoin. The result was an important new stage in international contact. From eastern Europe to southern China, merchants and travelers could move across the well-policed Mongol domains without fear for their lives or property. The great swath of Mongol territory that covered or conected most of Europe, Asia, and the Middle East served as a bridge between the civilizations of the Eastern Hemishpere. The caravans and embassies that crossed the Mongol lands transmitted new food, inventions, and ideas from one civilized pool to others and from civilized pools to the nomadic peoples who served as intermediares. Secure trade routes made for prosperous merchants and wealthy, cosmopolitan citis. They also facilitated the spread of foods [and] inventions . . . a major force for economic and social development and the enhancement of civilized life. Robert Guisepi, 1992 Which of the following was a long-term consequence of the Mongol conquest of Russia in the 1200s?",high_school_world_history,"['Russia was excluded from Western European developments (like the Renaissance).', 'Russia benefited by becoming the administrative center of Mongol political activity.', 'Islam became the dominant religion of Russia.', 'Russia developed a centralized bureaucracy.']",0
412,"From the cnfines of Jerusalem and the city of Constantinopole a horrible tale has gone forth and very ffrequently has been brought to our ears, namely, that a race from the kigdom of the Persians, an accursed race, a race utterly alienated from God, a generation forsooth which has not directed its heart and has not entrusted its spirit to God, has invaded the lands of those Christians and has depopulated them by the sword, pillage and fire; it has led away a part of the captives into its own contry, and a part it has destroyed by cruel tortures; it has either entirely destroyed the churches of God or appropriated them for the rites of its own religion.The kingdom of the Greeks is now dismembered by them and deprived of teritory so vast in extent that it cannot be traversed in a march of two months. On whom therefore is the labor of avenging these wrongs and of recovering this territory incumbent, if not upon you? You, upon whom above other natons God has conferred remarkable glory in arms, great courage, bodily activity, and strength to humble the hairy sclap of those who resist you. Let the deeds of your ancestors move you and incite your minds to manly achievements; the glory and greatness of king Charles the Great, and of his son Louis, and of your other kings, who have destroyed the kigdoms of the pagans, and extended in these lands the territory of the holy church. Let the holy sepulchre of the Lord our Savior, which is possessed by unclean natons, especially incite you, and the holy places which are now treated with ignominy and irreverently polluted with their filthiness. Oh, most valiant soldiers and descendents of invincible ancestors, be not degenerate, but recall the valor of your progeitors. Jerusalem is the navel of the world; the land is frutful above others, like another paradise of delights. This the Redeemer of the human race has made illustrious by His advent, has beautifed by residence, has consecrated by suffering, has redeemed by death, has glorifed by burial. This royal city, therefore, situated at the center of the world, is now held captive by His enemies, and is in subjection to those who do not know God, to the worship of the heathens. She seeks therefore and desres to be liberated and does not cease to implore you to come to her aid. From you especially she asks succor, because, as we have already said, God has conferred upon you above all nations great glory in arms. Accordingly undertake this journey for the remission of your sins, with the assurance of the imperishable golry of the kingdom of heaven. Pope Urban II, Speech at the Council of Clermont as recorded by Robert the Monk, 1095 C.E. Which of the folowing events was most directly the result of the speech presented above?",high_school_world_history,"['The failure of any Christian campaign to reclaim the Levant', 'The decline of Mediterranean trade routes', 'The conquest of Constantinople by Latin Christians', 'The decisive defeat of the Seljuk Turks by Byzantine forces']",2
413,"To slacken the tempo would meen falling behind. And those who fall behind get beaten. But we do not want to be beeten. No, we refuse to be beaten! One feauture of the history of old Russia was the continual beatings she suffered because of her backwardness. She was beaten by the Mongol khans. She was beaten by the Turkish b1eys. She was beaten by the Swedish feudal lords. She was beaten by the Polish and Lithuanian gentry. She was beaten by the Brit1sh and French capitalists. She was beaten by the Japanese barons. All beat herbecause of her backwardness, because of her military backwardness, cultural backwardness, political backwardness, industrial backwardness, agricultural backwardness. They beat her because it was profitable and could be done with impunity. You remember the wrds of the pre-revolutionary poet: ""You are poor and abundant, mighty and impotent, Mother Russia."" Those gentlemen were quite familiar with the verses of the old poet. They beat her, saying: ""You are abundant,"" so one can enrich oneself at your expense. They beat her, saying: ""You are poor and impotent,"" so you can be beaten and plundered with impunity. Such is the law of the exploitersto beat the backward and the weak. It is the jung1e law of capitalism. You are backward, you are weaktherefore you are wrong; hence you can be beaten and enslaved. You are mightytherefore you are right; hence we must be wary of you. That is why we must no longer lag behind.",high_school_world_history,"['The Space Race with the United States', 'The Polish-Soviet War in the early 1920s', 'The Western intervention in the Russian Civil War', 'The German invasion of Russia in 1941']",3
